[0 ms] UsbSnoop compiled on Jan 18 2003 22:41:32 loading
[0 ms] UsbSnoop - DriverEntry(f22aac40) : Windows NT WDM version 1.16
[3 ms] UsbSnoop - AddDevice(f22aaf50) : DriverObject 827cd970, pdo 8266ca90
[3 ms] UsbSnoop - DispatchAny(f22a8610) : IRP_MJ_PNP (0x00000018)
[3 ms] UsbSnoop - MyDispatchPNP(f22aaee0) : IRP_MJ_PNP (0x00000018)
[4 ms] UsbSnoop - DispatchAny(f22a8610) : IRP_MJ_PNP (IRP_MN_QUERY_RESOURCE_REQUIREMENTS)
[4 ms] UsbSnoop - MyDispatchPNP(f22aaee0) : IRP_MJ_PNP (IRP_MN_QUERY_RESOURCE_REQUIREMENTS)
[4 ms] UsbSnoop - DispatchAny(f22a8610) : IRP_MJ_PNP (IRP_MN_FILTER_RESOURCE_REQUIREMENTS)
[4 ms] UsbSnoop - MyDispatchPNP(f22aaee0) : IRP_MJ_PNP (IRP_MN_FILTER_RESOURCE_REQUIREMENTS)
[4 ms] UsbSnoop - DispatchAny(f22a8610) : IRP_MJ_PNP (IRP_MN_START_DEVICE)
[4 ms] UsbSnoop - MyDispatchPNP(f22aaee0) : IRP_MJ_PNP (IRP_MN_START_DEVICE)
[4 ms] UsbSnoop - DispatchAny(f22a8610) : IRP_MJ_INTERNAL_DEVICE_CONTROL
[4 ms] UsbSnoop - MyDispatchInternalIOCTL(f22a9e80) : fdo=8266ca90, Irp=825b4008, IRQL=0
[4 ms]  >>>  URB 1 going down  >>> 
-- URB_FUNCTION_GET_DESCRIPTOR_FROM_DEVICE:
  TransferBufferLength = 00000012
  TransferBuffer       = 82684d68
  TransferBufferMDL    = 00000000
  Index                = 00000000
  DescriptorType       = 00000001 (USB_DEVICE_DESCRIPTOR_TYPE)
  LanguageId           = 00000000
[10 ms] UsbSnoop - MyInternalIOCTLCompletion(f22a9db0) : fido=00000000, Irp=825b4008, Context=825c2e08, IRQL=2
[10 ms]  <<<  URB 1 coming back  <<< 
-- URB_FUNCTION_CONTROL_TRANSFER:
  PipeHandle           = 825b0b54
  TransferFlags        = 005c0077 (USBD_TRANSFER_DIRECTION_IN, USBD_SHORT_TRANSFER_OK)
  TransferBufferLength = 00000012
  TransferBuffer       = 82684d68
  TransferBufferMDL    = 825da628
    00000000: 12 01 00 02 ff 00 00 08 93 0a 02 00 17 01 01 02
    00000010: 03 01
  UrbLink              = 00000000
  SetupPacket          =
    00000000: 80 06 00 01 00 00 12 00
[10 ms] UsbSnoop - DispatchAny(f22a8610) : IRP_MJ_INTERNAL_DEVICE_CONTROL
[10 ms] UsbSnoop - MyDispatchInternalIOCTL(f22a9e80) : fdo=8266ca90, Irp=825b4008, IRQL=0
[10 ms]  >>>  URB 2 going down  >>> 
-- URB_FUNCTION_GET_DESCRIPTOR_FROM_DEVICE:
  TransferBufferLength = 00000209
  TransferBuffer       = 82634868
  TransferBufferMDL    = 00000000
  Index                = 00000000
  DescriptorType       = 00000002 (USB_CONFIGURATION_DESCRIPTOR_TYPE)
  LanguageId           = 00000000
[20 ms] UsbSnoop - MyInternalIOCTLCompletion(f22a9db0) : fido=00000000, Irp=825b4008, Context=82653c08, IRQL=2
[20 ms]  <<<  URB 2 coming back  <<< 
-- URB_FUNCTION_CONTROL_TRANSFER:
  PipeHandle           = 825b0b54
  TransferFlags        = 005c0077 (USBD_TRANSFER_DIRECTION_IN, USBD_SHORT_TRANSFER_OK)
  TransferBufferLength = 00000028
  TransferBuffer       = 82634868
  TransferBufferMDL    = 825da628
    00000000: 09 02 20 00 01 01 00 a0 64 09 04 00 00 02 ff 00
    00000010: ff 00 07 05 81 03 08 00 01 07 05 82 03 40 00 01
    00000020: 00 00 00 00 00 00 00 00
  UrbLink              = 00000000
  SetupPacket          =
    00000000: 80 06 00 02 00 00 09 02
[20 ms] UsbSnoop - DispatchAny(f22a8610) : IRP_MJ_INTERNAL_DEVICE_CONTROL
[20 ms] UsbSnoop - MyDispatchInternalIOCTL(f22a9e80) : fdo=8266ca90, Irp=825b4008, IRQL=0
[20 ms]  >>>  URB 3 going down  >>> 
-- URB_FUNCTION_SELECT_CONFIGURATION:
  ConfigurationDescriptor = 0x82634868 (configure)
  ConfigurationDescriptor : bLength             = 9
  ConfigurationDescriptor : bDescriptorType     = 0x00000002
  ConfigurationDescriptor : wTotalLength        = 0x00000020
  ConfigurationDescriptor : bNumInterfaces      = 0x00000001
  ConfigurationDescriptor : bConfigurationValue = 0x00000001
  ConfigurationDescriptor : iConfiguration      = 0x00000000
  ConfigurationDescriptor : bmAttributes        = 0x000000a0
  ConfigurationDescriptor : MaxPower            = 0x00000064
  ConfigurationHandle     = 0x005c0077
  Interface[0]: Length            = 56
  Interface[0]: InterfaceNumber   = 0
  Interface[0]: AlternateSetting  = 0
[23 ms] UsbSnoop - MyInternalIOCTLCompletion(f22a9db0) : fido=00000000, Irp=825b4008, Context=825c2d08, IRQL=0
[23 ms]  <<<  URB 3 coming back  <<< 
-- URB_FUNCTION_SELECT_CONFIGURATION:
  ConfigurationDescriptor = 0x82634868 (configure)
  ConfigurationDescriptor : bLength             = 9
  ConfigurationDescriptor : bDescriptorType     = 0x00000002
  ConfigurationDescriptor : wTotalLength        = 0x00000020
  ConfigurationDescriptor : bNumInterfaces      = 0x00000001
  ConfigurationDescriptor : bConfigurationValue = 0x00000001
  ConfigurationDescriptor : iConfiguration      = 0x00000000
  ConfigurationDescriptor : bmAttributes        = 0x000000a0
  ConfigurationDescriptor : MaxPower            = 0x00000064
  ConfigurationHandle     = 0xe123c648
  Interface[0]: Length            = 56
  Interface[0]: InterfaceNumber   = 0
  Interface[0]: AlternateSetting  = 0
  Interface[0]: Class             = 0x000000ff
  Interface[0]: SubClass          = 0x00000000
  Interface[0]: Protocol          = 0x000000ff
  Interface[0]: InterfaceHandle   = 0x82625b68
  Interface[0]: NumberOfPipes     = 2
  Interface[0]: Pipes[0] : MaximumPacketSize = 0x00000008
  Interface[0]: Pipes[0] : EndpointAddress   = 0x00000081
  Interface[0]: Pipes[0] : Interval          = 0x00000001
  Interface[0]: Pipes[0] : PipeType          = 0x00000003 (UsbdPipeTypeInterrupt)
  Interface[0]: Pipes[0] : PipeHandle        = 0x82625b80
  Interface[0]: Pipes[0] : MaxTransferSize   = 0x00001000
  Interface[0]: Pipes[0] : PipeFlags         = 0x00000000
  Interface[0]: Pipes[1] : MaximumPacketSize = 0x00000040
  Interface[0]: Pipes[1] : EndpointAddress   = 0x00000082
  Interface[0]: Pipes[1] : Interval          = 0x00000001
  Interface[0]: Pipes[1] : PipeType          = 0x00000003 (UsbdPipeTypeInterrupt)
  Interface[0]: Pipes[1] : PipeHandle        = 0x82625b9c
  Interface[0]: Pipes[1] : MaxTransferSize   = 0x00001000
  Interface[0]: Pipes[1] : PipeFlags         = 0x00000000
[24 ms] UsbSnoop - DispatchAny(f22a8610) : IRP_MJ_PNP (IRP_MN_QUERY_CAPABILITIES)
[24 ms] UsbSnoop - MyDispatchPNP(f22aaee0) : IRP_MJ_PNP (IRP_MN_QUERY_CAPABILITIES)
[24 ms] UsbSnoop - DispatchAny(f22a8610) : IRP_MJ_PNP (IRP_MN_QUERY_PNP_DEVICE_STATE)
[24 ms] UsbSnoop - MyDispatchPNP(f22aaee0) : IRP_MJ_PNP (IRP_MN_QUERY_PNP_DEVICE_STATE)
[24 ms] UsbSnoop - DispatchAny(f22a8610) : IRP_MJ_PNP (IRP_MN_QUERY_DEVICE_RELATIONS)
[24 ms] UsbSnoop - MyDispatchPNP(f22aaee0) : IRP_MJ_PNP (IRP_MN_QUERY_DEVICE_RELATIONS)
[24 ms] UsbSnoop - DispatchAny(f22a8610) : IRP_MJ_PNP (IRP_MN_QUERY_DEVICE_RELATIONS)
[24 ms] UsbSnoop - MyDispatchPNP(f22aaee0) : IRP_MJ_PNP (IRP_MN_QUERY_DEVICE_RELATIONS)
[26 ms] UsbSnoop - DispatchAny(f22a8610) : IRP_MJ_INTERNAL_DEVICE_CONTROL
[26 ms] UsbSnoop - MyDispatchInternalIOCTL(f22a9e80) : fdo=8266ca90, Irp=825b4008, IRQL=0
[26 ms]  >>>  URB 4 going down  >>> 
-- URB_FUNCTION_BULK_OR_INTERRUPT_TRANSFER:
  PipeHandle           = 82625b80 [endpoint 0x00000081]
  TransferFlags        = 00000003 (USBD_TRANSFER_DIRECTION_IN, USBD_SHORT_TRANSFER_OK)
  TransferBufferLength = 00000008
  TransferBuffer       = 825c2e08
  TransferBufferMDL    = 00000000
  UrbLink              = 00000000
[26 ms] UsbSnoop - DispatchAny(f22a8610) : IRP_MJ_INTERNAL_DEVICE_CONTROL
[26 ms] UsbSnoop - MyDispatchInternalIOCTL(f22a9e80) : fdo=8266ca90, Irp=825b33e8, IRQL=0
[26 ms]  >>>  URB 5 going down  >>> 
-- URB_FUNCTION_BULK_OR_INTERRUPT_TRANSFER:
  PipeHandle           = 82625b9c [endpoint 0x00000082]
  TransferFlags        = 00000003 (USBD_TRANSFER_DIRECTION_IN, USBD_SHORT_TRANSFER_OK)
  TransferBufferLength = 0000041c
  TransferBuffer       = 82689bc8
  TransferBufferMDL    = 00000000
  UrbLink              = 00000000
[27 ms] UsbSnoop - DispatchAny(f22a8610) : IRP_MJ_INTERNAL_DEVICE_CONTROL
[27 ms] UsbSnoop - MyDispatchInternalIOCTL(f22a9e80) : fdo=8266ca90, Irp=825b25c8, IRQL=0
[27 ms]  >>>  URB 6 going down  >>> 
-- URB_FUNCTION_VENDOR_DEVICE:
  TransferFlags          = 00000000 (USBD_TRANSFER_DIRECTION_OUT, ~USBD_SHORT_TRANSFER_OK)
  TransferBufferLength = 00000000
  TransferBuffer       = 00000000
  TransferBufferMDL    = 00000000

    no data supplied
  UrbLink                 = 00000000
  RequestTypeReservedBits = 00000000
  Request                 = 000000fe
  Value                   = 000000de
  Index                   = 00000005
[30 ms] UsbSnoop - MyInternalIOCTLCompletion(f22a9db0) : fido=00000000, Irp=825b25c8, Context=825b5948, IRQL=2
[30 ms]  <<<  URB 6 coming back  <<< 
-- URB_FUNCTION_CONTROL_TRANSFER:
  PipeHandle           = 825b0b54
  TransferFlags        = 00000002 (USBD_TRANSFER_DIRECTION_OUT, USBD_SHORT_TRANSFER_OK)
  TransferBufferLength = 00000000
  TransferBuffer       = 00000000
  TransferBufferMDL    = 00000000
  UrbLink              = 00000000
  SetupPacket          =
    00000000: 40 fe de 00 05 00 00 00
[22782 ms] UsbSnoop - MyInternalIOCTLCompletion(f22a9db0) : fido=00000000, Irp=825b4008, Context=82684d48, IRQL=2
[22782 ms]  <<<  URB 4 coming back  <<< 
-- URB_FUNCTION_BULK_OR_INTERRUPT_TRANSFER:
  PipeHandle           = 82625b80 [endpoint 0x00000081]
  TransferFlags        = 00000003 (USBD_TRANSFER_DIRECTION_IN, USBD_SHORT_TRANSFER_OK)
  TransferBufferLength = 00000007
  TransferBuffer       = 825c2e08
  TransferBufferMDL    = 825da628
    00000000: 01 01 17 01 00 30 05
  UrbLink              = 00000000
[22782 ms] UsbSnoop - DispatchAny(f22a8610) : IRP_MJ_INTERNAL_DEVICE_CONTROL
[22782 ms] UsbSnoop - MyDispatchInternalIOCTL(f22a9e80) : fdo=8266ca90, Irp=825b4008, IRQL=2
[22782 ms]  >>>  URB 7 going down  >>> 
-- URB_FUNCTION_BULK_OR_INTERRUPT_TRANSFER:
  PipeHandle           = 82625b80 [endpoint 0x00000081]
  TransferFlags        = 00000003 (USBD_TRANSFER_DIRECTION_IN, USBD_SHORT_TRANSFER_OK)
  TransferBufferLength = 00000008
  TransferBuffer       = 825c2e08
  TransferBufferMDL    = 00000000
  UrbLink              = 00000000
[22792 ms] UsbSnoop - MyInternalIOCTLCompletion(f22a9db0) : fido=00000000, Irp=825b33e8, Context=825b52a8, IRQL=2
[22793 ms]  <<<  URB 5 coming back  <<< 
-- URB_FUNCTION_BULK_OR_INTERRUPT_TRANSFER:
  PipeHandle           = 82625b9c [endpoint 0x00000082]
  TransferFlags        = 00000003 (USBD_TRANSFER_DIRECTION_IN, USBD_SHORT_TRANSFER_OK)
  TransferBufferLength = 00000006
  TransferBuffer       = 82689bc8
  TransferBufferMDL    = 825d8008
    00000000: 01 01 17 01 01 20
  UrbLink              = 00000000
[22793 ms] UsbSnoop - DispatchAny(f22a8610) : IRP_MJ_INTERNAL_DEVICE_CONTROL
[22793 ms] UsbSnoop - MyDispatchInternalIOCTL(f22a9e80) : fdo=8266ca90, Irp=825b33e8, IRQL=2
[22793 ms]  >>>  URB 8 going down  >>> 
-- URB_FUNCTION_BULK_OR_INTERRUPT_TRANSFER:
  PipeHandle           = 82625b9c [endpoint 0x00000082]
  TransferFlags        = 00000003 (USBD_TRANSFER_DIRECTION_IN, USBD_SHORT_TRANSFER_OK)
  TransferBufferLength = 0000041c
  TransferBuffer       = 82689bc8
  TransferBufferMDL    = 00000000
  UrbLink              = 00000000
[23431 ms] UsbSnoop - MyInternalIOCTLCompletion(f22a9db0) : fido=00000000, Irp=825b33e8, Context=8268bd28, IRQL=2
[23431 ms]  <<<  URB 8 coming back  <<< 
-- URB_FUNCTION_BULK_OR_INTERRUPT_TRANSFER:
  PipeHandle           = 82625b9c [endpoint 0x00000082]
  TransferFlags        = 00000003 (USBD_TRANSFER_DIRECTION_IN, USBD_SHORT_TRANSFER_OK)
  TransferBufferLength = 00000162
  TransferBuffer       = 82689bc8
  TransferBufferMDL    = 825d8008
    00000000: 01 01 17 01 00 20 00 00 00 00 00 00 00 00 68 00
    00000010: 50 00 00 00 4c 01 f0 ff ff bf f3 ff ff bf f3 ff
    00000020: ff bf f3 ff ff bf f3 ff ff bf f3 ff ff cf f2 ff
    00000030: ff cf f2 ff ff cf f2 ff ff bf f3 ff ff cf f2 ff
    00000040: ff cf f2 ff ff cf f2 ff ff bf f3 ff ff cf f2 ff
    00000050: ff cf f2 ff ff cf f2 ff ff cf f2 ff ff cf f2 ff
    00000060: ff cf f2 ff ff cf f2 ff ff cf f2 ff ff cf f2 ff
    00000070: ff cf f2 ff ff cf f2 ff ff cf f2 ff ff cf f2 ff
    00000080: ff cf f2 ff ff cf f2 ff ff cf f2 ff ff cf f2 1e
    00000090: 8f f1 ff 23 ff ff ff 2c ff ff ff 2c ff ff ff 2c
    000000a0: ff ff ff 2c ff ff ff 2c ff ff ff 2c ff ff ff 2c
    000000b0: ff ff ff 2c ff ff 1a ff 21 ff 5f f1 ff 26 ff ff
    000000c0: ff 2c ff ff ff 2c ff ff ff 2c ff ff ff 2c ff ff
    000000d0: ff 2c ff 5f f2 ff 25 ff ff ff 2c ff ff ff 2c ff
    000000e0: ff ff 2c ff ff ff 2c ff ff ff 2c ff ff ff 2c ff
    000000f0: ff ff 2c ff ff ff 2c ff ff ff 2c ff ff ff 2c ff
    00000100: ff ff 1d ff ff ff 2c ff ff ff 2c ff ff ff 2c ff
    00000110: ff ff 2c ff ff ff 1d ff ff ff 2c ff ff ff 2c ff
    00000120: ff 10 ff 2b ff 8f f9 bf f1 ff ff df f1 ff ff cf
    00000130: f2 ff ff cf f2 ff ff cf e2 f2 ff ff 2b ff ff ff
    00000140: 2c ff ff ff 1d ff ff 8f f2 13 ff ff 8f f1 23 ff
    00000150: ff ff 1d ff ff ff 1d ff ff ff 1d ff ff ff 1d ff
    00000160: ff ff
  UrbLink              = 00000000
[23431 ms] UsbSnoop - DispatchAny(f22a8610) : IRP_MJ_INTERNAL_DEVICE_CONTROL
[23431 ms] UsbSnoop - MyDispatchInternalIOCTL(f22a9e80) : fdo=8266ca90, Irp=825b33e8, IRQL=2
[23431 ms]  >>>  URB 9 going down  >>> 
-- URB_FUNCTION_BULK_OR_INTERRUPT_TRANSFER:
  PipeHandle           = 82625b9c [endpoint 0x00000082]
  TransferFlags        = 00000003 (USBD_TRANSFER_DIRECTION_IN, USBD_SHORT_TRANSFER_OK)
  TransferBufferLength = 0000041c
  TransferBuffer       = 82689bc8
  TransferBufferMDL    = 00000000
  UrbLink              = 00000000
[24799 ms] UsbSnoop - MyInternalIOCTLCompletion(f22a9db0) : fido=00000000, Irp=825b33e8, Context=825b52a8, IRQL=2
[24799 ms]  <<<  URB 9 coming back  <<< 
-- URB_FUNCTION_BULK_OR_INTERRUPT_TRANSFER:
  PipeHandle           = 82625b9c [endpoint 0x00000082]
  TransferFlags        = 00000003 (USBD_TRANSFER_DIRECTION_IN, USBD_SHORT_TRANSFER_OK)
  TransferBufferLength = 00000132
  TransferBuffer       = 82689bc8
  TransferBufferMDL    = 825d8008
    00000000: 01 01 17 01 00 20 00 00 00 00 00 00 00 00 68 00
    00000010: 50 00 00 00 1c 01 f0 ff ff ff ff ff ff ff ff ff
    00000020: ff ff ff ff ff ff ff ff ff ff ff ff ff ff ff ff
    00000030: ff ff ff ff ff ff ff ff ff ff ff ff ff ff ff ff
    00000040: ff ff ff ff ff ff ff ff ff ff ff ff ff ff ff ff
    00000050: ff ff ff ff ff ff ff ff ff ff ff ff ff ff ff ff
    00000060: ff ff ff ff ff ff ff ff ff ff ff ff ff ff ff ff
    00000070: ff ff ff ff ff ff ff ff ff ff ff ff ff ff ff ff
    00000080: ff ff ff ff ff ff ff ff ff ff ff ff ff ff ff ff
    00000090: ff ff ff ff ff ff ff ff ff ff ff ff ff ff ff ff
    000000a0: 11 ff ff ff ff ff ff ff ff ff ff ff ff ff ff ff
    000000b0: ff ff ff ff ff ff ff ff 2f f1 ff ff ff ff ff ff
    000000c0: ff ff ff ff ff ff ff ff ff ff ff ff ff ff ff ff
    000000d0: ff ff ff ff ff ff ff ff ff ff ff ff ff ff ff ff
    000000e0: ff ff ff ff ff ff ff ff ff ff ff ff ff ff ff ff
    000000f0: ff ff ff ff ff ff ff ff ff ff ff ff ff ff cf f9
    00000100: ff ff ff ff ff ff ff ff ff ff ff ff ff ff ff 17
    00000110: ff ff ff ff ff ff ff ff ff ff ff ff 5f f1 ff ff
    00000120: df f1 ff ff ff ff ff ff ff ff ff ff ff ff ff ff
    00000130: 11 f1
  UrbLink              = 00000000
[24799 ms] UsbSnoop - DispatchAny(f22a8610) : IRP_MJ_INTERNAL_DEVICE_CONTROL
[24799 ms] UsbSnoop - MyDispatchInternalIOCTL(f22a9e80) : fdo=8266ca90, Irp=825b33e8, IRQL=2
[24799 ms]  >>>  URB 10 going down  >>> 
-- URB_FUNCTION_BULK_OR_INTERRUPT_TRANSFER:
  PipeHandle           = 82625b9c [endpoint 0x00000082]
  TransferFlags        = 00000003 (USBD_TRANSFER_DIRECTION_IN, USBD_SHORT_TRANSFER_OK)
  TransferBufferLength = 0000041c
  TransferBuffer       = 82689bc8
  TransferBufferMDL    = 00000000
  UrbLink              = 00000000
[24799 ms] UsbSnoop - MyInternalIOCTLCompletion(f22a9db0) : fido=00000000, Irp=825b4008, Context=825b86c8, IRQL=2
[24799 ms]  <<<  URB 7 coming back  <<< 
-- URB_FUNCTION_BULK_OR_INTERRUPT_TRANSFER:
  PipeHandle           = 82625b80 [endpoint 0x00000081]
  TransferFlags        = 00000003 (USBD_TRANSFER_DIRECTION_IN, USBD_SHORT_TRANSFER_OK)
  TransferBufferLength = 00000007
  TransferBuffer       = 825c2e08
  TransferBufferMDL    = 825da628
    00000000: 01 01 17 01 00 30 01
  UrbLink              = 00000000
[24799 ms] UsbSnoop - DispatchAny(f22a8610) : IRP_MJ_INTERNAL_DEVICE_CONTROL
[24799 ms] UsbSnoop - MyDispatchInternalIOCTL(f22a9e80) : fdo=8266ca90, Irp=825b4008, IRQL=2
[24799 ms]  >>>  URB 11 going down  >>> 
-- URB_FUNCTION_BULK_OR_INTERRUPT_TRANSFER:
  PipeHandle           = 82625b80 [endpoint 0x00000081]
  TransferFlags        = 00000003 (USBD_TRANSFER_DIRECTION_IN, USBD_SHORT_TRANSFER_OK)
  TransferBufferLength = 00000008
  TransferBuffer       = 825c2e08
  TransferBufferMDL    = 00000000
  UrbLink              = 00000000
[24801 ms] UsbSnoop - MyInternalIOCTLCompletion(f22a9db0) : fido=00000000, Irp=825b33e8, Context=82687a28, IRQL=2
[24801 ms]  <<<  URB 10 coming back  <<< 
-- URB_FUNCTION_BULK_OR_INTERRUPT_TRANSFER:
  PipeHandle           = 82625b9c [endpoint 0x00000082]
  TransferFlags        = 00000003 (USBD_TRANSFER_DIRECTION_IN, USBD_SHORT_TRANSFER_OK)
  TransferBufferLength = 00000006
  TransferBuffer       = 82689bc8
  TransferBufferMDL    = 825d8008
    00000000: 01 01 17 01 02 20
  UrbLink              = 00000000
[24801 ms] UsbSnoop - DispatchAny(f22a8610) : IRP_MJ_INTERNAL_DEVICE_CONTROL
[24801 ms] UsbSnoop - MyDispatchInternalIOCTL(f22a9e80) : fdo=8266ca90, Irp=825b33e8, IRQL=2
[24801 ms]  >>>  URB 12 going down  >>> 
-- URB_FUNCTION_BULK_OR_INTERRUPT_TRANSFER:
  PipeHandle           = 82625b9c [endpoint 0x00000082]
  TransferFlags        = 00000003 (USBD_TRANSFER_DIRECTION_IN, USBD_SHORT_TRANSFER_OK)
  TransferBufferLength = 0000041c
  TransferBuffer       = 82689bc8
  TransferBufferMDL    = 00000000
  UrbLink              = 00000000
[24808 ms] UsbSnoop - MyInternalIOCTLCompletion(f22a9db0) : fido=00000000, Irp=825b4008, Context=825e8ba8, IRQL=2
[24808 ms]  <<<  URB 11 coming back  <<< 
-- URB_FUNCTION_BULK_OR_INTERRUPT_TRANSFER:
  PipeHandle           = 82625b80 [endpoint 0x00000081]
  TransferFlags        = 00000003 (USBD_TRANSFER_DIRECTION_IN, USBD_SHORT_TRANSFER_OK)
  TransferBufferLength = 00000007
  TransferBuffer       = 825c2e08
  TransferBufferMDL    = 825da628
    00000000: 01 01 17 01 00 30 00
  UrbLink              = 00000000
[24808 ms] UsbSnoop - DispatchAny(f22a8610) : IRP_MJ_INTERNAL_DEVICE_CONTROL
[24808 ms] UsbSnoop - MyDispatchInternalIOCTL(f22a9e80) : fdo=8266ca90, Irp=825b4008, IRQL=2
[24808 ms]  >>>  URB 13 going down  >>> 
-- URB_FUNCTION_BULK_OR_INTERRUPT_TRANSFER:
  PipeHandle           = 82625b80 [endpoint 0x00000081]
  TransferFlags        = 00000003 (USBD_TRANSFER_DIRECTION_IN, USBD_SHORT_TRANSFER_OK)
  TransferBufferLength = 00000008
  TransferBuffer       = 825c2e08
  TransferBufferMDL    = 00000000
  UrbLink              = 00000000
