[0 ms] UsbSnoop compiled on Jan 18 2003 22:41:32 loading
[0 ms] UsbSnoop - DriverEntry(f23e2c40) : Windows NT WDM version 1.16
[11 ms] UsbSnoop - AddDevice(f23e2f50) : DriverObject 8273fc70, pdo 825e4030
[11 ms] UsbSnoop - DispatchAny(f23e0610) : IRP_MJ_PNP (0x00000018)
[11 ms] UsbSnoop - MyDispatchPNP(f23e2ee0) : IRP_MJ_PNP (0x00000018)
[11 ms] UsbSnoop - DispatchAny(f23e0610) : IRP_MJ_PNP (IRP_MN_QUERY_RESOURCE_REQUIREMENTS)
[11 ms] UsbSnoop - MyDispatchPNP(f23e2ee0) : IRP_MJ_PNP (IRP_MN_QUERY_RESOURCE_REQUIREMENTS)
[11 ms] UsbSnoop - DispatchAny(f23e0610) : IRP_MJ_PNP (IRP_MN_FILTER_RESOURCE_REQUIREMENTS)
[11 ms] UsbSnoop - MyDispatchPNP(f23e2ee0) : IRP_MJ_PNP (IRP_MN_FILTER_RESOURCE_REQUIREMENTS)
[12 ms] UsbSnoop - DispatchAny(f23e0610) : IRP_MJ_PNP (IRP_MN_START_DEVICE)
[12 ms] UsbSnoop - MyDispatchPNP(f23e2ee0) : IRP_MJ_PNP (IRP_MN_START_DEVICE)
[12 ms] UsbSnoop - DispatchAny(f23e0610) : IRP_MJ_INTERNAL_DEVICE_CONTROL
[12 ms] UsbSnoop - MyDispatchInternalIOCTL(f23e1e80) : fdo=825e4030, Irp=827667e8, IRQL=0
[12 ms]  >>>  URB 1 going down  >>> 
-- URB_FUNCTION_GET_DESCRIPTOR_FROM_DEVICE:
  TransferBufferLength = 00000012
  TransferBuffer       = 825f94c8
  TransferBufferMDL    = 00000000
  Index                = 00000000
  DescriptorType       = 00000001 (USB_DEVICE_DESCRIPTOR_TYPE)
  LanguageId           = 00000000
[18 ms] UsbSnoop - MyInternalIOCTLCompletion(f23e1db0) : fido=00000000, Irp=827667e8, Context=825f93c8, IRQL=2
[18 ms]  <<<  URB 1 coming back  <<< 
-- URB_FUNCTION_CONTROL_TRANSFER:
  PipeHandle           = 825c5554
  TransferFlags        = 005c0077 (USBD_TRANSFER_DIRECTION_IN, USBD_SHORT_TRANSFER_OK)
  TransferBufferLength = 00000012
  TransferBuffer       = 825f94c8
  TransferBufferMDL    = 82619a68
    00000000: 12 01 00 02 ff 00 00 08 93 0a 02 00 17 01 01 02
    00000010: 03 01
  UrbLink              = 00000000
  SetupPacket          =
    00000000: 80 06 00 01 00 00 12 00
[18 ms] UsbSnoop - DispatchAny(f23e0610) : IRP_MJ_INTERNAL_DEVICE_CONTROL
[18 ms] UsbSnoop - MyDispatchInternalIOCTL(f23e1e80) : fdo=825e4030, Irp=827667e8, IRQL=0
[18 ms]  >>>  URB 2 going down  >>> 
-- URB_FUNCTION_GET_DESCRIPTOR_FROM_DEVICE:
  TransferBufferLength = 00000209
  TransferBuffer       = 8270d168
  TransferBufferMDL    = 00000000
  Index                = 00000000
  DescriptorType       = 00000002 (USB_CONFIGURATION_DESCRIPTOR_TYPE)
  LanguageId           = 00000000
[28 ms] UsbSnoop - MyInternalIOCTLCompletion(f23e1db0) : fido=00000000, Irp=827667e8, Context=825fa628, IRQL=2
[28 ms]  <<<  URB 2 coming back  <<< 
-- URB_FUNCTION_CONTROL_TRANSFER:
  PipeHandle           = 825c5554
  TransferFlags        = 005c0077 (USBD_TRANSFER_DIRECTION_IN, USBD_SHORT_TRANSFER_OK)
  TransferBufferLength = 00000028
  TransferBuffer       = 8270d168
  TransferBufferMDL    = 82619a68
    00000000: 09 02 20 00 01 01 00 a0 64 09 04 00 00 02 ff 00
    00000010: ff 00 07 05 81 03 08 00 01 07 05 82 03 40 00 01
    00000020: 00 00 00 00 00 00 00 00
  UrbLink              = 00000000
  SetupPacket          =
    00000000: 80 06 00 02 00 00 09 02
[28 ms] UsbSnoop - DispatchAny(f23e0610) : IRP_MJ_INTERNAL_DEVICE_CONTROL
[28 ms] UsbSnoop - MyDispatchInternalIOCTL(f23e1e80) : fdo=825e4030, Irp=827667e8, IRQL=0
[28 ms]  >>>  URB 3 going down  >>> 
-- URB_FUNCTION_SELECT_CONFIGURATION:
  ConfigurationDescriptor = 0x8270d168 (configure)
  ConfigurationDescriptor : bLength             = 9
  ConfigurationDescriptor : bDescriptorType     = 0x00000002
  ConfigurationDescriptor : wTotalLength        = 0x00000020
  ConfigurationDescriptor : bNumInterfaces      = 0x00000001
  ConfigurationDescriptor : bConfigurationValue = 0x00000001
  ConfigurationDescriptor : iConfiguration      = 0x00000000
  ConfigurationDescriptor : bmAttributes        = 0x000000a0
  ConfigurationDescriptor : MaxPower            = 0x00000064
  ConfigurationHandle     = 0x005c0077
  Interface[0]: Length            = 56
  Interface[0]: InterfaceNumber   = 0
  Interface[0]: AlternateSetting  = 0
[31 ms] UsbSnoop - MyInternalIOCTLCompletion(f23e1db0) : fido=00000000, Irp=827667e8, Context=82602e08, IRQL=0
[31 ms]  <<<  URB 3 coming back  <<< 
-- URB_FUNCTION_SELECT_CONFIGURATION:
  ConfigurationDescriptor = 0x8270d168 (configure)
  ConfigurationDescriptor : bLength             = 9
  ConfigurationDescriptor : bDescriptorType     = 0x00000002
  ConfigurationDescriptor : wTotalLength        = 0x00000020
  ConfigurationDescriptor : bNumInterfaces      = 0x00000001
  ConfigurationDescriptor : bConfigurationValue = 0x00000001
  ConfigurationDescriptor : iConfiguration      = 0x00000000
  ConfigurationDescriptor : bmAttributes        = 0x000000a0
  ConfigurationDescriptor : MaxPower            = 0x00000064
  ConfigurationHandle     = 0xe12e2d48
  Interface[0]: Length            = 56
  Interface[0]: InterfaceNumber   = 0
  Interface[0]: AlternateSetting  = 0
  Interface[0]: Class             = 0x000000ff
  Interface[0]: SubClass          = 0x00000000
  Interface[0]: Protocol          = 0x000000ff
  Interface[0]: InterfaceHandle   = 0x825c4828
  Interface[0]: NumberOfPipes     = 2
  Interface[0]: Pipes[0] : MaximumPacketSize = 0x00000008
  Interface[0]: Pipes[0] : EndpointAddress   = 0x00000081
  Interface[0]: Pipes[0] : Interval          = 0x00000001
  Interface[0]: Pipes[0] : PipeType          = 0x00000003 (UsbdPipeTypeInterrupt)
  Interface[0]: Pipes[0] : PipeHandle        = 0x825c4840
  Interface[0]: Pipes[0] : MaxTransferSize   = 0x00001000
  Interface[0]: Pipes[0] : PipeFlags         = 0x00000000
  Interface[0]: Pipes[1] : MaximumPacketSize = 0x00000040
  Interface[0]: Pipes[1] : EndpointAddress   = 0x00000082
  Interface[0]: Pipes[1] : Interval          = 0x00000001
  Interface[0]: Pipes[1] : PipeType          = 0x00000003 (UsbdPipeTypeInterrupt)
  Interface[0]: Pipes[1] : PipeHandle        = 0x825c485c
  Interface[0]: Pipes[1] : MaxTransferSize   = 0x00001000
  Interface[0]: Pipes[1] : PipeFlags         = 0x00000000
[32 ms] UsbSnoop - DispatchAny(f23e0610) : IRP_MJ_PNP (IRP_MN_QUERY_CAPABILITIES)
[32 ms] UsbSnoop - MyDispatchPNP(f23e2ee0) : IRP_MJ_PNP (IRP_MN_QUERY_CAPABILITIES)
[32 ms] UsbSnoop - DispatchAny(f23e0610) : IRP_MJ_PNP (IRP_MN_QUERY_PNP_DEVICE_STATE)
[32 ms] UsbSnoop - MyDispatchPNP(f23e2ee0) : IRP_MJ_PNP (IRP_MN_QUERY_PNP_DEVICE_STATE)
[32 ms] UsbSnoop - DispatchAny(f23e0610) : IRP_MJ_PNP (IRP_MN_QUERY_DEVICE_RELATIONS)
[32 ms] UsbSnoop - MyDispatchPNP(f23e2ee0) : IRP_MJ_PNP (IRP_MN_QUERY_DEVICE_RELATIONS)
[32 ms] UsbSnoop - DispatchAny(f23e0610) : IRP_MJ_PNP (IRP_MN_QUERY_DEVICE_RELATIONS)
[32 ms] UsbSnoop - MyDispatchPNP(f23e2ee0) : IRP_MJ_PNP (IRP_MN_QUERY_DEVICE_RELATIONS)
[34 ms] UsbSnoop - DispatchAny(f23e0610) : IRP_MJ_INTERNAL_DEVICE_CONTROL
[34 ms] UsbSnoop - MyDispatchInternalIOCTL(f23e1e80) : fdo=825e4030, Irp=827667e8, IRQL=0
[34 ms]  >>>  URB 4 going down  >>> 
-- URB_FUNCTION_BULK_OR_INTERRUPT_TRANSFER:
  PipeHandle           = 825c4840 [endpoint 0x00000081]
  TransferFlags        = 00000003 (USBD_TRANSFER_DIRECTION_IN, USBD_SHORT_TRANSFER_OK)
  TransferBufferLength = 00000008
  TransferBuffer       = 826585c8
  TransferBufferMDL    = 00000000
  UrbLink              = 00000000
[34 ms] UsbSnoop - DispatchAny(f23e0610) : IRP_MJ_INTERNAL_DEVICE_CONTROL
[34 ms] UsbSnoop - MyDispatchInternalIOCTL(f23e1e80) : fdo=825e4030, Irp=82617ac8, IRQL=0
[34 ms]  >>>  URB 5 going down  >>> 
-- URB_FUNCTION_BULK_OR_INTERRUPT_TRANSFER:
  PipeHandle           = 825c485c [endpoint 0x00000082]
  TransferFlags        = 00000003 (USBD_TRANSFER_DIRECTION_IN, USBD_SHORT_TRANSFER_OK)
  TransferBufferLength = 0000041c
  TransferBuffer       = 825c7bc8
  TransferBufferMDL    = 00000000
  UrbLink              = 00000000
[35 ms] UsbSnoop - DispatchAny(f23e0610) : IRP_MJ_INTERNAL_DEVICE_CONTROL
[35 ms] UsbSnoop - MyDispatchInternalIOCTL(f23e1e80) : fdo=825e4030, Irp=825d83c8, IRQL=0
[35 ms]  >>>  URB 6 going down  >>> 
-- URB_FUNCTION_VENDOR_DEVICE:
  TransferFlags          = 00000000 (USBD_TRANSFER_DIRECTION_OUT, ~USBD_SHORT_TRANSFER_OK)
  TransferBufferLength = 00000000
  TransferBuffer       = 00000000
  TransferBufferMDL    = 00000000

    no data supplied
  UrbLink                 = 00000000
  RequestTypeReservedBits = 00000000
  Request                 = 000000fe
  Value                   = 000000de
  Index                   = 00000005
[38 ms] UsbSnoop - MyInternalIOCTLCompletion(f23e1db0) : fido=00000000, Irp=825d83c8, Context=82625248, IRQL=2
[38 ms]  <<<  URB 6 coming back  <<< 
-- URB_FUNCTION_CONTROL_TRANSFER:
  PipeHandle           = 825c5554
  TransferFlags        = 00000002 (USBD_TRANSFER_DIRECTION_OUT, USBD_SHORT_TRANSFER_OK)
  TransferBufferLength = 00000000
  TransferBuffer       = 00000000
  TransferBufferMDL    = 00000000
  UrbLink              = 00000000
  SetupPacket          =
    00000000: 40 fe de 00 05 00 00 00
[189490 ms] UsbSnoop - MyInternalIOCTLCompletion(f23e1db0) : fido=00000000, Irp=827667e8, Context=82641708, IRQL=2
[189490 ms]  <<<  URB 4 coming back  <<< 
-- URB_FUNCTION_BULK_OR_INTERRUPT_TRANSFER:
  PipeHandle           = 825c4840 [endpoint 0x00000081]
  TransferFlags        = 00000003 (USBD_TRANSFER_DIRECTION_IN, USBD_SHORT_TRANSFER_OK)
  TransferBufferLength = 00000007
  TransferBuffer       = 826585c8
  TransferBufferMDL    = 82619a68
    00000000: 01 01 17 01 00 30 05
  UrbLink              = 00000000
[189490 ms] UsbSnoop - DispatchAny(f23e0610) : IRP_MJ_INTERNAL_DEVICE_CONTROL
[189490 ms] UsbSnoop - MyDispatchInternalIOCTL(f23e1e80) : fdo=825e4030, Irp=827667e8, IRQL=2
[189490 ms]  >>>  URB 7 going down  >>> 
-- URB_FUNCTION_BULK_OR_INTERRUPT_TRANSFER:
  PipeHandle           = 825c4840 [endpoint 0x00000081]
  TransferFlags        = 00000003 (USBD_TRANSFER_DIRECTION_IN, USBD_SHORT_TRANSFER_OK)
  TransferBufferLength = 00000008
  TransferBuffer       = 826585c8
  TransferBufferMDL    = 00000000
  UrbLink              = 00000000
[189498 ms] UsbSnoop - MyInternalIOCTLCompletion(f23e1db0) : fido=00000000, Irp=82617ac8, Context=826139a8, IRQL=2
[189499 ms]  <<<  URB 5 coming back  <<< 
-- URB_FUNCTION_BULK_OR_INTERRUPT_TRANSFER:
  PipeHandle           = 825c485c [endpoint 0x00000082]
  TransferFlags        = 00000003 (USBD_TRANSFER_DIRECTION_IN, USBD_SHORT_TRANSFER_OK)
  TransferBufferLength = 00000006
  TransferBuffer       = 825c7bc8
  TransferBufferMDL    = 82615b48
    00000000: 01 01 17 01 01 20
  UrbLink              = 00000000
[189499 ms] UsbSnoop - DispatchAny(f23e0610) : IRP_MJ_INTERNAL_DEVICE_CONTROL
[189499 ms] UsbSnoop - MyDispatchInternalIOCTL(f23e1e80) : fdo=825e4030, Irp=82617ac8, IRQL=2
[189499 ms]  >>>  URB 8 going down  >>> 
-- URB_FUNCTION_BULK_OR_INTERRUPT_TRANSFER:
  PipeHandle           = 825c485c [endpoint 0x00000082]
  TransferFlags        = 00000003 (USBD_TRANSFER_DIRECTION_IN, USBD_SHORT_TRANSFER_OK)
  TransferBufferLength = 0000041c
  TransferBuffer       = 825c7bc8
  TransferBufferMDL    = 00000000
  UrbLink              = 00000000
[189533 ms] UsbSnoop - MyInternalIOCTLCompletion(f23e1db0) : fido=00000000, Irp=82617ac8, Context=8262c688, IRQL=2
[189534 ms]  <<<  URB 8 coming back  <<< 
-- URB_FUNCTION_BULK_OR_INTERRUPT_TRANSFER:
  PipeHandle           = 825c485c [endpoint 0x00000082]
  TransferFlags        = 00000003 (USBD_TRANSFER_DIRECTION_IN, USBD_SHORT_TRANSFER_OK)
  TransferBufferLength = 00000136
  TransferBuffer       = 825c7bc8
  TransferBufferMDL    = 82615b48
    00000000: 01 01 17 01 00 20 00 00 00 00 00 00 00 00 68 00
    00000010: 50 00 00 00 20 01 f0 ff ff ff ff ff ff ff ff ff
    00000020: ff ff ff ff ff ff ff ff ff ff ff ff ff ff ff ff
    00000030: ff ff ff ff ff ff ff ff ff ff ff ff ff ff ff ff
    00000040: ff ff ff ff ff ff ff ff ff ff ff ff ff ff ff ff
    00000050: ff ff ff ff ff ff ff ff ff ff ff ff ff ff ff ff
    00000060: ff ff ff ff ff ff ff ff ff ff ff ff ff ff ff ff
    00000070: ff ff ff ff ff ff ff ff ff ff ff ff ff ff ff ff
    00000080: ff ff ff ff ff ff ff ff ff ff ff ff ff ff ff ff
    00000090: ff ff ff ff ff ff ff ff ff ff ff ff ff ff ff ef
    000000a0: 16 ef ff f6 ff ff ff ff ff ff ff ff ff ff ff ff
    000000b0: ff ff ff ff ff ff ff ff ff ff ff ff 8f 42 11 32
    000000c0: 11 12 5f ff 11 13 f2 ff ff ff ff ff ff ff ff ff
    000000d0: ff ff ff ff ff ff ff ff ff ff ff ff ff ff ff ff
    000000e0: ff ff ff ff ff ff ff ff ff ff ff ff ff ff ff ff
    000000f0: ff ff ff ff ff ff ff ff ff ff ff ff ff ff ff ff
    00000100: ff ff ff ff ff 8d ff ff ff ff ff ff ff ff ff ff
    00000110: ff ff ff ff ff ff ff ff ff ff ff ff ff ff ff ff
    00000120: ff ff ff ff ff cf f1 ff ff ff ff ff ff ff ff ff
    00000130: ff ff ff ff ff 11
  UrbLink              = 00000000
[189534 ms] UsbSnoop - DispatchAny(f23e0610) : IRP_MJ_INTERNAL_DEVICE_CONTROL
[189534 ms] UsbSnoop - MyDispatchInternalIOCTL(f23e1e80) : fdo=825e4030, Irp=82617ac8, IRQL=2
[189534 ms]  >>>  URB 9 going down  >>> 
-- URB_FUNCTION_BULK_OR_INTERRUPT_TRANSFER:
  PipeHandle           = 825c485c [endpoint 0x00000082]
  TransferFlags        = 00000003 (USBD_TRANSFER_DIRECTION_IN, USBD_SHORT_TRANSFER_OK)
  TransferBufferLength = 0000041c
  TransferBuffer       = 825c7bc8
  TransferBufferMDL    = 00000000
  UrbLink              = 00000000
[189978 ms] UsbSnoop - MyInternalIOCTLCompletion(f23e1db0) : fido=00000000, Irp=82617ac8, Context=82619d08, IRQL=2
[189978 ms]  <<<  URB 9 coming back  <<< 
-- URB_FUNCTION_BULK_OR_INTERRUPT_TRANSFER:
  PipeHandle           = 825c485c [endpoint 0x00000082]
  TransferFlags        = 00000003 (USBD_TRANSFER_DIRECTION_IN, USBD_SHORT_TRANSFER_OK)
  TransferBufferLength = 0000013e
  TransferBuffer       = 825c7bc8
  TransferBufferMDL    = 8261b1e8
    00000000: 01 01 17 01 00 20 17 00 00 00 00 00 00 00 68 00
    00000010: 50 00 00 00 28 01 f0 ff ff ff ff ff ff ff ff ff
    00000020: ff ff ff ff ff ff ff ff ff ff ff ff ff ff ff ff
    00000030: ff ff ff ff ff ff ff ff ff ff ff ff ff ff ff ff
    00000040: ff ff ff ff ff ff ff ff ff ff ff ff ff ff ff ff
    00000050: ff ff ff ff ff ff ff ff ff ff ff ff ff ff ff ff
    00000060: ff ff ff ff ff ff ff ff ff ff ff ff ff ff ff ff
    00000070: ff ff ff ff ff ff ff ff ff ff ff ff ff ff ff ff
    00000080: ff ff ff ff ff ff ff ff ff ff ff ff ff ff ff ff
    00000090: ff ff ff ff ff ff ff ff ff ff ff ff ef 51 32 fb
    000000a0: ff 42 f2 ff b6 ff ff ff ff ff ff ff ff ff ff ff
    000000b0: ff ff ff ff ff ff ff ff ff ff ff ff 14 2f 11 f2
    000000c0: ff 1c 12 21 71 f2 1f 23 17 14 16 51 f1 ff ff ff
    000000d0: ff ff ff ff ff ff ff ff ff ff ff ff ff ff ff ff
    000000e0: ff ff ff ff ff ff ff ff ff ff ff ff ff ff ff ff
    000000f0: ff ff ff ff ff ff ff ff ff ff ff ff ff ff ff ff
    00000100: ff ff ff ff ff ff ff ff ff ff ff 4f f7 ff ff ff
    00000110: ff ff ff ff ff ff ff ff ff ff ff ff ff ff ff ff
    00000120: ff ff ff ff ff ff ff ff ff ff ff ff 1d ff ff ff
    00000130: ff ff ff ff ff ff ff ff ff ff ff 1f 1d ff
  UrbLink              = 00000000
[189978 ms] UsbSnoop - DispatchAny(f23e0610) : IRP_MJ_INTERNAL_DEVICE_CONTROL
[189978 ms] UsbSnoop - MyDispatchInternalIOCTL(f23e1e80) : fdo=825e4030, Irp=82617ac8, IRQL=2
[189978 ms]  >>>  URB 10 going down  >>> 
-- URB_FUNCTION_BULK_OR_INTERRUPT_TRANSFER:
  PipeHandle           = 825c485c [endpoint 0x00000082]
  TransferFlags        = 00000003 (USBD_TRANSFER_DIRECTION_IN, USBD_SHORT_TRANSFER_OK)
  TransferBufferLength = 0000041c
  TransferBuffer       = 825c7bc8
  TransferBufferMDL    = 00000000
  UrbLink              = 00000000
[189996 ms] UsbSnoop - MyInternalIOCTLCompletion(f23e1db0) : fido=00000000, Irp=82617ac8, Context=825c91e8, IRQL=2
[189996 ms]  <<<  URB 10 coming back  <<< 
-- URB_FUNCTION_BULK_OR_INTERRUPT_TRANSFER:
  PipeHandle           = 825c485c [endpoint 0x00000082]
  TransferFlags        = 00000003 (USBD_TRANSFER_DIRECTION_IN, USBD_SHORT_TRANSFER_OK)
  TransferBufferLength = 0000013a
  TransferBuffer       = 825c7bc8
  TransferBufferMDL    = 8261b1e8
    00000000: 01 01 17 01 00 20 25 00 00 00 00 00 00 00 68 00
    00000010: 50 00 00 00 24 01 f0 ff ff ff ff ff ff ff ff ff
    00000020: ff ff ff ff ff ff ff ff ff ff ff ff ff ff ff ff
    00000030: ff ff ff ff ff ff ff ff ff ff ff ff ff ff ff ff
    00000040: ff ff ff ff ff ff ff ff ff ff ff ff ff ff ff ff
    00000050: ff ff ff ff ff ff ff ff ff ff ff ff ff ff ff ff
    00000060: ff ff ff ff ff ff ff ff ff ff ff ff ff ff ff ff
    00000070: ff ff ff ff ff ff ff ff ff ff ff ff ff ff ff ff
    00000080: ff ff ff ff ff ff ff ff ff ff ff ff ff ff ff ff
    00000090: ff ff ff ff ff ff ff ff ff ff ff ff ff f2 f4 9f
    000000a0: 21 12 ff ef f8 ff ff ff ff ff ff ff ff ff ff ff
    000000b0: ff ff ff ff ff ff ff ff ff ff ff ff 31 74 ff 1a
    000000c0: 14 19 c2 f1 3f 32 75 11 f2 ff ff ff ff ff ff ff
    000000d0: ff ff ff ff ff ff ff ff ff ff ff ff ff ff ff ff
    000000e0: ff ff ff ff ff ff ff ff ff ff ff ff ff ff ff ff
    000000f0: ff ff ff ff ff ff ff ff ff ff ff ff ff ff ff ff
    00000100: ff ff ff ff ff ff ff ff 70 ff ff ff ff ff ff ff
    00000110: ff ff ff ff ff ff ff ff ff ff ff ff ff ff ff ff
    00000120: ff ff ff ff ff ff ff ff df f1 ff ff ff ff ff ff
    00000130: ff ff ff ff ff ff ff ff 11 f1
  UrbLink              = 00000000
[189996 ms] UsbSnoop - DispatchAny(f23e0610) : IRP_MJ_INTERNAL_DEVICE_CONTROL
[189996 ms] UsbSnoop - MyDispatchInternalIOCTL(f23e1e80) : fdo=825e4030, Irp=82617ac8, IRQL=2
[189996 ms]  >>>  URB 11 going down  >>> 
-- URB_FUNCTION_BULK_OR_INTERRUPT_TRANSFER:
  PipeHandle           = 825c485c [endpoint 0x00000082]
  TransferFlags        = 00000003 (USBD_TRANSFER_DIRECTION_IN, USBD_SHORT_TRANSFER_OK)
  TransferBufferLength = 0000041c
  TransferBuffer       = 825c7bc8
  TransferBufferMDL    = 00000000
  UrbLink              = 00000000
[190087 ms] UsbSnoop - MyInternalIOCTLCompletion(f23e1db0) : fido=00000000, Irp=82617ac8, Context=8263abc8, IRQL=2
[190087 ms]  <<<  URB 11 coming back  <<< 
-- URB_FUNCTION_BULK_OR_INTERRUPT_TRANSFER:
  PipeHandle           = 825c485c [endpoint 0x00000082]
  TransferFlags        = 00000003 (USBD_TRANSFER_DIRECTION_IN, USBD_SHORT_TRANSFER_OK)
  TransferBufferLength = 0000013e
  TransferBuffer       = 825c7bc8
  TransferBufferMDL    = 8261b1e8
    00000000: 01 01 17 01 00 20 36 00 00 00 00 00 00 00 68 00
    00000010: 50 00 00 00 28 01 f0 ff ff ff ff ff ff ff ff ff
    00000020: ff ff ff ff ff ff ff ff ff ff ff ff ff ff ff ff
    00000030: ff ff ff ff ff ff ff ff ff ff ff ff ff ff ff ff
    00000040: ff ff ff ff ff ff ff ff ff ff ff ff ff ff ff ff
    00000050: ff ff ff ff ff ff ff ff ff ff ff ff ff ff ff ff
    00000060: ff ff ff ff ff ff ff ff ff ff ff ff ff ff ff ff
    00000070: ff ff ff ff ff ff ff ff ff ff ff ff ff ff ff ff
    00000080: ff ff ff ff ff ff ff ff ff ff ff ff ff ff ff ff
    00000090: ff ff ff ff ff ff ff ff ff 9f 21 fa ff 37 f2 ff
    000000a0: f2 12 f2 ff ff ff ff ff ff ff ff ff ff ff ff ff
    000000b0: ff ff ff ff ff ff ff ff ff ff 21 ff 8f 11 12 12
    000000c0: 24 12 ff 64 11 11 62 11 15 ff ff ff ff ff ff ff
    000000d0: ff ff ff ff ff ff ff ff ff ff ff ff ff ff ff ff
    000000e0: ff ff ff ff ff ff ff ff ff ff ff ff ff ff ff ff
    000000f0: ff ff ff ff ff ff ff ff ff ff ff ff ff ff ff ff
    00000100: ff ff ff ff ff ff ff ff ff ff ff 9f f7 ff ff ff
    00000110: ff ff ff ff ff ff ff ff ff ff ff ff ff ff ff ff
    00000120: ff ff ff ff ff ff ff ff ff ff ff ff 1d ff ff ff
    00000130: ff ff ff ff ff ff ff ff ff ff ff 1f 1d ff
  UrbLink              = 00000000
[190087 ms] UsbSnoop - DispatchAny(f23e0610) : IRP_MJ_INTERNAL_DEVICE_CONTROL
[190087 ms] UsbSnoop - MyDispatchInternalIOCTL(f23e1e80) : fdo=825e4030, Irp=82617ac8, IRQL=2
[190087 ms]  >>>  URB 12 going down  >>> 
-- URB_FUNCTION_BULK_OR_INTERRUPT_TRANSFER:
  PipeHandle           = 825c485c [endpoint 0x00000082]
  TransferFlags        = 00000003 (USBD_TRANSFER_DIRECTION_IN, USBD_SHORT_TRANSFER_OK)
  TransferBufferLength = 0000041c
  TransferBuffer       = 825c7bc8
  TransferBufferMDL    = 00000000
  UrbLink              = 00000000
[190096 ms] UsbSnoop - MyInternalIOCTLCompletion(f23e1db0) : fido=00000000, Irp=82617ac8, Context=825f1668, IRQL=2
[190096 ms]  <<<  URB 12 coming back  <<< 
-- URB_FUNCTION_BULK_OR_INTERRUPT_TRANSFER:
  PipeHandle           = 825c485c [endpoint 0x00000082]
  TransferFlags        = 00000003 (USBD_TRANSFER_DIRECTION_IN, USBD_SHORT_TRANSFER_OK)
  TransferBufferLength = 0000013a
  TransferBuffer       = 825c7bc8
  TransferBufferMDL    = 8261b1e8
    00000000: 01 01 17 01 00 20 43 00 00 00 00 00 00 00 68 00
    00000010: 50 00 00 00 24 01 f0 ff ff ff ff ff ff ff ff ff
    00000020: ff ff ff ff ff ff ff ff ff ff ff ff ff ff ff ff
    00000030: ff ff ff ff ff ff ff ff ff ff ff ff ff ff ff ff
    00000040: ff ff ff ff ff ff ff ff ff ff ff ff ff ff ff ff
    00000050: ff ff ff ff ff ff ff ff ff ff ff ff ff ff ff ff
    00000060: ff ff ff ff ff ff ff ff ff ff ff ff ff ff ff ff
    00000070: ff ff ff ff ff ff ff ff ff ff ff ff ff ff ff ff
    00000080: ff ff ff ff ff ff ff ff ff ff ff ff ff ff ff ff
    00000090: ff ff ff ff ff ff ff ff ff 1b 11 11 f2 f4 9f 11
    000000a0: 21 ff ff 10 ff ff ff ff ff ff ff ff ff ff ff ff
    000000b0: ff ff ff ff ff ff ff ff ff ff ff 3f 71 21 11 f6
    000000c0: 3f e1 41 ff 6f f1 ff ff ff ff ff ff ff ff ff ff
    000000d0: ff ff ff ff ff ff ff ff ff ff ff ff ff ff ff ff
    000000e0: ff ff ff ff ff ff ff ff ff ff ff ff ff ff ff ff
    000000f0: ff ff ff ff ff ff ff ff ff ff ff ff ff ff ff ff
    00000100: ff ff ff ff ff ff ff ff ff 74 ff ff ff ff ff ff
    00000110: ff ff ff ff ff ff ff ff ff ff ff ff ff ff ff ff
    00000120: ff ff ff ff ff ff ff ff ff df f1 ff ff ff ff ff
    00000130: ff ff ff ff ff ff ff ff ff 11
  UrbLink              = 00000000
[190096 ms] UsbSnoop - DispatchAny(f23e0610) : IRP_MJ_INTERNAL_DEVICE_CONTROL
[190096 ms] UsbSnoop - MyDispatchInternalIOCTL(f23e1e80) : fdo=825e4030, Irp=82617ac8, IRQL=2
[190096 ms]  >>>  URB 13 going down  >>> 
-- URB_FUNCTION_BULK_OR_INTERRUPT_TRANSFER:
  PipeHandle           = 825c485c [endpoint 0x00000082]
  TransferFlags        = 00000003 (USBD_TRANSFER_DIRECTION_IN, USBD_SHORT_TRANSFER_OK)
  TransferBufferLength = 0000041c
  TransferBuffer       = 825c7bc8
  TransferBufferMDL    = 00000000
  UrbLink              = 00000000
[190105 ms] UsbSnoop - MyInternalIOCTLCompletion(f23e1db0) : fido=00000000, Irp=82617ac8, Context=826139a8, IRQL=2
[190105 ms]  <<<  URB 13 coming back  <<< 
-- URB_FUNCTION_BULK_OR_INTERRUPT_TRANSFER:
  PipeHandle           = 825c485c [endpoint 0x00000082]
  TransferFlags        = 00000003 (USBD_TRANSFER_DIRECTION_IN, USBD_SHORT_TRANSFER_OK)
  TransferBufferLength = 0000013a
  TransferBuffer       = 825c7bc8
  TransferBufferMDL    = 8261b1e8
    00000000: 01 01 17 01 00 20 54 00 00 00 00 00 00 00 68 00
    00000010: 50 00 00 00 24 01 f0 ff ff ff ff ff ff ff ff ff
    00000020: ff ff ff ff ff ff ff ff ff ff ff ff ff ff ff ff
    00000030: ff ff ff ff ff ff ff ff ff ff ff ff ff ff ff ff
    00000040: ff ff ff ff ff ff ff ff ff ff ff ff ff ff ff ff
    00000050: ff ff ff ff ff ff ff ff ff ff ff ff ff ff ff ff
    00000060: ff ff ff ff ff ff ff ff ff ff ff ff ff ff ff ff
    00000070: ff ff ff ff ff ff ff ff ff ff ff ff ff ff ff ff
    00000080: ff ff ff ff ff ff ff ff ff ff ff ff ff ff ff ff
    00000090: ff ff ff ff ff ff 5f f1 ff af 12 12 11 df 9f 41
    000000a0: ff ff ff ff ff ff ff ff ff ff ff ff ff ff ff ff
    000000b0: ff ff ff ff ff ff ff ff ff 11 1e 13 24 53 f2 f1
    000000c0: fd 17 ff ff ff ff ff ff ff ff ff ff ff ff ff ff
    000000d0: ff ff ff ff ff ff ff ff ff ff ff ff ff ff ff ff
    000000e0: ff ff ff ff ff ff ff ff ff ff ff ff ff ff ff ff
    000000f0: ff ff ff ff ff ff ff ff ff ff ff ff ff ff ff ff
    00000100: ff ff ff ff ff ff ff 7d ff ff ff ff ff ff ff ff
    00000110: ff ff ff ff ff ff ff ff ff ff ff ff ff ff ff ff
    00000120: ff ff ff ff ff ff ff df f1 ff ff ff ff ff ff ff
    00000130: ff ff ff ff ff ff ff 11 f1 ff
  UrbLink              = 00000000
[190105 ms] UsbSnoop - DispatchAny(f23e0610) : IRP_MJ_INTERNAL_DEVICE_CONTROL
[190105 ms] UsbSnoop - MyDispatchInternalIOCTL(f23e1e80) : fdo=825e4030, Irp=82617ac8, IRQL=2
[190105 ms]  >>>  URB 14 going down  >>> 
-- URB_FUNCTION_BULK_OR_INTERRUPT_TRANSFER:
  PipeHandle           = 825c485c [endpoint 0x00000082]
  TransferFlags        = 00000003 (USBD_TRANSFER_DIRECTION_IN, USBD_SHORT_TRANSFER_OK)
  TransferBufferLength = 0000041c
  TransferBuffer       = 825c7bc8
  TransferBufferMDL    = 00000000
  UrbLink              = 00000000
[190114 ms] UsbSnoop - MyInternalIOCTLCompletion(f23e1db0) : fido=00000000, Irp=82617ac8, Context=8275da68, IRQL=2
[190114 ms]  <<<  URB 14 coming back  <<< 
-- URB_FUNCTION_BULK_OR_INTERRUPT_TRANSFER:
  PipeHandle           = 825c485c [endpoint 0x00000082]
  TransferFlags        = 00000003 (USBD_TRANSFER_DIRECTION_IN, USBD_SHORT_TRANSFER_OK)
  TransferBufferLength = 0000013a
  TransferBuffer       = 825c7bc8
  TransferBufferMDL    = 8261b1e8
    00000000: 01 01 17 01 00 20 61 00 00 00 00 00 00 00 68 00
    00000010: 50 00 00 00 24 01 f0 ff ff ff ff ff ff ff ff ff
    00000020: ff ff ff ff ff ff ff ff ff ff ff ff ff ff ff ff
    00000030: ff ff ff ff ff ff ff ff ff ff ff ff ff ff ff ff
    00000040: ff ff ff ff ff ff ff ff ff ff ff ff ff ff ff ff
    00000050: ff ff ff ff ff ff ff ff ff ff ff ff ff ff ff ff
    00000060: ff ff ff ff ff ff ff ff ff ff ff ff ff ff ff ff
    00000070: ff ff ff ff ff ff ff ff ff ff ff ff ff ff ff ff
    00000080: ff ff ff ff ff ff ff ff ff ff ff ff ff ff ff ff
    00000090: ff ff ff ff ff ff 1c 11 71 ff cf 91 ff f7 f6 ff
    000000a0: ff ff ff ff ff ff ff ff ff ff ff ff ff ff ff ff
    000000b0: ff ff ff ff ff ff ff 8f 62 61 31 12 11 23 25 2f
    000000c0: 0f 12 22 df f1 ff ff ff ff ff ff ff ff ff ff ff
    000000d0: ff ff ff ff ff ff ff ff ff ff ff ff ff ff ff ff
    000000e0: ff ff ff ff ff ff ff ff ff ff ff ff ff ff ff ff
    000000f0: ff ff ff ff ff ff ff ff ff ff ff ff ff ff ff ff
    00000100: ff ff ff ff ff ff ff ff ff df f7 ff ff ff ff ff
    00000110: ff ff ff ff ff ff ff ff ff ff ff ff ff ff ff ff
    00000120: ff ff ff ff ff ff ff ff ff ff 1d ff ff ff ff ff
    00000130: ff ff ff ff ff ff ff ff ff 1f
  UrbLink              = 00000000
[190114 ms] UsbSnoop - DispatchAny(f23e0610) : IRP_MJ_INTERNAL_DEVICE_CONTROL
[190114 ms] UsbSnoop - MyDispatchInternalIOCTL(f23e1e80) : fdo=825e4030, Irp=82617ac8, IRQL=2
[190114 ms]  >>>  URB 15 going down  >>> 
-- URB_FUNCTION_BULK_OR_INTERRUPT_TRANSFER:
  PipeHandle           = 825c485c [endpoint 0x00000082]
  TransferFlags        = 00000003 (USBD_TRANSFER_DIRECTION_IN, USBD_SHORT_TRANSFER_OK)
  TransferBufferLength = 0000041c
  TransferBuffer       = 825c7bc8
  TransferBufferMDL    = 00000000
  UrbLink              = 00000000
[190132 ms] UsbSnoop - MyInternalIOCTLCompletion(f23e1db0) : fido=00000000, Irp=82617ac8, Context=825ea948, IRQL=2
[190132 ms]  <<<  URB 15 coming back  <<< 
-- URB_FUNCTION_BULK_OR_INTERRUPT_TRANSFER:
  PipeHandle           = 825c485c [endpoint 0x00000082]
  TransferFlags        = 00000003 (USBD_TRANSFER_DIRECTION_IN, USBD_SHORT_TRANSFER_OK)
  TransferBufferLength = 0000013a
  TransferBuffer       = 825c7bc8
  TransferBufferMDL    = 8261b1e8
    00000000: 01 01 17 01 00 20 6f 00 00 00 00 00 00 00 68 00
    00000010: 50 00 00 00 24 01 f0 ff ff ff ff ff ff ff ff ff
    00000020: ff ff ff ff ff ff ff ff ff ff ff ff ff ff ff ff
    00000030: ff ff ff ff ff ff ff ff ff ff ff ff ff ff ff ff
    00000040: ff ff ff ff ff ff ff ff ff ff ff ff ff ff ff ff
    00000050: ff ff ff ff ff ff ff ff ff ff ff ff ff ff ff ff
    00000060: ff ff ff ff ff ff ff ff ff ff ff ff ff ff ff ff
    00000070: ff ff ff ff ff ff ff ff ff ff ff ff ff ff ff ff
    00000080: ff ff ff ff ff ff ff ff ff ff ff ff ff ff ff ff
    00000090: ff ff ff ff ff ff f6 f2 ff 25 f1 ff f6 f0 ff ff
    000000a0: ff ff ff ff ff ff ff ff ff ff ff ff ff ff ff ff
    000000b0: ff ff ff ff ff 10 21 ff 8f 23 11 32 11 1e bf 24
    000000c0: 57 f2 ff ff ff ff ff ff ff ff ff ff ff ff ff ff
    000000d0: ff ff ff ff ff ff ff ff ff ff ff ff ff ff ff ff
    000000e0: ff ff ff ff ff ff ff ff ff ff ff ff ff ff ff ff
    000000f0: ff ff ff ff ff ff ff ff ff ff ff ff ff ff ff ff
    00000100: ff ff ff ff ff ff ff ef f7 ff ff ff ff ff ff ff
    00000110: ff ff ff ff ff ff ff ff ff ff ff ff ff ff ff ff
    00000120: ff ff ff ff ff ff ff ff 1d ff ff ff ff ff ff ff
    00000130: ff ff ff ff ff ff ff 1f 1d ff
  UrbLink              = 00000000
[190132 ms] UsbSnoop - DispatchAny(f23e0610) : IRP_MJ_INTERNAL_DEVICE_CONTROL
[190132 ms] UsbSnoop - MyDispatchInternalIOCTL(f23e1e80) : fdo=825e4030, Irp=82617ac8, IRQL=2
[190132 ms]  >>>  URB 16 going down  >>> 
-- URB_FUNCTION_BULK_OR_INTERRUPT_TRANSFER:
  PipeHandle           = 825c485c [endpoint 0x00000082]
  TransferFlags        = 00000003 (USBD_TRANSFER_DIRECTION_IN, USBD_SHORT_TRANSFER_OK)
  TransferBufferLength = 0000041c
  TransferBuffer       = 825c7bc8
  TransferBufferMDL    = 00000000
  UrbLink              = 00000000
[190168 ms] UsbSnoop - MyInternalIOCTLCompletion(f23e1db0) : fido=00000000, Irp=82617ac8, Context=825eac48, IRQL=2
[190168 ms]  <<<  URB 16 coming back  <<< 
-- URB_FUNCTION_BULK_OR_INTERRUPT_TRANSFER:
  PipeHandle           = 825c485c [endpoint 0x00000082]
  TransferFlags        = 00000003 (USBD_TRANSFER_DIRECTION_IN, USBD_SHORT_TRANSFER_OK)
  TransferBufferLength = 0000013a
  TransferBuffer       = 825c7bc8
  TransferBufferMDL    = 8261b1e8
    00000000: 01 01 17 01 00 20 81 00 00 00 00 00 00 00 68 00
    00000010: 50 00 00 00 24 01 f0 ff ff ff ff ff ff ff ff ff
    00000020: ff ff ff ff ff ff ff ff ff ff ff ff ff ff ff ff
    00000030: ff ff ff ff ff ff ff ff ff ff ff ff ff ff ff ff
    00000040: ff ff ff ff ff ff ff ff ff ff ff ff ff ff ff ff
    00000050: ff ff ff ff ff ff ff ff ff ff ff ff ff ff ff ff
    00000060: ff ff ff ff ff ff ff ff ff ff ff ff ff ff ff ff
    00000070: ff ff ff ff ff ff ff ff ff ff ff ff ff ff ff ff
    00000080: ff ff ff ff ff ff ff ff ff ff ff ff ff ff ff ff
    00000090: ff ff ff 11 52 ff ff f4 af af 13 ff ff ff ff ff
    000000a0: ff ff ff ff ff ff ff ff ff ff ff ff ff ff ff ff
    000000b0: ff ff ff ff 17 15 14 21 f5 fb 15 13 19 d1 f1 ff
    000000c0: ff ff ff ff ff ff ff ff ff ff ff ff ff ff ff ff
    000000d0: ff ff ff ff ff ff ff ff ff ff ff ff ff ff ff ff
    000000e0: ff ff ff ff ff ff ff ff ff ff ff ff ff ff ff ff
    000000f0: ff ff ff ff ff ff ff ff ff ff ff ff ff ff ff ff
    00000100: ff ff ff ff ff ff ff 7d ff ff ff ff ff ff ff ff
    00000110: ff ff ff ff ff ff ff ff ff ff ff ff ff ff ff ff
    00000120: ff ff ff ff ff ff ff df f1 ff ff ff ff ff ff ff
    00000130: ff ff ff ff ff ff ff 11 f1 ff
  UrbLink              = 00000000
[190168 ms] UsbSnoop - DispatchAny(f23e0610) : IRP_MJ_INTERNAL_DEVICE_CONTROL
[190168 ms] UsbSnoop - MyDispatchInternalIOCTL(f23e1e80) : fdo=825e4030, Irp=82617ac8, IRQL=2
[190168 ms]  >>>  URB 17 going down  >>> 
-- URB_FUNCTION_BULK_OR_INTERRUPT_TRANSFER:
  PipeHandle           = 825c485c [endpoint 0x00000082]
  TransferFlags        = 00000003 (USBD_TRANSFER_DIRECTION_IN, USBD_SHORT_TRANSFER_OK)
  TransferBufferLength = 0000041c
  TransferBuffer       = 825c7bc8
  TransferBufferMDL    = 00000000
  UrbLink              = 00000000
[190194 ms] UsbSnoop - MyInternalIOCTLCompletion(f23e1db0) : fido=00000000, Irp=82617ac8, Context=825eaa48, IRQL=2
[190195 ms]  <<<  URB 17 coming back  <<< 
-- URB_FUNCTION_BULK_OR_INTERRUPT_TRANSFER:
  PipeHandle           = 825c485c [endpoint 0x00000082]
  TransferFlags        = 00000003 (USBD_TRANSFER_DIRECTION_IN, USBD_SHORT_TRANSFER_OK)
  TransferBufferLength = 0000013a
  TransferBuffer       = 825c7bc8
  TransferBufferMDL    = 8261b1e8
    00000000: 01 01 17 01 00 20 8f 00 00 00 00 00 00 00 68 00
    00000010: 50 00 00 00 24 01 f0 ff ff ff ff ff ff ff ff ff
    00000020: ff ff ff ff ff ff ff ff ff ff ff ff ff ff ff ff
    00000030: ff ff ff ff ff ff ff ff ff ff ff ff ff ff ff ff
    00000040: ff ff ff ff ff ff ff ff ff ff ff ff ff ff ff ff
    00000050: ff ff ff ff ff ff ff ff ff ff ff ff ff ff ff ff
    00000060: ff ff ff ff ff ff ff ff ff ff ff ff ff ff ff ff
    00000070: ff ff ff ff ff ff ff ff ff ff ff ff ff ff ff ff
    00000080: ff ff ff ff ff ff ff ff ff ff ff ff ff ff ff ff
    00000090: ff ff 7e f1 f2 ff 24 f1 ff c7 21 ff ff ff ff ff
    000000a0: ff ff ff ff ff ff ff ff ff ff ff ff ff ff ff ff
    000000b0: ff ff 2f f6 ff 13 23 14 44 f3 4f 26 53 72 f2 ff
    000000c0: ff ff ff ff ff ff ff ff ff ff ff ff ff ff ff ff
    000000d0: ff ff ff ff ff ff ff ff ff ff ff ff ff ff ff ff
    000000e0: ff ff ff ff ff ff ff ff ff ff ff ff ff ff ff ff
    000000f0: ff ff ff ff ff ff ff ff ff ff ff ff ff ff ff ff
    00000100: ff ff ff ff ff ff ff ff 76 ff ff ff ff ff ff ff
    00000110: ff ff ff ff ff ff ff ff ff ff ff ff ff ff ff ff
    00000120: ff ff ff ff ff ff ff ff ff ff ff ff ff ff ff ff
    00000130: ff ff ff ff ff ff ff ff ff ff
  UrbLink              = 00000000
[190195 ms] UsbSnoop - DispatchAny(f23e0610) : IRP_MJ_INTERNAL_DEVICE_CONTROL
[190195 ms] UsbSnoop - MyDispatchInternalIOCTL(f23e1e80) : fdo=825e4030, Irp=82617ac8, IRQL=2
[190195 ms]  >>>  URB 18 going down  >>> 
-- URB_FUNCTION_BULK_OR_INTERRUPT_TRANSFER:
  PipeHandle           = 825c485c [endpoint 0x00000082]
  TransferFlags        = 00000003 (USBD_TRANSFER_DIRECTION_IN, USBD_SHORT_TRANSFER_OK)
  TransferBufferLength = 0000041c
  TransferBuffer       = 825c7bc8
  TransferBufferMDL    = 00000000
  UrbLink              = 00000000
[190267 ms] UsbSnoop - MyInternalIOCTLCompletion(f23e1db0) : fido=00000000, Irp=82617ac8, Context=825ea948, IRQL=2
[190267 ms]  <<<  URB 18 coming back  <<< 
-- URB_FUNCTION_BULK_OR_INTERRUPT_TRANSFER:
  PipeHandle           = 825c485c [endpoint 0x00000082]
  TransferFlags        = 00000003 (USBD_TRANSFER_DIRECTION_IN, USBD_SHORT_TRANSFER_OK)
  TransferBufferLength = 0000013a
  TransferBuffer       = 825c7bc8
  TransferBufferMDL    = 8261b1e8
    00000000: 01 01 17 01 00 20 a0 00 00 00 00 00 00 00 68 00
    00000010: 50 00 00 00 24 01 f0 ff ff ff ff ff ff ff ff ff
    00000020: ff ff ff ff ff ff ff ff ff ff ff ff ff ff ff ff
    00000030: ff ff ff ff ff ff ff ff ff ff ff ff ff ff ff ff
    00000040: ff ff ff ff ff ff ff ff ff ff ff ff ff ff ff ff
    00000050: ff ff ff ff ff ff ff ff ff ff ff ff ff ff ff ff
    00000060: ff ff ff ff ff ff ff ff ff ff ff ff ff ff ff ff
    00000070: ff ff ff ff ff ff ff ff ff ff ff ff ff ff ff ff
    00000080: ff ff ff ff ff ff ff ff ff ff ff ff ff ff ff 8f
    00000090: f2 ff 2f ff fc 3f 21 ff ff 1a ff ff ff ff ff ff
    000000a0: 3f f3 ff ff df f2 ff ff ff ff ff ff 1b ff ff ff
    000000b0: 5b 11 ff ff 1b 14 24 f3 f3 6f 31 22 33 ff ff ff
    000000c0: ff ff ff ff ff ff ff ff ff ff ff ff ff ff ff ff
    000000d0: ff ff ff ff ff ff ff ff ff ff ff ff ff ff ff ff
    000000e0: ff ff ff ff ff ff ff ff ff ff ff ff ff ff ff ff
    000000f0: ff ff ff ff ff ff ff ff ff ff ff ff ff ff ff ff
    00000100: ff ff ff ff ff ff ff ff ff 7c ff ff ff ff ff ff
    00000110: ff ff ff ff ff ff ff ff ff ff ff ff ff ff ff ff
    00000120: ff ff ff ff ff ff ff ff ff ff ff ff ff ff ff ff
    00000130: ff ff ff ff ff ff ff ff ff ff
  UrbLink              = 00000000
[190267 ms] UsbSnoop - DispatchAny(f23e0610) : IRP_MJ_INTERNAL_DEVICE_CONTROL
[190267 ms] UsbSnoop - MyDispatchInternalIOCTL(f23e1e80) : fdo=825e4030, Irp=82617ac8, IRQL=2
[190267 ms]  >>>  URB 19 going down  >>> 
-- URB_FUNCTION_BULK_OR_INTERRUPT_TRANSFER:
  PipeHandle           = 825c485c [endpoint 0x00000082]
  TransferFlags        = 00000003 (USBD_TRANSFER_DIRECTION_IN, USBD_SHORT_TRANSFER_OK)
  TransferBufferLength = 0000041c
  TransferBuffer       = 825c7bc8
  TransferBufferMDL    = 00000000
  UrbLink              = 00000000
[190347 ms] UsbSnoop - MyInternalIOCTLCompletion(f23e1db0) : fido=00000000, Irp=82617ac8, Context=825ea848, IRQL=2
[190347 ms]  <<<  URB 19 coming back  <<< 
-- URB_FUNCTION_BULK_OR_INTERRUPT_TRANSFER:
  PipeHandle           = 825c485c [endpoint 0x00000082]
  TransferFlags        = 00000003 (USBD_TRANSFER_DIRECTION_IN, USBD_SHORT_TRANSFER_OK)
  TransferBufferLength = 0000013a
  TransferBuffer       = 825c7bc8
  TransferBufferMDL    = 8261b1e8
    00000000: 01 01 17 01 00 20 93 00 00 00 00 00 00 00 68 00
    00000010: 50 00 00 00 24 01 f0 ff ff ff ff ff ff ff ff ff
    00000020: ff ff ff ff ff ff ff ff ff ff ff ff ff ff ff ff
    00000030: ff ff ff ff ff ff ff ff ff ff ff ff ff ff ff ff
    00000040: ff ff ff ff ff ff ff ff ff ff ff ff ff ff ff ff
    00000050: ff ff ff ff ff ff ff ff ff ff ff ff ff ff ff ff
    00000060: ff ff ff ff ff ff ff ff ff ff ff ff ff ff ff ff
    00000070: ff ff ff ff ff ff ff ff ff ff ff ff ff ff ff ff
    00000080: ff ff ff ff ff ff ff ff ff ff ff ff ff ff ff 8f
    00000090: f2 ff bf 16 bf ff fe ff 0f 1d f2 ff ff ff ff ff
    000000a0: 1b ff ff ff 2d ff ff ff ff ff ff ff ff ff ff 3a
    000000b0: 26 ff ff bf 21 5f ff 5f 32 11 17 ff c9 14 24 ff
    000000c0: ff ff ff ff ff ff ff ff ff ff ff ff ff ff ff ff
    000000d0: ff ff ff ff ff ff ff ff ff ff ff ff ff ff ff ff
    000000e0: ff ff ff ff ff ff ff ff ff ff ff ff ff ff ff ff
    000000f0: ff ff ff ff ff ff ff ff ff ff ff ff ff ff ff ff
    00000100: ff ff ff ff ff ff ff ff af f7 ff ff ff ff ff ff
    00000110: ff ff ff ff ff ff ff ff ff ff ff ff ff ff ff ff
    00000120: ff ff ff ff ff ff ff ff ff ff ff ff ff ff ff ff
    00000130: ff ff ff ff ff ff ff ff ff ff
  UrbLink              = 00000000
[190347 ms] UsbSnoop - DispatchAny(f23e0610) : IRP_MJ_INTERNAL_DEVICE_CONTROL
[190347 ms] UsbSnoop - MyDispatchInternalIOCTL(f23e1e80) : fdo=825e4030, Irp=82617ac8, IRQL=2
[190347 ms]  >>>  URB 20 going down  >>> 
-- URB_FUNCTION_BULK_OR_INTERRUPT_TRANSFER:
  PipeHandle           = 825c485c [endpoint 0x00000082]
  TransferFlags        = 00000003 (USBD_TRANSFER_DIRECTION_IN, USBD_SHORT_TRANSFER_OK)
  TransferBufferLength = 0000041c
  TransferBuffer       = 825c7bc8
  TransferBufferMDL    = 00000000
  UrbLink              = 00000000
[190427 ms] UsbSnoop - MyInternalIOCTLCompletion(f23e1db0) : fido=00000000, Irp=82617ac8, Context=825ea9c8, IRQL=2
[190427 ms]  <<<  URB 20 coming back  <<< 
-- URB_FUNCTION_BULK_OR_INTERRUPT_TRANSFER:
  PipeHandle           = 825c485c [endpoint 0x00000082]
  TransferFlags        = 00000003 (USBD_TRANSFER_DIRECTION_IN, USBD_SHORT_TRANSFER_OK)
  TransferBufferLength = 0000013a
  TransferBuffer       = 825c7bc8
  TransferBufferMDL    = 8261b1e8
    00000000: 01 01 17 01 00 20 84 00 00 00 00 00 00 00 68 00
    00000010: 50 00 00 00 24 01 f0 ff ff ff ff ff ff ff ff ff
    00000020: ff ff ff ff ff ff ff ff ff ff ff ff ff ff ff ff
    00000030: ff ff ff ff ff ff ff ff ff ff ff ff ff ff ff ff
    00000040: ff ff ff ff ff ff ff ff ff ff ff ff ff ff ff ff
    00000050: ff ff ff ff ff ff ff ff ff ff ff ff ff ff ff ff
    00000060: ff ff ff ff ff ff ff ff ff ff ff ff ff ff ff ff
    00000070: ff ff ff ff ff ff ff ff ff ff ff ff ff ff ff ff
    00000080: ff ff ff ff ff ff ff ff ff ff ff ff ff ff ff ff
    00000090: ff ff 3f 12 31 fe ff fe ff f0 1f ff ff 1d ff ff
    000000a0: ff ff ff ef f2 ff ff df f2 ff ff ff ff ff ff ff
    000000b0: 17 ff ff 1f 64 33 32 f7 ff 7f 11 12 ff f2 1f 71
    000000c0: 14 ff ff 1a ff ff ff ff ff ff ff ff ff ff ff ff
    000000d0: ff ff ff ff ff ff ff ff ff ff ff ff ff ff ff ff
    000000e0: ff ff ff ff ff ff ff ff ff ff ff ff ff ff ff ff
    000000f0: ff ff ff ff ff ff ff ff ff ff ff ff ff ff ff ff
    00000100: ff ff ff ff ff ff ff ff ff ff 8f f7 ff ff ff ff
    00000110: ff ff ff ff ff ff ff ff ff ff ff ff ff ff ff ff
    00000120: ff ff ff ff ff ff ff ff ff ff ff ff ff ff ff ff
    00000130: ff ff ff ff ff ff ff ff ff ff
  UrbLink              = 00000000
[190427 ms] UsbSnoop - DispatchAny(f23e0610) : IRP_MJ_INTERNAL_DEVICE_CONTROL
[190427 ms] UsbSnoop - MyDispatchInternalIOCTL(f23e1e80) : fdo=825e4030, Irp=82617ac8, IRQL=2
[190427 ms]  >>>  URB 21 going down  >>> 
-- URB_FUNCTION_BULK_OR_INTERRUPT_TRANSFER:
  PipeHandle           = 825c485c [endpoint 0x00000082]
  TransferFlags        = 00000003 (USBD_TRANSFER_DIRECTION_IN, USBD_SHORT_TRANSFER_OK)
  TransferBufferLength = 0000041c
  TransferBuffer       = 825c7bc8
  TransferBufferMDL    = 00000000
  UrbLink              = 00000000
[190472 ms] UsbSnoop - MyInternalIOCTLCompletion(f23e1db0) : fido=00000000, Irp=82617ac8, Context=825ea748, IRQL=2
[190472 ms]  <<<  URB 21 coming back  <<< 
-- URB_FUNCTION_BULK_OR_INTERRUPT_TRANSFER:
  PipeHandle           = 825c485c [endpoint 0x00000082]
  TransferFlags        = 00000003 (USBD_TRANSFER_DIRECTION_IN, USBD_SHORT_TRANSFER_OK)
  TransferBufferLength = 0000013a
  TransferBuffer       = 825c7bc8
  TransferBufferMDL    = 8261b1e8
    00000000: 01 01 17 01 00 20 75 00 00 00 00 00 00 00 68 00
    00000010: 50 00 00 00 24 01 f0 ff ff ff ff ff ff ff ff ff
    00000020: ff ff ff ff ff ff ff ff ff ff ff ff ff ff ff ff
    00000030: ff ff ff ff ff ff ff ff ff ff ff ff ff ff ff ff
    00000040: ff ff ff ff ff ff ff ff ff ff ff ff ff ff ff ff
    00000050: ff ff ff ff ff ff ff ff ff ff ff ff ff ff ff ff
    00000060: ff ff ff ff ff ff ff ff ff ff ff ff ff ff ff ff
    00000070: ff ff ff ff ff ff ff ff ff ff ff ff ff ff ff ff
    00000080: ff ff ff ff ff ff ff ff ff ff ff ff ff ff ff ff
    00000090: ff ff ff 45 ff ff fb 3f ff 1f ff df 6f ff ff ff
    000000a0: ff ff ff ff ff 2d ff ff ff 1d ff ff ff ff ff ff
    000000b0: ff 8f 72 f2 ff 6f 33 11 34 23 3f ff bf ff 3f 19
    000000c0: 3a 13 f1 ff ff ff ff ff ff ff ff ff ff ff ff ff
    000000d0: ff ff ff ff ff ff ff ff ff ff ff ff ff ff ff ff
    000000e0: ff ff ff ff ff ff ff ff ff ff ff ff ff ff ff ff
    000000f0: ff ff ff ff ff ff ff ff ff ff ff ff ff ff ff ff
    00000100: ff ff ff ff ff ff ff ff 6f f7 ff ff ff ff ff ff
    00000110: ff ff ff ff ff ff ff ff ff ff ff ff ff ff ff ff
    00000120: ff ff ff ff ff ff ff ff ff ff ff ff ff ff ff ff
    00000130: ff ff ff ff ff ff ff ff ff ff
  UrbLink              = 00000000
[190472 ms] UsbSnoop - DispatchAny(f23e0610) : IRP_MJ_INTERNAL_DEVICE_CONTROL
[190472 ms] UsbSnoop - MyDispatchInternalIOCTL(f23e1e80) : fdo=825e4030, Irp=82617ac8, IRQL=2
[190472 ms]  >>>  URB 22 going down  >>> 
-- URB_FUNCTION_BULK_OR_INTERRUPT_TRANSFER:
  PipeHandle           = 825c485c [endpoint 0x00000082]
  TransferFlags        = 00000003 (USBD_TRANSFER_DIRECTION_IN, USBD_SHORT_TRANSFER_OK)
  TransferBufferLength = 0000041c
  TransferBuffer       = 825c7bc8
  TransferBufferMDL    = 00000000
  UrbLink              = 00000000
[190686 ms] UsbSnoop - MyInternalIOCTLCompletion(f23e1db0) : fido=00000000, Irp=82617ac8, Context=825e9768, IRQL=2
[190686 ms]  <<<  URB 22 coming back  <<< 
-- URB_FUNCTION_BULK_OR_INTERRUPT_TRANSFER:
  PipeHandle           = 825c485c [endpoint 0x00000082]
  TransferFlags        = 00000003 (USBD_TRANSFER_DIRECTION_IN, USBD_SHORT_TRANSFER_OK)
  TransferBufferLength = 0000013e
  TransferBuffer       = 825c7bc8
  TransferBufferMDL    = 8261b1e8
    00000000: 01 01 17 01 00 20 84 00 00 00 00 00 00 00 68 00
    00000010: 50 00 00 00 28 01 f0 ff ff ff ff ff ff ff ff ff
    00000020: ff ff ff ff ff ff ff ff ff ff ff ff ff ff ff ff
    00000030: ff ff ff ff ff ff ff ff ff ff ff ff ff ff ff ff
    00000040: ff ff ff ff ff ff ff ff ff ff ff ff ff ff ff ff
    00000050: ff ff ff ff ff ff ff ff ff ff ff ff ff ff ff ff
    00000060: ff ff ff ff ff ff ff ff ff ff ff ff ff ff ff ff
    00000070: ff ff ff ff ff ff ff ff ff ff ff ff ff ff ff ff
    00000080: ff ff ff ff ff ff ff ff ff ff ff ff ff ff ff ff
    00000090: ff ff af 32 f9 ff 3f 11 ff f9 1e f6 ff 8f f7 ff
    000000a0: ff ff ff ff ff ff 6f f1 ff ff cf f3 ff ff df f1
    000000b0: ff ff ff ff 5f 23 f1 ff 30 13 12 1d 81 f1 fa 8f
    000000c0: 21 ff ff 13 31 12 15 17 ff ff ff ff ff ff ff ff
    000000d0: ff ff ff ff ff ff ff ff ff ff ff ff ff ff ff ff
    000000e0: ff ff ff ff ff ff ff ff ff ff ff ff ff ff ff ff
    000000f0: ff ff ff ff ff ff ff ff ff ff ff ff ff ff ff ff
    00000100: ff ff ff ff ff ff ff ff ff ff ff ff ff ff 7c ff
    00000110: ff ff ff ff ff ff ff ff ff ff ff ff ff ff ff ff
    00000120: ff ff ff ff ff ff ff ff ff ff ff ff ff ff ff ff
    00000130: ff ff ff ff ff ff ff ff ff ff ff ff ff ff
  UrbLink              = 00000000
[190686 ms] UsbSnoop - DispatchAny(f23e0610) : IRP_MJ_INTERNAL_DEVICE_CONTROL
[190686 ms] UsbSnoop - MyDispatchInternalIOCTL(f23e1e80) : fdo=825e4030, Irp=82617ac8, IRQL=2
[190686 ms]  >>>  URB 23 going down  >>> 
-- URB_FUNCTION_BULK_OR_INTERRUPT_TRANSFER:
  PipeHandle           = 825c485c [endpoint 0x00000082]
  TransferFlags        = 00000003 (USBD_TRANSFER_DIRECTION_IN, USBD_SHORT_TRANSFER_OK)
  TransferBufferLength = 0000041c
  TransferBuffer       = 825c7bc8
  TransferBufferMDL    = 00000000
  UrbLink              = 00000000
[190784 ms] UsbSnoop - MyInternalIOCTLCompletion(f23e1db0) : fido=00000000, Irp=82617ac8, Context=825ea748, IRQL=2
[190784 ms]  <<<  URB 23 coming back  <<< 
-- URB_FUNCTION_BULK_OR_INTERRUPT_TRANSFER:
  PipeHandle           = 825c485c [endpoint 0x00000082]
  TransferFlags        = 00000003 (USBD_TRANSFER_DIRECTION_IN, USBD_SHORT_TRANSFER_OK)
  TransferBufferLength = 0000013a
  TransferBuffer       = 825c7bc8
  TransferBufferMDL    = 8261b1e8
    00000000: 01 01 17 01 00 20 92 00 00 00 00 00 00 00 68 00
    00000010: 50 00 00 00 24 01 f0 ff ff ff ff ff ff ff ff ff
    00000020: ff ff ff ff ff ff ff ff ff ff ff ff ff ff ff ff
    00000030: ff ff ff ff ff ff ff ff ff ff ff ff ff ff ff ff
    00000040: ff ff ff ff ff ff ff ff ff ff ff ff ff ff ff ff
    00000050: ff ff ff ff ff ff ff ff ff ff ff ff ff ff ff ff
    00000060: ff ff ff ff ff ff ff ff ff ff ff ff ff ff ff ff
    00000070: ff ff ff ff ff ff ff ff ff ff ff ff ff ff ff ff
    00000080: ff ff ff ff ff ff ff ff ff ff ff ff ff ff ff ff
    00000090: ff ff 1f 8f ff bf 11 ff 1f 8f 18 ff ff ff ff ff
    000000a0: ff ff ff ff ff ff ff ff 9f f2 ff ff df f1 ff ff
    000000b0: ff ff df 31 17 f1 ff 2b 11 f5 9f ef ff ff 7f f1
    000000c0: ff ff ff ff ff ff ff ff ff ff ff ff ff ff ff ff
    000000d0: ff ff ff ff ff ff ff ff ff ff ff ff ff ff ff ff
    000000e0: ff ff ff ff ff ff ff ff ff ff ff ff ff ff ff ff
    000000f0: ff ff ff ff ff ff ff ff ff ff ff ff ff ff ff ff
    00000100: ff ff ff ff ff ff 7b ff ff ff ff ff ff ff ff ff
    00000110: ff ff ff ff ff ff ff ff ff ff ff ff ff ff ff ff
    00000120: ff ff ff ff ff ff df f1 ff ff ff ff ff ff ff ff
    00000130: ff ff ff ff ff ff 11 f1 ff ff
  UrbLink              = 00000000
[190784 ms] UsbSnoop - DispatchAny(f23e0610) : IRP_MJ_INTERNAL_DEVICE_CONTROL
[190784 ms] UsbSnoop - MyDispatchInternalIOCTL(f23e1e80) : fdo=825e4030, Irp=82617ac8, IRQL=2
[190784 ms]  >>>  URB 24 going down  >>> 
-- URB_FUNCTION_BULK_OR_INTERRUPT_TRANSFER:
  PipeHandle           = 825c485c [endpoint 0x00000082]
  TransferFlags        = 00000003 (USBD_TRANSFER_DIRECTION_IN, USBD_SHORT_TRANSFER_OK)
  TransferBufferLength = 0000041c
  TransferBuffer       = 825c7bc8
  TransferBufferMDL    = 00000000
  UrbLink              = 00000000
[191086 ms] UsbSnoop - MyInternalIOCTLCompletion(f23e1db0) : fido=00000000, Irp=82617ac8, Context=825ea848, IRQL=2
[191086 ms]  <<<  URB 24 coming back  <<< 
-- URB_FUNCTION_BULK_OR_INTERRUPT_TRANSFER:
  PipeHandle           = 825c485c [endpoint 0x00000082]
  TransferFlags        = 00000003 (USBD_TRANSFER_DIRECTION_IN, USBD_SHORT_TRANSFER_OK)
  TransferBufferLength = 0000013e
  TransferBuffer       = 825c7bc8
  TransferBufferMDL    = 8261b1e8
    00000000: 01 01 17 01 00 20 a3 00 00 00 00 00 00 00 68 00
    00000010: 50 00 00 00 28 01 f0 ff ff ff ff ff ff ff ff ff
    00000020: ff ff ff ff ff ff ff ff ff ff ff ff ff ff ff ff
    00000030: ff ff ff ff ff ff ff ff ff ff ff ff ff ff ff ff
    00000040: ff ff ff ff ff ff ff ff ff ff ff ff ff ff ff ff
    00000050: ff ff ff ff ff ff ff ff ff ff ff ff ff ff ff ff
    00000060: ff ff ff ff ff ff ff ff ff ff ff ff ff ff ff ff
    00000070: ff ff ff ff ff ff ff ff ff ff ff ff ff ff ff ff
    00000080: ff ff ff ff ff ff ff ff ff ff ff ff ff ff ff 0f
    00000090: 12 f7 ff 6f 11 ff f6 3f 31 15 ff ff 91 ff ff ff
    000000a0: ff ff ff ff ff ff ff ff ff ff 5f f3 ff ff cf f3
    000000b0: ff ff 19 ff af f1 4f 52 12 1f 25 8f a2 32 13 ff
    000000c0: 8f 63 71 32 f1 ff ff ff ff ff ff ff ff ff ff ff
    000000d0: ff ff ff ff ff ff ff ff ff ff ff ff ff ff ff ff
    000000e0: ff ff ff ff ff ff ff ff ff ff ff ff ff ff ff ff
    000000f0: ff ff ff ff ff ff ff ff ff ff ff ff ff ff ff ff
    00000100: ff ff ff ff ff ff ff ff ff ff ff ff ff ff 7a ff
    00000110: ff ff ff ff ff ff ff ff ff ff ff ff ff ff ff ff
    00000120: ff ff ff ff ff ff ff ff ff ff ff ff ff ff ff ff
    00000130: ff ff ff ff ff ff ff ff ff ff ff ff ff ff
  UrbLink              = 00000000
[191086 ms] UsbSnoop - DispatchAny(f23e0610) : IRP_MJ_INTERNAL_DEVICE_CONTROL
[191086 ms] UsbSnoop - MyDispatchInternalIOCTL(f23e1e80) : fdo=825e4030, Irp=82617ac8, IRQL=2
[191086 ms]  >>>  URB 25 going down  >>> 
-- URB_FUNCTION_BULK_OR_INTERRUPT_TRANSFER:
  PipeHandle           = 825c485c [endpoint 0x00000082]
  TransferFlags        = 00000003 (USBD_TRANSFER_DIRECTION_IN, USBD_SHORT_TRANSFER_OK)
  TransferBufferLength = 0000041c
  TransferBuffer       = 825c7bc8
  TransferBufferMDL    = 00000000
  UrbLink              = 00000000
[191183 ms] UsbSnoop - MyInternalIOCTLCompletion(f23e1db0) : fido=00000000, Irp=82617ac8, Context=825eac48, IRQL=2
[191183 ms]  <<<  URB 25 coming back  <<< 
-- URB_FUNCTION_BULK_OR_INTERRUPT_TRANSFER:
  PipeHandle           = 825c485c [endpoint 0x00000082]
  TransferFlags        = 00000003 (USBD_TRANSFER_DIRECTION_IN, USBD_SHORT_TRANSFER_OK)
  TransferBufferLength = 0000013a
  TransferBuffer       = 825c7bc8
  TransferBufferMDL    = 8261b1e8
    00000000: 01 01 17 01 00 20 b0 00 00 00 00 00 00 00 68 00
    00000010: 50 00 00 00 24 01 f0 ff ff ff ff ff ff ff ff ff
    00000020: ff ff ff ff ff ff ff ff ff ff ff ff ff ff ff ff
    00000030: ff ff ff ff ff ff ff ff ff ff ff ff ff ff ff ff
    00000040: ff ff ff ff ff ff ff ff ff ff ff ff ff ff ff ff
    00000050: ff ff ff ff ff ff ff ff ff ff ff ff ff ff ff ff
    00000060: ff ff ff ff ff ff ff ff ff ff ff ff ff ff ff ff
    00000070: ff ff ff ff ff ff ff ff ff ff ff ff ff ff ff ff
    00000080: ff ff ff ff ff ff ff ff ff ff ff ff ff ff ff 22
    00000090: f1 f5 ff f7 ff f7 f9 ff ff ff ff ff ff ff ff ff
    000000a0: ff ff ff ff ff ff ff ff ff ff ff ff ff 1f 23 f8
    000000b0: 0f f1 4f 52 12 ef 2f 92 33 22 ff ff 0f f1 ff ff
    000000c0: ff ff ff ff ff ff ff ff ff ff ff ff ff ff ff ff
    000000d0: ff ff ff ff ff ff ff ff ff ff ff ff ff ff ff ff
    000000e0: ff ff ff ff ff ff ff ff ff ff ff ff ff ff ff ff
    000000f0: ff ff ff ff ff ff ff ff ff ff ff ff ff ff ff ff
    00000100: ff ff ff ff ff ff ff 8f f7 ff ff ff ff ff ff ff
    00000110: ff ff ff ff ff ff ff ff ff ff ff ff ff ff ff ff
    00000120: ff ff ff ff ff ff ff ff ff ff ff ff ff ff ff ff
    00000130: ff ff ff ff ff ff ff ff ff ff
  UrbLink              = 00000000
[191183 ms] UsbSnoop - DispatchAny(f23e0610) : IRP_MJ_INTERNAL_DEVICE_CONTROL
[191183 ms] UsbSnoop - MyDispatchInternalIOCTL(f23e1e80) : fdo=825e4030, Irp=82617ac8, IRQL=2
[191183 ms]  >>>  URB 26 going down  >>> 
-- URB_FUNCTION_BULK_OR_INTERRUPT_TRANSFER:
  PipeHandle           = 825c485c [endpoint 0x00000082]
  TransferFlags        = 00000003 (USBD_TRANSFER_DIRECTION_IN, USBD_SHORT_TRANSFER_OK)
  TransferBufferLength = 0000041c
  TransferBuffer       = 825c7bc8
  TransferBufferMDL    = 00000000
  UrbLink              = 00000000
[191326 ms] UsbSnoop - MyInternalIOCTLCompletion(f23e1db0) : fido=00000000, Irp=82617ac8, Context=825eaac8, IRQL=2
[191326 ms]  <<<  URB 26 coming back  <<< 
-- URB_FUNCTION_BULK_OR_INTERRUPT_TRANSFER:
  PipeHandle           = 825c485c [endpoint 0x00000082]
  TransferFlags        = 00000003 (USBD_TRANSFER_DIRECTION_IN, USBD_SHORT_TRANSFER_OK)
  TransferBufferLength = 0000013a
  TransferBuffer       = 825c7bc8
  TransferBufferMDL    = 8261b1e8
    00000000: 01 01 17 01 00 20 bd 00 00 00 00 00 00 00 68 00
    00000010: 50 00 00 00 24 01 f0 ff ff ff ff ff ff ff ff ff
    00000020: ff ff ff ff ff ff ff ff ff ff ff ff ff ff ff ff
    00000030: ff ff ff ff ff ff ff ff ff ff ff ff ff ff ff ff
    00000040: ff ff ff ff ff ff ff ff ff ff ff ff ff ff ff ff
    00000050: ff ff ff ff ff ff ff ff ff ff ff ff ff ff ff ff
    00000060: ff ff ff ff ff ff ff ff ff ff ff ff ff ff ff ff
    00000070: ff ff ff ff ff ff ff ff ff ff ff ff ff ff ff ff
    00000080: ff ff ff ff ff ff ff ff ff ff ff ff 12 25 ff ff
    00000090: 1a f1 3f ff fc ff 2f 2f ff ff ff ff ff ff ff ff
    000000a0: ff ff ff ff ff ff ff ff ff ff ff ff ff ff af 71
    000000b0: 3f 2f f1 4f 52 31 ff 4b 82 21 91 12 ff ff ff ff
    000000c0: ff ff ff ff ff ff ff ff ff ff ff ff ff ff ff ff
    000000d0: ff ff ff ff ff ff ff ff ff ff ff ff ff ff ff ff
    000000e0: ff ff ff ff ff ff ff ff ff ff ff ff ff ff ff ff
    000000f0: ff ff ff ff ff ff ff ff ff ff ff ff ff ff ff ff
    00000100: ff ff ff ff ff ff ff ff ff 72 ff ff ff ff ff ff
    00000110: ff ff ff ff ff ff ff ff ff ff ff ff ff ff ff ff
    00000120: ff ff ff ff ff ff ff ff ff df f1 ff ff ff ff ff
    00000130: ff ff ff ff ff ff ff ff ff 11
  UrbLink              = 00000000
[191326 ms] UsbSnoop - DispatchAny(f23e0610) : IRP_MJ_INTERNAL_DEVICE_CONTROL
[191326 ms] UsbSnoop - MyDispatchInternalIOCTL(f23e1e80) : fdo=825e4030, Irp=82617ac8, IRQL=2
[191326 ms]  >>>  URB 27 going down  >>> 
-- URB_FUNCTION_BULK_OR_INTERRUPT_TRANSFER:
  PipeHandle           = 825c485c [endpoint 0x00000082]
  TransferFlags        = 00000003 (USBD_TRANSFER_DIRECTION_IN, USBD_SHORT_TRANSFER_OK)
  TransferBufferLength = 0000041c
  TransferBuffer       = 825c7bc8
  TransferBufferMDL    = 00000000
  UrbLink              = 00000000
[191456 ms] UsbSnoop - MyInternalIOCTLCompletion(f23e1db0) : fido=00000000, Irp=827667e8, Context=8261ac88, IRQL=2
[191456 ms]  <<<  URB 7 coming back  <<< 
-- URB_FUNCTION_BULK_OR_INTERRUPT_TRANSFER:
  PipeHandle           = 825c4840 [endpoint 0x00000081]
  TransferFlags        = 00000003 (USBD_TRANSFER_DIRECTION_IN, USBD_SHORT_TRANSFER_OK)
  TransferBufferLength = 00000007
  TransferBuffer       = 826585c8
  TransferBufferMDL    = 82619a68
    00000000: 01 01 17 01 00 30 04
  UrbLink              = 00000000
[191456 ms] UsbSnoop - DispatchAny(f23e0610) : IRP_MJ_INTERNAL_DEVICE_CONTROL
[191456 ms] UsbSnoop - MyDispatchInternalIOCTL(f23e1e80) : fdo=825e4030, Irp=827667e8, IRQL=2
[191456 ms]  >>>  URB 28 going down  >>> 
-- URB_FUNCTION_BULK_OR_INTERRUPT_TRANSFER:
  PipeHandle           = 825c4840 [endpoint 0x00000081]
  TransferFlags        = 00000003 (USBD_TRANSFER_DIRECTION_IN, USBD_SHORT_TRANSFER_OK)
  TransferBufferLength = 00000008
  TransferBuffer       = 826585c8
  TransferBufferMDL    = 00000000
  UrbLink              = 00000000
[191497 ms] UsbSnoop - MyInternalIOCTLCompletion(f23e1db0) : fido=00000000, Irp=82617ac8, Context=825eafa8, IRQL=2
[191497 ms]  <<<  URB 27 coming back  <<< 
-- URB_FUNCTION_BULK_OR_INTERRUPT_TRANSFER:
  PipeHandle           = 825c485c [endpoint 0x00000082]
  TransferFlags        = 00000003 (USBD_TRANSFER_DIRECTION_IN, USBD_SHORT_TRANSFER_OK)
  TransferBufferLength = 00000146
  TransferBuffer       = 825c7bc8
  TransferBufferMDL    = 8261b1e8
    00000000: 01 01 17 01 00 20 bd 00 00 00 00 00 00 00 68 00
    00000010: 50 00 00 00 30 01 f0 ff ff ff ff ff ff ff ff ff
    00000020: ff ff ff ff ff ff ff ff ff ff ff ff ff ff ff ff
    00000030: ff ff ff ff ff ff ff ff ff ff ff ff ff ff ff ff
    00000040: ff ff ff ff ff ff ff ff ff ff ff ff ff ff ff ff
    00000050: ff ff ff ff ff ff ff ff ff ff ff ff ff ff ff ff
    00000060: ff ff ff ff ff ff ff ff ff ff ff ff ff ff ff ff
    00000070: ff ff ff ff ff ff ff ff ff ff ff ff ff ff ff ff
    00000080: ff 3f 81 f2 ff af 12 ff f1 ff 30 11 f1 ff f8 fb
    00000090: ff ff 53 21 ff ff ff ff ff ff ff ff ff ff ff ff
    000000a0: ff ff ff ff 9f 12 f5 ff ef 14 12 7f ff 7f 23 23
    000000b0: 28 ff c2 81 33 11 32 ff ff 2a 13 13 ff ff ff ff
    000000c0: ff ff ff ff ff ff ff ff ff ff ff 16 ff ff ff ff
    000000d0: ff ff ff ff ff ff ff ff ff ff ff ff ff ff ff ff
    000000e0: ff ff ff ff ff ff ff ff ff ff ff ff ff ff ff ff
    000000f0: ff ff ff ff ff ff ff ff ff ff ff ff ff ff ff ff
    00000100: ff ff ff ff ff ff ff ff ff ff ff ff ff ff ff ff
    00000110: ff 8d ff ff ff ff ff ff ff ff ff ff ff ff ff ff
    00000120: ff 7f f1 ff ff ff ff ff ff ff ff ff ff ff ff 15
    00000130: ff ff ff 1d ff ff ff ff ff ff ff ff ff ff ff ff
    00000140: ff ff 1f 1d ff ff
  UrbLink              = 00000000
[191497 ms] UsbSnoop - DispatchAny(f23e0610) : IRP_MJ_INTERNAL_DEVICE_CONTROL
[191497 ms] UsbSnoop - MyDispatchInternalIOCTL(f23e1e80) : fdo=825e4030, Irp=82617ac8, IRQL=2
[191497 ms]  >>>  URB 29 going down  >>> 
-- URB_FUNCTION_BULK_OR_INTERRUPT_TRANSFER:
  PipeHandle           = 825c485c [endpoint 0x00000082]
  TransferFlags        = 00000003 (USBD_TRANSFER_DIRECTION_IN, USBD_SHORT_TRANSFER_OK)
  TransferBufferLength = 0000041c
  TransferBuffer       = 825c7bc8
  TransferBufferMDL    = 00000000
  UrbLink              = 00000000
[191497 ms] UsbSnoop - MyInternalIOCTLCompletion(f23e1db0) : fido=00000000, Irp=827667e8, Context=8262efe8, IRQL=2
[191497 ms]  <<<  URB 28 coming back  <<< 
-- URB_FUNCTION_BULK_OR_INTERRUPT_TRANSFER:
  PipeHandle           = 825c4840 [endpoint 0x00000081]
  TransferFlags        = 00000003 (USBD_TRANSFER_DIRECTION_IN, USBD_SHORT_TRANSFER_OK)
  TransferBufferLength = 00000007
  TransferBuffer       = 826585c8
  TransferBufferMDL    = 82619a68
    00000000: 01 01 17 01 00 30 00
  UrbLink              = 00000000
[191497 ms] UsbSnoop - DispatchAny(f23e0610) : IRP_MJ_INTERNAL_DEVICE_CONTROL
[191497 ms] UsbSnoop - MyDispatchInternalIOCTL(f23e1e80) : fdo=825e4030, Irp=827667e8, IRQL=2
[191497 ms]  >>>  URB 30 going down  >>> 
-- URB_FUNCTION_BULK_OR_INTERRUPT_TRANSFER:
  PipeHandle           = 825c4840 [endpoint 0x00000081]
  TransferFlags        = 00000003 (USBD_TRANSFER_DIRECTION_IN, USBD_SHORT_TRANSFER_OK)
  TransferBufferLength = 00000008
  TransferBuffer       = 826585c8
  TransferBufferMDL    = 00000000
  UrbLink              = 00000000
[191499 ms] UsbSnoop - MyInternalIOCTLCompletion(f23e1db0) : fido=00000000, Irp=82617ac8, Context=82641708, IRQL=2
[191499 ms]  <<<  URB 29 coming back  <<< 
-- URB_FUNCTION_BULK_OR_INTERRUPT_TRANSFER:
  PipeHandle           = 825c485c [endpoint 0x00000082]
  TransferFlags        = 00000003 (USBD_TRANSFER_DIRECTION_IN, USBD_SHORT_TRANSFER_OK)
  TransferBufferLength = 00000006
  TransferBuffer       = 825c7bc8
  TransferBufferMDL    = 8261b1e8
    00000000: 01 01 17 01 02 20
  UrbLink              = 00000000
[191499 ms] UsbSnoop - DispatchAny(f23e0610) : IRP_MJ_INTERNAL_DEVICE_CONTROL
[191499 ms] UsbSnoop - MyDispatchInternalIOCTL(f23e1e80) : fdo=825e4030, Irp=82617ac8, IRQL=2
[191499 ms]  >>>  URB 31 going down  >>> 
-- URB_FUNCTION_BULK_OR_INTERRUPT_TRANSFER:
  PipeHandle           = 825c485c [endpoint 0x00000082]
  TransferFlags        = 00000003 (USBD_TRANSFER_DIRECTION_IN, USBD_SHORT_TRANSFER_OK)
  TransferBufferLength = 0000041c
  TransferBuffer       = 825c7bc8
  TransferBufferMDL    = 00000000
  UrbLink              = 00000000
[201802 ms] UsbSnoop - DispatchAny(f23e0610) : IRP_MJ_PNP (IRP_MN_QUERY_DEVICE_RELATIONS)
[201802 ms] UsbSnoop - MyDispatchPNP(f23e2ee0) : IRP_MJ_PNP (IRP_MN_QUERY_DEVICE_RELATIONS)
[201802 ms] UsbSnoop - DispatchAny(f23e0610) : IRP_MJ_PNP (IRP_MN_CANCEL_REMOVE_DEVICE)
[201802 ms] UsbSnoop - MyDispatchPNP(f23e2ee0) : IRP_MJ_PNP (IRP_MN_CANCEL_REMOVE_DEVICE)
