[0 ms] UsbSnoop compiled on Jan 18 2003 22:41:32 loading
[0 ms] UsbSnoop - DriverEntry(f23a2c40) : Windows NT WDM version 1.16
[4 ms] UsbSnoop - AddDevice(f23a2f50) : DriverObject 826de330, pdo 825ad5b0
[4 ms] UsbSnoop - DispatchAny(f23a0610) : IRP_MJ_PNP (0x00000018)
[4 ms] UsbSnoop - MyDispatchPNP(f23a2ee0) : IRP_MJ_PNP (0x00000018)
[4 ms] UsbSnoop - DispatchAny(f23a0610) : IRP_MJ_PNP (IRP_MN_QUERY_RESOURCE_REQUIREMENTS)
[4 ms] UsbSnoop - MyDispatchPNP(f23a2ee0) : IRP_MJ_PNP (IRP_MN_QUERY_RESOURCE_REQUIREMENTS)
[5 ms] UsbSnoop - DispatchAny(f23a0610) : IRP_MJ_PNP (IRP_MN_FILTER_RESOURCE_REQUIREMENTS)
[5 ms] UsbSnoop - MyDispatchPNP(f23a2ee0) : IRP_MJ_PNP (IRP_MN_FILTER_RESOURCE_REQUIREMENTS)
[5 ms] UsbSnoop - DispatchAny(f23a0610) : IRP_MJ_PNP (IRP_MN_START_DEVICE)
[5 ms] UsbSnoop - MyDispatchPNP(f23a2ee0) : IRP_MJ_PNP (IRP_MN_START_DEVICE)
[5 ms] UsbSnoop - DispatchAny(f23a0610) : IRP_MJ_INTERNAL_DEVICE_CONTROL
[5 ms] UsbSnoop - MyDispatchInternalIOCTL(f23a1e80) : fdo=825ad5b0, Irp=825b9008, IRQL=0
[5 ms]  >>>  URB 1 going down  >>> 
-- URB_FUNCTION_GET_DESCRIPTOR_FROM_DEVICE:
  TransferBufferLength = 00000012
  TransferBuffer       = 8269f848
  TransferBufferMDL    = 00000000
  Index                = 00000000
  DescriptorType       = 00000001 (USB_DEVICE_DESCRIPTOR_TYPE)
  LanguageId           = 00000000
[11 ms] UsbSnoop - MyInternalIOCTLCompletion(f23a1db0) : fido=00000000, Irp=825b9008, Context=82644ec8, IRQL=2
[14 ms]  <<<  URB 1 coming back  <<< 
-- URB_FUNCTION_CONTROL_TRANSFER:
  PipeHandle           = 826fd274
  TransferFlags        = 005c0077 (USBD_TRANSFER_DIRECTION_IN, USBD_SHORT_TRANSFER_OK)
  TransferBufferLength = 00000012
  TransferBuffer       = 8269f848
  TransferBufferMDL    = 825e6988
    00000000: 12 01 00 02 ff 00 00 08 93 0a 02 00 17 01 01 02
    00000010: 03 01
  UrbLink              = 00000000
  SetupPacket          =
    00000000: 80 06 00 01 00 00 12 00
[14 ms] UsbSnoop - DispatchAny(f23a0610) : IRP_MJ_INTERNAL_DEVICE_CONTROL
[14 ms] UsbSnoop - MyDispatchInternalIOCTL(f23a1e80) : fdo=825ad5b0, Irp=825b9008, IRQL=0
[15 ms]  >>>  URB 2 going down  >>> 
-- URB_FUNCTION_GET_DESCRIPTOR_FROM_DEVICE:
  TransferBufferLength = 00000209
  TransferBuffer       = 825ad2a8
  TransferBufferMDL    = 00000000
  Index                = 00000000
  DescriptorType       = 00000002 (USB_CONFIGURATION_DESCRIPTOR_TYPE)
  LanguageId           = 00000000
[25 ms] UsbSnoop - MyInternalIOCTLCompletion(f23a1db0) : fido=00000000, Irp=825b9008, Context=825b23c8, IRQL=2
[25 ms]  <<<  URB 2 coming back  <<< 
-- URB_FUNCTION_CONTROL_TRANSFER:
  PipeHandle           = 826fd274
  TransferFlags        = 005c0077 (USBD_TRANSFER_DIRECTION_IN, USBD_SHORT_TRANSFER_OK)
  TransferBufferLength = 00000028
  TransferBuffer       = 825ad2a8
  TransferBufferMDL    = 825e6988
    00000000: 09 02 20 00 01 01 00 a0 64 09 04 00 00 02 ff 00
    00000010: ff 00 07 05 81 03 08 00 01 07 05 82 03 40 00 01
    00000020: 00 00 00 00 00 00 00 00
  UrbLink              = 00000000
  SetupPacket          =
    00000000: 80 06 00 02 00 00 09 02
[25 ms] UsbSnoop - DispatchAny(f23a0610) : IRP_MJ_INTERNAL_DEVICE_CONTROL
[25 ms] UsbSnoop - MyDispatchInternalIOCTL(f23a1e80) : fdo=825ad5b0, Irp=825b9008, IRQL=0
[25 ms]  >>>  URB 3 going down  >>> 
-- URB_FUNCTION_SELECT_CONFIGURATION:
  ConfigurationDescriptor = 0x825ad2a8 (configure)
  ConfigurationDescriptor : bLength             = 9
  ConfigurationDescriptor : bDescriptorType     = 0x00000002
  ConfigurationDescriptor : wTotalLength        = 0x00000020
  ConfigurationDescriptor : bNumInterfaces      = 0x00000001
  ConfigurationDescriptor : bConfigurationValue = 0x00000001
  ConfigurationDescriptor : iConfiguration      = 0x00000000
  ConfigurationDescriptor : bmAttributes        = 0x000000a0
  ConfigurationDescriptor : MaxPower            = 0x00000064
  ConfigurationHandle     = 0x005c0077
  Interface[0]: Length            = 56
  Interface[0]: InterfaceNumber   = 0
  Interface[0]: AlternateSetting  = 0
[28 ms] UsbSnoop - MyInternalIOCTLCompletion(f23a1db0) : fido=00000000, Irp=825b9008, Context=82659788, IRQL=0
[28 ms]  <<<  URB 3 coming back  <<< 
-- URB_FUNCTION_SELECT_CONFIGURATION:
  ConfigurationDescriptor = 0x825ad2a8 (configure)
  ConfigurationDescriptor : bLength             = 9
  ConfigurationDescriptor : bDescriptorType     = 0x00000002
  ConfigurationDescriptor : wTotalLength        = 0x00000020
  ConfigurationDescriptor : bNumInterfaces      = 0x00000001
  ConfigurationDescriptor : bConfigurationValue = 0x00000001
  ConfigurationDescriptor : iConfiguration      = 0x00000000
  ConfigurationDescriptor : bmAttributes        = 0x000000a0
  ConfigurationDescriptor : MaxPower            = 0x00000064
  ConfigurationHandle     = 0xe19bd768
  Interface[0]: Length            = 56
  Interface[0]: InterfaceNumber   = 0
  Interface[0]: AlternateSetting  = 0
  Interface[0]: Class             = 0x000000ff
  Interface[0]: SubClass          = 0x00000000
  Interface[0]: Protocol          = 0x000000ff
  Interface[0]: InterfaceHandle   = 0x825e6ca8
  Interface[0]: NumberOfPipes     = 2
  Interface[0]: Pipes[0] : MaximumPacketSize = 0x00000008
  Interface[0]: Pipes[0] : EndpointAddress   = 0x00000081
  Interface[0]: Pipes[0] : Interval          = 0x00000001
  Interface[0]: Pipes[0] : PipeType          = 0x00000003 (UsbdPipeTypeInterrupt)
  Interface[0]: Pipes[0] : PipeHandle        = 0x825e6cc0
  Interface[0]: Pipes[0] : MaxTransferSize   = 0x00001000
  Interface[0]: Pipes[0] : PipeFlags         = 0x00000000
  Interface[0]: Pipes[1] : MaximumPacketSize = 0x00000040
  Interface[0]: Pipes[1] : EndpointAddress   = 0x00000082
  Interface[0]: Pipes[1] : Interval          = 0x00000001
  Interface[0]: Pipes[1] : PipeType          = 0x00000003 (UsbdPipeTypeInterrupt)
  Interface[0]: Pipes[1] : PipeHandle        = 0x825e6cdc
  Interface[0]: Pipes[1] : MaxTransferSize   = 0x00001000
  Interface[0]: Pipes[1] : PipeFlags         = 0x00000000
[28 ms] UsbSnoop - DispatchAny(f23a0610) : IRP_MJ_PNP (IRP_MN_QUERY_CAPABILITIES)
[28 ms] UsbSnoop - MyDispatchPNP(f23a2ee0) : IRP_MJ_PNP (IRP_MN_QUERY_CAPABILITIES)
[28 ms] UsbSnoop - DispatchAny(f23a0610) : IRP_MJ_PNP (IRP_MN_QUERY_PNP_DEVICE_STATE)
[28 ms] UsbSnoop - MyDispatchPNP(f23a2ee0) : IRP_MJ_PNP (IRP_MN_QUERY_PNP_DEVICE_STATE)
[28 ms] UsbSnoop - DispatchAny(f23a0610) : IRP_MJ_PNP (IRP_MN_QUERY_DEVICE_RELATIONS)
[28 ms] UsbSnoop - MyDispatchPNP(f23a2ee0) : IRP_MJ_PNP (IRP_MN_QUERY_DEVICE_RELATIONS)
[28 ms] UsbSnoop - DispatchAny(f23a0610) : IRP_MJ_PNP (IRP_MN_QUERY_DEVICE_RELATIONS)
[28 ms] UsbSnoop - MyDispatchPNP(f23a2ee0) : IRP_MJ_PNP (IRP_MN_QUERY_DEVICE_RELATIONS)
[29 ms] UsbSnoop - DispatchAny(f23a0610) : IRP_MJ_INTERNAL_DEVICE_CONTROL
[29 ms] UsbSnoop - MyDispatchInternalIOCTL(f23a1e80) : fdo=825ad5b0, Irp=825b9008, IRQL=0
[29 ms]  >>>  URB 4 going down  >>> 
-- URB_FUNCTION_BULK_OR_INTERRUPT_TRANSFER:
  PipeHandle           = 825e6cc0 [endpoint 0x00000081]
  TransferFlags        = 00000003 (USBD_TRANSFER_DIRECTION_IN, USBD_SHORT_TRANSFER_OK)
  TransferBufferLength = 00000008
  TransferBuffer       = 825e1be8
  TransferBufferMDL    = 00000000
  UrbLink              = 00000000
[29 ms] UsbSnoop - DispatchAny(f23a0610) : IRP_MJ_INTERNAL_DEVICE_CONTROL
[29 ms] UsbSnoop - MyDispatchInternalIOCTL(f23a1e80) : fdo=825ad5b0, Irp=825b9b28, IRQL=0
[29 ms]  >>>  URB 5 going down  >>> 
-- URB_FUNCTION_BULK_OR_INTERRUPT_TRANSFER:
  PipeHandle           = 825e6cdc [endpoint 0x00000082]
  TransferFlags        = 00000003 (USBD_TRANSFER_DIRECTION_IN, USBD_SHORT_TRANSFER_OK)
  TransferBufferLength = 0000041c
  TransferBuffer       = 825cc008
  TransferBufferMDL    = 00000000
  UrbLink              = 00000000
[29 ms] UsbSnoop - DispatchAny(f23a0610) : IRP_MJ_INTERNAL_DEVICE_CONTROL
[29 ms] UsbSnoop - MyDispatchInternalIOCTL(f23a1e80) : fdo=825ad5b0, Irp=825f0008, IRQL=0
[29 ms]  >>>  URB 6 going down  >>> 
-- URB_FUNCTION_VENDOR_DEVICE:
  TransferFlags          = 00000000 (USBD_TRANSFER_DIRECTION_OUT, ~USBD_SHORT_TRANSFER_OK)
  TransferBufferLength = 00000000
  TransferBuffer       = 00000000
  TransferBufferMDL    = 00000000

    no data supplied
  UrbLink                 = 00000000
  RequestTypeReservedBits = 00000000
  Request                 = 000000fe
  Value                   = 000000de
  Index                   = 00000005
[30 ms] UsbSnoop - MyInternalIOCTLCompletion(f23a1db0) : fido=00000000, Irp=825b9b28, Context=82612188, IRQL=2
[30 ms]  <<<  URB 5 coming back  <<< 
-- URB_FUNCTION_BULK_OR_INTERRUPT_TRANSFER:
  PipeHandle           = 825e6cdc [endpoint 0x00000082]
  TransferFlags        = 00000003 (USBD_TRANSFER_DIRECTION_IN, USBD_SHORT_TRANSFER_OK)
  TransferBufferLength = 00000006
  TransferBuffer       = 825cc008
  TransferBufferMDL    = 825aed88
    00000000: 01 01 17 01 01 20
  UrbLink              = 00000000
[30 ms] UsbSnoop - DispatchAny(f23a0610) : IRP_MJ_INTERNAL_DEVICE_CONTROL
[30 ms] UsbSnoop - MyDispatchInternalIOCTL(f23a1e80) : fdo=825ad5b0, Irp=825b9b28, IRQL=2
[30 ms]  >>>  URB 7 going down  >>> 
-- URB_FUNCTION_BULK_OR_INTERRUPT_TRANSFER:
  PipeHandle           = 825e6cdc [endpoint 0x00000082]
  TransferFlags        = 00000003 (USBD_TRANSFER_DIRECTION_IN, USBD_SHORT_TRANSFER_OK)
  TransferBufferLength = 0000041c
  TransferBuffer       = 825cc008
  TransferBufferMDL    = 00000000
  UrbLink              = 00000000
[30 ms] UsbSnoop - MyInternalIOCTLCompletion(f23a1db0) : fido=00000000, Irp=825b9008, Context=825b2908, IRQL=2
[30 ms]  <<<  URB 4 coming back  <<< 
-- URB_FUNCTION_BULK_OR_INTERRUPT_TRANSFER:
  PipeHandle           = 825e6cc0 [endpoint 0x00000081]
  TransferFlags        = 00000003 (USBD_TRANSFER_DIRECTION_IN, USBD_SHORT_TRANSFER_OK)
  TransferBufferLength = 00000007
  TransferBuffer       = 825e1be8
  TransferBufferMDL    = 825e6988
    00000000: 01 01 17 01 00 30 05
  UrbLink              = 00000000
[30 ms] UsbSnoop - DispatchAny(f23a0610) : IRP_MJ_INTERNAL_DEVICE_CONTROL
[30 ms] UsbSnoop - MyDispatchInternalIOCTL(f23a1e80) : fdo=825ad5b0, Irp=825b9008, IRQL=2
[30 ms]  >>>  URB 8 going down  >>> 
-- URB_FUNCTION_BULK_OR_INTERRUPT_TRANSFER:
  PipeHandle           = 825e6cc0 [endpoint 0x00000081]
  TransferFlags        = 00000003 (USBD_TRANSFER_DIRECTION_IN, USBD_SHORT_TRANSFER_OK)
  TransferBufferLength = 00000008
  TransferBuffer       = 825e1be8
  TransferBufferMDL    = 00000000
  UrbLink              = 00000000
[30 ms] UsbSnoop - MyInternalIOCTLCompletion(f23a1db0) : fido=00000000, Irp=825f0008, Context=825f4448, IRQL=2
[30 ms]  <<<  URB 6 coming back  <<< 
-- URB_FUNCTION_CONTROL_TRANSFER:
  PipeHandle           = 826fd274
  TransferFlags        = 00000002 (USBD_TRANSFER_DIRECTION_OUT, USBD_SHORT_TRANSFER_OK)
  TransferBufferLength = 00000000
  TransferBuffer       = 00000000
  TransferBufferMDL    = 00000000
  UrbLink              = 00000000
  SetupPacket          =
    00000000: 40 fe de 00 05 00 00 00
[33 ms] UsbSnoop - MyInternalIOCTLCompletion(f23a1db0) : fido=00000000, Irp=825b9008, Context=826a31a8, IRQL=2
[33 ms]  <<<  URB 8 coming back  <<< 
-- URB_FUNCTION_BULK_OR_INTERRUPT_TRANSFER:
  PipeHandle           = 825e6cc0 [endpoint 0x00000081]
  TransferFlags        = 00000003 (USBD_TRANSFER_DIRECTION_IN, USBD_SHORT_TRANSFER_OK)
  TransferBufferLength = 00000007
  TransferBuffer       = 825e1be8
  TransferBufferMDL    = 825e6988
    00000000: 01 01 17 01 00 30 04
  UrbLink              = 00000000
[33 ms] UsbSnoop - DispatchAny(f23a0610) : IRP_MJ_INTERNAL_DEVICE_CONTROL
[33 ms] UsbSnoop - MyDispatchInternalIOCTL(f23a1e80) : fdo=825ad5b0, Irp=825b9008, IRQL=2
[33 ms]  >>>  URB 9 going down  >>> 
-- URB_FUNCTION_BULK_OR_INTERRUPT_TRANSFER:
  PipeHandle           = 825e6cc0 [endpoint 0x00000081]
  TransferFlags        = 00000003 (USBD_TRANSFER_DIRECTION_IN, USBD_SHORT_TRANSFER_OK)
  TransferBufferLength = 00000008
  TransferBuffer       = 825e1be8
  TransferBufferMDL    = 00000000
  UrbLink              = 00000000
[35 ms] UsbSnoop - MyInternalIOCTLCompletion(f23a1db0) : fido=00000000, Irp=825b9008, Context=825b2ae8, IRQL=2
[35 ms]  <<<  URB 9 coming back  <<< 
-- URB_FUNCTION_BULK_OR_INTERRUPT_TRANSFER:
  PipeHandle           = 825e6cc0 [endpoint 0x00000081]
  TransferFlags        = 00000003 (USBD_TRANSFER_DIRECTION_IN, USBD_SHORT_TRANSFER_OK)
  TransferBufferLength = 00000007
  TransferBuffer       = 825e1be8
  TransferBufferMDL    = 825e6988
    00000000: 01 01 17 01 00 30 05
  UrbLink              = 00000000
[35 ms] UsbSnoop - DispatchAny(f23a0610) : IRP_MJ_INTERNAL_DEVICE_CONTROL
[35 ms] UsbSnoop - MyDispatchInternalIOCTL(f23a1e80) : fdo=825ad5b0, Irp=825b9008, IRQL=2
[35 ms]  >>>  URB 10 going down  >>> 
-- URB_FUNCTION_BULK_OR_INTERRUPT_TRANSFER:
  PipeHandle           = 825e6cc0 [endpoint 0x00000081]
  TransferFlags        = 00000003 (USBD_TRANSFER_DIRECTION_IN, USBD_SHORT_TRANSFER_OK)
  TransferBufferLength = 00000008
  TransferBuffer       = 825e1be8
  TransferBufferMDL    = 00000000
  UrbLink              = 00000000
[42 ms] UsbSnoop - MyInternalIOCTLCompletion(f23a1db0) : fido=00000000, Irp=825b9b28, Context=8262c468, IRQL=2
[42 ms]  <<<  URB 7 coming back  <<< 
-- URB_FUNCTION_BULK_OR_INTERRUPT_TRANSFER:
  PipeHandle           = 825e6cdc [endpoint 0x00000082]
  TransferFlags        = 00000003 (USBD_TRANSFER_DIRECTION_IN, USBD_SHORT_TRANSFER_OK)
  TransferBufferLength = 000001ca
  TransferBuffer       = 825cc008
  TransferBufferMDL    = 825aed88
    00000000: 01 01 17 01 00 20 00 00 00 00 00 00 00 00 68 00
    00000010: 50 00 00 00 b4 01 f0 ef f2 ff 1c ff 3d ff bf f2
    00000020: df f3 ff 1c ff 3d ff cf f1 df f3 ff 1c 19 17 11
    00000030: 22 11 11 11 22 2a 22 31 f3 10 14 5b 71 11 ff 1a
    00000040: 1d 3f 71 f1 23 ff 36 61 42 34 11 71 f1 0f 51 26
    00000050: 12 31 11 22 31 13 d1 f3 ff 1b ff 0f f2 ff 2b ff
    00000060: 3d ff cf f1 ef f2 ff 2b ff 2e ff cf f1 ef f2 ff
    00000070: ff cf f2 ff 1c ff 2e ff bf f2 df f3 ff 2b ff 3d
    00000080: 9f f1 11 2e ff 2e ff bf f4 1a 1f f2 ff 2b 18 ff
    00000090: 25 ff bf f2 ef f2 ff 1c ff 0f f1 ff 1c ff 1e ff
    000000a0: df f1 df f3 ff 1c ff 2e ff bf f2 df f3 ff 2b ff
    000000b0: 3d ff bf f2 ef f2 ff 2b ff 3d ff bf f2 1e 1e 18
    000000c0: ff 4f f1 ef f2 ff 1c ff 4d ff af f2 df f3 ff 2b
    000000d0: ff 2e ff bf f2 ef f2 ff 3a ff 2d ff bf f3 ef f2
    000000e0: ff 2b ff 3d ff bf f2 df f2 2a ef f3 ef 51 f2 23
    000000f0: ff 20 ff 1e ff cf f2 df f1 ff 2d ff 2d ff bf f3
    00000100: df f2 ff 2c ff 2d ff cf f2 df 52 f2 ff 25 ff 2d
    00000110: 25 ff 5f f2 ef f1 ff 2c ff 2d ff df f1 df f2 ff
    00000120: 2c ff 2d ff cf f2 df f2 ff 2c ff 1e ff cf f2 df
    00000130: f2 ff 3b 19 ff 33 ff 9f 11 f2 df f2 ff 2c ff 2d
    00000140: ff df f1 df f2 ff 2c ff 1e ff bf 53 f1 7f f2 ff
    00000150: 2c 11 ff 3a ff cf 7f 21 22 12 3c ff bf ff 4c 12
    00000160: 14 11 11 61 31 41 51 11 42 71 71 13 11 31 26 8f
    00000170: 12 e2 f3 17 5d f3 1b 16 39 f1 ff 24 12 f3 ef 81
    00000180: ba 43 24 41 36 f3 df 92 f8 bf f1 ef f1 ff 2c ff
    00000190: 1e ff bf 53 f2 6f f2 ff 2c 2e 29 1f f2 ff 2c 2e
    000001a0: 1a 2f f1 ff 2c ff 1d ff df f2 df f2 8f f2 22 ff
    000001b0: 13 38 ff 37 2f f2 cf f3 ff 2c ff 3c ff bf f3 df
    000001c0: f3 ff 2b 2f f1 3a ff bf 22 2c
  UrbLink              = 00000000
[42 ms] UsbSnoop - DispatchAny(f23a0610) : IRP_MJ_INTERNAL_DEVICE_CONTROL
[42 ms] UsbSnoop - MyDispatchInternalIOCTL(f23a1e80) : fdo=825ad5b0, Irp=825b9b28, IRQL=2
[42 ms]  >>>  URB 11 going down  >>> 
-- URB_FUNCTION_BULK_OR_INTERRUPT_TRANSFER:
  PipeHandle           = 825e6cdc [endpoint 0x00000082]
  TransferFlags        = 00000003 (USBD_TRANSFER_DIRECTION_IN, USBD_SHORT_TRANSFER_OK)
  TransferBufferLength = 0000041c
  TransferBuffer       = 825cc008
  TransferBufferMDL    = 00000000
  UrbLink              = 00000000
[498 ms] UsbSnoop - MyInternalIOCTLCompletion(f23a1db0) : fido=00000000, Irp=825b9b28, Context=82612188, IRQL=2
[498 ms]  <<<  URB 11 coming back  <<< 
-- URB_FUNCTION_BULK_OR_INTERRUPT_TRANSFER:
  PipeHandle           = 825e6cdc [endpoint 0x00000082]
  TransferFlags        = 00000003 (USBD_TRANSFER_DIRECTION_IN, USBD_SHORT_TRANSFER_OK)
  TransferBufferLength = 000001c6
  TransferBuffer       = 825cc008
  TransferBufferMDL    = 825aed88
    00000000: 01 01 17 01 00 20 0d 00 00 00 03 00 00 00 68 00
    00000010: 50 00 00 00 b0 01 f0 12 4c 11 11 1b 28 ef f2 0f
    00000020: d1 f3 ff 1b bf 11 d1 11 53 11 11 25 12 12 11 12
    00000030: 14 22 12 12 d1 d1 ff ff ff 11 14 ff ff ff 15 6f
    00000040: f1 30 11 41 12 21 32 12 11 e1 f1 16 18 17 ff 22
    00000050: ff ff ff 1d ff cf f1 ef f3 ff 1b ff 3d ff bf f2
    00000060: ef f2 ff 1c ff 2e ff cf f1 1b 2f f2 ff 1c ff 2e
    00000070: ff cf f1 ef f2 ff 2c ff 2d ff cf f2 df f3 3f f1
    00000080: 45 ff 3d ff af f3 df f2 ff 2c ff 2d 15 ff 6f f1
    00000090: ef f2 ff 1c ff 1e ff df f1 ef f2 ff 1c ff 2e ff
    000000a0: cf f1 ef 22 f1 ff 28 ff 2e ff bf f2 ef f2 ff 1c
    000000b0: ff 3d ff bf f2 ef f2 ff 1c ff 2e ff bf f2 cf f4
    000000c0: 15 ff 25 ff 2e ff bf f2 ef f2 ff 3a ff 1e ff df
    000000d0: f1 ef f2 ff 1c ff 3d ff bf f2 9f 41 f4 ff 1a ff
    000000e0: 2d ff cf f2 ef f1 ff 3b ff 0f f1 7f f2 22 ff 2e
    000000f0: 2f f1 24 2f f2 df f3 ff 2b ff 2e ff bf f2 ef f1
    00000100: ff 2c ff 2e ff bf f2 df f2 ff 2c ff 2d 3f f2 7f
    00000110: f2 df f2 14 ff 27 ff 2d ff df f1 ef f1 ff 2c ff
    00000120: 1e ff cf f2 ef f1 ff 3b ff 1e ff cf f2 ef f1 ff
    00000130: 2c ff 1e ff bf f3 df f2 ff 2c ff 1e ff cf f2 ef
    00000140: f1 ff 1d ff 1c 11 ff cf d2 12 11 31 53 11 b1 f1
    00000150: ff 1c fc 4d 82 f1 ff 32 fb 0f f2 8f 91 31 36 14
    00000160: 19 17 36 22 22 f3 ff 27 5f ff 11 16 2a 12 f7 df
    00000170: ff 11 ff cf 21 f1 ff bf f2 ff ff 5f f9 2b ff 0f
    00000180: f1 87 cf f1 ff 10 ff cf f1 ef f2 ff 1d 1e 23 12
    00000190: 5f f2 ff 1c df 92 23 f2 ff 3b cf a2 31 f2 ff 2b
    000001a0: ff 2e ff cf f1 ef f2 ff 26 23 ff 2e ff 5f 43 f1
    000001b0: ef f2 ff 1c ff 0f f2 ff 2a ff 0f f2 ff 1b ff 4d
    000001c0: ff af d3 1c ff 0f
  UrbLink              = 00000000
[498 ms] UsbSnoop - DispatchAny(f23a0610) : IRP_MJ_INTERNAL_DEVICE_CONTROL
[498 ms] UsbSnoop - MyDispatchInternalIOCTL(f23a1e80) : fdo=825ad5b0, Irp=825b9b28, IRQL=2
[498 ms]  >>>  URB 12 going down  >>> 
-- URB_FUNCTION_BULK_OR_INTERRUPT_TRANSFER:
  PipeHandle           = 825e6cdc [endpoint 0x00000082]
  TransferFlags        = 00000003 (USBD_TRANSFER_DIRECTION_IN, USBD_SHORT_TRANSFER_OK)
  TransferBufferLength = 0000041c
  TransferBuffer       = 825cc008
  TransferBufferMDL    = 00000000
  UrbLink              = 00000000
[597 ms] UsbSnoop - MyInternalIOCTLCompletion(f23a1db0) : fido=00000000, Irp=825b9b28, Context=825f4448, IRQL=2
[597 ms]  <<<  URB 12 coming back  <<< 
-- URB_FUNCTION_BULK_OR_INTERRUPT_TRANSFER:
  PipeHandle           = 825e6cdc [endpoint 0x00000082]
  TransferFlags        = 00000003 (USBD_TRANSFER_DIRECTION_IN, USBD_SHORT_TRANSFER_OK)
  TransferBufferLength = 000001da
  TransferBuffer       = 825cc008
  TransferBufferMDL    = 825aed88
    00000000: 01 01 17 01 00 20 1a 00 00 00 04 00 00 00 68 00
    00000010: 50 00 00 00 c4 01 f0 42 24 18 1d 13 24 0f f3 1c
    00000020: 11 3d 19 11 21 f5 39 32 11 11 32 11 12 13 66 11
    00000030: 14 15 11 11 11 ff ff ff ff ff ff 13 6f 11 51 51
    00000040: 62 11 13 11 11 31 31 14 2b 14 12 17 14 5f 91 f1
    00000050: ff ff cf f2 ff 1b ff ff ff 2c ff 3e ff af f3 df
    00000060: f3 ff 3a ff 2e ff af f3 ef f2 ff 3a ff 2e ff af
    00000070: f3 ef f2 ff 2b ff 3d ff af f3 df f3 ff 2b ff 3d
    00000080: ff af f3 df f3 ff 2b ff 2e ff bf f2 df f3 ff 2a
    00000090: ff 0f f1 ff 2b ff 0f f2 ff 1b ff 3e ff bf f1 ff
    000000a0: 11 ff bf f1 ef f3 ff 3a ff 3d ff af f3 df f3 ff
    000000b0: 1b ff 3e ff 9f f3 ef f3 ff 19 11 ff 3e ff bf f1
    000000c0: ef 93 f1 18 6f f2 ef f3 ff 3a ff 2e ff 9f 11 f2
    000000d0: df f3 ff 2a ff 3e ff af f2 ef f3 ff 3a ff 3d 1e
    000000e0: ff 2a ff 3e ff bf f2 df f3 ff 3a ff 3d ff 5f 42
    000000f0: f1 ef f3 0f f1 24 14 ff 3e ff af f2 ef f3 ff 2a
    00000100: ff 0f f2 ff 2b ff 4c ff bf f1 ef f3 ff 1b ff 3e
    00000110: ff 20 8f f2 ef f3 1f f1 19 ff 3e ff af f2 ef f2
    00000120: ff 2b ff 3e ff af f2 ef f3 ff 2a ff 3e ff af f2
    00000130: ef f2 ff 2b ff 2e ff bf f2 ef f3 ff 2a ff 3d ff
    00000140: cf f1 ef f3 ff 1b cf d4 f2 ff 1c cf 3e 15 26 13
    00000150: 11 11 11 51 f1 2c af 2f f1 9f d1 35 91 81 11 42
    00000160: 11 1b 33 11 51 f1 cf f1 2f 11 1f 71 a1 41 91 17
    00000170: 21 11 27 ff f0 32 ff af 23 c1 51 12 f1 ff ff 10
    00000180: 11 ff 1e ff 2c 2d ff ff 5f d9 f2 ff 20 ff 84 1e
    00000190: ff 3e ff af f2 ef 22 f1 ff 37 df 31 22 61 73 f1
    000001a0: ff 42 ff 2a 31 25 ff 2f 43 f1 6f 12 63 f1 ff 13
    000001b0: 12 ff 2c ff bf f2 ef f3 ff 39 26 ff 36 ff 9f 53
    000001c0: f3 6f f2 ff 2b ff 2e ff bf f2 ef 13 f1 6f f1 21
    000001d0: df f1 30 ff af f2 cc ff bf f2
  UrbLink              = 00000000
[597 ms] UsbSnoop - DispatchAny(f23a0610) : IRP_MJ_INTERNAL_DEVICE_CONTROL
[597 ms] UsbSnoop - MyDispatchInternalIOCTL(f23a1e80) : fdo=825ad5b0, Irp=825b9b28, IRQL=2
[597 ms]  >>>  URB 13 going down  >>> 
-- URB_FUNCTION_BULK_OR_INTERRUPT_TRANSFER:
  PipeHandle           = 825e6cdc [endpoint 0x00000082]
  TransferFlags        = 00000003 (USBD_TRANSFER_DIRECTION_IN, USBD_SHORT_TRANSFER_OK)
  TransferBufferLength = 0000041c
  TransferBuffer       = 825cc008
  TransferBufferMDL    = 00000000
  UrbLink              = 00000000
[725 ms] UsbSnoop - MyInternalIOCTLCompletion(f23a1db0) : fido=00000000, Irp=825b9b28, Context=826df808, IRQL=2
[725 ms]  <<<  URB 13 coming back  <<< 
-- URB_FUNCTION_BULK_OR_INTERRUPT_TRANSFER:
  PipeHandle           = 825e6cdc [endpoint 0x00000082]
  TransferFlags        = 00000003 (USBD_TRANSFER_DIRECTION_IN, USBD_SHORT_TRANSFER_OK)
  TransferBufferLength = 000001aa
  TransferBuffer       = 825cc008
  TransferBufferMDL    = 825aed88
    00000000: 01 01 17 01 00 20 28 00 00 00 05 00 00 00 68 00
    00000010: 50 00 00 00 94 01 f0 ff 14 3b ff 2f 91 53 13 11
    00000020: 24 11 1c 12 11 22 23 8f 71 92 f3 ff 19 ff 14 49
    00000030: 1f 11 31 11 31 11 24 11 41 22 34 13 52 14 22 27
    00000040: 13 1a ff ff 12 ff ff ff 1e ff ff ff 1d ff ff ff
    00000050: 2c ff ff ff 2c ff ff ff 1d ff ff ff 1d ff ff ff
    00000060: 2c ff ff ff 2c ff ff ff 2c ff ff ff 2c ff ff ff
    00000070: 2c ff 1f f1 ff 1b ff 1f f1 ff 2a ff ff ff 1d ff
    00000080: ff 17 ff 15 ff ff ff 1d ff ff ff 1d ff ff ff 1d
    00000090: ff ff ff 1d ff 1f f1 ff 2a ff 1f f1 ff 1b ff 1f
    000000a0: f1 ff 1b ff 1f f1 ff 1b ff ff ff 2c ff ff ff 2c
    000000b0: ff ff 19 8f 81 f2 ff ff ff ff ff ff ff ef f1 ff
    000000c0: 1a ff ff ff 2d ff 0f f1 ff 2b ff ff ff 2c ff ff
    000000d0: ff 1d ff ff ff 1d ff 0f f1 ff 4f f2 8f f1 df b1
    000000e0: 71 f2 ff ff ff ff 16 ff bf f2 ff ff df f1 ff 10
    000000f0: ff bf f2 ff 10 ff ff ff ff df f2 ff ff ff 1a ff
    00000100: ff ff 1d ff ff ff 1c ff ff ff 2d ff 0f f1 ff 2b
    00000110: ff ff ff 1d ff ff ff 2c ff ff ff 1c ff 1f f1 ff
    00000120: ff ff ff af f1 ff ff bf 11 f1 ff 15 14 12 11 13
    00000130: ff 28 ff 2a 13 f1 1e 11 17 d2 a1 f1 2d 3c c1 11
    00000140: f1 14 54 16 ff 12 f4 4f 51 84 63 14 11 ff f6 ff
    00000150: 2f f1 18 13 23 44 ff ff 12 ff ff ff 1d ff ff ff
    00000160: 2b ff ff ff 96 ff 1f f1 ff 13 62 ff ff ff ff ff
    00000170: 20 ff 9f f3 ff 20 ff 9f f3 ff 20 27 19 ff 25 ff
    00000180: af a2 f1 4f f2 ff ff cf f2 ff ff df f1 25 ff ff
    00000190: 5f f2 25 ff ff 5f f2 ff 11 ff af f3 ff 10 ff bf
    000001a0: f2 ff 10 ff af f2 bf ff 11 ff
  UrbLink              = 00000000
[725 ms] UsbSnoop - DispatchAny(f23a0610) : IRP_MJ_INTERNAL_DEVICE_CONTROL
[725 ms] UsbSnoop - MyDispatchInternalIOCTL(f23a1e80) : fdo=825ad5b0, Irp=825b9b28, IRQL=2
[725 ms]  >>>  URB 14 going down  >>> 
-- URB_FUNCTION_BULK_OR_INTERRUPT_TRANSFER:
  PipeHandle           = 825e6cdc [endpoint 0x00000082]
  TransferFlags        = 00000003 (USBD_TRANSFER_DIRECTION_IN, USBD_SHORT_TRANSFER_OK)
  TransferBufferLength = 0000041c
  TransferBuffer       = 825cc008
  TransferBufferMDL    = 00000000
  UrbLink              = 00000000
[923 ms] UsbSnoop - MyInternalIOCTLCompletion(f23a1db0) : fido=00000000, Irp=825b9b28, Context=825e5468, IRQL=2
[923 ms]  <<<  URB 14 coming back  <<< 
-- URB_FUNCTION_BULK_OR_INTERRUPT_TRANSFER:
  PipeHandle           = 825e6cdc [endpoint 0x00000082]
  TransferFlags        = 00000003 (USBD_TRANSFER_DIRECTION_IN, USBD_SHORT_TRANSFER_OK)
  TransferBufferLength = 000001a6
  TransferBuffer       = 825cc008
  TransferBufferMDL    = 825aed88
    00000000: 01 01 17 01 00 20 35 00 00 00 06 00 00 00 68 00
    00000010: 50 00 00 00 90 01 10 11 d1 51 21 13 11 14 31 51
    00000020: 15 21 11 14 31 21 42 54 11 11 32 91 ff 2f f1 ff
    00000030: ff ff ff ef 71 11 62 11 11 11 11 22 19 21 72 51
    00000040: 11 21 11 45 21 35 31 11 32 13 ff 6f f1 ff ff cf
    00000050: f1 ff ff cf f2 ff ff cf f2 ff ff df f2 ff ff af
    00000060: f4 ff ff bf f3 ff ff af f4 ff 5f f1 15 3e ff ff
    00000070: ff 2b af f1 ff ff 31 ff ff ff 2b ff ff ff 2d ff
    00000080: ff ff 2b ff ff ff 1d ff ff ff 1d ff ff ff 1d ff
    00000090: ff ff 1d ff ff ff 1d ff ff ff 1d ff ff ff 1d ff
    000000a0: ff ff 1d ff ff ff 2c ff ff ff 2c ff ff ff 2c ff
    000000b0: ff ff 2c ff ff 7f f1 24 12 ff ff ff ff ff ff 8f
    000000c0: f1 ff ff df f2 ff ff cf f2 ff ff cf f2 ff ff 1c
    000000d0: 0f f1 ff ff bf f3 ff ff cf f2 ff ff df f1 24 ff
    000000e0: ff 6f f3 23 ff ff ff ff ff ff 15 ff ff ff 1d ff
    000000f0: ff ff 1d ff ff ff 1d ff ff ff 3d ff ff ff 3b ff
    00000100: ff ff 1b ff ff ff 2c ff ff ff 2c ff ff ff 2c ff
    00000110: ff ff 1d ff ff ff 1d ff ff ff 1d ff ff ff 2c ff
    00000120: ff ff 1d ff 9f 16 31 51 11 f1 1e ff 9f ff 14 11
    00000130: a1 f2 ff f9 df 12 31 f1 3f 11 17 37 4f 11 12 1c
    00000140: 11 17 15 ff 6f ff 3f 12 11 41 ff 0f 12 ff ff 2f
    00000150: 41 28 f5 ff 28 ff ff ff 2c ff ff ff 2c 2a ff ff
    00000160: ff 20 93 ff ff ff 10 85 ff 1d 18 ff 27 ff ef f1
    00000170: 10 1b 3e ff 9f 31 22 f1 7f f4 ff 7f 92 f2 35 11
    00000180: ff ff 26 1a 6f f2 ff ff cf f2 ff ff cf f2 3f f2
    00000190: ff 7f f3 2f f2 ff 7f f2 ff ff df f1 ff ff cf f2
    000001a0: ff ff bf f4 ff 88
  UrbLink              = 00000000
[923 ms] UsbSnoop - DispatchAny(f23a0610) : IRP_MJ_INTERNAL_DEVICE_CONTROL
[923 ms] UsbSnoop - MyDispatchInternalIOCTL(f23a1e80) : fdo=825ad5b0, Irp=825b9b28, IRQL=2
[923 ms]  >>>  URB 15 going down  >>> 
-- URB_FUNCTION_BULK_OR_INTERRUPT_TRANSFER:
  PipeHandle           = 825e6cdc [endpoint 0x00000082]
  TransferFlags        = 00000003 (USBD_TRANSFER_DIRECTION_IN, USBD_SHORT_TRANSFER_OK)
  TransferBufferLength = 0000041c
  TransferBuffer       = 825cc008
  TransferBufferMDL    = 00000000
  UrbLink              = 00000000
[1003 ms] UsbSnoop - MyInternalIOCTLCompletion(f23a1db0) : fido=00000000, Irp=825b9b28, Context=826df808, IRQL=2
[1003 ms]  <<<  URB 15 coming back  <<< 
-- URB_FUNCTION_BULK_OR_INTERRUPT_TRANSFER:
  PipeHandle           = 825e6cdc [endpoint 0x00000082]
  TransferFlags        = 00000003 (USBD_TRANSFER_DIRECTION_IN, USBD_SHORT_TRANSFER_OK)
  TransferBufferLength = 000001b2
  TransferBuffer       = 825cc008
  TransferBufferMDL    = 825aed88
    00000000: 01 01 17 01 00 20 42 00 00 00 06 00 00 00 68 00
    00000010: 50 00 00 00 9c 01 f0 6f f2 ff 2b 4f 11 11 15 11
    00000020: 11 b1 61 0f b1 71 11 22 21 26 23 11 f1 1d 25 ff
    00000030: 4f 21 c6 13 31 13 22 11 11 11 31 11 22 13 31 11
    00000040: 52 11 11 23 13 2c af f1 7f f1 ff ff ff ff ff ff
    00000050: ff ff ff af f2 ff ff df f1 ff 1c ff 0f f1 ff ff
    00000060: df f1 ff ff df f1 ff 1c ff 0f f1 ff 1c ff 0f f1
    00000070: ff ff cf f2 ff 2b ff 0f f1 ff ff df f1 ff 1c ff
    00000080: 0f f1 ff 2b ff 0f f1 ff 1c ff 0f f1 ff ff df f1
    00000090: ff ff ff ff bf f1 ff 10 ff cf f1 ff 10 ff cf f1
    000000a0: ff 10 ff ff ff 1d ff cf f1 ff 10 ff cf f1 ff 10
    000000b0: ff cf f1 ef f2 ff ff cf f2 ff ff 5f 71 f1 10 ff
    000000c0: 1b ff ff ff 2c ff ff ff 1d ff 1e ff cf f2 ef f1
    000000d0: ff 1d ff 2e ff cf f1 ff 10 ff cf f1 ff 10 ff cf
    000000e0: f1 ff ff df f1 ff 10 ff 22 8f f1 ff 1d 5f f1 ff
    000000f0: ff ff 6f f1 ef f1 ff 1e ff 0f f1 ff 2b ff 1e ff
    00000100: cf f2 ff ff ff ff 1d 2d ff ff ff ff ff ff ff ff
    00000110: 1b ff 1e ff cf f1 ff ff ff ff ff ff 2c ff ff ff
    00000120: 1d ff ff ff 2c ff ff ff 1d ff ff ff ff ff ff bf
    00000130: f1 ff ff df 91 26 15 12 11 32 b1 f1 ff 1d 48 f3
    00000140: 67 13 17 13 13 21 11 f2 af f2 41 37 11 33 f3 ff
    00000150: 71 62 f2 ff 13 14 14 f1 5e fa ff ff 4f f2 df f2
    00000160: ff 2b ff ff ff 1d ff 0f f1 ff ff ff 1f f8 ff ff
    00000170: 6f 12 f2 5f f1 ef f2 ff 1c ff 3e ff bf f1 10 df
    00000180: f2 ff 2c 7f 92 a1 f2 ff 2b 7f a2 91 f1 ff 1c ff
    00000190: 2e ff bf f2 ef f1 ff 22 19 ff ff ff 22 ff 9f f2
    000001a0: ff ff df f1 ff 1c ff 3e ff bf f1 ef f2 ff 1c 99
    000001b0: ff ff
  UrbLink              = 00000000
[1003 ms] UsbSnoop - DispatchAny(f23a0610) : IRP_MJ_INTERNAL_DEVICE_CONTROL
[1003 ms] UsbSnoop - MyDispatchInternalIOCTL(f23a1e80) : fdo=825ad5b0, Irp=825b9b28, IRQL=2
[1003 ms]  >>>  URB 16 going down  >>> 
-- URB_FUNCTION_BULK_OR_INTERRUPT_TRANSFER:
  PipeHandle           = 825e6cdc [endpoint 0x00000082]
  TransferFlags        = 00000003 (USBD_TRANSFER_DIRECTION_IN, USBD_SHORT_TRANSFER_OK)
  TransferBufferLength = 0000041c
  TransferBuffer       = 825cc008
  TransferBufferMDL    = 00000000
  UrbLink              = 00000000
[1070 ms] UsbSnoop - MyInternalIOCTLCompletion(f23a1db0) : fido=00000000, Irp=825b9b28, Context=826c29e8, IRQL=2
[1070 ms]  <<<  URB 16 coming back  <<< 
-- URB_FUNCTION_BULK_OR_INTERRUPT_TRANSFER:
  PipeHandle           = 825e6cdc [endpoint 0x00000082]
  TransferFlags        = 00000003 (USBD_TRANSFER_DIRECTION_IN, USBD_SHORT_TRANSFER_OK)
  TransferBufferLength = 000001d2
  TransferBuffer       = 825cc008
  TransferBufferMDL    = 825aed88
    00000000: 01 01 17 01 00 20 4f 00 00 00 06 00 00 00 68 00
    00000010: 50 00 00 00 bc 01 f0 29 8f f1 1f f3 1f c1 f2 10
    00000020: 21 11 31 21 41 a1 32 76 12 23 14 11 d2 31 13 51
    00000030: f1 ff ff 8f f1 2f f2 11 31 12 17 17 11 66 81 11
    00000040: 11 31 21 31 21 11 31 91 a1 f1 14 ff 1f f1 ff 1b
    00000050: ff 1f f1 ff ff df f1 ff 1b ff 3e ff bf f1 ff 20
    00000060: ff ff ff 2c ff bf f1 ff 20 ff af f3 ef f2 ff 2b
    00000070: ef e1 f2 ff 3a ff 2e ff bf f2 ef f2 ff 2b ff 2e
    00000080: ff af f3 ef f2 ff 2b 2a ff 22 ff bf f2 ef f2 ff
    00000090: 1b ff 0f f2 ff 1b ff 1f f1 ff 2b ff 2e ff af f3
    000000a0: ef f2 ff 1b ff 3e ff af f2 ff 20 ff bf f2 ef f2
    000000b0: ff 1b ff 0f f2 ff 1b ff 0f f1 ff 1c ff 0f f2 ff
    000000c0: 1b ff 0f 32 f1 18 df f1 ff 20 ff af f2 ff 20 ff
    000000d0: af f2 ef f2 ff 2b ff 0f f2 ff 2a ff 0f f2 ff 1b
    000000e0: ff 3e 18 ff 2f f1 ff 10 ff bf f2 ff 10 ff cf f2
    000000f0: ef f1 ff 20 1a ff 0f f2 19 4f a2 f1 ff 10 ff ff
    00000100: ff 1d ff cf f1 ff 10 ff cf f1 ff 20 ff bf f1 ff
    00000110: 10 ff bf f2 ff 20 9f f2 0f f1 ff 20 ff bf f1 ff
    00000120: 10 ff cf f1 ef f2 ff 1b ff 1f f1 ff 2b ff 0f f1
    00000130: ff 2b ff 0f f2 ff 2a ff 0f f1 ff 1c ff 2e ff cf
    00000140: f1 ff ff cf f2 ff ff ff ff 2d ff bf f2 66 22 11
    00000150: 2b ff cf f1 f6 13 31 1d 37 53 f1 39 4f 14 18 11
    00000160: 17 ff 8f 11 24 11 51 11 31 25 2f 11 31 13 41 ff
    00000170: 0f f2 fa ff 3f 13 11 83 19 12 fb 37 ff bf f2 ff
    00000180: 10 ff bf f1 ff 11 ff 16 4f f1 ff 11 df f9 15 ff
    00000190: 2e ef f8 14 ff 0f f3 ff 19 ff 1f f3 ff 2a bf 22
    000001a0: d1 f4 ff 29 ff 25 47 ff 9f f2 5f 72 f4 ff 19 ff
    000001b0: 1f f1 ff 1b ff 0f f2 ff 4b ff 2d ff af f4 df f1
    000001c0: ff 1b 11 ff 3d ff af f2 ef f3 ff 1a ff 0f f3 ff
    000001d0: 2a 6f
  UrbLink              = 00000000
[1070 ms] UsbSnoop - DispatchAny(f23a0610) : IRP_MJ_INTERNAL_DEVICE_CONTROL
[1070 ms] UsbSnoop - MyDispatchInternalIOCTL(f23a1e80) : fdo=825ad5b0, Irp=825b9b28, IRQL=2
[1070 ms]  >>>  URB 17 going down  >>> 
-- URB_FUNCTION_BULK_OR_INTERRUPT_TRANSFER:
  PipeHandle           = 825e6cdc [endpoint 0x00000082]
  TransferFlags        = 00000003 (USBD_TRANSFER_DIRECTION_IN, USBD_SHORT_TRANSFER_OK)
  TransferBufferLength = 0000041c
  TransferBuffer       = 825cc008
  TransferBufferMDL    = 00000000
  UrbLink              = 00000000
[1196 ms] UsbSnoop - MyInternalIOCTLCompletion(f23a1db0) : fido=00000000, Irp=825b9b28, Context=82685608, IRQL=2
[1196 ms]  <<<  URB 17 coming back  <<< 
-- URB_FUNCTION_BULK_OR_INTERRUPT_TRANSFER:
  PipeHandle           = 825e6cdc [endpoint 0x00000082]
  TransferFlags        = 00000003 (USBD_TRANSFER_DIRECTION_IN, USBD_SHORT_TRANSFER_OK)
  TransferBufferLength = 000001e2
  TransferBuffer       = 825cc008
  TransferBufferMDL    = 825aed88
    00000000: 01 01 17 01 00 20 5d 00 00 00 06 00 00 00 68 00
    00000010: 50 00 00 00 cc 01 b0 42 f1 10 11 3d 11 3d ff 0f
    00000020: 42 71 31 13 22 21 1e 14 24 19 13 15 13 26 11 11
    00000030: 56 13 11 ff 5f f1 ff ff cf f2 bf 24 12 53 11 11
    00000040: 21 15 12 11 1d 1f f3 cf f1 ff 1d ff ff ff 13 19
    00000050: ff ff ff 2c ff 1f f1 ff 2a ff 1f f1 ff 2a ff 1f
    00000060: f2 ff 1a ff 4e ff 9f f3 ff 30 ff 8f f2 ff 40 ff
    00000070: 8f f2 ff 11 ff af f2 ff 11 ff bf f2 ef f3 ff 39
    00000080: ff 0f 11 f1 ff 28 1b ff 14 ff 9f f3 ff 11 ff af
    00000090: f2 ff 11 ff af f2 ff 11 ff bf f2 ff 10 ff af f2
    000000a0: ff 11 ff bf f1 ff 10 ff bf f2 ef 11 f1 ff 2a ff
    000000b0: 1f f1 ff 2a ff 18 17 ff 9f f3 ff 11 ff af f2 ff
    000000c0: 11 ff bf f1 ff 20 2f f1 18 2d ff 1e 11 ff af f2
    000000d0: ef 11 f1 ff 2a ff 3e ff af f2 ff 11 ff 9f f3 ef
    000000e0: f3 ff 2a ff 1f f1 17 ff 22 ff 3e ff af f2 ff 20
    000000f0: ff af f2 ff 11 ff bf 11 f2 df f1 8f f2 10 22 ff
    00000100: 2c ff af f2 ff 11 ff af f2 ff 11 ff af f2 ef f3
    00000110: ff 2a ff 1f f1 ff 1a ff 1f f2 8f f2 10 ff 1f f2
    00000120: 9f f1 10 ff 1f f2 ff 1a ff 1f f2 ff 1a ff 1f f2
    00000130: ff 2a ff 0f f2 ff 2a ff 0f f2 ff 2a ff 1e ff bf
    00000140: f3 ef 11 f1 ff 2a ff 2e ff bf f2 ef 11 f1 ff 2a
    00000150: ff 3e ff af f2 5f 54 43 12 41 21 f1 9f f2 5f 16
    00000160: ff 11 17 42 a3 52 f1 2d 31 11 f3 ff 58 ef 71 1a
    00000170: 12 13 11 13 11 11 12 f1 ff cf 39 ff af 15 24 5f
    00000180: 41 39 ff 9f f2 ff 30 ff 9f f2 ff 12 ff 3f 52 f1
    00000190: ff 21 ff 9b 24 ff 0f f3 cf 48 f2 ff 21 ff 9f f3
    000001a0: ef 93 f1 df f4 6f 31 12 14 21 f1 ff 34 ff 16 77
    000001b0: 29 ff 78 ff 2c 22 1a ff 29 ff 0f f3 ff 39 ff 0f
    000001c0: f2 ff 29 0f f2 3d ff af e1 f3 3d ff af 21 f1 cf
    000001d0: f3 ff 1a ff 0f f3 ff 39 ff 3e ff 18 0f f2 6f cf
    000001e0: f3 ff
  UrbLink              = 00000000
[1196 ms] UsbSnoop - DispatchAny(f23a0610) : IRP_MJ_INTERNAL_DEVICE_CONTROL
[1196 ms] UsbSnoop - MyDispatchInternalIOCTL(f23a1e80) : fdo=825ad5b0, Irp=825b9b28, IRQL=2
[1196 ms]  >>>  URB 18 going down  >>> 
-- URB_FUNCTION_BULK_OR_INTERRUPT_TRANSFER:
  PipeHandle           = 825e6cdc [endpoint 0x00000082]
  TransferFlags        = 00000003 (USBD_TRANSFER_DIRECTION_IN, USBD_SHORT_TRANSFER_OK)
  TransferBufferLength = 0000041c
  TransferBuffer       = 825cc008
  TransferBufferMDL    = 00000000
  UrbLink              = 00000000
[1296 ms] UsbSnoop - MyInternalIOCTLCompletion(f23a1db0) : fido=00000000, Irp=825b9b28, Context=8263ac08, IRQL=2
[1296 ms]  <<<  URB 18 coming back  <<< 
-- URB_FUNCTION_BULK_OR_INTERRUPT_TRANSFER:
  PipeHandle           = 825e6cdc [endpoint 0x00000082]
  TransferFlags        = 00000003 (USBD_TRANSFER_DIRECTION_IN, USBD_SHORT_TRANSFER_OK)
  TransferBufferLength = 00000172
  TransferBuffer       = 825cc008
  TransferBufferMDL    = 825aed88
    00000000: 01 01 17 01 00 20 6b 00 00 00 06 00 00 00 68 00
    00000010: 50 00 00 00 5c 01 f0 ff 1a ff ff ff 1d ff ff 13
    00000020: 31 11 42 21 61 31 41 11 11 a4 61 f1 1b 31 61 15
    00000030: 31 11 24 25 12 33 d1 11 24 11 11 61 61 15 14 f3
    00000040: ff ff ff ff ff ff ff ff ff ff ff ff ff ff ff ff
    00000050: ff ff ff ff ff ff ff ff ff cf f1 ff ff df f1 ff
    00000060: ff ff ff ff ff ff ff ff ff ff ff ff 1a ff ff ff
    00000070: 1d ff ff ff 1d ff ff ff 1d ff ff ff ff ff ff ff
    00000080: ff ff ff 1b ff ff ff ff ff ff ff ff ff ff ff ff
    00000090: ff ff ff ff ff ff ff ff ff ff ff ff ff ff af f1
    000000a0: 28 ff ff ff ff ff ff ff ff ff ff ff ff ff bf f1
    000000b0: ff ff df f1 ff ff ff ff ff ff ff ff ff bf f1 ff
    000000c0: ff ff 1d ff ff ff 1e ff ff ff ff ff ff 1b ff ff
    000000d0: ff ff ff ff ff ff ff ff ff ff ff 5f f2 ff ff ff
    000000e0: ff ff ff ff ff ff ff ff ff ff ff ff ff ff ff ff
    000000f0: ff 1c ff ff ff ff ff ff ff ff ff ff ff ff ff af
    00000100: f1 ff ff ff ff ff ff ff ff 11 f8 62 52 11 f2 ff
    00000110: 1e 2a 25 11 21 41 91 71 11 16 18 33 1f f1 ff 46
    00000120: 1f 3b 18 4f 14 ff ff 7f 41 51 31 42 f1 ff ff ff
    00000130: ff ff ff ff ff 1a ff ff ff 9c ff ff ff 26 12 ff
    00000140: ff ff ff ff ff 8f f2 ff 19 ff 2f f1 ff 3f f2 8f
    00000150: f1 ff ff ff ff ff ff ff ff ff ff ff ff ff ff 19
    00000160: ff ff ff ff ff ef f1 ff ff cf f1 ff ff ff ff 3f
    00000170: ff ff
  UrbLink              = 00000000
[1296 ms] UsbSnoop - DispatchAny(f23a0610) : IRP_MJ_INTERNAL_DEVICE_CONTROL
[1296 ms] UsbSnoop - MyDispatchInternalIOCTL(f23a1e80) : fdo=825ad5b0, Irp=825b9b28, IRQL=2
[1296 ms]  >>>  URB 19 going down  >>> 
-- URB_FUNCTION_BULK_OR_INTERRUPT_TRANSFER:
  PipeHandle           = 825e6cdc [endpoint 0x00000082]
  TransferFlags        = 00000003 (USBD_TRANSFER_DIRECTION_IN, USBD_SHORT_TRANSFER_OK)
  TransferBufferLength = 0000041c
  TransferBuffer       = 825cc008
  TransferBufferMDL    = 00000000
  UrbLink              = 00000000
[1367 ms] UsbSnoop - MyInternalIOCTLCompletion(f23a1db0) : fido=00000000, Irp=825b9b28, Context=8262c468, IRQL=2
[1367 ms]  <<<  URB 19 coming back  <<< 
-- URB_FUNCTION_BULK_OR_INTERRUPT_TRANSFER:
  PipeHandle           = 825e6cdc [endpoint 0x00000082]
  TransferFlags        = 00000003 (USBD_TRANSFER_DIRECTION_IN, USBD_SHORT_TRANSFER_OK)
  TransferBufferLength = 0000019e
  TransferBuffer       = 825cc008
  TransferBufferMDL    = 825aed88
    00000000: 01 01 17 01 00 20 7a 00 00 00 06 00 00 00 68 00
    00000010: 50 00 00 00 88 01 f0 12 0f e1 f3 ff 19 19 11 23
    00000020: 16 11 11 11 21 16 b6 61 81 41 11 72 11 11 f9 ff
    00000030: 12 ff ff ff 1a ff ff 22 21 43 11 13 31 51 42 b1
    00000040: 83 f1 13 ff 13 ff 19 ff ff ff 14 18 ff ff ff 1d
    00000050: ff ff ff 2d ff ff ff 2b ff ff ff 2d ff ff ff 3b
    00000060: ff ff ff 1c ff ff ff 1d ff ff ff 3c ff ff ff 3b
    00000070: ff ff ff 3b ff ff ff 1c ff ff ff 2c ff ff ff 1d
    00000080: ff ff ff 2c ff ff ff 2d ff ff ff 2b ff ff ff 1d
    00000090: ff ff ff 1d ff ff ff 1d ff ff ff 2c ff ff ff 1d
    000000a0: ff ff ff 1d ff ff ff 2d ff ff 7f f1 14 13 ff ff
    000000b0: ff 28 ff ff ff 1d ff ff ff 2c ff ff ff 2c ff ff
    000000c0: ff 2d ff ff ff 2b ff ff ff 2c ff ff ff 1d ff ff
    000000d0: ff 1d 5f f2 ff ff 36 3f f2 ff ff ff ff ff 4f f2
    000000e0: ff ff cf f2 ff ff ff ff ff ff 1c ff ff ff 3d ff
    000000f0: ff ff 2c ff ff ff ff ff ff 9f f1 ff ff df f2 ff
    00000100: ff cf f2 ff ff cf f2 ff ff cf f2 ff ff cf f2 ff
    00000110: ff cf f2 ff ff cf f2 ff ff cf f2 ff 69 51 24 11
    00000120: 14 8f f2 ff f9 8f 41 34 15 17 ff f8 ff 31 ff 17
    00000130: 16 73 f2 12 11 33 11 71 31 21 f5 ff 14 34 f1 ff
    00000140: 21 13 19 11 24 81 f1 f4 ff 35 ff 17 15 ff cf f3
    00000150: ff ff cf b2 f1 ff ff 0f 32 f9 ff ff 2e 65 11 ff
    00000160: ff ef f3 ff ff 10 af f3 ff 29 23 12 ff 13 42 ff
    00000170: ff 28 19 5f 14 f1 ff 6f a2 f1 16 ff ff ff 3c ff
    00000180: ff ff 1c ff 24 ff ff 27 ff 23 ff ff 27 ff ff ff
    00000190: 3b ff ff ff 3b ff ff 8f f1 32 ff 9f 27 ff
  UrbLink              = 00000000
[1367 ms] UsbSnoop - DispatchAny(f23a0610) : IRP_MJ_INTERNAL_DEVICE_CONTROL
[1367 ms] UsbSnoop - MyDispatchInternalIOCTL(f23a1e80) : fdo=825ad5b0, Irp=825b9b28, IRQL=2
[1367 ms]  >>>  URB 20 going down  >>> 
-- URB_FUNCTION_BULK_OR_INTERRUPT_TRANSFER:
  PipeHandle           = 825e6cdc [endpoint 0x00000082]
  TransferFlags        = 00000003 (USBD_TRANSFER_DIRECTION_IN, USBD_SHORT_TRANSFER_OK)
  TransferBufferLength = 0000041c
  TransferBuffer       = 825cc008
  TransferBufferMDL    = 00000000
  UrbLink              = 00000000
[1422 ms] UsbSnoop - MyInternalIOCTLCompletion(f23a1db0) : fido=00000000, Irp=825b9b28, Context=825e5468, IRQL=2
[1422 ms]  <<<  URB 20 coming back  <<< 
-- URB_FUNCTION_BULK_OR_INTERRUPT_TRANSFER:
  PipeHandle           = 825e6cdc [endpoint 0x00000082]
  TransferFlags        = 00000003 (USBD_TRANSFER_DIRECTION_IN, USBD_SHORT_TRANSFER_OK)
  TransferBufferLength = 000001b2
  TransferBuffer       = 825cc008
  TransferBufferMDL    = 825aed88
    00000000: 01 01 17 01 00 20 88 00 00 00 06 00 00 00 68 00
    00000010: 50 00 00 00 9c 01 f0 3f f4 ff ff bf e2 61 32 32
    00000020: 61 f1 23 1a 26 11 a1 61 12 f2 ff 39 24 ff 16 ff
    00000030: df 53 a1 15 37 15 19 11 13 19 3f f1 27 ff ff ff
    00000040: 1d ff 15 ff ff ff ff ff ff ff 16 ff ff ff 1d ff
    00000050: cf f1 ff 10 ff cf f1 ef f3 ff 2a ff 0f f1 ff 1c
    00000060: ff 0f f1 ff 1c ff 0f f1 ff 3b ff 1e ff cf f1 ff
    00000070: 20 ff cf f1 ef b1 f1 ff 20 ff 2d ff bf f2 ff 10
    00000080: ff ff ff 2c ff cf f1 ff 10 ff ff ff 1d ff ff ff
    00000090: 1d ff ff ff 1d ff bf f2 ff 10 ff cf f2 ef f1 ff
    000000a0: 2c ff 1e ff cf f1 ff 10 ff cf f1 ff 10 ff ff ff
    000000b0: 17 15 2f f1 9f f1 ef f2 ff 1c ff 0f f1 ff 2b ff
    000000c0: 0f f1 ff ff df f1 ff 1d ff 2d ff ff ff 3b ff cf
    000000d0: f1 ff 10 ff cf f1 ff 10 ff bf f2 ff ff 25 5f f2
    000000e0: ff 0f f1 24 6f f1 ff 10 ff cf f2 ef f1 ff 2c ff
    000000f0: 1e ff bf f3 ff ff bf f2 ff ff cf f2 ff 0f f2 bf
    00000100: f1 ff ff df f1 ff ff ff ff ff ff 2b ff 0f f1 ff
    00000110: 1c ff 0f f1 ff 2b ff 0f f1 ff 2b ff 0f f1 ff 2b
    00000120: ff 0f f1 ff 2b ff 0f f1 ff 2b ff 0f f1 ff ff ff
    00000130: ff bf b1 f3 1f f1 ff 1c fa 6d 52 f2 ff 15 68 f1
    00000140: 3a 7f 21 f1 10 12 62 51 91 f2 12 11 24 11 b5 f1
    00000150: df 12 c1 ff 24 cf 13 21 12 15 13 54 12 f9 4f f1
    00000160: ff 2c 27 ff ff ff 13 ff ff ff 1e ff 1e 4f f8 ff
    00000170: ff 11 4f 12 f2 3f f1 ef f3 ff ff bf f3 ff df f2
    00000180: 3b ff bf f1 2a 19 37 ff bf f2 29 1a 17 ff cf f1
    00000190: ff 20 ff cf f1 ff ff 3f 72 f2 ef f1 ff 23 17 ff
    000001a0: 0f f2 ff ff bf f3 ff ff cf f2 ff 2b cf f1 30 ff
    000001b0: bf b1
  UrbLink              = 00000000
[1422 ms] UsbSnoop - DispatchAny(f23a0610) : IRP_MJ_INTERNAL_DEVICE_CONTROL
[1422 ms] UsbSnoop - MyDispatchInternalIOCTL(f23a1e80) : fdo=825ad5b0, Irp=825b9b28, IRQL=2
[1422 ms]  >>>  URB 21 going down  >>> 
-- URB_FUNCTION_BULK_OR_INTERRUPT_TRANSFER:
  PipeHandle           = 825e6cdc [endpoint 0x00000082]
  TransferFlags        = 00000003 (USBD_TRANSFER_DIRECTION_IN, USBD_SHORT_TRANSFER_OK)
  TransferBufferLength = 0000041c
  TransferBuffer       = 825cc008
  TransferBufferMDL    = 00000000
  UrbLink              = 00000000
[1544 ms] UsbSnoop - MyInternalIOCTLCompletion(f23a1db0) : fido=00000000, Irp=825b9b28, Context=826df808, IRQL=2
[1544 ms]  <<<  URB 21 coming back  <<< 
-- URB_FUNCTION_BULK_OR_INTERRUPT_TRANSFER:
  PipeHandle           = 825e6cdc [endpoint 0x00000082]
  TransferFlags        = 00000003 (USBD_TRANSFER_DIRECTION_IN, USBD_SHORT_TRANSFER_OK)
  TransferBufferLength = 000001ea
  TransferBuffer       = 825cc008
  TransferBufferMDL    = 825aed88
    00000000: 01 01 17 01 00 20 95 00 00 00 06 00 00 00 68 00
    00000010: 50 00 00 00 d4 01 f0 12 53 17 11 1d 13 15 13 3e
    00000020: 9f f1 10 43 1f 21 31 11 21 31 22 33 92 11 f2 38
    00000030: 33 11 11 31 73 f1 ff 11 11 3f 11 f1 ff ff ff 9f
    00000040: f1 10 19 9f 22 f1 16 96 d1 f1 ff 2a ff 1f f1 ff
    00000050: 39 ff 1f f1 ff 1b ff 3e ff bf f1 ff 20 ff bf f1
    00000060: ff 20 ff af f2 ff 10 ff bf f2 6f 71 f3 ff 2a ff
    00000070: 0f f2 ff 39 ff 3e ff 9f f3 ef f3 ff 39 ff 4e ff
    00000080: 8f f3 ef a3 f2 df 62 f1 7f f3 ff 39 15 ff 29 13
    00000090: ff 6f f2 ff 20 ff af a2 f1 4f f2 ff 1b ff 3e ff
    000000a0: af f2 ff 20 ff bf f1 ff 20 ff af f2 ff 20 ff 9f
    000000b0: 13 f1 12 9f f3 ff 2a ff 3e ff af f2 ff 20 ff af
    000000c0: f2 ff 20 ff bf f1 ef 62 f1 18 bf f1 ef f2 ff 2b
    000000d0: ff 2e ff af f3 ef f2 ff 2b ff 2e ff bf f2 ef f2
    000000e0: ff 2b ff 3e 1a ff 2e ff 2e ff af f3 ff 20 ff af
    000000f0: 12 f1 cf f2 ff 22 36 ff 2e cf f1 24 27 ff 2e ff
    00000100: bf f2 ef f2 ff 3a ff 2e ff af f3 ef f2 ff 3a ff
    00000110: 0f f1 ff 3a ff 1e df f2 2c ff 0f f1 1d cf f2 ef
    00000120: f1 ff 2c ff 2e ff af 11 f1 ef f1 ff 1b 11 ff 2e
    00000130: ff af f3 ef f2 ff 3a ff 2e ff af f2 ff 11 ff af
    00000140: f3 ef f2 ff 3a ff 2e ff bf f2 ef f2 ff 1c 1c 2a
    00000150: 11 15 2b ff af f3 f8 33 15 62 31 11 f1 6f f3 f6
    00000160: 15 ff 26 25 d1 62 f1 20 11 11 37 22 11 f1 ff 38
    00000170: 5f 61 6f 32 71 12 22 13 12 11 bf f1 fc 35 ff 19
    00000180: 11 16 36 f1 f7 16 ff cf f1 ff 20 ff 36 2f f1 ff
    00000190: 10 ff 91 2f f1 ff 20 ff 81 2f f1 ff 20 ff af f2
    000001a0: bf 11 f4 ff 1b af 31 22 61 32 22 f1 ff 27 ff 15
    000001b0: 22 11 41 32 ff 5f f3 7f 32 11 31 f2 ff 26 ff 0f
    000001c0: f2 ff 2a ff 0f f2 ff 2a 23 ff 2a ff af 22 f3 af
    000001d0: f2 ff 2a ff 4e ff 8f f3 bf 31 f2 ff 2a ff 1b 32
    000001e0: 14 ff 11 3f 13 f1 66 f3 bf 31
  UrbLink              = 00000000
[1544 ms] UsbSnoop - DispatchAny(f23a0610) : IRP_MJ_INTERNAL_DEVICE_CONTROL
[1544 ms] UsbSnoop - MyDispatchInternalIOCTL(f23a1e80) : fdo=825ad5b0, Irp=825b9b28, IRQL=2
[1544 ms]  >>>  URB 22 going down  >>> 
-- URB_FUNCTION_BULK_OR_INTERRUPT_TRANSFER:
  PipeHandle           = 825e6cdc [endpoint 0x00000082]
  TransferFlags        = 00000003 (USBD_TRANSFER_DIRECTION_IN, USBD_SHORT_TRANSFER_OK)
  TransferBufferLength = 0000041c
  TransferBuffer       = 825cc008
  TransferBufferMDL    = 00000000
  UrbLink              = 00000000
[1645 ms] UsbSnoop - MyInternalIOCTLCompletion(f23a1db0) : fido=00000000, Irp=825b9b28, Context=826c29e8, IRQL=2
[1645 ms]  <<<  URB 22 coming back  <<< 
-- URB_FUNCTION_BULK_OR_INTERRUPT_TRANSFER:
  PipeHandle           = 825e6cdc [endpoint 0x00000082]
  TransferFlags        = 00000003 (USBD_TRANSFER_DIRECTION_IN, USBD_SHORT_TRANSFER_OK)
  TransferBufferLength = 000001d2
  TransferBuffer       = 825cc008
  TransferBufferMDL    = 825aed88
    00000000: 01 01 17 01 00 20 a2 00 00 00 06 00 00 00 68 00
    00000010: 50 00 00 00 bc 01 90 f3 7f f1 12 ff 0f 53 f1 1d
    00000020: 21 1f f3 6f 53 1b ff 19 23 9f 61 a3 f1 ff ff af
    00000030: c7 11 11 14 11 12 11 93 61 11 11 11 f3 8f 19 ff
    00000040: bf f2 ff ff cf f2 ff ff df f1 ff 21 ff 9f f2 ff
    00000050: 30 ff af f1 ff 11 ff af f2 ff 30 ff 8f f3 ff 20
    00000060: 12 ff 7f f2 ff 20 ff af f2 ff 20 ff af f2 ff 30
    00000070: ff 9f f2 ff 30 ff 8f f3 ff 30 ff 8f f3 ff 30 ff
    00000080: 8f f3 ff 20 ff ff 14 ff 46 ff af f1 ff 30 ff af
    00000090: f1 ff 20 ff af f1 ff 21 ff af f2 ff 20 ff 9f f3
    000000a0: ff 20 ff af f2 ff 10 ff bf f2 ef f3 ff 2a ff 0f
    000000b0: f1 ff 1c ff ff ff ff ef f2 13 8f c1 f2 ff 20 ff
    000000c0: 9f f3 ff 20 ff af f2 ff 20 ff af f2 ef f3 ff 2a
    000000d0: ff 0f f1 ff 2b ff 0f f1 19 ff 21 ff 0f f2 ff 2a
    000000e0: ff 0f f2 ff 29 ff 1f f1 ff 2a 23 ff 1b ff 1a 0f
    000000f0: 22 f2 bf f1 ff 2b ff 0f f2 ff 2a ff 0f f1 ff 1b
    00000100: ff 1f f1 ff 1b ff 1f f1 ff 2a ff 1f f2 9f e2 f2
    00000110: ff 10 ff 1b 1e ff 1f f1 ff ff df f2 ff 1a ff 1f
    00000120: f1 ff 2a ff 1f f1 ff 2a ff 1f f2 ff 29 ff 1f f1
    00000130: ff 2a ff 1f f1 ff 2a ff 0f f2 ff 1b ff 0f f2 ff
    00000140: ff df f1 ff 2a ff 27 11 24 ff bf f1 10 12 3f 35
    00000150: 6f 23 15 bf f1 5f 16 11 ff 1d b3 f2 5f 92 13 31
    00000160: 11 11 11 15 ff 41 ff 13 11 84 f2 1f 13 1c 42 ff
    00000170: 8a f2 ff 2a 14 92 f1 95 f1 ff 1b ff 0f f2 ff 15
    00000180: 15 ff 1f f1 df f9 ff 16 ff 8e ff 5f f3 ff 29 ff
    00000190: 0f 12 f1 ff 19 ff 18 53 11 ff 9f f1 ff 20 11 31
    000001a0: 29 ff 37 ff 0f 42 a2 f1 9f f1 ff 11 ff af f2 ff
    000001b0: 11 ff 9f f3 21 df f1 ff 2a 0f f3 2c ff af f1 ff
    000001c0: 21 ff af f1 ff 31 ff 9f f2 ff 20 11 ff 8f f2 7f
    000001d0: 21 ff
  UrbLink              = 00000000
[1645 ms] UsbSnoop - DispatchAny(f23a0610) : IRP_MJ_INTERNAL_DEVICE_CONTROL
[1645 ms] UsbSnoop - MyDispatchInternalIOCTL(f23a1e80) : fdo=825ad5b0, Irp=825b9b28, IRQL=2
[1645 ms]  >>>  URB 23 going down  >>> 
-- URB_FUNCTION_BULK_OR_INTERRUPT_TRANSFER:
  PipeHandle           = 825e6cdc [endpoint 0x00000082]
  TransferFlags        = 00000003 (USBD_TRANSFER_DIRECTION_IN, USBD_SHORT_TRANSFER_OK)
  TransferBufferLength = 0000041c
  TransferBuffer       = 825cc008
  TransferBufferMDL    = 00000000
  UrbLink              = 00000000
[1755 ms] UsbSnoop - MyInternalIOCTLCompletion(f23a1db0) : fido=00000000, Irp=825b9b28, Context=82685608, IRQL=2
[1755 ms]  <<<  URB 23 coming back  <<< 
-- URB_FUNCTION_BULK_OR_INTERRUPT_TRANSFER:
  PipeHandle           = 825e6cdc [endpoint 0x00000082]
  TransferFlags        = 00000003 (USBD_TRANSFER_DIRECTION_IN, USBD_SHORT_TRANSFER_OK)
  TransferBufferLength = 0000019a
  TransferBuffer       = 825cc008
  TransferBufferMDL    = 825aed88
    00000000: 01 01 17 01 00 20 af 00 00 00 06 00 00 00 68 00
    00000010: 50 00 00 00 84 01 f1 4f d1 31 14 21 f1 cf f2 10
    00000020: ff 35 ff 3f 14 11 17 1d 21 16 13 43 21 23 13 13
    00000030: 15 13 15 f2 f5 ff ff ff 4f 11 f1 18 ff cf 19 8f
    00000040: f1 34 ff 19 ff ff 12 ff ff ff 1d ff ff ff 1d ff
    00000050: ff ff 1d ff ff ff 2c ff ff ff 2c ff ff ff 2c ff
    00000060: ff ff 1d ff ff ff 3c ff ff ff 2b ff 4f f1 ff 36
    00000070: ff ef f1 bf f4 ff ff bf f2 ff ff df f1 ff ff cf
    00000080: f2 ff 1c ff 0f f1 ff ff cf f2 ff ff df f1 ff ff
    00000090: cf f2 ff ff cf f2 14 ff ff 7f f2 ff ff cf f2 ff
    000000a0: ff cf f2 ff ff cf f1 ff ff 14 8f f2 ff ff cf f2
    000000b0: ff 1d ff 1e ff ff ff 2c ff ff ff 1d ff ff ff 2c
    000000c0: ff 5f f1 1f f2 23 ff ff ff 2c ff ff ff 2c ff ff
    000000d0: ff 1c 1f f2 ff ff 27 21 0f f2 ff ff 2a ff ff ff
    000000e0: 3b ff ff ff 2c ff ff ff 1c ff ff ff 1d ff ff ff
    000000f0: 4a ff ff ff 2a 21 ff ff ff 1c ff ff ff 2d ff ff
    00000100: ff 1c ff ff ff 1d ff ff ff 1d ff ff ff 1d ff ff
    00000110: ff 2c ff ff ff 1d ff ff ff 1d ff ff ff 2c ff 6f
    00000120: 11 f1 ff 14 0f 21 f1 1f 7f 51 af f1 ff f3 af 31
    00000130: 31 17 ff 3f 12 91 41 ff 23 ff 13 9b f1 19 12 f1
    00000140: 60 12 ff 4f ff 8f 71 12 13 ff f6 ff 18 ff 12 34
    00000150: 17 ff af 52 f2 ff ff 5f f9 ff ff 5f f9 ff ff 4f
    00000160: f2 ff ff cf f2 ff 25 23 12 26 ff 15 ff 5f c2 92
    00000170: f2 49 ff ff 23 1a bf f1 ff 16 ff 5f f2 ff ff cf
    00000180: f2 2e ff ff 2b df f2 ff cf f2 ff ff bf f3 ff ff
    00000190: bf f3 ff ff 19 1f 13 f1 ff 33
  UrbLink              = 00000000
[1755 ms] UsbSnoop - DispatchAny(f23a0610) : IRP_MJ_INTERNAL_DEVICE_CONTROL
[1755 ms] UsbSnoop - MyDispatchInternalIOCTL(f23a1e80) : fdo=825ad5b0, Irp=825b9b28, IRQL=2
[1755 ms]  >>>  URB 24 going down  >>> 
-- URB_FUNCTION_BULK_OR_INTERRUPT_TRANSFER:
  PipeHandle           = 825e6cdc [endpoint 0x00000082]
  TransferFlags        = 00000003 (USBD_TRANSFER_DIRECTION_IN, USBD_SHORT_TRANSFER_OK)
  TransferBufferLength = 0000041c
  TransferBuffer       = 825cc008
  TransferBufferMDL    = 00000000
  UrbLink              = 00000000
[1824 ms] UsbSnoop - MyInternalIOCTLCompletion(f23a1db0) : fido=00000000, Irp=825b9b28, Context=825e1b28, IRQL=2
[1824 ms]  <<<  URB 24 coming back  <<< 
-- URB_FUNCTION_BULK_OR_INTERRUPT_TRANSFER:
  PipeHandle           = 825e6cdc [endpoint 0x00000082]
  TransferFlags        = 00000003 (USBD_TRANSFER_DIRECTION_IN, USBD_SHORT_TRANSFER_OK)
  TransferBufferLength = 000001c6
  TransferBuffer       = 825cc008
  TransferBufferMDL    = 825aed88
    00000000: 01 01 17 01 00 20 bc 00 00 00 06 00 00 00 68 00
    00000010: 50 00 00 00 b0 01 f0 12 0f 61 63 f1 ff 34 4f f1
    00000020: 18 ff cf 42 d1 11 31 f1 24 17 ff 4f 31 ff 37 ff
    00000030: 1f 21 1b f3 ff ff 4f 11 14 12 19 13 22 31 13 11
    00000040: 15 47 11 21 11 11 31 53 51 31 13 41 17 11 17 ff
    00000050: 1c ff ff ff 1d ff ff ff 2c ff df f1 ef f1 ff 1d
    00000060: ff 1e ff df f1 ef f1 ff 1d ff 2d ff df f1 ef f1
    00000070: ff ff cf f2 ff 1d ff 2d ff df f1 cf f3 ff 4b ff
    00000080: 2c ff df f1 cf f3 ff 1d ff 2d ff df f1 ff ff cf
    00000090: f2 ef f1 ff 2c ff 1e ff cf f2 ef f1 ff 2c ff 1e
    000000a0: ff cf f2 ef f1 14 ff 36 ff 2d ff cf f2 df f2 ff
    000000b0: 1d ff 1e ff cf f2 ef f1 ff 3b ff 12 1b 1b ff 0f
    000000c0: f2 df f2 ff 1d ff 2d ff bf f3 ef f1 ff 4b ff 1d
    000000d0: ff cf f3 cf f2 ff 2c 11 ff 15 25 ff cf f2 df f2
    000000e0: ff 1d ff 2d ff cf f2 df f1 2e bf f2 ef 82 f1 24
    000000f0: cf f2 df f2 ff 1d ff 2d ff cf f2 df f2 ff 2c ff
    00000100: 2d ff cf f1 ef f1 ff 3c ff 2d 28 ff 1f 11 f1 ff
    00000110: 19 ff 2f f1 ef f1 ff ff ff ff bf f3 ff ff bf f3
    00000120: df f1 ff 1d ff 1e ff cf f3 df f1 ff 2c ff 1e ff
    00000130: df f2 df f1 ff 3c ff 1d ff ff ff 1e ff bf f1 ff
    00000140: ff df 42 16 15 31 f1 26 ff df 21 ff 12 63 f1 ff
    00000150: 1c 23 11 11 f2 0f f3 13 19 11 31 21 31 f1 21 15
    00000160: 1e 12 71 71 f2 ff 59 f2 df 32 21 18 51 ff fd af
    00000170: f1 5f 11 53 13 16 f7 af f1 33 ff 16 ff df f9 6f
    00000180: f1 ff 8e ff 16 ff 2e ff cf f2 ef f1 ff 2c 15 11
    00000190: 21 12 ef f3 ff 2b 3f 92 c2 f2 ff 2c 3f a2 c1 f3
    000001a0: ff 1b ff 3e ff bf f2 df f2 cf 72 41 f2 ef f2 cf
    000001b0: d2 f1 ef f3 ff 3a ff 1e ff cf f2 df f2 ff 2c 6f
    000001c0: f1 36 ff af 52 3a
  UrbLink              = 00000000
[1824 ms] UsbSnoop - DispatchAny(f23a0610) : IRP_MJ_INTERNAL_DEVICE_CONTROL
[1824 ms] UsbSnoop - MyDispatchInternalIOCTL(f23a1e80) : fdo=825ad5b0, Irp=825b9b28, IRQL=2
[1824 ms]  >>>  URB 25 going down  >>> 
-- URB_FUNCTION_BULK_OR_INTERRUPT_TRANSFER:
  PipeHandle           = 825e6cdc [endpoint 0x00000082]
  TransferFlags        = 00000003 (USBD_TRANSFER_DIRECTION_IN, USBD_SHORT_TRANSFER_OK)
  TransferBufferLength = 0000041c
  TransferBuffer       = 825cc008
  TransferBufferMDL    = 00000000
  UrbLink              = 00000000
[1910 ms] UsbSnoop - MyInternalIOCTLCompletion(f23a1db0) : fido=00000000, Irp=825b9b28, Context=825dd1e8, IRQL=2
[1910 ms]  <<<  URB 25 coming back  <<< 
-- URB_FUNCTION_BULK_OR_INTERRUPT_TRANSFER:
  PipeHandle           = 825e6cdc [endpoint 0x00000082]
  TransferFlags        = 00000003 (USBD_TRANSFER_DIRECTION_IN, USBD_SHORT_TRANSFER_OK)
  TransferBufferLength = 000001c6
  TransferBuffer       = 825cc008
  TransferBufferMDL    = 825aed88
    00000000: 01 01 17 01 00 20 c9 00 00 00 06 00 00 00 68 00
    00000010: 50 00 00 00 b0 01 f0 12 49 12 ff 6f f3 12 0f 91
    00000020: 11 f1 ff 2b 2f f1 3a ff bf f2 61 b1 11 11 11 11
    00000030: 31 f1 bf 13 2a 1f ff ff 5f 26 72 41 31 11 11 42
    00000040: 33 d9 61 f1 16 22 13 71 31 11 11 62 f1 2e ff bf
    00000050: f1 ff 20 ff bf f1 ef f3 ff 3a ff 3d ff bf f2 df
    00000060: f2 ff 2c ff 2d ff cf f2 df f2 ff 2c ff 2d ff cf
    00000070: f1 ef f3 ff 2b ff 2d ff cf f2 cf f4 ff 3a ff 4c
    00000080: ff af 63 f1 6f f3 ff 2b ff 2d ff cf f2 19 3f f1
    00000090: ff 2d ff 2d ff cf f2 df f2 ff 2c ff 2d ff cf f2
    000000a0: df f2 ff 2c af f1 41 ff af f3 df f1 ff 3c ff 3d
    000000b0: ff bf f1 ef f2 ff 2b ff 0f f2 ff 2a ff 3e 8f f1
    000000c0: 1f f3 df f2 ff 3b ff 3d ff af f3 cf f3 ff 4a ff
    000000d0: 2d ff af f4 df f2 ff 3b ff 2d ff cf f1 ef f3 ff
    000000e0: 3a ff 2d ff cf f1 df f2 cf d2 f3 df f2 16 4f d2
    000000f0: f3 df f2 ff 3b ff 3c ff af f3 ef f2 ff 4a ff 1d
    00000100: ff cf f2 ef f2 ff 3b ff 1d 7f f2 3f f2 ef f2 17
    00000110: ff 23 ff 1e ff df f1 ff 10 ff cf f1 df f2 ff 1d
    00000120: ff 1e ff cf f2 df f2 ff 3b ff 2d ff df f1 ef f1
    00000130: ff 2c ff 1e ff bf f3 ef f1 ff 2c ff 2e ff bf f2
    00000140: ef f1 10 ff 2b 2f 54 62 91 f1 ff 1c 1f 9f 24 11
    00000150: ff 9f f3 f0 19 ff 23 21 25 11 e1 f2 13 c6 21 32
    00000160: f1 ff 14 32 13 11 31 f2 12 1f 62 18 2f f1 df cf
    00000170: f1 7f 72 11 35 5f bf f2 2f f2 37 0f f1 1d af f9
    00000180: 27 ff 2e bf f8 27 ff 0f f1 ff 3b ff 1e ff bf f3
    00000190: 27 12 1f f2 ff 3b ff 21 39 ff bf f3 1f 92 f3 ff
    000001a0: 3b ff 1e ff bf f3 cf f3 ff 4a ff 1c 11 ff 9f f5
    000001b0: cf f3 ff 4a ff 1c 11 ff bf f3 cf f3 ff 2b ff 3d
    000001c0: ff bf f3 22 ff 1c
  UrbLink              = 00000000
[1910 ms] UsbSnoop - DispatchAny(f23a0610) : IRP_MJ_INTERNAL_DEVICE_CONTROL
[1910 ms] UsbSnoop - MyDispatchInternalIOCTL(f23a1e80) : fdo=825ad5b0, Irp=825b9b28, IRQL=2
[1910 ms]  >>>  URB 26 going down  >>> 
-- URB_FUNCTION_BULK_OR_INTERRUPT_TRANSFER:
  PipeHandle           = 825e6cdc [endpoint 0x00000082]
  TransferFlags        = 00000003 (USBD_TRANSFER_DIRECTION_IN, USBD_SHORT_TRANSFER_OK)
  TransferBufferLength = 0000041c
  TransferBuffer       = 825cc008
  TransferBufferMDL    = 00000000
  UrbLink              = 00000000
[2018 ms] UsbSnoop - MyInternalIOCTLCompletion(f23a1db0) : fido=00000000, Irp=825b9b28, Context=82612188, IRQL=2
[2018 ms]  <<<  URB 26 coming back  <<< 
-- URB_FUNCTION_BULK_OR_INTERRUPT_TRANSFER:
  PipeHandle           = 825e6cdc [endpoint 0x00000082]
  TransferFlags        = 00000003 (USBD_TRANSFER_DIRECTION_IN, USBD_SHORT_TRANSFER_OK)
  TransferBufferLength = 000001d2
  TransferBuffer       = 825cc008
  TransferBufferMDL    = 825aed88
    00000000: 01 01 17 01 00 20 d6 00 00 00 06 00 00 00 68 00
    00000010: 50 00 00 00 bc 01 f0 30 ff 15 2f f4 ef f3 ff 39
    00000020: ff 10 3d ff af f2 4e 24 26 91 f1 1c d3 f1 0f ff
    00000030: ff 13 33 11 13 2c 37 14 71 51 25 14 11 11 25 12
    00000040: 14 11 32 11 33 13 81 31 12 31 21 11 13 52 f2 21
    00000050: ff ff ff 1d ff af f2 ff 20 ff af f2 ff 11 ff bf
    00000060: f1 ff 20 ff af f2 ff 10 ff cf f1 df 11 f1 ff 2b
    00000070: ff 0f f2 ff 1b ff 0f f3 ff 29 ff 0f f2 ff 1b ff
    00000080: 0f 22 f1 ff 36 ff 0f f2 ff 48 5f f1 29 ff af f2
    00000090: ff ff cf f2 ff 10 28 ff 1f f2 ff 10 ff cf f1 ff
    000000a0: ff cf f2 ff 10 ff bf f2 ff 10 ff bf f2 ef f3 12
    000000b0: ff 36 ff 3e ff af f2 ef f2 ff 2b ff 0f f1 ff 2b
    000000c0: ff ff ff 3b ff 0f d1 f1 18 3f f2 ff 10 ff bf f1
    000000d0: ff 21 ff 9f f3 ff 10 ff af f3 ff 10 ff af f3 ef
    000000e0: f3 ff 2a ff 0f f1 ff 3a ff 2e ff af f3 ef f2 ff
    000000f0: 1b 4f f1 2a ff 9f f2 ff 12 ff 24 3f f3 ff 20 ff
    00000100: af f3 ef f2 ff 2a ff 0f f2 ff 2a ff 1e 21 ff af
    00000110: f1 ff 20 ff af f2 ff 20 11 ff 22 5f f1 ff 20 ff
    00000120: 24 4f f2 ff 20 ff bf f1 ef f3 ff 3a ff 1e ff bf
    00000130: f2 ff 20 ff bf f1 ef 11 f1 ff 2a ff ff ff 2c ff
    00000140: ff ff 2c ff ff ff 2c ff 0f f2 ff 1a ff 1f f1 ff
    00000150: 2b ff 0f f1 12 ff 28 ff 41 ff ff ff 68 41 74 53
    00000160: 11 22 ff 26 ff c0 f2 ef 2e ff 13 2b 41 f1 ff 10
    00000170: 21 13 14 13 12 22 31 f2 36 5f 14 11 ff ff f1 ff
    00000180: bf 21 11 df ff ff 10 39 ef f2 ff 98 19 ff ff bf
    00000190: 16 81 f2 ff ff cf f2 ff 11 ff af f3 6f 22 31 f2
    000001a0: ff 3a ff 1c 31 19 ff 3e ff 3e 1a ff 3d ff 0f f1
    000001b0: ff 2a ff 1f f1 ff 3a 2a ff 12 ff bf 93 f3 ff ff
    000001c0: 3e ff 2e ff af f3 ef 22 f1 ff 37 ff 1e 13 ff 7f
    000001d0: f3 1f
  UrbLink              = 00000000
[2018 ms] UsbSnoop - DispatchAny(f23a0610) : IRP_MJ_INTERNAL_DEVICE_CONTROL
[2018 ms] UsbSnoop - MyDispatchInternalIOCTL(f23a1e80) : fdo=825ad5b0, Irp=825b9b28, IRQL=2
[2018 ms]  >>>  URB 27 going down  >>> 
-- URB_FUNCTION_BULK_OR_INTERRUPT_TRANSFER:
  PipeHandle           = 825e6cdc [endpoint 0x00000082]
  TransferFlags        = 00000003 (USBD_TRANSFER_DIRECTION_IN, USBD_SHORT_TRANSFER_OK)
  TransferBufferLength = 0000041c
  TransferBuffer       = 825cc008
  TransferBufferMDL    = 00000000
  UrbLink              = 00000000
[2095 ms] UsbSnoop - MyInternalIOCTLCompletion(f23a1db0) : fido=00000000, Irp=825b9b28, Context=825e5468, IRQL=2
[2095 ms]  <<<  URB 27 coming back  <<< 
-- URB_FUNCTION_BULK_OR_INTERRUPT_TRANSFER:
  PipeHandle           = 825e6cdc [endpoint 0x00000082]
  TransferFlags        = 00000003 (USBD_TRANSFER_DIRECTION_IN, USBD_SHORT_TRANSFER_OK)
  TransferBufferLength = 000001b6
  TransferBuffer       = 825cc008
  TransferBufferMDL    = 825aed88
    00000000: 01 01 17 01 00 20 e4 00 00 00 07 00 00 00 68 00
    00000010: 50 00 00 00 a0 01 30 f1 ff 39 ff 1f f1 ff 39 ff
    00000020: 1f f1 16 26 9f f2 ff 10 21 f2 cf 11 27 23 51 12
    00000030: 11 62 23 15 13 11 12 11 31 f1 1e 19 21 62 11 13
    00000040: 15 42 14 23 22 12 fb ff ff bf f2 ff ff ff ff ef
    00000050: f1 ff 12 ff ff ff 1d ff af f1 ff 12 ff 9f f2 ff
    00000060: ff cf f2 ff ff df f1 ff ff df f1 ff ff cf f2 ff
    00000070: 11 ff af f2 ff 10 ff bf f2 ff 12 ff 9f f2 ff ff
    00000080: df f1 ff ff df f1 ff 11 ff af f2 ff ff cf f2 ff
    00000090: ff cf f2 ff ff cf f2 ff 20 ff af f2 ff 11 ff af
    000000a0: f2 ff 21 ff 9f f2 ff 21 ff af f1 ff ff cf f2 ff
    000000b0: 10 ff bf f2 ff df f1 18 24 ff 1f f1 ff 2a ff ff
    000000c0: ff 3b ff ff ff 2c ff 0f f3 ff 29 ff 0f f2 ff 1b
    000000d0: ff 0f f2 ff 2a ff 0f f2 ff 1a 4f f1 1b ff bf f1
    000000e0: ff 21 ff af b1 f2 4f f1 ff 12 27 2a ff ff ff 20
    000000f0: ff 0f f2 ff 1a ff 1f f1 ff 1b ff ff ff 1d ff 2f
    00000100: f1 ff ff df f1 ff 31 ff ff ff 5f f1 ff 11 ff bf
    00000110: f1 ff 21 ff af f1 ff 11 ff ff ff 1d ff bf f1 ff
    00000120: ff ff ff 0f f1 ff 1b ff 1f f1 ff 1b ff ff 12 ff
    00000130: ff ff 1c ff 1b ff ff ff 1d ff ff ff ff ef 63 53
    00000140: 11 f1 7f f2 df 11 12 ff 13 11 f3 10 ff 2f 61 ff
    00000150: 1f 32 24 15 ff 14 8f 22 21 ff ff 20 15 11 12 f1
    00000160: ff 1a f3 df ff ff ff 21 21 35 ff cf f5 ff ff 6f
    00000170: f8 df f1 ff 77 ff 1e ff af f1 ff 12 ff af f2 ff
    00000180: 11 23 ff 5f f2 ff 20 2c ff 3a ff 1f c1 a2 f1 3e
    00000190: ff 1f f1 ff 2a ff ff ff 2c 9f f2 15 ff 9f f3 29
    000001a0: 5f f1 ff 2a ff 1f f1 ff 2a ff 1f f1 ff 2a ff 1f
    000001b0: f1 ff 39 ff ff 1f
  UrbLink              = 00000000
[2095 ms] UsbSnoop - DispatchAny(f23a0610) : IRP_MJ_INTERNAL_DEVICE_CONTROL
[2095 ms] UsbSnoop - MyDispatchInternalIOCTL(f23a1e80) : fdo=825ad5b0, Irp=825b9b28, IRQL=2
[2095 ms]  >>>  URB 28 going down  >>> 
-- URB_FUNCTION_BULK_OR_INTERRUPT_TRANSFER:
  PipeHandle           = 825e6cdc [endpoint 0x00000082]
  TransferFlags        = 00000003 (USBD_TRANSFER_DIRECTION_IN, USBD_SHORT_TRANSFER_OK)
  TransferBufferLength = 0000041c
  TransferBuffer       = 825cc008
  TransferBufferMDL    = 00000000
  UrbLink              = 00000000
[2158 ms] UsbSnoop - MyInternalIOCTLCompletion(f23a1db0) : fido=00000000, Irp=825b9b28, Context=8268eda8, IRQL=2
[2158 ms]  <<<  URB 28 coming back  <<< 
-- URB_FUNCTION_BULK_OR_INTERRUPT_TRANSFER:
  PipeHandle           = 825e6cdc [endpoint 0x00000082]
  TransferFlags        = 00000003 (USBD_TRANSFER_DIRECTION_IN, USBD_SHORT_TRANSFER_OK)
  TransferBufferLength = 0000019e
  TransferBuffer       = 825cc008
  TransferBufferMDL    = 825aed88
    00000000: 01 01 17 01 00 20 f1 00 00 00 07 00 00 00 68 00
    00000010: 50 00 00 00 88 01 f0 12 cf f5 ff 1a 0f f1 4c ff
    00000020: af 53 12 11 11 1b 41 b2 23 c2 21 21 f1 11 1f ff
    00000030: 5a ff bf f3 af 11 31 91 21 71 41 f1 be 71 f1 1d
    00000040: 11 ef 61 54 f1 ff 1a ff ff ff 1d ff ff ff 2d ff
    00000050: ff ff 2c ff ff ff 3b ff ff ff 2c ff ff ff ff ff
    00000060: ff bf f2 ff ff bf f3 ff ff cf f2 ff 1c ff 3d ff
    00000070: ff ff 3b ff 18 ff ff 23 ff ff 8f f1 32 ff ff ff
    00000080: 3b ff ff ff 2b ff ff ff 2d ff ff ff 3b ff ff 15
    00000090: ff 35 ff ff ff 2c ff ff ff 1c ff ff ff 2c ff ff
    000000a0: ff 1d ff ff ff 2d 11 ff ff 8f f1 20 16 ff ff ff
    000000b0: 25 ff ff ff 3c ff ff ff 2b ff ff ff 2c ff ff ff
    000000c0: 2c ff ff ff 2c ff ff ff 2c ff ff ff 2c ff ff ff
    000000d0: 1d 8f f2 ff ff 22 22 4f f2 ff ff 22 ff ff ff 2c
    000000e0: ff ff ff 1d ff ff ff 1d ff bf f1 ff ff ff ff 0f
    000000f0: 31 f2 ff 16 ff 1f 41 f1 ff ff 8f f1 ff ff ff ff
    00000100: af f1 ff 20 ff ff ff 1d ff ff ff 1d ff ff ff 2c
    00000110: ff ff ff 2c ff ff ff 1c ff ff 13 ff 19 ff ff ff
    00000120: ff ff ff cf f1 ff 7c 71 51 15 11 2f f1 ff fb 8f
    00000130: 28 ff bf 25 11 ff ff 14 13 13 12 11 32 23 91 f1
    00000140: 14 33 f1 ff cf 21 ff 3e 12 53 f3 df ff 0f f1 af
    00000150: 41 12 12 f1 ff 34 2e ff ff bf 72 f9 ff ff 1c 68
    00000160: 11 ff ff bf f3 ff ff bf f3 ff 1d 23 12 ff 53 ff
    00000170: af e1 92 f2 41 ff bf e1 a2 f1 22 ff ff ff 2c ff
    00000180: ff ff 2c ff 27 ff ff 33 ff 26 ff ff 33 ff bf f1
    00000190: ef f2 ff ff cf f2 ff 1f f1 9f f4 ff 1b ff
  UrbLink              = 00000000
[2158 ms] UsbSnoop - DispatchAny(f23a0610) : IRP_MJ_INTERNAL_DEVICE_CONTROL
[2158 ms] UsbSnoop - MyDispatchInternalIOCTL(f23a1e80) : fdo=825ad5b0, Irp=825b9b28, IRQL=2
[2158 ms]  >>>  URB 29 going down  >>> 
-- URB_FUNCTION_BULK_OR_INTERRUPT_TRANSFER:
  PipeHandle           = 825e6cdc [endpoint 0x00000082]
  TransferFlags        = 00000003 (USBD_TRANSFER_DIRECTION_IN, USBD_SHORT_TRANSFER_OK)
  TransferBufferLength = 0000041c
  TransferBuffer       = 825cc008
  TransferBufferMDL    = 00000000
  UrbLink              = 00000000
[2245 ms] UsbSnoop - MyInternalIOCTLCompletion(f23a1db0) : fido=00000000, Irp=825b9b28, Context=826df808, IRQL=2
[2245 ms]  <<<  URB 29 coming back  <<< 
-- URB_FUNCTION_BULK_OR_INTERRUPT_TRANSFER:
  PipeHandle           = 825e6cdc [endpoint 0x00000082]
  TransferFlags        = 00000003 (USBD_TRANSFER_DIRECTION_IN, USBD_SHORT_TRANSFER_OK)
  TransferBufferLength = 000001ba
  TransferBuffer       = 825cc008
  TransferBufferMDL    = 825aed88
    00000000: 01 01 17 01 00 20 fe 00 00 00 07 00 00 00 68 00
    00000010: 50 00 00 00 a4 01 f0 12 6e ff 9f f2 1c 0f f3 ff
    00000020: 3b 1a 17 35 0f 73 f1 1b 13 13 1d fb 1d 21 15 ff
    00000030: 6f 43 12 f1 3f d4 a1 11 f1 1e 1e 61 72 f1 20 ff
    00000040: 48 16 18 21 43 ff ff ff 13 ff 1e ff ff ff 3c ff
    00000050: cf f2 df f3 ff 1b ff 3e ff bf f1 ef f2 ff 1c 9f
    00000060: f1 15 ff cf f1 df f3 ff 1c ff 2e ff cf f3 cf f2
    00000070: ff 1c ff 2e ff cf f1 ef f2 5f f1 45 ff 2c ff af
    00000080: 11 f2 df f2 ff 2b ff 2e ff bf c2 f1 1f f2 ff 1c
    00000090: ff 2e ff cf f1 ef f2 ff 1c ff 3e ff bf f1 df f3
    000000a0: ff 2b ff 1e ff df f1 df f3 ff 1c ff 3d ff cf f2
    000000b0: df f2 ff 1c ff 1a 32 3f f1 8f f2 cf f3 ff 2b ff
    000000c0: 3d ff af f3 ef f3 ff 2b ff 2d ff bf f2 ef f2 ff
    000000d0: 1c ff 2e ff cf f2 cf f3 ff 2b ff 1e ff df f1 df
    000000e0: f3 5f f2 34 ff 1d 1f f1 24 3f f3 df f2 ff 1d ff
    000000f0: 3e ff 9f f3 ef f1 ff 3b ff 1e ff cf f2 ef f1 ff
    00000100: 2c ff 1e 1f f2 af f1 ef f1 12 ff 29 ff 1e ff df
    00000110: f1 ef f1 ff 2c ff 2d ff df f1 ef f1 ff 3c ff 1d
    00000120: ff df f1 df f2 ff 1d ff 2d ff bf f3 ef f1 ff 1d
    00000130: ff 2d ff df f1 ef f1 ff 2c 1e cf f3 ff 2c 6b 51
    00000140: 11 31 11 2c ff cf 92 ef 12 31 ff df 91 ff ff 1f
    00000150: 62 38 22 18 17 14 11 21 21 41 11 f1 ff df ff 22
    00000160: 29 41 31 11 f5 df ff 22 ff 7f 41 12 32 f5 2f f2
    00000170: 2b ff ff 2e 4f f9 ff ef f2 85 ff ff 2e ff cf f1
    00000180: df f4 ff 2a 2f 22 f1 36 ff bf f2 2b 29 44 ff bf
    00000190: f2 2a 29 25 ff cf f2 df f2 ff ff cf f2 ff 24 26
    000001a0: ff 2d ff 4f 52 f3 cf f3 ff 1c ff 2e ff bf f2 df
    000001b0: f3 ff 1c ff 4d ff af c2 ff 1c
  UrbLink              = 00000000
[2245 ms] UsbSnoop - DispatchAny(f23a0610) : IRP_MJ_INTERNAL_DEVICE_CONTROL
[2245 ms] UsbSnoop - MyDispatchInternalIOCTL(f23a1e80) : fdo=825ad5b0, Irp=825b9b28, IRQL=2
[2245 ms]  >>>  URB 30 going down  >>> 
-- URB_FUNCTION_BULK_OR_INTERRUPT_TRANSFER:
  PipeHandle           = 825e6cdc [endpoint 0x00000082]
  TransferFlags        = 00000003 (USBD_TRANSFER_DIRECTION_IN, USBD_SHORT_TRANSFER_OK)
  TransferBufferLength = 0000041c
  TransferBuffer       = 825cc008
  TransferBufferMDL    = 00000000
  UrbLink              = 00000000
[2315 ms] UsbSnoop - MyInternalIOCTLCompletion(f23a1db0) : fido=00000000, Irp=825b9b28, Context=826c29e8, IRQL=2
[2315 ms]  <<<  URB 30 coming back  <<< 
-- URB_FUNCTION_BULK_OR_INTERRUPT_TRANSFER:
  PipeHandle           = 825e6cdc [endpoint 0x00000082]
  TransferFlags        = 00000003 (USBD_TRANSFER_DIRECTION_IN, USBD_SHORT_TRANSFER_OK)
  TransferBufferLength = 000001d2
  TransferBuffer       = 825cc008
  TransferBufferMDL    = 825aed88
    00000000: 01 01 17 01 00 20 0b 01 00 00 07 00 00 00 68 00
    00000010: 50 00 00 00 bc 01 f0 12 42 11 8f f1 4c 9f 91 51
    00000020: 31 f3 ff 29 af 71 b1 92 e1 81 21 23 51 71 83 e1
    00000030: 1c 31 31 2f f1 7f f2 ef 11 11 d1 91 f1 0f f1 3b
    00000040: 41 72 31 31 11 51 f1 3c 2e 27 13 21 43 7f f1 ff
    00000050: 1c ff 0f f1 ff 1c ff 0f f1 ff 2c ff 2e ff bf f1
    00000060: ff 20 ff bf f1 ff 10 ff ff ff 1d ff cf f1 ff 10
    00000070: ff bf f3 ef f2 ff 39 ff 0f f1 ff 2b ff 1b 11 21
    00000080: ff 9f f4 ef f2 ff 3a ff 2e ff af f2 ff 20 ff af
    00000090: f2 ff 20 ff af f2 ff 10 ff cf f1 ff 20 ff bf f1
    000000a0: ff 20 ff af f2 df f4 ff 2a ff 0f f1 ff 2b ff 0f
    000000b0: f1 ff 2b ff 0f f1 ff 2b ff 3e ff bf f1 ef f3 ff
    000000c0: 3a ff 1e 17 8f f1 29 ff 2e ff bf f3 cf f4 ff 39
    000000d0: ff 4e ff 9f f2 ff 10 ff bf f2 df f3 ff 2b ff 3d
    000000e0: 1c ff 2d ff 2e ff bf f2 ef f2 6f f1 24 ff 2e ff
    000000f0: 3f 62 f3 df f2 1d 4f 62 f2 ef f2 ff 2b ff 0f d1
    00000100: f1 cf f2 ef f2 ff 3a ff 0f f1 ff 2b ff 0f f1 ff
    00000110: 2b ff 0f f1 2d bf f2 ff 10 ef f1 2b ff 0f f1 ff
    00000120: 2b ff 2e ff bf f2 ff 10 ff bf f2 ef f2 ff 1b ff
    00000130: 0f f2 ff 2b ff 2e ff bf f2 ff ff cf f2 ef f2 ff
    00000140: 2b ff 2e ff bf f2 df 11 f1 ff 2b ff 3d ff bf f2
    00000150: 69 13 17 21 ff cf f2 f7 0f 11 41 1d ef f2 f7 ff
    00000160: ff 31 13 11 21 22 41 91 71 11 41 21 14 ff ff 5f
    00000170: 4f f3 11 18 51 31 f2 ef 5f f2 ff 2b 16 15 37 6f
    00000180: f2 7f f3 12 ff 3d ff 91 ff ff 31 ff 82 ff ff 31
    00000190: ff bf f2 df f3 ff 2b af 31 22 91 f3 ff 3a ff 37
    000001a0: 61 32 ff 3f 11 f2 8f 32 33 f2 ff 26 ff 2e ff bf
    000001b0: f2 df f3 ff 2b 23 ff 29 ff af 23 f3 9f f2 ff 2b
    000001c0: ff 2e ff af f3 df f2 ff 3b ff 1b 31 ff bf f1 aa
    000001d0: ff 2e
  UrbLink              = 00000000
[2315 ms] UsbSnoop - DispatchAny(f23a0610) : IRP_MJ_INTERNAL_DEVICE_CONTROL
[2315 ms] UsbSnoop - MyDispatchInternalIOCTL(f23a1e80) : fdo=825ad5b0, Irp=825b9b28, IRQL=2
[2315 ms]  >>>  URB 31 going down  >>> 
-- URB_FUNCTION_BULK_OR_INTERRUPT_TRANSFER:
  PipeHandle           = 825e6cdc [endpoint 0x00000082]
  TransferFlags        = 00000003 (USBD_TRANSFER_DIRECTION_IN, USBD_SHORT_TRANSFER_OK)
  TransferBufferLength = 0000041c
  TransferBuffer       = 825cc008
  TransferBufferMDL    = 00000000
  UrbLink              = 00000000
[2369 ms] UsbSnoop - MyInternalIOCTLCompletion(f23a1db0) : fido=00000000, Irp=825b9b28, Context=825dd1e8, IRQL=2
[2369 ms]  <<<  URB 31 coming back  <<< 
-- URB_FUNCTION_BULK_OR_INTERRUPT_TRANSFER:
  PipeHandle           = 825e6cdc [endpoint 0x00000082]
  TransferFlags        = 00000003 (USBD_TRANSFER_DIRECTION_IN, USBD_SHORT_TRANSFER_OK)
  TransferBufferLength = 000001e2
  TransferBuffer       = 825cc008
  TransferBufferMDL    = 825aed88
    00000000: 01 01 17 01 00 20 19 01 00 00 07 00 00 00 68 00
    00000010: 50 00 00 00 cc 01 70 73 f1 10 0f d1 13 f1 7f 51
    00000020: 13 f1 ff 36 11 ff 3d ff 13 22 12 2d 14 13 51 22
    00000030: 11 12 1a 2b 26 11 11 33 21 61 f1 27 ff 4e 0f f1
    00000040: af f1 af 19 13 22 17 11 15 14 24 11 21 3d 15 11
    00000050: 51 63 11 41 25 ff ff 15 ff ff ff 2d ff 1f f2 ff
    00000060: 38 ff 1f f2 ff 1a ff 1f f1 ff 1b ff 1f f2 ff 29
    00000070: ff 1f f1 ff 2a ff ff ff 2b ff 1f f2 ff 39 ff 1f
    00000080: f2 ff 18 11 ff 1f f1 ff 2a 11 ff 2e ff 8f f3 ff
    00000090: 30 ff 8f f3 ff 20 3f f1 5f f2 ff 22 ff 9f f2 ff
    000000a0: 20 ff af f2 ff 11 ff af f2 ff 11 ff 9f f2 ff 21
    000000b0: ff 9f f3 ff 30 ff 8f f3 ff 20 ff bf f1 ff 20 ff
    000000c0: 9f f3 ff 20 ff af f1 ff 21 ff af f2 ff 20 5f f1
    000000d0: 18 29 ff 1f f3 ff 29 ff 0f f3 ff 29 ff 0f f3 ff
    000000e0: 29 ff 0f f2 ff 39 ff 0f f3 ff 28 ff 1f f2 1a df
    000000f0: f3 ff 20 ff af f2 ff 20 ff 9f f3 ff 10 ff 14 6f
    00000100: 42 f2 9f f2 bf d1 51 f2 9f f2 ff 29 ff 1f f3 ff
    00000110: 28 ff 1f f3 ff 29 ff 0f f3 ff 29 ff 1f f1 ff 1a
    00000120: ff 1f f1 cf c2 f2 ff 20 ff 1c 1c ff 1f f1 ff 1a
    00000130: ff ff ff 1e ff 2f f1 ff 1a ff 1f f1 ff 1b ff 1f
    00000140: f2 ff 1a ff 1f f2 ff 39 ff ff ff 1a 21 ff 0f f3
    00000150: ff 19 ff 1f f1 ff 1b ff ff ff 2d ff 0f f1 ff 1b
    00000160: ff 1a 15 19 11 ff 2d ff 67 f1 18 21 f2 2e 6f f1
    00000170: f0 ff 1f a3 21 34 61 41 11 14 11 12 f5 ff ff 7f
    00000180: 37 17 4f 13 2f f4 cf ff ff 23 6f 42 15 11 74 f1
    00000190: ff 27 ff 4f f1 ff 90 12 ff 1f f1 ff 81 12 ff 1e
    000001a0: 11 ff bf f1 ef f4 ff 29 ff 1a 53 ff 8f f2 9f 32
    000001b0: 35 93 f2 6f f3 ff 20 25 1a ff 17 ff 1f f1 ff 1b
    000001c0: ff 1f f2 ff 38 3f f2 ff ff 27 2f f3 1b 11 ff 7f
    000001d0: f3 ef f5 ff 37 ff 0f f2 ff 2a ff 0f f4 ff 17 11
    000001e0: ff 99
  UrbLink              = 00000000
[2369 ms] UsbSnoop - DispatchAny(f23a0610) : IRP_MJ_INTERNAL_DEVICE_CONTROL
[2369 ms] UsbSnoop - MyDispatchInternalIOCTL(f23a1e80) : fdo=825ad5b0, Irp=825b9b28, IRQL=2
[2369 ms]  >>>  URB 32 going down  >>> 
-- URB_FUNCTION_BULK_OR_INTERRUPT_TRANSFER:
  PipeHandle           = 825e6cdc [endpoint 0x00000082]
  TransferFlags        = 00000003 (USBD_TRANSFER_DIRECTION_IN, USBD_SHORT_TRANSFER_OK)
  TransferBufferLength = 0000041c
  TransferBuffer       = 825cc008
  TransferBufferMDL    = 00000000
  UrbLink              = 00000000
[2426 ms] UsbSnoop - MyInternalIOCTLCompletion(f23a1db0) : fido=00000000, Irp=825b9b28, Context=82612188, IRQL=2
[2426 ms]  <<<  URB 32 coming back  <<< 
-- URB_FUNCTION_BULK_OR_INTERRUPT_TRANSFER:
  PipeHandle           = 825e6cdc [endpoint 0x00000082]
  TransferFlags        = 00000003 (USBD_TRANSFER_DIRECTION_IN, USBD_SHORT_TRANSFER_OK)
  TransferBufferLength = 0000019e
  TransferBuffer       = 825cc008
  TransferBufferMDL    = 825aed88
    00000000: 01 01 17 01 00 20 26 01 00 00 07 00 00 00 68 00
    00000010: 50 00 00 00 88 01 f0 12 0f f1 60 ff 5f f1 10 ff
    00000020: 32 ff ff 8f f2 31 18 21 42 31 51 31 21 2f 61 32
    00000030: 21 32 11 13 6f f2 ff ff ef f1 ff 18 71 f1 10 11
    00000040: 53 27 11 24 26 71 24 81 32 15 17 ff ff ff ff ff
    00000050: 16 ff ff ff 3c ff ff ff 1d ff ff ff 1c ff ff ff
    00000060: ff ff ff cf f2 ff ff df f1 ff ff bf f3 ff ff cf
    00000070: f2 ff ff 19 1f f3 ff ff af 11 f2 ff ff cf f2 ff
    00000080: ff 13 7f f2 ff ff cf 11 f1 ff ff ff ff ff ff 1b
    00000090: ff ff ff 1d ff ff ff 1d ff ff ff 2d ff ff ff 2c
    000000a0: ff 9f f1 ff 22 ff ff ff ff ff ff 9f f4 ff ff 15
    000000b0: 5f f4 ff ff bf f2 ff ff cf f2 ff ff bf f3 ff ff
    000000c0: cf f1 ff ff cf f3 ff 17 ff 21 0f f3 ff ff cf f1
    000000d0: ff ff cf f2 ff ff cf f3 22 ff ff 7f f2 23 ff ff
    000000e0: 7f f2 ff ff ff ff ff ff 2b ff ff ff 1d ff ff ff
    000000f0: 1d ff ff ff 3c ff ff ff 2b ff ff ff 1d ff ff ff
    00000100: 1d ff ff ff 1d ff ff ff 1d ff ff ff ff ff ff cf
    00000110: f1 ff ff df f1 ff ff df f1 ff ff df f1 ff ff df
    00000120: f1 ff ff cf f2 ff 18 17 17 ff 13 ff 5f ff 10 11
    00000130: 33 c2 f1 4f f1 f0 ff ff 5f 12 12 16 31 f1 ff ff
    00000140: 7f cf a1 12 11 25 26 21 ff fd ff 16 ff 24 11 11
    00000150: 13 15 ff ff 22 ff ff ff 13 91 ff ff ff 13 82 ff
    00000160: ff ff 11 ff ff ff 2e ff 8f 31 22 f1 af f2 ff 18
    00000170: 2c 29 7f f3 ff 6f a2 f1 19 ff ff ff 4b ff ff ff
    00000180: 2b ff 21 ff ff 38 ff 30 ff ff 29 ff ff ff 1d ff
    00000190: ff 19 ff 22 ff ff 19 ff 22 11 ff 5f ff ff
  UrbLink              = 00000000
[2426 ms] UsbSnoop - DispatchAny(f23a0610) : IRP_MJ_INTERNAL_DEVICE_CONTROL
[2426 ms] UsbSnoop - MyDispatchInternalIOCTL(f23a1e80) : fdo=825ad5b0, Irp=825b9b28, IRQL=2
[2426 ms]  >>>  URB 33 going down  >>> 
-- URB_FUNCTION_BULK_OR_INTERRUPT_TRANSFER:
  PipeHandle           = 825e6cdc [endpoint 0x00000082]
  TransferFlags        = 00000003 (USBD_TRANSFER_DIRECTION_IN, USBD_SHORT_TRANSFER_OK)
  TransferBufferLength = 0000041c
  TransferBuffer       = 825cc008
  TransferBufferMDL    = 00000000
  UrbLink              = 00000000
[2490 ms] UsbSnoop - MyInternalIOCTLCompletion(f23a1db0) : fido=00000000, Irp=825b9b28, Context=825e5468, IRQL=2
[2490 ms]  <<<  URB 33 coming back  <<< 
-- URB_FUNCTION_BULK_OR_INTERRUPT_TRANSFER:
  PipeHandle           = 825e6cdc [endpoint 0x00000082]
  TransferFlags        = 00000003 (USBD_TRANSFER_DIRECTION_IN, USBD_SHORT_TRANSFER_OK)
  TransferBufferLength = 000001be
  TransferBuffer       = 825cc008
  TransferBufferMDL    = 825aed88
    00000000: 01 01 17 01 00 20 35 01 00 00 07 00 00 00 68 00
    00000010: 50 00 00 00 a8 01 f0 5f f3 ff 2b ff 2e ff bf f2
    00000020: ef c2 51 51 23 12 51 11 e2 f2 12 13 f1 23 13 11
    00000030: ff 5f 23 a2 11 51 f1 16 ff df c1 26 11 11 91 31
    00000040: 11 31 12 46 61 d1 13 41 11 27 26 16 ff 17 ff df
    00000050: f1 ff ff df f1 ff 10 ff bf f2 ff 10 ff cf f1 ef
    00000060: f2 ff 2b ff ff ff 1d ff 0f f1 ff 1c ff 0f 31 f1
    00000070: ff 18 ff 2e ff bf f2 ff 10 ff cf f1 1c 1d 31 ff
    00000080: bf f2 df f3 ff 2b ff 2e ff bf f3 df f3 ff 1b ff
    00000090: 0f f1 ff 1c ff 2e ff bf f2 ef f1 ff 2c ff ff ff
    000000a0: 2c ff 2d ff cf f2 df f2 ff 3c ff 2d ff bf f2 ff
    000000b0: 10 ff bf f2 ff 10 ff bf f2 ef f1 ff 2c ff 17 35
    000000c0: 0f f1 af f2 df f3 ff 2b ff 2e ff bf f2 df f3 ff
    000000d0: 2b ff 2e ff bf f2 cf f3 ff 2c ff 2b 21 ff bf f2
    000000e0: ef f2 ff 2b ff 2e ff bf f2 18 11 3f f2 2f f2 37
    000000f0: ff 1d 1d 4f f2 27 ff 3d ff bf f2 df 11 f1 ff 3b
    00000100: ff 3c ff bf f3 df f1 ff 2c ff 1e ff cf f2 ef d1
    00000110: f2 cf f3 df e1 f1 cf f2 ef f1 ff 2c ff 1e ff cf
    00000120: f2 ff ff cf f3 ff ff bf f2 ef f2 ff 2b ff 2d ff
    00000130: cf f2 df f3 ff 2b ff 1e ff cf f2 df f1 ff 2d ff
    00000140: ff ff 2c ff 1e ff cf 92 f1 10 3f f1 ff 2c f6 0f
    00000150: 11 25 13 ff 8f 62 ff ff 7f 11 11 12 27 19 f5 ff
    00000160: ff 1a fb 1c 11 75 91 61 f2 df ff ff bf 81 41 f2
    00000170: 8f f1 ff 1c ff 0f f1 91 ff ff ff 26 51 ff 22 ff
    00000180: 2d ff cf f2 cf f3 ff 8f 31 f2 2d ff cf f2 27 19
    00000190: 48 ff af f3 27 1a 19 ff cf f2 df f2 ff 2c ff 3d
    000001a0: ff 0f 72 11 f2 ef f1 ff 30 29 ff 2d ff df f1 ff
    000001b0: ff cf f2 ff ff bf 93 f1 10 1f f3 ff 2c 88
  UrbLink              = 00000000
[2490 ms] UsbSnoop - DispatchAny(f23a0610) : IRP_MJ_INTERNAL_DEVICE_CONTROL
[2490 ms] UsbSnoop - MyDispatchInternalIOCTL(f23a1e80) : fdo=825ad5b0, Irp=825b9b28, IRQL=2
[2490 ms]  >>>  URB 34 going down  >>> 
-- URB_FUNCTION_BULK_OR_INTERRUPT_TRANSFER:
  PipeHandle           = 825e6cdc [endpoint 0x00000082]
  TransferFlags        = 00000003 (USBD_TRANSFER_DIRECTION_IN, USBD_SHORT_TRANSFER_OK)
  TransferBufferLength = 0000041c
  TransferBuffer       = 825cc008
  TransferBufferMDL    = 00000000
  UrbLink              = 00000000
[2581 ms] UsbSnoop - MyInternalIOCTLCompletion(f23a1db0) : fido=00000000, Irp=825b9b28, Context=8268eda8, IRQL=2
[2581 ms]  <<<  URB 34 coming back  <<< 
-- URB_FUNCTION_BULK_OR_INTERRUPT_TRANSFER:
  PipeHandle           = 825e6cdc [endpoint 0x00000082]
  TransferFlags        = 00000003 (USBD_TRANSFER_DIRECTION_IN, USBD_SHORT_TRANSFER_OK)
  TransferBufferLength = 000001ae
  TransferBuffer       = 825cc008
  TransferBufferMDL    = 825aed88
    00000000: 01 01 17 01 00 20 43 01 00 00 07 00 00 00 68 00
    00000010: 50 00 00 00 98 01 f0 18 ff bf f2 ff 10 ff bf f2
    00000020: ef f2 af 51 81 f3 ff 10 11 13 12 22 f1 4f 41 f2
    00000030: 1e 0f f1 ff 2b ff 0f 22 f1 1f c1 61 54 31 13 11
    00000040: 27 ff ff 5f f1 ff ff df f2 ff 10 ff bf f3 ef f1
    00000050: ff 1c ff 0f f1 ff 2b ff ff ff 2c ff ff ff 2c ff
    00000060: 0f f1 ff 2b ff 0f f1 ff 3a ff 1d 11 ff bf f2 df
    00000070: 11 f1 ff 2b ff 1d 11 ff af f3 ef f2 ff 2b ff 1e
    00000080: 14 ff 7f f2 ff 10 ff bf f1 ff 11 ff cf f1 ff ff
    00000090: cf f2 ef f1 ff 2c ff 2e ff af f3 ef f2 ff 3b ff
    000000a0: 1e ff af f4 df f2 ff 2b ff 0f f1 ff 2b ff 2e ff
    000000b0: bf f2 ef 52 f1 18 bf f2 ef f2 ff 2b ff 3d ff af
    000000c0: f3 ef f2 ff 3a ff 2e ff af f3 ff ff cf f2 ef a2
    000000d0: f1 ff 20 ff 2e ff bf f2 ff 10 ff af f4 cf f3 ff
    000000e0: 21 37 ff 3d bf f1 24 37 ff 2e ff bf f2 df f1 ff
    000000f0: 2d ff 2e ff af f3 df f3 ff 2b ff 2e ff af f3 df
    00000100: 11 f1 2b cf f3 ef f2 1c df f2 ff ff cf f2 ef f2
    00000110: ff 2b ff ff ff 2c ff ff ff 2c ff 0f f1 ff 2b ff
    00000120: 2e ff af f3 ef f2 ff 3a ff 1e ff bf f3 ff ff bf
    00000130: f3 ff 10 ff af f3 ef f2 ff 3a ff ff ff 3b 5f 16
    00000140: 11 14 81 23 f1 ff 27 6f ff ff 28 93 f2 f7 15 ff
    00000150: cf f1 1a f1 34 31 f1 ff ff f0 ff ff 15 25 23 12
    00000160: ff ff 28 2f f1 ff ff 92 ff ff ff 86 3f f1 ff 10
    00000170: ff cf f2 df f2 ff 1d cf 22 c1 f1 ff 1c ff 27 16
    00000180: 22 ff 8f f2 6f 92 f2 ff 18 ff 2e ff bf f2 ff 20
    00000190: ff bf 12 f2 bf f1 ff 1c 31 ff 1a ff df f1 ff 11
    000001a0: ff bf f1 ff 10 ff bf f3 ef f2 ff 2b 7f f1
  UrbLink              = 00000000
[2581 ms] UsbSnoop - DispatchAny(f23a0610) : IRP_MJ_INTERNAL_DEVICE_CONTROL
[2581 ms] UsbSnoop - MyDispatchInternalIOCTL(f23a1e80) : fdo=825ad5b0, Irp=825b9b28, IRQL=2
[2581 ms]  >>>  URB 35 going down  >>> 
-- URB_FUNCTION_BULK_OR_INTERRUPT_TRANSFER:
  PipeHandle           = 825e6cdc [endpoint 0x00000082]
  TransferFlags        = 00000003 (USBD_TRANSFER_DIRECTION_IN, USBD_SHORT_TRANSFER_OK)
  TransferBufferLength = 0000041c
  TransferBuffer       = 825cc008
  TransferBufferMDL    = 00000000
  UrbLink              = 00000000
[2619 ms] UsbSnoop - MyInternalIOCTLCompletion(f23a1db0) : fido=00000000, Irp=825b9b28, Context=826df808, IRQL=2
[2619 ms]  <<<  URB 35 coming back  <<< 
-- URB_FUNCTION_BULK_OR_INTERRUPT_TRANSFER:
  PipeHandle           = 825e6cdc [endpoint 0x00000082]
  TransferFlags        = 00000003 (USBD_TRANSFER_DIRECTION_IN, USBD_SHORT_TRANSFER_OK)
  TransferBufferLength = 000001ca
  TransferBuffer       = 825cc008
  TransferBufferMDL    = 825aed88
    00000000: 01 01 17 01 00 20 51 01 00 00 06 00 00 00 68 00
    00000010: 50 00 00 00 b4 01 90 f1 ff 2b ff 1f f1 ff 3a ff
    00000020: 2e ff af f2 ff 10 ff bf 72 41 21 31 32 53 11 92
    00000030: 82 11 21 ff 29 ff 1d 31 ff ff ff 3b 21 12 8f b1
    00000040: 12 33 27 12 13 ff 18 ff cf f1 ff ff cf f2 ff 10
    00000050: ff bf f2 ff 11 ff bf f1 ff 20 ff af f2 ff ff cf
    00000060: f2 ff 11 ff af f2 ff 10 ff bf f2 ff 10 ff cf f1
    00000070: ef f3 ff 2a ff 0f f2 ff 39 ff 0f f2 ff 39 ff 0f
    00000080: f2 ff 2a ff 2e ff cf f1 ef f2 ff 2b ff 0f f1 ff
    00000090: 1c ff 0f f2 ff 2a ff 0f f2 ff 39 ff 2e ff bf f2
    000000a0: ff 10 ff bf f2 ef f2 ff 2b ff 2e ff bf f2 ff 10
    000000b0: ff bf f2 ff 20 3f f1 18 2c ff 0f f2 ff 2a ff 3e
    000000c0: ff af f2 ef f3 ff 2a ff 3e ff 9f f3 ff 10 ff bf
    000000d0: f2 ff 10 ff bf f2 ff 20 ff af f2 ff 20 ff af f2
    000000e0: ff 10 ff bf 22 f2 bf f1 af f1 20 22 ff 2a ff bf
    000000f0: f2 ff 10 ff bf f2 ef f2 ff 2b ff 0f f2 ff 2a ff
    00000100: 2e ff bf f2 ff 10 ff 2a 2e ff 0f f1 bf e1 f2 ff
    00000110: 10 ff bf f2 ff 20 ff bf f1 ff ff cf f2 ff 10 ff
    00000120: bf f2 ff 10 ff bf f2 ff 10 ff bf f2 ff 10 ff af
    00000130: f3 ff 10 ff bf f2 ff 10 ff bf f2 ff 10 ff af f3
    00000140: ff 10 ff bf f2 ff 10 ff bf f2 4f 92 f1 ff 2b ff
    00000150: 64 34 12 13 11 15 18 ff 21 ff f6 ff 1c 43 23 32
    00000160: 22 12 11 13 11 31 42 11 19 ff ff ff 96 f1 30 11
    00000170: 12 14 f1 d0 ff 97 f1 ff 34 15 23 ff 1a ff 9d 24
    00000180: ff 0f f1 ef 12 f5 ff 17 ff af f1 ff 11 ff cf f1
    00000190: bf 12 f2 ff 2b ff 0f 31 93 f1 af f2 ff 10 24 1a
    000001a0: ff 29 ff 0f f2 ff 2a ff 0f f1 ff 2b 0f f2 1d ff
    000001b0: af e3 f3 1d ff af f2 ff 11 ff bf f2 ff 20 ff bf
    000001c0: f1 ff 10 ff af f3 6f ff 11 ff
  UrbLink              = 00000000
[2619 ms] UsbSnoop - DispatchAny(f23a0610) : IRP_MJ_INTERNAL_DEVICE_CONTROL
[2619 ms] UsbSnoop - MyDispatchInternalIOCTL(f23a1e80) : fdo=825ad5b0, Irp=825b9b28, IRQL=2
[2619 ms]  >>>  URB 36 going down  >>> 
-- URB_FUNCTION_BULK_OR_INTERRUPT_TRANSFER:
  PipeHandle           = 825e6cdc [endpoint 0x00000082]
  TransferFlags        = 00000003 (USBD_TRANSFER_DIRECTION_IN, USBD_SHORT_TRANSFER_OK)
  TransferBufferLength = 0000041c
  TransferBuffer       = 825cc008
  TransferBufferMDL    = 00000000
  UrbLink              = 00000000
[2654 ms] UsbSnoop - MyInternalIOCTLCompletion(f23a1db0) : fido=00000000, Irp=825b9b28, Context=8263e948, IRQL=2
[2654 ms]  <<<  URB 36 coming back  <<< 
-- URB_FUNCTION_BULK_OR_INTERRUPT_TRANSFER:
  PipeHandle           = 825e6cdc [endpoint 0x00000082]
  TransferFlags        = 00000003 (USBD_TRANSFER_DIRECTION_IN, USBD_SHORT_TRANSFER_OK)
  TransferBufferLength = 00000196
  TransferBuffer       = 825cc008
  TransferBufferMDL    = 825aed88
    00000000: 01 01 17 01 00 20 5f 01 00 00 05 00 00 00 68 00
    00000010: 50 00 00 00 80 01 f0 ff 36 ff ff ff 2c ff ff ff
    00000020: 2c ff ff ff 2c ff ff ff 3b 16 11 26 15 21 71 72
    00000030: 11 11 1c 17 11 11 f1 3b ff 7f 11 35 f1 9f f2 ff
    00000040: 17 11 11 4f b1 11 11 21 21 26 25 16 ff 19 15 15
    00000050: 21 ff 23 ff ff ff 2c ff ff ff 2c ff ff ff 1d ff
    00000060: ff ff 2c ff ff ff 2c ff ff ff 2c ff ff ff 2c ff
    00000070: ff ff 3b ff ff ff 2c ff ff ff 2c ff ff ff 2c ff
    00000080: ff ff 2c ff ff ff 2c ff ff ff 2c ff ff ff 2c ff
    00000090: ff ff 2c ff ff ff 2c ff ff ff 2c ff ff ff 2c ff
    000000a0: ff ff 2c ff ff ff 2c ff ff 4f f1 37 ff ff ff 2b
    000000b0: ff ff ff 2c ff 18 ff ff 23 ff ff ff 3b ff ff ff
    000000c0: 3b ff ff 9f f1 22 ff ff ff 2c ff ff ff 2c ff ff
    000000d0: ff 2c 1f f2 ff ff 47 1f f2 ff ff 38 ff ff ff 2c
    000000e0: ff ff ff 2c ff ff ff 2c ff ff ff 2c ff ff ff 4a
    000000f0: ff ff ff 3b ff ff ff 2c ff ff ff 2c ff ff ff 1d
    00000100: ff ff ff 1d ff ff ff 2c ff ff ff 2c ff ff ff 2c
    00000110: ff ff ff 3b ff ff ff 2c ff ff ff 2c ff ff ff 2c
    00000120: ff ff ff 2c ff 3f f2 ff 27 ff 3f 12 f1 ff 25 ff
    00000130: 5f 16 25 16 12 14 75 a1 f2 6f d1 ff 5f 22 13 c3
    00000140: f1 2f 11 91 f1 5f 51 f4 ef 1f 62 11 31 34 11 11
    00000150: 11 73 19 22 21 13 8f 21 31 ff 8f f9 ff ff 5f f9
    00000160: ff ff 5f f1 ff ff cf f2 ff 2a ff 1f f1 ff 4f f2
    00000170: 5f f3 ff 4f f2 7f f1 ff ff cf f2 ff ff cf f2 2e
    00000180: ff ff 3a df f3 ff bf f2 ff ff bf f3 ff ff df f1
    00000190: ff ff bf f3 ff 55
  UrbLink              = 00000000
[2654 ms] UsbSnoop - DispatchAny(f23a0610) : IRP_MJ_INTERNAL_DEVICE_CONTROL
[2654 ms] UsbSnoop - MyDispatchInternalIOCTL(f23a1e80) : fdo=825ad5b0, Irp=825b9b28, IRQL=2
[2654 ms]  >>>  URB 37 going down  >>> 
-- URB_FUNCTION_BULK_OR_INTERRUPT_TRANSFER:
  PipeHandle           = 825e6cdc [endpoint 0x00000082]
  TransferFlags        = 00000003 (USBD_TRANSFER_DIRECTION_IN, USBD_SHORT_TRANSFER_OK)
  TransferBufferLength = 0000041c
  TransferBuffer       = 825cc008
  TransferBufferMDL    = 00000000
  UrbLink              = 00000000
[2709 ms] UsbSnoop - MyInternalIOCTLCompletion(f23a1db0) : fido=00000000, Irp=825b9b28, Context=8275ecc8, IRQL=2
[2709 ms]  <<<  URB 37 coming back  <<< 
-- URB_FUNCTION_BULK_OR_INTERRUPT_TRANSFER:
  PipeHandle           = 825e6cdc [endpoint 0x00000082]
  TransferFlags        = 00000003 (USBD_TRANSFER_DIRECTION_IN, USBD_SHORT_TRANSFER_OK)
  TransferBufferLength = 000001c2
  TransferBuffer       = 825cc008
  TransferBufferMDL    = 825aed88
    00000000: 01 01 17 01 00 20 6d 01 00 00 05 00 00 00 68 00
    00000010: 50 00 00 00 ac 01 f0 7f f3 ff 1c ff 2e ff ff ff
    00000020: 2c ff ff ff 1c ff ff ff 2c cf 21 62 11 61 91 f2
    00000030: 10 0f 11 41 42 12 14 ff 2f 61 91 f1 3c ff cf 13
    00000040: f4 3f 21 11 31 61 14 37 15 ff e6 11 21 12 0f f4
    00000050: ff 2a ff 3d ff cf f1 df f3 ff ff cf f2 ff 2b ff
    00000060: 3d ff bf f2 ef f2 ff 1c ff 2e ff cf f1 ef f1 ff
    00000070: 1d ff 3d ff cf f2 cf 13 51 f1 ff 11 22 ff 3c ff
    00000080: bf f3 cf f3 ff 1c ff 2e ff cf f1 ef f2 ff ff cf
    00000090: f1 ff ff df f1 ff 1d af f1 32 ff cf f1 df f3 ff
    000000a0: 2c ff 3c ff cf f1 ef f2 ff 1c ff 3d ff df f1 df
    000000b0: f2 ff 2c ff 14 28 1d ff 3c ff 3c ff cf f1 df f3
    000000c0: ff 2c ff 3c ff bf f3 cf f3 ff 2b ff 3d ff bf f2
    000000d0: af 31 f2 ff 3b ff 3c ff bf f2 ef f2 ff 2c ff 3c
    000000e0: ff 20 9f f3 cf a3 f1 24 9f f3 cf f3 ff 3b ff 3c
    000000f0: ff bf f3 cf f3 ff 2b ff 3d ff bf f2 df f3 ff 3b
    00000100: ff 3c 2a ff 3e ff 2d 1b ff 2e ff 3d ff bf f3 df
    00000110: f2 ff 3b ff 1d ff cf f3 df f2 ff 3a ff 3d ff bf
    00000120: f2 ef f2 ff 3b ff 3c ff af f4 df f2 ff 4a ff 3c
    00000130: ff bf f2 df f3 ff 2c ff 3c ff cf f2 cf f3 ff 2c
    00000140: 23 ff 18 ff df 32 f2 7f f2 ff 1b 11 26 31 d1 11
    00000150: 23 2a ff bf 11 61 ff 16 13 1f 74 f1 14 22 21 15
    00000160: 11 ff 16 11 2f f4 6f 71 1d 32 12 32 15 25 51 41
    00000170: b2 31 f1 15 11 41 f7 7f f1 90 ff 15 ff 1e 0f f8
    00000180: ff ff 25 ff ff ff 2c ff cf c1 f1 1f f2 ff 1d 4f
    00000190: 92 c1 f2 ff 1c 5f a2 b1 f2 ff ff cf f2 ff ff bf
    000001a0: f3 df f2 ff 2c ff 3c 1c 8f f1 25 11 ff af f1 ef
    000001b0: f2 ff 1c 8f f1 34 ff cf f1 18 4f f3 ff 1c 66 ef
    000001c0: f2 ff
  UrbLink              = 00000000
[2709 ms] UsbSnoop - DispatchAny(f23a0610) : IRP_MJ_INTERNAL_DEVICE_CONTROL
[2709 ms] UsbSnoop - MyDispatchInternalIOCTL(f23a1e80) : fdo=825ad5b0, Irp=825b9b28, IRQL=2
[2709 ms]  >>>  URB 38 going down  >>> 
-- URB_FUNCTION_BULK_OR_INTERRUPT_TRANSFER:
  PipeHandle           = 825e6cdc [endpoint 0x00000082]
  TransferFlags        = 00000003 (USBD_TRANSFER_DIRECTION_IN, USBD_SHORT_TRANSFER_OK)
  TransferBufferLength = 0000041c
  TransferBuffer       = 825cc008
  TransferBufferMDL    = 00000000
  UrbLink              = 00000000
[2835 ms] UsbSnoop - MyInternalIOCTLCompletion(f23a1db0) : fido=00000000, Irp=825b9b28, Context=825b07c8, IRQL=2
[2835 ms]  <<<  URB 38 coming back  <<< 
-- URB_FUNCTION_BULK_OR_INTERRUPT_TRANSFER:
  PipeHandle           = 825e6cdc [endpoint 0x00000082]
  TransferFlags        = 00000003 (USBD_TRANSFER_DIRECTION_IN, USBD_SHORT_TRANSFER_OK)
  TransferBufferLength = 000001ba
  TransferBuffer       = 825cc008
  TransferBufferMDL    = 825aed88
    00000000: 01 01 17 01 00 20 7b 01 00 00 05 00 00 00 68 00
    00000010: 50 00 00 00 a4 01 f0 38 ff bf f1 ff 20 ff ff ff
    00000020: 2c ff bf f1 ff 20 ff af f2 ff 20 8f 11 31 21 11
    00000030: 11 11 13 a3 13 23 14 42 a2 71 11 41 12 11 11 ff
    00000040: 3f f2 df f3 ff 3b 31 21 96 5f 11 b1 13 14 13 1c
    00000050: 7f f1 56 3f f4 ff 39 ff 2e ff bf f2 ef f2 ff 2a
    00000060: ff 0f f2 ff 3a ff 2e ff af f3 ef f2 ff 3a ff 2e
    00000070: ff bf f2 ef f2 ff 2b ff 3d ff af f3 ef f2 ff 2b
    00000080: ff 3d ff bf f2 ef f4 ff 19 ff 0f f2 ff 2b ff 2e
    00000090: ff bf f2 ef f2 ff 1c ff 1e ff cf f2 df f3 ff 3a
    000000a0: ff 3d ff af f3 ef f2 ff 2b ff 3d ff bf f2 df f3
    000000b0: ff 2b ff 2e ff bf f2 ef 32 f1 18 cf f3 df f3 ff
    000000c0: 2b ff 3d ff af f3 df f3 ff 3a ff 3d ff af f3 df
    000000d0: f3 ff 2b ff 3d ff bf f2 df f3 ff 3a ff 3d ff af
    000000e0: f3 df f3 ef 92 f3 df f3 19 4f 92 f3 df f3 ff 3a
    000000f0: ff 2e ff af f4 cf f3 ff 2b ff 3d ff bf f2 df f3
    00000100: ff 2b ff 3d 9f f2 3e ff 3d af f1 3e ff 3d ff af
    00000110: f3 df f3 ff 3a ff 1e ff bf f3 ef f2 ff 3a ff 2e
    00000120: ff af f3 ef f2 ff 2b ff 3d ff 7f 11 f4 df f3 ff
    00000130: 3a ff 3d ff bf f1 ef f3 ff 2b ff 3d ff bf f2 df
    00000140: f3 ff 3a 3f f2 38 ff af f3 23 11 6f f3 ff 3a 5f
    00000150: 5f 34 12 13 27 ff 48 4f ff ff df f1 1e 15 21 ff
    00000160: 24 6f f1 f7 29 23 21 17 11 11 41 92 11 13 41 11
    00000170: f7 10 11 f4 29 cf f9 25 ff 2e df f8 25 ff 2e ff
    00000180: cf f1 ef f2 ff 2b af 22 e1 f2 ff 2b ff 24 38 ff
    00000190: 9f f3 4f 82 f3 ff ff bf f1 ff 1c ff 0f f2 ff 4a
    000001a0: ff 2d ff af f4 df f2 ff 3a ff 3d ff af f3 ef f2
    000001b0: ff 3a ff 3d ff af f3 55 3a ff
  UrbLink              = 00000000
[2836 ms] UsbSnoop - DispatchAny(f23a0610) : IRP_MJ_INTERNAL_DEVICE_CONTROL
[2836 ms] UsbSnoop - MyDispatchInternalIOCTL(f23a1e80) : fdo=825ad5b0, Irp=825b9b28, IRQL=2
[2836 ms]  >>>  URB 39 going down  >>> 
-- URB_FUNCTION_BULK_OR_INTERRUPT_TRANSFER:
  PipeHandle           = 825e6cdc [endpoint 0x00000082]
  TransferFlags        = 00000003 (USBD_TRANSFER_DIRECTION_IN, USBD_SHORT_TRANSFER_OK)
  TransferBufferLength = 0000041c
  TransferBuffer       = 825cc008
  TransferBufferMDL    = 00000000
  UrbLink              = 00000000
[2871 ms] UsbSnoop - MyInternalIOCTLCompletion(f23a1db0) : fido=00000000, Irp=825b9b28, Context=825b0f68, IRQL=2
[2871 ms]  <<<  URB 39 coming back  <<< 
-- URB_FUNCTION_BULK_OR_INTERRUPT_TRANSFER:
  PipeHandle           = 825e6cdc [endpoint 0x00000082]
  TransferFlags        = 00000003 (USBD_TRANSFER_DIRECTION_IN, USBD_SHORT_TRANSFER_OK)
  TransferBufferLength = 000001d2
  TransferBuffer       = 825cc008
  TransferBufferMDL    = 825aed88
    00000000: 01 01 17 01 00 20 88 01 00 00 05 00 00 00 68 00
    00000010: 50 00 00 00 bc 01 b0 f2 ff 1b ff 0f f2 ff 2a ff
    00000020: ff ff 2c ff ff ff 2c ff ff 6f 31 f1 31 11 11 41
    00000030: 21 41 f1 f0 12 11 15 31 f1 ff ff 12 62 11 ff 6f
    00000040: 32 11 71 15 0f 11 15 21 11 19 16 22 12 11 f1 1f
    00000050: f1 4f 56 22 21 f1 ff 34 ff 2e ff af f2 ff 20 ff
    00000060: af f2 ff 11 ff af f2 ff 21 ff 9f f2 ff 11 ff bf
    00000070: f1 ff 11 ff bf f1 ff 10 ff bf f2 ff 20 ff 9f f4
    00000080: cf 11 f3 ff 39 ff 2e ff af f3 ef f2 ff 1b ff 0f
    00000090: f2 ff 2a ff 0f f2 ff 1b ff 0f f1 ff 2c ff 2e ff
    000000a0: bf f1 ff 20 ff af f2 ff 20 ff bf f2 ef f2 ff 2b
    000000b0: ff 0f f1 ff 2b ff 2e ff bf f2 ef f2 6f f1 33 ff
    000000c0: 3e 0f f1 18 3e ff 2e ff bf f2 ef f2 ff 3a ff 3e
    000000d0: ff af f2 ef f2 ff 3a ff 2e ff af f3 ef f2 16 ff
    000000e0: 33 ff 2e ff af f3 ef f2 ff 3a ff 3e ff 9f f4 df
    000000f0: f3 6f f1 33 ff 2d ff af f3 ef f2 ff 3a ff 2e ff
    00000100: af f3 ef f3 1e 9f f3 ef f2 ff 2b ff 3e ff 26 2f
    00000110: f2 ef f2 8f f1 31 ff 3e ff 9f f3 ef f2 ff 2b ff
    00000120: 2e ff af f3 ef f3 ff 39 ff 3e ff 9f f3 ef f3 ff
    00000130: 39 ff 2e ff 7f 21 f2 ff 21 ff 9f f3 ef f3 ff 39
    00000140: ff 2e ff af f3 ef f2 ff 2b ff 2e ff bf f2 1f b2
    00000150: f2 ff 3a ff 21 3b ff 9f f3 3f 16 22 32 21 11 31
    00000160: 22 31 81 f1 3a 4f 41 41 31 ff ff 10 44 16 ff 13
    00000170: 24 12 ff 2d 27 ff f5 21 af 11 21 14 12 11 74 14
    00000180: 13 22 31 22 11 11 13 22 f2 ff 98 17 ff ff df 88
    00000190: f1 ff ff df f1 ef f2 ff 2b ff 28 14 ff cf f2 ef
    000001a0: 95 f1 df f2 ff 22 1a ff 1d ff 0f f1 ff 1b ff 1f
    000001b0: f2 ff 2a 2c ff 10 11 ff 9f b3 f3 0f f2 ff 3a ff
    000001c0: 0f f2 ff 2a ff 0f f1 ff 3a ff 3e ff 9f f3 3f ff
    000001d0: 0f f2
  UrbLink              = 00000000
[2871 ms] UsbSnoop - DispatchAny(f23a0610) : IRP_MJ_INTERNAL_DEVICE_CONTROL
[2871 ms] UsbSnoop - MyDispatchInternalIOCTL(f23a1e80) : fdo=825ad5b0, Irp=825b9b28, IRQL=2
[2871 ms]  >>>  URB 40 going down  >>> 
-- URB_FUNCTION_BULK_OR_INTERRUPT_TRANSFER:
  PipeHandle           = 825e6cdc [endpoint 0x00000082]
  TransferFlags        = 00000003 (USBD_TRANSFER_DIRECTION_IN, USBD_SHORT_TRANSFER_OK)
  TransferBufferLength = 0000041c
  TransferBuffer       = 825cc008
  TransferBufferMDL    = 00000000
  UrbLink              = 00000000
[2913 ms] UsbSnoop - MyInternalIOCTLCompletion(f23a1db0) : fido=00000000, Irp=825b9b28, Context=82644ec8, IRQL=2
[2913 ms]  <<<  URB 40 coming back  <<< 
-- URB_FUNCTION_BULK_OR_INTERRUPT_TRANSFER:
  PipeHandle           = 825e6cdc [endpoint 0x00000082]
  TransferFlags        = 00000003 (USBD_TRANSFER_DIRECTION_IN, USBD_SHORT_TRANSFER_OK)
  TransferBufferLength = 000001a2
  TransferBuffer       = 825cc008
  TransferBufferMDL    = 825aed88
    00000000: 01 01 17 01 00 20 97 01 00 00 06 00 00 00 68 00
    00000010: 50 00 00 00 8c 01 f0 ff 38 ff ff ff 3b ff 4f f1
    00000020: ff 26 ff ff ff 3c 2d 43 f1 18 f1 14 15 35 b1 51
    00000030: f1 ff 86 14 15 ff 13 ff 3f 11 f1 ff 45 71 f2 af
    00000040: 17 23 11 22 11 f1 2f f2 ff 14 ff 6f f3 ff ff bf
    00000050: f3 ff ff bf f3 ff ff bf f3 ff ff bf f3 ff ff cf
    00000060: f2 ff ff bf f3 ff ff cf f2 ff 14 ff 6f f3 ff 1c
    00000070: ff 3d ff ff ff 2c ff ff ff 2c ff ff 7f a1 91 f1
    00000080: ff ff df f1 ff ff df f1 ff ff cf f2 ff ff bf f3
    00000090: ff 14 ff 8f f1 ff ff bf f3 ff ff bf 11 f1 ff ff
    000000a0: cf f2 ff ff bf f3 ff ff 12 8f f3 ff ff cf f2 ff
    000000b0: ff cf f2 ff 14 ff 7f f2 ff 14 ff 7f f2 ff 13 ff
    000000c0: 7f f3 ff 14 ff 21 4f f2 ff ff cf f2 ff ff cf f2
    000000d0: ff 23 ff 7f e2 f2 ff ff 27 22 2e ff ff bf f2 ff
    000000e0: ff cf f2 ff ff cf f2 ff ff cf f2 ff ff df f1 ff
    000000f0: 13 ff 4f 22 f2 ff ff 9f 21 f2 ff 14 ff 8f f1 ff
    00000100: ff cf f2 ff ff cf f2 ff 13 ff 8f f2 ff ff cf f2
    00000110: ff ff bf f3 ff ff bf f3 ff 13 ff 7f f3 6f f1 ff
    00000120: 6f f2 ff ff cf f1 ff ff cf f2 ff 14 ff 7f f2 ff
    00000130: 21 ff 9f f2 ff 21 11 1b 13 11 15 cf f3 1a 1d f8
    00000140: ff 14 21 14 22 ff ff ff 16 ff 4f 11 21 32 11 24
    00000150: 22 31 b1 62 21 8c f1 3d f3 ff 48 32 ff ff ff 95
    00000160: ff ff ff 86 ff ff ff 17 ff ff ff 1d ff 3f 32 f2
    00000170: ff 22 ff 3f c2 92 f1 2d ff ff 22 1a df f1 ff 23
    00000180: ff 8f f1 ff 14 ff 6f 11 f1 2c ff ff 4c af f3 6f
    00000190: f1 6f f2 ff ff cf f2 ff ff cf f2 ff 23 ff 6f 24
    000001a0: f1 ef
  UrbLink              = 00000000
[2914 ms] UsbSnoop - DispatchAny(f23a0610) : IRP_MJ_INTERNAL_DEVICE_CONTROL
[2914 ms] UsbSnoop - MyDispatchInternalIOCTL(f23a1e80) : fdo=825ad5b0, Irp=825b9b28, IRQL=2
[2914 ms]  >>>  URB 41 going down  >>> 
-- URB_FUNCTION_BULK_OR_INTERRUPT_TRANSFER:
  PipeHandle           = 825e6cdc [endpoint 0x00000082]
  TransferFlags        = 00000003 (USBD_TRANSFER_DIRECTION_IN, USBD_SHORT_TRANSFER_OK)
  TransferBufferLength = 0000041c
  TransferBuffer       = 825cc008
  TransferBufferMDL    = 00000000
  UrbLink              = 00000000
[2964 ms] UsbSnoop - MyInternalIOCTLCompletion(f23a1db0) : fido=00000000, Irp=825b9b28, Context=825b23c8, IRQL=2
[2964 ms]  <<<  URB 41 coming back  <<< 
-- URB_FUNCTION_BULK_OR_INTERRUPT_TRANSFER:
  PipeHandle           = 825e6cdc [endpoint 0x00000082]
  TransferFlags        = 00000003 (USBD_TRANSFER_DIRECTION_IN, USBD_SHORT_TRANSFER_OK)
  TransferBufferLength = 000001aa
  TransferBuffer       = 825cc008
  TransferBufferMDL    = 825aed88
    00000000: 01 01 17 01 00 20 a4 01 00 00 06 00 00 00 68 00
    00000010: 50 00 00 00 94 01 f0 bf f2 ff 1d ff 2d ff cf f1
    00000020: ef f2 1f 41 f1 25 11 ff 2b 17 11 21 f1 9f 62 1a
    00000030: 12 51 f1 22 ff cf 52 51 f1 2f f1 15 13 11 12 22
    00000040: 12 f3 f9 3f 28 ff ff ff 2c ff ff ff 3b ff ff ff
    00000050: 2c ff df f2 cf f2 ff ff cf f2 ff 1d ff 2d ff df
    00000060: f1 df f2 ff 2d ff 2c ff df f2 cf f2 ff 3c ff 4b
    00000070: ff cf f2 cf f2 ff 1d ff 1e ff df f2 df f1 ff 1d
    00000080: ff ff ff ff df f1 ff 1d ff 2d ff df f1 df f1 ff
    00000090: 2d ff 2d ff df f2 cf f2 ff 2d ff 2c ff cf f2 df
    000000a0: f2 ff 2d ff 1d ff cf f3 cf f3 ff 3b ff 10 1c 1a
    000000b0: ff 1f f2 ef f1 ff 2d ff 3c ff bf f3 cf f2 ff 3c
    000000c0: ff 2c ff cf f3 cf f2 ff 3c ff 2c ff cf f3 cf f2
    000000d0: ff 3c ff 2c ff cf f2 df f3 2b ef f2 cf 72 f1 24
    000000e0: df f3 cf f2 ff 3c ff 2c ff cf f3 cf f2 ff 2d ff
    000000f0: 3c ff cf f2 df f2 ff 3b ff 2c 27 ff 3f f3 cf 82
    00000100: f1 ff 33 ff 1d ff df f2 cf f2 ff 3c ff 2c ff cf
    00000110: f3 cf f3 ff 2c ff 3c ff bf f3 cf f2 ff 1d ff 2d
    00000120: ff 8f f7 df f1 ff 3c ff 1d ff 7f 41 f3 df f2 ff
    00000130: ff bf f3 ff 1b 11 ff 2c ff cf f4 bf f3 ff 8b 13
    00000140: 13 11 22 21 12 11 36 17 7f 41 21 21 11 16 14 41
    00000150: 41 22 ff 29 ff ff ff ef f1 ff f2 df 41 f2 13 ff
    00000160: 12 ff 0f f1 11 ff ff ff 96 ff ff 9f a2 12 f5 ff
    00000170: ff 29 ff ff ff 2c ff cf 71 f2 5f f2 ff ef 92 f1
    00000180: 21 ff cf f2 20 1a 0f f2 ff 1d ff 3c ff cf f1 df
    00000190: f3 9f f2 11 ff 3d ff 38 2f f1 cf f3 ff ff bf f3
    000001a0: ff ff bf f3 ff ff bf f3 ff ff
  UrbLink              = 00000000
[2964 ms] UsbSnoop - DispatchAny(f23a0610) : IRP_MJ_INTERNAL_DEVICE_CONTROL
[2964 ms] UsbSnoop - MyDispatchInternalIOCTL(f23a1e80) : fdo=825ad5b0, Irp=825b9b28, IRQL=2
[2965 ms]  >>>  URB 42 going down  >>> 
-- URB_FUNCTION_BULK_OR_INTERRUPT_TRANSFER:
  PipeHandle           = 825e6cdc [endpoint 0x00000082]
  TransferFlags        = 00000003 (USBD_TRANSFER_DIRECTION_IN, USBD_SHORT_TRANSFER_OK)
  TransferBufferLength = 0000041c
  TransferBuffer       = 825cc008
  TransferBufferMDL    = 00000000
  UrbLink              = 00000000
[3053 ms] UsbSnoop - MyInternalIOCTLCompletion(f23a1db0) : fido=00000000, Irp=825b9b28, Context=8263ac08, IRQL=2
[3053 ms]  <<<  URB 42 coming back  <<< 
-- URB_FUNCTION_BULK_OR_INTERRUPT_TRANSFER:
  PipeHandle           = 825e6cdc [endpoint 0x00000082]
  TransferFlags        = 00000003 (USBD_TRANSFER_DIRECTION_IN, USBD_SHORT_TRANSFER_OK)
  TransferBufferLength = 000001b6
  TransferBuffer       = 825cc008
  TransferBufferMDL    = 825aed88
    00000000: 01 01 17 01 00 20 b1 01 00 00 06 00 00 00 68 00
    00000010: 50 00 00 00 a0 01 f0 3c ff af f3 df f3 ff 2b ff
    00000020: 3d bf 21 22 12 25 58 59 f4 3c 22 f5 ff 8f f5 13
    00000030: ff bf b3 23 f1 1c 22 1e 11 81 21 12 f3 8f 14 19
    00000040: 94 f2 ff 1c ff 2e ff ff ff 3b ff bf f2 df f3 ff
    00000050: 2b ff 3d ff bf f2 df f3 ff 2c ff 2d ff cf f2 df
    00000060: f2 ff 3b ff 3c ff bf f3 cf f3 ff 3b ff 3c ff bf
    00000070: f3 df f2 ff 3b ff 2d ff bf f3 cf f3 ff 2b 9f f1
    00000080: 15 ff cf f2 ef f1 ff 1c ff 2e ff cf f2 df f2 ff
    00000090: 3b ff 3c ff bf f3 cf f3 ff 1b 11 ff 2d ff bf f2
    000000a0: ef f2 ff 2c ff 2d ff bf f3 df f2 ff 3b ff 2d 8f
    000000b0: f1 2f f3 df f2 ff 2b ff 2e ff bf f3 df f1 ff 3c
    000000c0: ff 2d ff bf f3 df f2 ff 3b ff 2d ff bf f3 df f2
    000000d0: ff 3b ff 2d ff bf f2 df f3 af e2 f3 df f2 15 4f
    000000e0: e2 f3 df f2 ff 2c ff 3c ff bf f3 df f2 ff 2c ff
    000000f0: 3c ff bf f3 df f2 ff 3b ff 3c 5f f2 4f f3 df f2
    00000100: 16 ff 34 ff 2d ff df f1 df f2 ff 3b ff 2d ff cf
    00000110: f2 df f2 ff 3b ff 1a 31 ff cf f2 cf f3 ff 68 ff
    00000120: 2d ff 7f 21 f4 df f2 ff 17 33 ff 1e ff bf f3 df
    00000130: f2 ff 1b 11 ff 3c ff bf f3 df f2 ff 2c 2d ef f1
    00000140: ff 3b fd 19 51 21 52 34 11 36 6f 32 33 31 12 f4
    00000150: 2f f1 ff ff 9f 13 f1 0f c2 71 44 11 11 11 14 ff
    00000160: 13 ff cf f1 ff 10 ff 10 ff ff 1c 8f f9 ff bf f1
    00000170: 29 31 11 af f2 ef f1 ff ff df f1 ff 3b 5f 22 f1
    00000180: 14 ff bf f2 0f 92 22 f1 ff 3b ef a2 21 f1 ff 2c
    00000190: ff 1e ff cf f1 ff 10 ff 8f 32 f1 df f2 ff 37 22
    000001a0: ff 2d ff cf f1 ff 10 ff df f1 ef f2 ff ff cf f1
    000001b0: ff 2b 1f cf f1 ff
  UrbLink              = 00000000
[3054 ms] UsbSnoop - DispatchAny(f23a0610) : IRP_MJ_INTERNAL_DEVICE_CONTROL
[3054 ms] UsbSnoop - MyDispatchInternalIOCTL(f23a1e80) : fdo=825ad5b0, Irp=825b9b28, IRQL=2
[3054 ms]  >>>  URB 43 going down  >>> 
-- URB_FUNCTION_BULK_OR_INTERRUPT_TRANSFER:
  PipeHandle           = 825e6cdc [endpoint 0x00000082]
  TransferFlags        = 00000003 (USBD_TRANSFER_DIRECTION_IN, USBD_SHORT_TRANSFER_OK)
  TransferBufferLength = 0000041c
  TransferBuffer       = 825cc008
  TransferBufferMDL    = 00000000
  UrbLink              = 00000000
[3108 ms] UsbSnoop - MyInternalIOCTLCompletion(f23a1db0) : fido=00000000, Irp=825b9b28, Context=8268eda8, IRQL=2
[3108 ms]  <<<  URB 43 coming back  <<< 
-- URB_FUNCTION_BULK_OR_INTERRUPT_TRANSFER:
  PipeHandle           = 825e6cdc [endpoint 0x00000082]
  TransferFlags        = 00000003 (USBD_TRANSFER_DIRECTION_IN, USBD_SHORT_TRANSFER_OK)
  TransferBufferLength = 000001b6
  TransferBuffer       = 825cc008
  TransferBufferMDL    = 825aed88
    00000000: 01 01 17 01 00 20 be 01 00 00 06 00 00 00 68 00
    00000010: 50 00 00 00 a0 01 f0 10 ff bf 22 f1 cf 11 f1 ff
    00000020: 29 5f 42 11 f1 11 ff 11 22 14 31 22 31 11 91 f1
    00000030: f7 30 17 11 11 f1 ff ff 14 15 ff df d1 21 f2 1b
    00000040: 8f 13 11 21 11 41 6f f1 0f 26 61 f1 ff ff df f1
    00000050: ff 1c ff 0f f1 ff 2c ff 1e ff cf f2 ef f1 ff 1c
    00000060: ff 2e ff cf f2 cf 11 f1 ff 3b ff 1e ff cf f2 ef
    00000070: f1 ff 2c ff 2e ff bf f2 ef f3 ff 2a ff 2e ff cf
    00000080: f1 ef f2 ff 1c ff ff ff 2c ff 1e ff df f1 ef f1
    00000090: ff 2c ff ff ff 3b ff ff ff 1d ff 1e ff cf f2 ef
    000000a0: f2 ff 2b ff 3d ff ff ff 2c ff bf f2 ef f2 ff 2b
    000000b0: ff 2e ff af f2 ff 10 1d 8f f1 33 ff 2e ff af f3
    000000c0: ef f2 ff 2b ff 2e ff af f3 ef f2 ff 2b ff 3d ff
    000000d0: af f3 ef f2 ff 3a ff 3e ff 9f f3 ef f2 ff 2b ff
    000000e0: 3e ff 7f 12 f2 ef f2 3f f1 54 ff 2e ff bf f2 ef
    000000f0: f2 ff 2b ff 2e ff bf f2 ef f2 ff 2b ff 2e ff bf
    00000100: f2 ef f3 2f f2 26 4f f1 29 ff 14 6f f2 df f4 ff
    00000110: 39 ff 1e ff bf f3 ef f2 ff 2b ff 3e ff bf f1 ef
    00000120: f2 ff 3a ff 2e ff 7f f6 ef f2 ff 16 42 ff 2e ff
    00000130: 6f 21 f4 ef f3 ff 39 ff 3e ff bf f1 ef f3 ff 19
    00000140: 11 ff 3e ff af 72 f1 24 0f f2 ff 2b cf 3e 35 25
    00000150: 19 9f 61 31 f1 ff ff ff ff 10 31 52 0f f1 3c 14
    00000160: 41 11 48 11 41 fc ff ff ff 0f f1 ff ff df f1 6f
    00000170: c9 f1 ff 10 ff 67 1e ff 0f f1 ff 1c ff 0f f1 ff
    00000180: 1c ff 24 19 ff cf f1 df 74 f2 ff 31 ff 3c 19 ff
    00000190: 1f f2 ff 10 ff bf f2 ff 10 ff af 83 f2 5f f1 ff
    000001a0: 1c 37 ff 25 ff af f2 ff 11 ff bf f1 ff 20 ff bf
    000001b0: f1 ef f3 ff 2b df
  UrbLink              = 00000000
[3108 ms] UsbSnoop - DispatchAny(f23a0610) : IRP_MJ_INTERNAL_DEVICE_CONTROL
[3108 ms] UsbSnoop - MyDispatchInternalIOCTL(f23a1e80) : fdo=825ad5b0, Irp=825b9b28, IRQL=2
[3109 ms]  >>>  URB 44 going down  >>> 
-- URB_FUNCTION_BULK_OR_INTERRUPT_TRANSFER:
  PipeHandle           = 825e6cdc [endpoint 0x00000082]
  TransferFlags        = 00000003 (USBD_TRANSFER_DIRECTION_IN, USBD_SHORT_TRANSFER_OK)
  TransferBufferLength = 0000041c
  TransferBuffer       = 825cc008
  TransferBufferMDL    = 00000000
  UrbLink              = 00000000
[3155 ms] UsbSnoop - MyInternalIOCTLCompletion(f23a1db0) : fido=00000000, Irp=825b9b28, Context=82612188, IRQL=2
[3155 ms]  <<<  URB 44 coming back  <<< 
-- URB_FUNCTION_BULK_OR_INTERRUPT_TRANSFER:
  PipeHandle           = 825e6cdc [endpoint 0x00000082]
  TransferFlags        = 00000003 (USBD_TRANSFER_DIRECTION_IN, USBD_SHORT_TRANSFER_OK)
  TransferBufferLength = 000001d6
  TransferBuffer       = 825cc008
  TransferBufferMDL    = 825aed88
    00000000: 01 01 17 01 00 20 cb 01 00 00 06 00 00 00 68 00
    00000010: 50 00 00 00 c0 01 30 f1 ff 49 ff 0f f1 ff 49 11
    00000020: 23 15 13 12 21 a1 62 22 df 43 29 44 ff 1f 13 2c
    00000030: f1 7f f1 ff 12 13 ff 2f 31 12 c1 12 41 71 72 11
    00000040: 11 54 f1 12 11 11 31 13 f3 15 ff 0f f2 ff 1b ff
    00000050: 1f f1 ff 1b ff 0f f2 ff 2b ff 0f f1 ff 3a ff 2e
    00000060: ff bf f2 ff 10 ff af f3 ff 10 ff bf f2 ff 10 ff
    00000070: af f3 ff 10 ff af f3 ef f2 ff 2b ff 3e ff 9f f3
    00000080: ff 10 ff bf f2 ff 10 ff bf f2 ff ff bf f3 ff ff
    00000090: cf f2 ff 10 ff bf f2 ff 10 ff af f3 ff ff bf f3
    000000a0: ff 10 ff cf f1 ef f2 ff 2b ff 0f f1 ff 1a ff 2f
    000000b0: f1 ff 2b ff 2e ff bf f2 ef f3 ff 39 ff 0f f1 1a
    000000c0: 8f 61 f2 ef f2 ff 3a ff 0f f1 ff 2b ff 0f f1 ff
    000000d0: 2b ff 2e ff af f3 ef f2 ff 3a ff 0f f1 ff 3a ff
    000000e0: 2e ff bf f2 ff 10 ff bf f2 ef f2 ff 2b 28 ff 15
    000000f0: ff 1f 91 82 f2 5f f1 ff 3a ff 2e ff bf f2 ff 10
    00000100: ff bf f2 ff 10 ff af f3 ef f2 ff 2b ff 3e ff 0f
    00000110: 72 f3 14 af f1 ff 21 28 ff 0f f1 ff 2b ff 2e ff
    00000120: bf f2 11 df f1 ff 2b ff 0f f2 ff 2a ff 0f f2 ff
    00000130: 39 ff 2e ff 7f f6 ff 10 ff 6f 31 f3 ff 20 ff 4f
    00000140: 41 f3 ff 20 ff af f2 ff 20 ff 9f f3 ff 20 ff af
    00000150: f2 ff 20 ff af 72 f1 2f 32 f1 10 15 13 31 26 3f
    00000160: f1 10 11 11 15 11 81 f2 ff ff ff 15 ff 7f 11 81
    00000170: b1 f1 4a 31 72 11 25 12 11 41 11 12 11 12 31 a1
    00000180: e2 11 39 17 f3 ff ff ff ff ff 30 ff ff ff 95 ff
    00000190: 0f f2 ff 84 ff 0f f1 ff 1c ff ff ff 2c ff 1d 11
    000001a0: 21 12 ff 5f f2 ff 10 2a 29 ff 33 ff af a2 f1 3f
    000001b0: f2 ff 11 ff 9f f3 ff 20 ff af f3 25 7f f1 ff 3a
    000001c0: 5f f3 ff ff 43 ff 0f f1 ff 1b ff 3e ff af f2 ef
    000001d0: f3 ff 49 ff bb ff
  UrbLink              = 00000000
[3155 ms] UsbSnoop - DispatchAny(f23a0610) : IRP_MJ_INTERNAL_DEVICE_CONTROL
[3156 ms] UsbSnoop - MyDispatchInternalIOCTL(f23a1e80) : fdo=825ad5b0, Irp=825b9b28, IRQL=2
[3156 ms]  >>>  URB 45 going down  >>> 
-- URB_FUNCTION_BULK_OR_INTERRUPT_TRANSFER:
  PipeHandle           = 825e6cdc [endpoint 0x00000082]
  TransferFlags        = 00000003 (USBD_TRANSFER_DIRECTION_IN, USBD_SHORT_TRANSFER_OK)
  TransferBufferLength = 0000041c
  TransferBuffer       = 825cc008
  TransferBufferMDL    = 00000000
  UrbLink              = 00000000
[3190 ms] UsbSnoop - MyInternalIOCTLCompletion(f23a1db0) : fido=00000000, Irp=825b9b28, Context=825e5468, IRQL=2
[3190 ms]  <<<  URB 45 coming back  <<< 
-- URB_FUNCTION_BULK_OR_INTERRUPT_TRANSFER:
  PipeHandle           = 825e6cdc [endpoint 0x00000082]
  TransferFlags        = 00000003 (USBD_TRANSFER_DIRECTION_IN, USBD_SHORT_TRANSFER_OK)
  TransferBufferLength = 00000196
  TransferBuffer       = 825cc008
  TransferBufferMDL    = 825aed88
    00000000: 01 01 17 01 00 20 d8 01 00 00 06 00 00 00 68 00
    00000010: 50 00 00 00 80 01 f0 2b 4f f3 ff ff af 13 61 12
    00000020: ff 17 f5 13 23 41 21 41 11 51 f2 ff 1d 11 11 11
    00000030: ff ff 9f 31 51 f3 af 21 54 1a 17 18 9f 16 33 21
    00000040: 72 11 f1 15 ff ff ff ff ff ff ff ff ff ff 2a ff
    00000050: ff ff 2c ff ff ff 2c ff ff ff 2c ff ff ff 2c ff
    00000060: ff ff 2c ff ff ff 2c ff ff ff 2c ff ff ff 2c ff
    00000070: ff ff 2c ff ff ff 2c ff ff ff 1d ff ff ff 2c ff
    00000080: ff ff 2c ff ff ff 2c ff ff ff 1d ff ff ff 2c ff
    00000090: ff ff ff ff ff cf f1 ff ff df f1 ff ff cf f1 ff
    000000a0: ff df f3 ff ff 18 2f 33 f1 ff ff 7f f2 ff ff bf
    000000b0: 11 f1 ff ff bf f3 ff ff cf f2 ff ff cf f2 ff ff
    000000c0: cf f2 ff ff df f1 ff ff df f1 ff ff cf f2 26 ff
    000000d0: ff 4f 12 f1 24 ff ff 4f f2 ff ff cf f2 ff ff cf
    000000e0: f2 ff ff cf f2 ff ff df f1 ff ff df 11 f2 ff ff
    000000f0: af 11 f2 ff ff ff ff ff ff 19 ff ff ff 1d ff ff
    00000100: ff 1d ff ff ff 1d ff ff ff 18 11 21 ff ff ff 17
    00000110: 33 ff 16 ff ff 14 11 ff ff ff 2c ff ff ff ff ff
    00000120: ff cf f1 ff cf f1 2e ff 8f 16 11 18 5f 11 33 23
    00000130: 22 2a f2 15 18 31 ff cf f1 ef 61 31 f1 2f 22 15
    00000140: 11 11 2a f2 1a 25 f1 ff 25 ff ff ff 1d ff ff ff
    00000150: 1d ff ff ff 1d 94 ff ff ef 52 16 f1 ff ff 0f f2
    00000160: ff ff cf f2 ff 2e ff 49 ff ff 28 19 5f f4 ff 8f
    00000170: a2 f1 16 ff ff ff 3c ff ff ff 2c ff 23 ff ff 27
    00000180: ff 23 ff ff 27 ff ff ff 1d ff ff ff 2c ff ff ff
    00000190: 3b ff 9f ff 27 ff
  UrbLink              = 00000000
[3190 ms] UsbSnoop - DispatchAny(f23a0610) : IRP_MJ_INTERNAL_DEVICE_CONTROL
[3190 ms] UsbSnoop - MyDispatchInternalIOCTL(f23a1e80) : fdo=825ad5b0, Irp=825b9b28, IRQL=2
[3191 ms]  >>>  URB 46 going down  >>> 
-- URB_FUNCTION_BULK_OR_INTERRUPT_TRANSFER:
  PipeHandle           = 825e6cdc [endpoint 0x00000082]
  TransferFlags        = 00000003 (USBD_TRANSFER_DIRECTION_IN, USBD_SHORT_TRANSFER_OK)
  TransferBufferLength = 0000041c
  TransferBuffer       = 825cc008
  TransferBufferMDL    = 00000000
  UrbLink              = 00000000
[3231 ms] UsbSnoop - MyInternalIOCTLCompletion(f23a1db0) : fido=00000000, Irp=825b9b28, Context=825b23c8, IRQL=2
[3231 ms]  <<<  URB 46 coming back  <<< 
-- URB_FUNCTION_BULK_OR_INTERRUPT_TRANSFER:
  PipeHandle           = 825e6cdc [endpoint 0x00000082]
  TransferFlags        = 00000003 (USBD_TRANSFER_DIRECTION_IN, USBD_SHORT_TRANSFER_OK)
  TransferBufferLength = 000001ce
  TransferBuffer       = 825cc008
  TransferBufferMDL    = 825aed88
    00000000: 01 01 17 01 00 20 e7 01 00 00 06 00 00 00 68 00
    00000010: 50 00 00 00 b8 01 f0 12 2e 11 2f 41 12 11 31 41
    00000020: 31 b3 13 41 f5 12 3d 15 11 f1 ff 1f 11 15 31 11
    00000030: d1 f3 ff ff ff ff 2e 66 13 91 df 24 11 11 13 19
    00000040: 13 14 19 5f f2 15 7f f2 ff ff cf f1 ff 1d ff 2e
    00000050: ff cf f1 ef f2 ff 3b ff 2d ff bf f2 ef f2 ff 3b
    00000060: ff 2d ff cf f2 df f2 ff 3b ff 2d ff cf f2 cf f3
    00000070: ff 2c ff 1e ff bf f2 df 11 f1 ff 3b ff 2d ff bf
    00000080: f3 df f2 ff 3b ff 1e ff df f1 df f2 ff ff cf f2
    00000090: ff ff bf f3 ff 1d ff 1e ff df f1 df f2 ff 2c ff
    000000a0: 2d ff bf f3 ef f1 ff 1d 4f f1 28 ff df f1 df f2
    000000b0: ff 1d ff 2d ff cf f1 bf 21 f2 14 ff 18 ff 2d ff
    000000c0: cf f2 df f2 ff 1b 11 ff 2d ff df f1 df f2 ff 2c
    000000d0: ff 2d ff cf f2 df f2 ff 3b ff 2d ff bf f3 ef f1
    000000e0: ff 2c ff 2d ff 26 4f f2 df f2 11 4f f2 24 ff 2d
    000000f0: ff df f1 df f2 ff 1b 11 ff 2d ff bf f3 df f2 ff
    00000100: 2c ff 2d 4f f1 7f f2 df f2 21 ff 29 ff 1e 2f f1
    00000110: 8f f3 df f2 ff 1d ff 1e ff cf f2 df f2 ff 1d ff
    00000120: 1e ff df f1 9f f6 ff 2c ff 18 24 ff bf f3 8f 41
    00000130: f2 ff 1d ff 2d ff df f1 cf 11 f1 ff 1d ff 1e ff
    00000140: bf f3 df 72 f1 ff 24 1c 11 25 16 11 2c ff 31 15
    00000150: 13 3d f7 3f 31 22 f1 ef 31 11 81 f1 3f 91 f1 ff
    00000160: 15 1e 71 11 11 21 11 12 11 21 21 21 f2 23 11 32
    00000170: 32 a1 22 13 35 21 ff 1b ff 12 9f f2 df f1 ff 2d
    00000180: ff 2d ff df f1 ef f1 94 ff 10 ff 2d 5f 12 f3 2f
    00000190: f1 df f2 ff 2c ff 2e ff af f3 21 12 7f f3 ff 1c
    000001a0: af 92 42 f4 ff 1c af a2 51 f2 ff 2c ff 2e ff ff
    000001b0: ff 1c ff 4f 72 f1 ef f1 ff 33 26 ff 1e ff ff ff
    000001c0: 2c ff df f1 df f2 ff ff cf f3 ff 1c bb ff
  UrbLink              = 00000000
[3232 ms] UsbSnoop - DispatchAny(f23a0610) : IRP_MJ_INTERNAL_DEVICE_CONTROL
[3232 ms] UsbSnoop - MyDispatchInternalIOCTL(f23a1e80) : fdo=825ad5b0, Irp=825b9b28, IRQL=2
[3232 ms]  >>>  URB 47 going down  >>> 
-- URB_FUNCTION_BULK_OR_INTERRUPT_TRANSFER:
  PipeHandle           = 825e6cdc [endpoint 0x00000082]
  TransferFlags        = 00000003 (USBD_TRANSFER_DIRECTION_IN, USBD_SHORT_TRANSFER_OK)
  TransferBufferLength = 0000041c
  TransferBuffer       = 825cc008
  TransferBufferMDL    = 00000000
  UrbLink              = 00000000
[3290 ms] UsbSnoop - MyInternalIOCTLCompletion(f23a1db0) : fido=00000000, Irp=825b9b28, Context=8263ac08, IRQL=2
[3290 ms]  <<<  URB 47 coming back  <<< 
-- URB_FUNCTION_BULK_OR_INTERRUPT_TRANSFER:
  PipeHandle           = 825e6cdc [endpoint 0x00000082]
  TransferFlags        = 00000003 (USBD_TRANSFER_DIRECTION_IN, USBD_SHORT_TRANSFER_OK)
  TransferBufferLength = 000001b6
  TransferBuffer       = 825cc008
  TransferBufferMDL    = 825aed88
    00000000: 01 01 17 01 00 20 f4 01 00 00 07 00 00 00 68 00
    00000010: 50 00 00 00 a0 01 f0 12 21 12 19 11 11 22 21 f1
    00000020: 2c ef 11 19 11 b3 f1 ff ff ff ff 0f f1 36 7f f1
    00000030: 13 7f 2f f2 4a 11 13 19 ff cf f2 ef f1 ff 2c ff
    00000040: ff ff 2c ff ff ff 2c ff 4d ff 9f f4 df f2 ff 3a
    00000050: ff 2e ff af f4 df f2 ff 3a ff 2e ff af f4 df f2
    00000060: ff 4a ff 2d ff bf f2 ff 10 ff bf f3 df f2 ff 2b
    00000070: ff 3e ff 9f f3 ef f2 ff 2b ff 2e ff bf f2 ef f2
    00000080: ff 1c ff 2e ff cf f1 ef f2 ff 1c ff 0f f1 ff 1c
    00000090: ff 3d ff bf f3 cf f2 ff 3c ff 2d ff bf f3 cf f3
    000000a0: ff 3b ff 3c ff cf f1 ef f2 ff 2b ff 2e 18 8f f1
    000000b0: 37 ff 2e ff bf f2 df f3 ff 3b ff 2d ff bf f3 df
    000000c0: f2 ff 2c ff 3c ff bf f2 ef d2 f1 cf f2 df f3 ff
    000000d0: 2b ff 3d ff bf f2 ef f3 ff 23 26 ff 3d df f1 24
    000000e0: 16 ff 2e ff bf f2 df f3 ff 3b ff 2d ff bf f3 df
    000000f0: f2 ff 3b ff 2d ff bf f3 df f2 2e af f2 df f3 0f
    00000100: f1 2a ff 2e ff bf f2 df f3 ff 2b ff 2e ff cf f1
    00000110: af 13 f2 ff 1c ff 6a ff bf f3 8f 31 f3 ff 3b ff
    00000120: 2d ff cf f2 cf f3 ff 3b ff 2d ff bf f3 df f2 ff
    00000130: 2b bf 11 f1 20 ff bf f2 ca 81 72 42 11 f1 5e 21
    00000140: 27 11 ff ff ff ff 45 14 21 12 13 63 14 ff 14 13
    00000150: df 11 2f f1 ff 4b ff 2d ff bf f3 ef f1 ff 2b ff
    00000160: 0f f2 2f 51 f1 12 ff 2e ff 92 1f f1 ef f2 3f f8
    00000170: 20 ff 1e ff cf f3 df f3 ff 19 21 af 31 22 91 f2
    00000180: ff 3b ff 28 32 24 ff 4f f4 8f 32 42 f2 ff 25 ff
    00000190: 0f f2 ff 1b ff 1f f1 ff 2a 24 ff 1a ff af 32 f3
    000001a0: af f1 ff 2b ff 2e ff af f2 ef f3 ff 39 ff 1c 31
    000001b0: ff 9f f3 aa ff 2e
  UrbLink              = 00000000
[3290 ms] UsbSnoop - DispatchAny(f23a0610) : IRP_MJ_INTERNAL_DEVICE_CONTROL
[3290 ms] UsbSnoop - MyDispatchInternalIOCTL(f23a1e80) : fdo=825ad5b0, Irp=825b9b28, IRQL=2
[3290 ms]  >>>  URB 48 going down  >>> 
-- URB_FUNCTION_BULK_OR_INTERRUPT_TRANSFER:
  PipeHandle           = 825e6cdc [endpoint 0x00000082]
  TransferFlags        = 00000003 (USBD_TRANSFER_DIRECTION_IN, USBD_SHORT_TRANSFER_OK)
  TransferBufferLength = 0000041c
  TransferBuffer       = 825cc008
  TransferBufferMDL    = 00000000
  UrbLink              = 00000000
[3337 ms] UsbSnoop - MyInternalIOCTLCompletion(f23a1db0) : fido=00000000, Irp=825b9b28, Context=8268eda8, IRQL=2
[3337 ms]  <<<  URB 48 coming back  <<< 
-- URB_FUNCTION_BULK_OR_INTERRUPT_TRANSFER:
  PipeHandle           = 825e6cdc [endpoint 0x00000082]
  TransferFlags        = 00000003 (USBD_TRANSFER_DIRECTION_IN, USBD_SHORT_TRANSFER_OK)
  TransferBufferLength = 000001d2
  TransferBuffer       = 825cc008
  TransferBufferMDL    = 825aed88
    00000000: 01 01 17 01 00 20 03 02 00 00 07 00 00 00 68 00
    00000010: 50 00 00 00 bc 01 50 31 71 11 13 ff ff 8f 11 11
    00000020: 62 f1 ff ff 26 ff ff 26 13 25 12 f4 25 22 a2 22
    00000030: 11 11 13 31 31 11 13 13 3f f2 ff 10 ff bf f1 ff
    00000040: ff df f2 ff ff cf f2 ff ff cf f2 ff 10 ff bf f3
    00000050: ff ff af f4 ef f1 ff 3a ff 0f f2 ff 49 ff 0f 61
    00000060: f1 ff 42 ff 1e ff bf f3 ff ff bf f2 ff ff cf f2
    00000070: ff 20 ff af f2 ff 20 ff af f3 ff ff cf f1 ff 10
    00000080: ff cf f1 ff 13 ff 9f f1 ff ff df f1 ff 11 ff bf
    00000090: f1 ff ff df f1 ff 10 ff bf f3 ef f2 ff 2b ff 0f
    000000a0: f1 ff 3a ff 1c 11 ff bf f3 ef f1 ff 2b ff 0f f1
    000000b0: ff 2c ff ff 18 8f 81 f3 ef f1 ff 1c ff 0f f2 ff
    000000c0: 3a ff 1e ff bf f2 ef f3 ff 3a ff 1e ff bf f2 ff
    000000d0: 10 ff bf f2 ff 11 ff af f2 ff 10 ff cf f1 ff 20
    000000e0: ff bf 52 f2 7f f2 df b1 62 f2 7f f2 ff 1b ff 0f
    000000f0: f1 ff 3b ff 1e ff cf f1 ff 10 4f f1 6f f3 ef f2
    00000100: ff 2a ff ff ff 20 2a ff 0f f1 ff 10 19 11 ff 1f
    00000110: f1 ff 2a ff 0f f1 ff 2c ff 1e ff cf f1 bf f6 ff
    00000120: 2a ff 1a 33 ff bf f1 ff 11 ff 14 5f f3 ef f2 ff
    00000130: 3a ff 2d ff cf f2 ff ff bf f3 ef f1 ff 4a ff 19
    00000140: 23 13 17 11 33 11 11 31 61 42 12 3c 27 22 41 33
    00000150: 31 11 13 11 f1 ff 1d 14 ff 1f 11 41 a1 f1 2f f2
    00000160: ff f2 14 15 11 82 42 12 11 14 38 11 13 47 11 32
    00000170: 31 12 14 11 ff 19 8f f2 1b ff ff 0f f2 ff ff cf
    00000180: f2 ff ff af 12 f1 ff ff 3f fb ff ff 4f fb ef f1
    00000190: ff 2c ff 2e 1e ff 19 21 ff 1a 33 11 ff 7f f3 af
    000001a0: 31 72 92 f2 5f f3 ff 10 27 2a ff 24 ff 1f f1 ff
    000001b0: 1b ff ff ff 3c 3f f2 ff ff 27 2f f3 ff ff 26 ff
    000001c0: 0f f2 ff 2a ff 1f f1 ff 3a ff 3e ff 8f f4 9f ff
    000001d0: 0f f2
  UrbLink              = 00000000
[3337 ms] UsbSnoop - DispatchAny(f23a0610) : IRP_MJ_INTERNAL_DEVICE_CONTROL
[3337 ms] UsbSnoop - MyDispatchInternalIOCTL(f23a1e80) : fdo=825ad5b0, Irp=825b9b28, IRQL=2
[3337 ms]  >>>  URB 49 going down  >>> 
-- URB_FUNCTION_BULK_OR_INTERRUPT_TRANSFER:
  PipeHandle           = 825e6cdc [endpoint 0x00000082]
  TransferFlags        = 00000003 (USBD_TRANSFER_DIRECTION_IN, USBD_SHORT_TRANSFER_OK)
  TransferBufferLength = 0000041c
  TransferBuffer       = 825cc008
  TransferBufferMDL    = 00000000
  UrbLink              = 00000000
[3357 ms] UsbSnoop - MyInternalIOCTLCompletion(f23a1db0) : fido=00000000, Irp=825b9b28, Context=82612188, IRQL=2
[3357 ms]  <<<  URB 49 coming back  <<< 
-- URB_FUNCTION_BULK_OR_INTERRUPT_TRANSFER:
  PipeHandle           = 825e6cdc [endpoint 0x00000082]
  TransferFlags        = 00000003 (USBD_TRANSFER_DIRECTION_IN, USBD_SHORT_TRANSFER_OK)
  TransferBufferLength = 0000018a
  TransferBuffer       = 825cc008
  TransferBufferMDL    = 825aed88
    00000000: 01 01 17 01 00 20 11 02 00 00 07 00 00 00 68 00
    00000010: 50 00 00 00 74 01 90 21 12 17 ff ff 1d 16 ff ff
    00000020: 4f 12 61 11 41 f8 4f 91 63 ff 6f 72 31 31 31 31
    00000030: 31 f1 22 ff ff ff 1d ff ff ff 1d ff ff ff 1d ff
    00000040: ff ff 2d ff ff ff 2b ff ff ff 2d ff ff ff 3b ff
    00000050: ff ff 3b ff ff ff 3b ff ff ff 1d ff ff ff 2b ff
    00000060: ff ff 2d ff ff ff 1c ff ff ff 3c ff ff ff 2c ff
    00000070: ff ff ff ff ff ff ff ff ff 1b ff ff ff 2c ff ff
    00000080: ff 2c ff ff ff 1c ff ff ff 2d ff ff ff 2c ff ff
    00000090: ff 1d ff ff ff ff ff ff bf f2 ff ff 18 3f 32 f1
    000000a0: ff ff 8f f2 ff ff df f1 ff ff cf f2 ff ff cf f1
    000000b0: ff 12 ff 9f f3 ff ff bf f3 ff ff cf f1 ff ff ff
    000000c0: ff ff ff 1d 5f f2 ff ff 26 4f f2 ff ff ff ff ff
    000000d0: 4f f2 ff ff cf f2 ff ff cf f2 ff ff cf f2 ff ff
    000000e0: cf f4 ff ff af 21 f1 ff ff bf f1 ff ff cf f2 ff
    000000f0: ff cf f1 ff ff df f2 ff ff 16 6f f1 ff ff df f1
    00000100: ff ff bf 11 f1 ff ff cf f2 ff ff cf f2 ff ff df
    00000110: f1 ff 1a 11 15 11 22 b1 71 17 34 26 31 e1 33 91
    00000120: 24 62 11 11 f1 7f f1 ff ac 11 18 1d 11 51 22 13
    00000130: 18 12 ff 54 f2 1a 6f f2 ff ff df f1 ff ff ef f1
    00000140: ff ff cf f1 ff ff df f2 ff ff cf 32 f9 ff ff 0f
    00000150: 42 12 f3 ff ff 3f f1 ff ff cf f2 ff 2e ff 3a ff
    00000160: ff 28 ff 22 ff ff 28 1a ff ff ff ff 16 ff ff ff
    00000170: 2c ff 23 ff ff 27 ff 23 ff ff 27 ff ff ff ff ff
    00000180: ff cf f1 ff ff cf f2 ff 99 ff
  UrbLink              = 00000000
[3357 ms] UsbSnoop - DispatchAny(f23a0610) : IRP_MJ_INTERNAL_DEVICE_CONTROL
[3357 ms] UsbSnoop - MyDispatchInternalIOCTL(f23a1e80) : fdo=825ad5b0, Irp=825b9b28, IRQL=2
[3357 ms]  >>>  URB 50 going down  >>> 
-- URB_FUNCTION_BULK_OR_INTERRUPT_TRANSFER:
  PipeHandle           = 825e6cdc [endpoint 0x00000082]
  TransferFlags        = 00000003 (USBD_TRANSFER_DIRECTION_IN, USBD_SHORT_TRANSFER_OK)
  TransferBufferLength = 0000041c
  TransferBuffer       = 825cc008
  TransferBufferMDL    = 00000000
  UrbLink              = 00000000
[3411 ms] UsbSnoop - MyInternalIOCTLCompletion(f23a1db0) : fido=00000000, Irp=825b9b28, Context=825e5468, IRQL=2
[3411 ms]  <<<  URB 50 coming back  <<< 
-- URB_FUNCTION_BULK_OR_INTERRUPT_TRANSFER:
  PipeHandle           = 825e6cdc [endpoint 0x00000082]
  TransferFlags        = 00000003 (USBD_TRANSFER_DIRECTION_IN, USBD_SHORT_TRANSFER_OK)
  TransferBufferLength = 000001ae
  TransferBuffer       = 825cc008
  TransferBufferMDL    = 825aed88
    00000000: 01 01 17 01 00 20 1f 02 00 00 07 00 00 00 68 00
    00000010: 50 00 00 00 98 01 12 ff ff ff ff ff ff 16 51 44
    00000020: 31 ff 20 1f 31 ff 2b 69 62 31 1f f2 ff 3b ff 2d
    00000030: ff bf f3 cf f3 ff 2c ff 2d ff cf f2 cf f3 ff 2c
    00000040: ff 3c 11 ff 9f f4 bf f3 ff 4b ff 4b ff af f4 bf
    00000050: f4 ff 4a ff 3c ff bf f3 cf f2 ff 3c ff 1d ff cf
    00000060: f3 cf f2 ff 2d ff 3b ff df f1 df f2 ff 3c ff 2c
    00000070: ff bf f4 df f1 ff 1d ff 2d ff cf f2 cf f3 ff 2d
    00000080: ff 1d ff df f2 cf f2 ff 2d ff 2c ff cf f3 cf f2
    00000090: ff 3c ff 1d ff df f2 cf f1 ff 2e ff 2c ff cf f3
    000000a0: cf f2 ff 2d ff 17 24 2f f1 9f f3 df f1 ff 2c ff
    000000b0: 4c ff af f4 bf f3 ff 4b ff 2c ff 1f a1 f3 bf f4
    000000c0: ff 3b ff 3b ff cf f3 cf f2 ff 2d ff 2c ff bf f4
    000000d0: df f1 4f f2 36 ff 1d 1e 4f f2 36 ff 1d ff df f2
    000000e0: cf f2 ff 3c ff 2c ff cf f3 cf f2 ff 3c ff 2c ff
    000000f0: cf f3 cf e2 f2 bf f2 df f2 10 ff 2b ff 2d ff cf
    00000100: f3 df f1 ff 4b ff 1b 11 ff cf f3 df f1 ff 4b ff
    00000110: 2c ff bf f4 df f2 ff 3b ff 3b ff cf f3 cf f3 ff
    00000120: 3a ff 2d ff df f1 13 11 17 0f f1 ff 2c f9 1d 11
    00000130: 12 54 7f f2 2e 11 11 ff ff ff 12 4f f2 15 11 11
    00000140: ff 2f 41 11 11 43 11 33 ff 33 ff ef f1 cf f2 ff
    00000150: 2d ff 3c ff bf f3 df f1 ff 3c ff 1d 9f f2 1f f3
    00000160: cf f2 92 ff 31 ff 3c 2f f8 2f f2 df f2 ff 3b ff
    00000170: 4b ff af 94 31 22 f1 48 ff cf 82 d1 92 62 f4 ff
    00000180: 2c 7f a2 81 f2 ff 2c ff 1d ff cf 11 f1 df f2 ff
    00000190: 21 29 ff 2d ff 1f a2 f1 cf f2 ff 1e ff 3b ff df
    000001a0: f2 df f3 ff 3a 8f f1 33 ff af 84 1e ff 3b
  UrbLink              = 00000000
[3411 ms] UsbSnoop - DispatchAny(f23a0610) : IRP_MJ_INTERNAL_DEVICE_CONTROL
[3411 ms] UsbSnoop - MyDispatchInternalIOCTL(f23a1e80) : fdo=825ad5b0, Irp=825b9b28, IRQL=2
[3412 ms]  >>>  URB 51 going down  >>> 
-- URB_FUNCTION_BULK_OR_INTERRUPT_TRANSFER:
  PipeHandle           = 825e6cdc [endpoint 0x00000082]
  TransferFlags        = 00000003 (USBD_TRANSFER_DIRECTION_IN, USBD_SHORT_TRANSFER_OK)
  TransferBufferLength = 0000041c
  TransferBuffer       = 825cc008
  TransferBufferMDL    = 00000000
  UrbLink              = 00000000
[3529 ms] UsbSnoop - MyInternalIOCTLCompletion(f23a1db0) : fido=00000000, Irp=825b9b28, Context=825b23c8, IRQL=2
[3529 ms]  <<<  URB 51 coming back  <<< 
-- URB_FUNCTION_BULK_OR_INTERRUPT_TRANSFER:
  PipeHandle           = 825e6cdc [endpoint 0x00000082]
  TransferFlags        = 00000003 (USBD_TRANSFER_DIRECTION_IN, USBD_SHORT_TRANSFER_OK)
  TransferBufferLength = 000001be
  TransferBuffer       = 825cc008
  TransferBufferMDL    = 825aed88
    00000000: 01 01 17 01 00 20 2d 02 00 00 07 00 00 00 68 00
    00000010: 50 00 00 00 a8 01 ff ff 1e ff ff 8f f1 80 44 f1
    00000020: 62 62 11 11 32 21 11 14 ff 0f f3 19 3f f2 ff 3b
    00000030: ff 1c 11 ff bf f3 ef f1 ff 3b ff 2d ff bf f3 df
    00000040: f3 ff 3a ff 2d ff 9f 11 53 f1 6f f4 ff 3a 15 ff
    00000050: 36 ff bf f4 bf f3 ff 5a ff 15 17 ff bf f4 cf f2
    00000060: ff 4b ff 2c ff cf f2 df f2 ff 2c ff 1c 11 ff cf
    00000070: f2 ef f1 ff 3b ff 1e ff cf f1 ff 10 ff cf f2 ef
    00000080: f1 ff 2c ff 1e ff cf f2 ef f1 ff 1d ff 2d ff cf
    00000090: f2 cf f4 ff 2b ff 1c 11 ff bf 13 f1 bf f2 ff 3b
    000000a0: ff 2d ff cf f2 df f3 ff 3a ff 3d ff bf f2 ef 62
    000000b0: f1 18 9f f3 ef f1 ff 3b ff 1c 11 ff bf f4 cf f2
    000000c0: ff 3b ff 3c ff 1f a1 f2 cf f3 ff 2c ff 2d ff cf
    000000d0: f2 ef f1 ff 3b ff 2e ff af f3 ef f1 ff 23 46 ff
    000000e0: 1d df f1 24 46 ff 2c ff bf 11 f2 cf f2 ff 3b ff
    000000f0: 2d ff bf f3 df f2 ff 3b ff 3d ff af f4 cf f2 2d
    00000100: cf f3 df f1 1e df f1 ef f1 ff 3b ff 2d ff bf f4
    00000110: cf f2 ff 3b ff 2d ff bf f4 df f1 ff 3b ff 2e ff
    00000120: bf f2 ef f2 ff 3a ff 3d ff af f3 df f3 ff 2b 8f
    00000130: 12 17 71 66 11 31 22 71 21 61 33 c1 44 31 11 33
    00000140: 51 1d ff 7f f1 ff 16 ff ff ef 11 2f 14 c1 42 11
    00000150: 12 21 61 73 91 44 f1 20 4f f3 ff 2d 8f f1 24 ff
    00000160: bf f3 cf f3 ff 4a ff 1d ff cf f2 ef f1 7f f3 32
    00000170: ff 2c ff 91 2f f2 ef f2 1f f8 23 ff 2d ff af f4
    00000180: bf f4 ff 4b 7f 31 22 a1 f3 ff 4a ff 26 14 11 22
    00000190: ff 6f f4 6f 52 41 f1 ff 36 ff 2e ff bf f2 ef f1
    000001a0: ff 1d 22 ff 1a ff df f5 af f1 ff 2d ff 1d ff cf
    000001b0: f2 ef f2 ff 4a ff 4c ff 15 3f f5 66 ff 1d
  UrbLink              = 00000000
[3530 ms] UsbSnoop - DispatchAny(f23a0610) : IRP_MJ_INTERNAL_DEVICE_CONTROL
[3530 ms] UsbSnoop - MyDispatchInternalIOCTL(f23a1e80) : fdo=825ad5b0, Irp=825b9b28, IRQL=2
[3530 ms]  >>>  URB 52 going down  >>> 
-- URB_FUNCTION_BULK_OR_INTERRUPT_TRANSFER:
  PipeHandle           = 825e6cdc [endpoint 0x00000082]
  TransferFlags        = 00000003 (USBD_TRANSFER_DIRECTION_IN, USBD_SHORT_TRANSFER_OK)
  TransferBufferLength = 0000041c
  TransferBuffer       = 825cc008
  TransferBufferMDL    = 00000000
  UrbLink              = 00000000
[3590 ms] UsbSnoop - MyInternalIOCTLCompletion(f23a1db0) : fido=00000000, Irp=825b9b28, Context=8263ac08, IRQL=2
[3591 ms]  <<<  URB 52 coming back  <<< 
-- URB_FUNCTION_BULK_OR_INTERRUPT_TRANSFER:
  PipeHandle           = 825e6cdc [endpoint 0x00000082]
  TransferFlags        = 00000003 (USBD_TRANSFER_DIRECTION_IN, USBD_SHORT_TRANSFER_OK)
  TransferBufferLength = 000001c2
  TransferBuffer       = 825cc008
  TransferBufferMDL    = 825aed88
    00000000: 01 01 17 01 00 20 3b 02 00 00 07 00 00 00 68 00
    00000010: 50 00 00 00 ac 01 21 31 ff ff ff ff ff 16 12 2c
    00000020: 12 12 12 31 11 11 42 31 df 21 21 39 3f f3 8f 51
    00000030: 11 f1 ff 38 ff 0f f1 ff 2b ff 0f 11 f1 ff 38 ff
    00000040: ff ff 3c ff ff ff 2b 11 ff 2d ff 9f f5 df 11 f1
    00000050: ff 48 ff 2e ff 9f f4 ff 11 ff 8f f4 ef f2 ff 3a
    00000060: ff 1e ff bf 11 f1 ef f2 ff 2b ff 1e ff cf f2 ef
    00000070: f2 ff 3a ff 2e ff af f3 ef f1 ff 2c ff ff ff 2b
    00000080: ff 1f f1 ff 2a ff 0f f2 ff 1b ff ff ff 2d ff 1e
    00000090: ff cf f2 ef f2 ff 3a ff 3e ff 9f f3 ef f2 ff 2b
    000000a0: ff 2e ff af f3 ff 10 ff af f3 ef f2 ff 2a ff 0f
    000000b0: f2 15 8f a1 f3 ff 10 ff bf f1 ff 30 ff 9f f3 ef
    000000c0: f2 ff 3a ff 1e ff 0f a1 f3 ef f2 ff 3a ff 3d ff
    000000d0: bf f2 ef f1 ff 1c ff 0f f2 ff 2b ff ff ff 2c 23
    000000e0: ff 19 ff 1c 3d 23 ff 1a ff bf f2 ff 10 ff af f3
    000000f0: ef f1 ff 3b ff 2e ff af f2 ff 11 ff af f3 ef f1
    00000100: cf d2 f2 ef f1 df d1 f2 ff 10 ff bf f2 ff 10 ff
    00000110: af f3 ef f2 ff 3a ff 2e ff af f3 ff 10 ff af f3
    00000120: ef f2 ff 3a ff 0f f2 ff 39 ff 3e ff 9f f2 ff 20
    00000130: ff bf f1 ff 20 18 11 ff 2e df 91 25 16 11 5f f1
    00000140: 20 24 21 14 17 ff ff ef f1 cf 11 45 13 21 11 e2
    00000150: 11 81 21 11 21 39 31 42 51 11 11 11 11 11 29 17
    00000160: ff bf f3 ef f1 1a ff 21 ff 2e ff af f3 ff 10 ff
    00000170: 14 6f f2 ef f2 ff 16 24 ff 0f f1 ef 39 f2 ef f3
    00000180: ef 38 f2 ff 10 ff af f3 cf f4 ff 3a 8f e1 31 f5
    00000190: ff 3a ff 1e 25 19 ff 38 ff 0f 51 a2 f1 8f f2 ff
    000001a0: 10 ff cf f1 ff 10 ff cf f1 21 ff ff 9f f2 21 ff
    000001b0: ff af f1 ff 20 ff af f2 ef f2 ff 2b ff 3e ff af
    000001c0: f2 7f
  UrbLink              = 00000000
[3591 ms] UsbSnoop - DispatchAny(f23a0610) : IRP_MJ_INTERNAL_DEVICE_CONTROL
[3591 ms] UsbSnoop - MyDispatchInternalIOCTL(f23a1e80) : fdo=825ad5b0, Irp=825b9b28, IRQL=2
[3591 ms]  >>>  URB 53 going down  >>> 
-- URB_FUNCTION_BULK_OR_INTERRUPT_TRANSFER:
  PipeHandle           = 825e6cdc [endpoint 0x00000082]
  TransferFlags        = 00000003 (USBD_TRANSFER_DIRECTION_IN, USBD_SHORT_TRANSFER_OK)
  TransferBufferLength = 0000041c
  TransferBuffer       = 825cc008
  TransferBufferMDL    = 00000000
  UrbLink              = 00000000
[3624 ms] UsbSnoop - MyInternalIOCTLCompletion(f23a1db0) : fido=00000000, Irp=825b9b28, Context=8268eda8, IRQL=2
[3624 ms]  <<<  URB 53 coming back  <<< 
-- URB_FUNCTION_BULK_OR_INTERRUPT_TRANSFER:
  PipeHandle           = 825e6cdc [endpoint 0x00000082]
  TransferFlags        = 00000003 (USBD_TRANSFER_DIRECTION_IN, USBD_SHORT_TRANSFER_OK)
  TransferBufferLength = 00000186
  TransferBuffer       = 825cc008
  TransferBufferMDL    = 825aed88
    00000000: 01 01 17 01 00 20 49 02 00 00 07 00 00 00 68 00
    00000010: 50 00 00 00 70 01 80 12 31 13 15 ff ff ff ff ff
    00000020: 3f 61 f8 1d 19 83 f2 ff 27 11 24 4f f1 25 ff ff
    00000030: ff 2c ff ff ff 2c ff ff ff 2c ff ff ff 2c ff ff
    00000040: ff 2c ff ff ff 2c ff ff ff 3b ff ff ff 3c ff ff
    00000050: ff 3b ff ff ff 3b ff ff ff 3b ff ff ff 2c ff ff
    00000060: ff 3b ff ff ff 2b ff ff ff 1d ff ff ff ff ff ff
    00000070: ff ff ff ff 2a ff ff ff ff ff ff df f1 ff ff cf
    00000080: f2 ff ff bf f2 ff ff df f1 ff ff ff ff ff ff 1c
    00000090: ff ff ff 3b ff ff 6f f1 45 ff ff ff 1b ff ff ff
    000000a0: ff ff ff af f4 ff ff bf f2 ff ff 1f a1 f2 ff ff
    000000b0: cf f2 ff ff cf f2 ff ff df f1 ff ff cf f2 23 ff
    000000c0: ff 7f f2 23 ff ff 7f f2 ff ff df f2 ff ff cf f1
    000000d0: ff ff df f1 ff ff df f1 ff ff cf f3 ff ff bf f3
    000000e0: ff ff cf f1 ff ff df f1 ff ff df f1 ff ff cf f2
    000000f0: ff ff cf f2 ff ff df f1 ff ff cf f2 ff ff df f1
    00000100: ff ff df f1 ff ff ff ff 7f 14 14 21 11 72 11 11
    00000110: 11 f2 22 15 2c 54 21 91 11 23 f1 19 6f 11 53 f1
    00000120: ef 81 11 f1 1e 24 42 11 5f 81 12 13 31 32 26 4f
    00000130: f1 0f f3 ff ff df f1 ff ff cf f2 ff ff 15 6f f2
    00000140: ff ff cf f1 ff ff df fb ff ff 3f 21 f8 ff ff 4f
    00000150: f1 ff ff bf f3 ff 2b ff 3d ff ff 25 ff 25 ff ff
    00000160: 25 1a 9f f1 ff ff ef f1 ff ff df f1 0f f2 ff bf
    00000170: f1 0f f2 ff bf f1 ff ff df f1 ff ff cf f2 ff ff
    00000180: bf f4 ff 55 bf f1
  UrbLink              = 00000000
[3625 ms] UsbSnoop - DispatchAny(f23a0610) : IRP_MJ_INTERNAL_DEVICE_CONTROL
[3625 ms] UsbSnoop - MyDispatchInternalIOCTL(f23a1e80) : fdo=825ad5b0, Irp=825b9b28, IRQL=2
[3625 ms]  >>>  URB 54 going down  >>> 
-- URB_FUNCTION_BULK_OR_INTERRUPT_TRANSFER:
  PipeHandle           = 825e6cdc [endpoint 0x00000082]
  TransferFlags        = 00000003 (USBD_TRANSFER_DIRECTION_IN, USBD_SHORT_TRANSFER_OK)
  TransferBufferLength = 0000041c
  TransferBuffer       = 825cc008
  TransferBufferMDL    = 00000000
  UrbLink              = 00000000
[3665 ms] UsbSnoop - MyInternalIOCTLCompletion(f23a1db0) : fido=00000000, Irp=825b9b28, Context=825ea748, IRQL=2
[3665 ms]  <<<  URB 54 coming back  <<< 
-- URB_FUNCTION_BULK_OR_INTERRUPT_TRANSFER:
  PipeHandle           = 825e6cdc [endpoint 0x00000082]
  TransferFlags        = 00000003 (USBD_TRANSFER_DIRECTION_IN, USBD_SHORT_TRANSFER_OK)
  TransferBufferLength = 0000019e
  TransferBuffer       = 825cc008
  TransferBufferMDL    = 825aed88
    00000000: 01 01 17 01 00 20 57 02 00 00 07 00 00 00 68 00
    00000010: 50 00 00 00 88 01 f0 12 31 11 31 21 12 a1 f1 ff
    00000020: 0f 11 f4 19 12 ff 1e 14 52 14 33 1e 1f 11 63 31
    00000030: 11 42 38 15 af 71 44 62 23 f1 10 ff ff ff 1d ff
    00000040: cf f2 ef f1 ff ff cf f2 ff ff cf f2 ff ff cf f3
    00000050: ff ff cf f2 ff 1c ff 4c ff cf f1 df f3 ff 2b ff
    00000060: 2e ff ff ff 2c ff cf f1 ef f2 ff 1c ff 2e ff ff
    00000070: ff 1c ff ff ff 1d ff ff ff 3c ff ff ff 2c ff ff
    00000080: ff 1c ff df f1 ef f1 ff ff ff ff ff ff 1d ff ff
    00000090: ff 2c ff ff ff 1c ff ff ff 1d ff cf f1 ff 11 ff
    000000a0: bf f1 ff 10 ff ff ff 1d ff ff ff 15 27 1e ff 2c
    000000b0: ff 1d ff ff ff 1d ff ef f1 df f1 ff 1c ff 3e ff
    000000c0: ff ff 11 29 ff ef f1 cf f3 ff 1d ff 2d ff ff ff
    000000d0: 2c ff ff ff 1c ff 22 9f f1 ef c1 f1 15 ff ff 29
    000000e0: ff ff ff 2c ff cf f1 ef f2 ff 1c ff 1e ff ef f1
    000000f0: df f1 ff ff df b2 f2 ff ff 2e ff ff ff ff ff ff
    00000100: bf f2 ff ff cf f1 ff 1e ff 1d ff ff ff 2d ff ff
    00000110: ff 2c ff ff ff 2c ff ff ff 2b ff ff ff 1d ff ff
    00000120: ff 1d ff ff 19 1d 4f f1 8f f1 fa 1f 13 12 31 d1
    00000130: 71 f1 7a 11 21 ff 21 21 12 ff 11 1a 13 13 a1 31
    00000140: 13 e1 12 51 b1 72 61 f1 14 ff ff 27 ff df f1 df
    00000150: f2 ff ff cf f2 ff ff cf f2 ff ff cf e2 f9 4f f1
    00000160: ef f1 61 ff 16 ff 3e ff cf f1 df f3 ff 1b 2c ff
    00000170: 20 ff df f1 25 19 3b ff 9f f2 27 1a 1b ff ff ff
    00000180: 1d ff ff ff ff df f2 ff 1c ff 2e ff ff ff ff ff
    00000190: 1b ff ff ff 2c ff ff ff 2c ff df 61 ff ff
  UrbLink              = 00000000
[3665 ms] UsbSnoop - DispatchAny(f23a0610) : IRP_MJ_INTERNAL_DEVICE_CONTROL
[3665 ms] UsbSnoop - MyDispatchInternalIOCTL(f23a1e80) : fdo=825ad5b0, Irp=825b9b28, IRQL=2
[3666 ms]  >>>  URB 55 going down  >>> 
-- URB_FUNCTION_BULK_OR_INTERRUPT_TRANSFER:
  PipeHandle           = 825e6cdc [endpoint 0x00000082]
  TransferFlags        = 00000003 (USBD_TRANSFER_DIRECTION_IN, USBD_SHORT_TRANSFER_OK)
  TransferBufferLength = 0000041c
  TransferBuffer       = 825cc008
  TransferBufferMDL    = 00000000
  UrbLink              = 00000000
[3740 ms] UsbSnoop - MyInternalIOCTLCompletion(f23a1db0) : fido=00000000, Irp=825b9b28, Context=825b0988, IRQL=2
[3741 ms]  <<<  URB 55 coming back  <<< 
-- URB_FUNCTION_BULK_OR_INTERRUPT_TRANSFER:
  PipeHandle           = 825e6cdc [endpoint 0x00000082]
  TransferFlags        = 00000003 (USBD_TRANSFER_DIRECTION_IN, USBD_SHORT_TRANSFER_OK)
  TransferBufferLength = 000001be
  TransferBuffer       = 825cc008
  TransferBufferMDL    = 825aed88
    00000000: 01 01 17 01 00 20 64 02 00 00 06 00 00 00 68 00
    00000010: 50 00 00 00 a8 01 f0 38 17 11 1b 31 f1 ff 16 61
    00000020: 21 51 41 16 11 11 ff ff 8f 51 f2 ff 17 12 0f 41
    00000030: 14 f2 34 11 17 1b 1d f3 36 af 11 21 21 91 f3 ff
    00000040: 2b ff 3d ff af f3 df f3 ff 1b ff 3e ff 1b 3d ff
    00000050: 3d ff bf f2 df f3 ff 2b ff 3d ff bf f2 df f3 ff
    00000060: 2b ff 3d ff bf f2 df f3 ff 3a ff 3d ff bf f2 df
    00000070: f3 ff 2b ff 2e ff bf f2 ef f2 ff 1c ff 3d ff bf
    00000080: f3 cf 22 f1 ff 29 ff 3d ff cf f1 df f2 ff 2c ff
    00000090: 2e ff cf f1 df f2 ff 1d ff 3d ff bf f2 df f3 ff
    000000a0: 2b ff 3d ff bf f2 df f3 ff 2b ff 3d ff bf f2 df
    000000b0: f2 ff 2c ff 3d 13 8f f1 1e ff 2d ff cf f2 df f3
    000000c0: ff 1c ff 3d ff cf f1 df f3 ff 3b ff 3c ff bf f2
    000000d0: df f3 ff 3b ff 3c ff cf f1 df f3 ff 2b ff 3d ff
    000000e0: 2e 2a ff 2e 9f f1 24 39 ff 3d ff cf f1 ef f2 ff
    000000f0: 1c ff 3d ff bf f2 df f3 ff 2b ff 3d ff bf f2 df
    00000100: f3 29 ff 20 ff 3d af f1 1f f1 ef f2 ff 2b ff 3d
    00000110: ff bf f3 df f2 ff 2b ff 2e ff cf f1 df f3 ff 1d
    00000120: ff 3c ff bf f2 df f2 ff 2c ff 3d ff bf f3 cf f1
    00000130: ff ff df f2 ff 14 27 ff 2d ff cf f2 16 17 17 35
    00000140: cf 61 c1 41 31 12 31 11 ff 13 26 ff 3f 11 f3 7f
    00000150: 21 11 f1 4f f2 10 41 21 13 28 21 11 23 f1 37 26
    00000160: 22 13 5f 11 11 f1 10 ff 2e ff bf f2 ef f2 ff 1c
    00000170: ff 2e ff 24 5f f2 df f3 9c 5f f2 df f3 8d 5f f2
    00000180: ef f2 ff 1c ff 2e ff bf f2 2a 12 2e 8f f1 2f f3
    00000190: 3f 82 f4 12 13 ff 41 ff 23 38 ff ff ff 2b ff cf
    000001a0: f1 ef f2 ff 3b ff 1e ff bf f3 ef f1 ff 2b ff 0f
    000001b0: f1 ff 2b ff 0f f1 ff 1c ff 4d ff 9f f4 44
  UrbLink              = 00000000
[3741 ms] UsbSnoop - DispatchAny(f23a0610) : IRP_MJ_INTERNAL_DEVICE_CONTROL
[3741 ms] UsbSnoop - MyDispatchInternalIOCTL(f23a1e80) : fdo=825ad5b0, Irp=825b9b28, IRQL=2
[3741 ms]  >>>  URB 56 going down  >>> 
-- URB_FUNCTION_BULK_OR_INTERRUPT_TRANSFER:
  PipeHandle           = 825e6cdc [endpoint 0x00000082]
  TransferFlags        = 00000003 (USBD_TRANSFER_DIRECTION_IN, USBD_SHORT_TRANSFER_OK)
  TransferBufferLength = 0000041c
  TransferBuffer       = 825cc008
  TransferBufferMDL    = 00000000
  UrbLink              = 00000000
[3814 ms] UsbSnoop - MyInternalIOCTLCompletion(f23a1db0) : fido=00000000, Irp=825b9b28, Context=825d5888, IRQL=2
[3814 ms]  <<<  URB 56 coming back  <<< 
-- URB_FUNCTION_BULK_OR_INTERRUPT_TRANSFER:
  PipeHandle           = 825e6cdc [endpoint 0x00000082]
  TransferFlags        = 00000003 (USBD_TRANSFER_DIRECTION_IN, USBD_SHORT_TRANSFER_OK)
  TransferBufferLength = 000001ce
  TransferBuffer       = 825cc008
  TransferBufferMDL    = 825aed88
    00000000: 01 01 17 01 00 20 72 02 00 00 04 00 00 00 68 00
    00000010: 50 00 00 00 b8 01 90 f3 ff 59 ff 3c ff 9f e4 11
    00000020: 31 11 24 23 91 f3 1e 11 f1 15 ff 98 53 31 11 ff
    00000030: ff 9f 14 f1 ff 13 31 11 19 11 11 62 31 11 c1 11
    00000040: 51 35 51 11 11 51 62 11 f2 27 ff 0f f1 ff 2b ff
    00000050: 0f f1 ff 3b ff 2d ff af f4 df f3 ff 3a ff 3d ff
    00000060: af f3 df f3 ff 2b ff 2d ff bf f3 df f2 ff 1c ff
    00000070: 3e ff af f2 ef f3 ff 1b ff 3e ff af f3 df f3 ff
    00000080: 4a ff 3c ff bf f2 ef f2 ff 1b ff 4d ff bf f1 ef
    00000090: f3 ff 2b ff 1d 11 ff bf f2 df f3 ff 1b ff 3e ff
    000000a0: bf f1 ef f3 ff 2b ff 0f f1 ff 2b ff 3d ff bf f2
    000000b0: df f3 ff 1a 11 ff 1d ff cf f3 df f3 12 8f e1 f2
    000000c0: df f3 ff 2b ff 3d ff af f3 df f3 ff 2b ff 2e ff
    000000d0: bf f2 df f1 ff 2d ff 3d ff bf f2 df f3 ff 2a ff
    000000e0: 3e ff bf f2 df f3 ff 4b ff 2c ff 18 2f f4 cf f2
    000000f0: ff 2b ff 3d ff bf f2 df f3 ff 3a ff 3d ff bf f2
    00000100: df f3 ff 2b ff 3d ff 28 0f f3 df f2 af f1 21 ff
    00000110: 3d ff ff ff 3b ff cf f1 ef f2 ff 2b ff 2e ff bf
    00000120: f2 df f3 ff 2b ff 3d ff cf f1 df f3 ff 2b ff 3d
    00000130: ff bf f2 df f2 ff 2c ff 3d ff bf f2 df f3 ff 2b
    00000140: ff 2d ff 4f 71 f2 2f a2 f1 ff 2c 1f 71 21 41 12
    00000150: 81 12 21 12 11 11 11 61 1c 3a 41 41 13 6f f1 21
    00000160: ff 4f 31 12 11 f1 af 11 f3 4f 71 11 21 19 11 21
    00000170: 11 73 52 21 41 22 2d ff bf f2 ff 10 ff 4f 61 f2
    00000180: ef f2 bf 69 f2 df f2 df 16 61 f2 ef f2 ff 2b ff
    00000190: 2e ff af f3 9f 22 f2 ff 3b ff 4d 21 19 ff 2c ff
    000001a0: 0f 21 a2 f1 bf f2 ef f2 ff 2b ff 0f f1 ff 19 12
    000001b0: 2d ff 10 ff bf c2 f2 1f f1 ff 2b ff 2e ff af 11
    000001c0: f1 ef f2 ff 2b ff 0f f2 ff 2a ff 44 2e ff
  UrbLink              = 00000000
[3815 ms] UsbSnoop - DispatchAny(f23a0610) : IRP_MJ_INTERNAL_DEVICE_CONTROL
[3815 ms] UsbSnoop - MyDispatchInternalIOCTL(f23a1e80) : fdo=825ad5b0, Irp=825b9b28, IRQL=2
[3815 ms]  >>>  URB 57 going down  >>> 
-- URB_FUNCTION_BULK_OR_INTERRUPT_TRANSFER:
  PipeHandle           = 825e6cdc [endpoint 0x00000082]
  TransferFlags        = 00000003 (USBD_TRANSFER_DIRECTION_IN, USBD_SHORT_TRANSFER_OK)
  TransferBufferLength = 0000041c
  TransferBuffer       = 825cc008
  TransferBufferMDL    = 00000000
  UrbLink              = 00000000
[3920 ms] UsbSnoop - MyInternalIOCTLCompletion(f23a1db0) : fido=00000000, Irp=825b9b28, Context=8261dbc8, IRQL=2
[3920 ms]  <<<  URB 57 coming back  <<< 
-- URB_FUNCTION_BULK_OR_INTERRUPT_TRANSFER:
  PipeHandle           = 825e6cdc [endpoint 0x00000082]
  TransferFlags        = 00000003 (USBD_TRANSFER_DIRECTION_IN, USBD_SHORT_TRANSFER_OK)
  TransferBufferLength = 000001a6
  TransferBuffer       = 825cc008
  TransferBufferMDL    = 825aed88
    00000000: 01 01 17 01 00 20 7f 02 00 00 03 00 00 00 68 00
    00000010: 50 00 00 00 90 01 f0 3f 11 f1 42 ff ff ff 5a ff
    00000020: ff ff 3a 7f 31 22 51 43 f4 1e 12 1a 16 63 f1 df
    00000030: 1d 42 11 31 f1 ff ff 64 ff 1c 3f 11 81 31 41 11
    00000040: 11 11 39 12 f2 2b 21 11 d1 f2 ff ff bf f2 ff ff
    00000050: cf f3 ff ff bf f3 ff ff af f4 ff ff bf f3 ff ff
    00000060: cf f2 ff ff bf f3 ff ff cf f2 ff ff cf f2 ff ff
    00000070: 9f f5 ff ff af f4 ff ff bf f3 1e ff 1e bf f3 ff
    00000080: ff cf f2 ff ff bf f2 ff ff df f2 ff ff cf f2 ff
    00000090: ff bf f3 5f f1 ff 6f f2 ff ff df f1 ff ff cf f2
    000000a0: ff ff bf f3 ff ff cf f2 ff ff 11 8f f2 ff ff df
    000000b0: f3 ff ff bf f3 ff ff df f1 ff ff cf f2 ff ff cf
    000000c0: f2 ef f1 5f f2 25 ff ff ff 2c ff ff ff 2b ff ff
    000000d0: ff 3c 2d ff ff 7f 32 d2 f2 ff ff 2c ff ff ff 2c
    000000e0: ff ff ff 2c ff ff ff 3b ff ff ff 2c ff ff ff 27
    000000f0: 23 ff ff ff 18 32 ff ff ff 2c ff ff ff 1d ff ff
    00000100: ff ff ff ff bf f2 ff ff cf f2 ff ff cf f2 ff ff
    00000110: cf f2 ff ff cf f2 ff ff cf f2 ff ff cf f2 ff ff
    00000120: df f1 ff ff cf f2 ff 20 ff bf f1 ff 20 11 ff 8f
    00000130: d2 c1 21 22 11 21 81 22 22 44 14 17 0f 11 29 12
    00000140: f1 ff ff 3f 13 f1 ff 18 19 1d 11 35 45 d1 33 21
    00000150: 12 35 11 11 32 f6 1f f1 4e 31 ff ff ff 95 ff ff
    00000160: ff 86 ff ff ff 27 ff 2f f1 ff 29 ff 2f 32 f2 ff
    00000170: 42 ff 1f d1 92 f1 4d ff 12 1d 2d 1a df f3 ff 21
    00000180: ff 8f f2 ff 22 ff 8f f3 2a 5f f1 ff 16 31 9f f3
    00000190: 14 ff 9f f3 ff 11 ff 9f f3 ff 11 ff 8f f4 ff 21
    000001a0: ff 6f f5 5f 92 11
  UrbLink              = 00000000
[3920 ms] UsbSnoop - DispatchAny(f23a0610) : IRP_MJ_INTERNAL_DEVICE_CONTROL
[3920 ms] UsbSnoop - MyDispatchInternalIOCTL(f23a1e80) : fdo=825ad5b0, Irp=825b9b28, IRQL=2
[3920 ms]  >>>  URB 58 going down  >>> 
-- URB_FUNCTION_BULK_OR_INTERRUPT_TRANSFER:
  PipeHandle           = 825e6cdc [endpoint 0x00000082]
  TransferFlags        = 00000003 (USBD_TRANSFER_DIRECTION_IN, USBD_SHORT_TRANSFER_OK)
  TransferBufferLength = 0000041c
  TransferBuffer       = 825cc008
  TransferBufferMDL    = 00000000
  UrbLink              = 00000000
[3977 ms] UsbSnoop - MyInternalIOCTLCompletion(f23a1db0) : fido=00000000, Irp=825b9b28, Context=8268ec48, IRQL=2
[3977 ms]  <<<  URB 58 coming back  <<< 
-- URB_FUNCTION_BULK_OR_INTERRUPT_TRANSFER:
  PipeHandle           = 825e6cdc [endpoint 0x00000082]
  TransferFlags        = 00000003 (USBD_TRANSFER_DIRECTION_IN, USBD_SHORT_TRANSFER_OK)
  TransferBufferLength = 000001ca
  TransferBuffer       = 825cc008
  TransferBufferMDL    = 825aed88
    00000000: 01 01 17 01 00 20 8e 02 00 00 02 00 00 00 68 00
    00000010: 50 00 00 00 b4 01 f0 9f f3 ff 1c ff 3d ff bf f2
    00000020: df 11 f1 ff ff bf f2 ff 11 0f f1 9f 13 71 41 11
    00000030: 11 ff 26 96 61 12 15 11 11 28 ff 9f 21 16 f1 4f
    00000040: f2 18 1b 11 f6 e9 b1 13 39 12 ff ef 34 13 11 11
    00000050: 11 22 11 f1 30 ff bf f2 df f3 ff 2c ff 3c ff cf
    00000060: f1 df f3 ff ff bf f2 ff ff df f2 ff ff cf f2 ff
    00000070: 1c ff 2e ff cf f2 cf f3 ff 3b ff 1a 31 ff cf f2
    00000080: bf f4 ff 1b 11 ff 4b ff cf f2 df f2 ff 2c ff 2d
    00000090: ff df f1 ef f1 ff 1c ff 0f f1 ff 1d ff 1e ff cf
    000000a0: f2 cf f3 ff 1b 11 ff 2d ff cf f2 df f2 ff 2c ff
    000000b0: 1c 11 ff bf f3 df f2 ff 3b ff 12 1b 1b ff 3e ff
    000000c0: 3c ff df f1 cf f3 ff 3b ff 2d ff df f2 bf f3 ff
    000000d0: 2c ff 3c ff cf f4 5f 61 f1 ff 2c ff 1e ff cf f3
    000000e0: df f1 ff 2c ff 2d df f2 3b ff 2d 18 4f f2 1d ff
    000000f0: 2d ff df 11 f1 cf f1 ff 2c ff 2d ff cf f3 bf f3
    00000100: ff 3b ff 3c ff bf f2 ef 82 f2 ff 11 11 12 ff 1b
    00000110: 19 ff 2f f2 df f2 ff 1c 12 ff 1c ff bf 11 f1 ef
    00000120: f1 ff 1d ff 1e ff df f1 ef f1 ff 2c ff 2d ff bf
    00000130: 11 f1 df f2 ff 2d ff 1d ff df f1 ef f1 ff 1d ff
    00000140: 1e ff df f1 ef f1 ff 2c ff 1c 11 ff df f4 af f2
    00000150: ff 1d 21 ff 22 17 ff cf 42 f1 19 3d 9f 81 12 32
    00000160: e1 32 df 11 11 21 25 d1 11 f3 6f f1 9f 27 b1 f6
    00000170: 7f 83 71 91 42 11 5b 32 22 61 11 13 21 11 55 23
    00000180: ff cf b1 f9 ff ff 18 8c ff 18 ff 2d ff ff ff 2d
    00000190: ff ff 26 ff 23 ff df f1 22 9f f3 ff 2c 1f a2 e1
    000001a0: f1 3f f1 ff 9f f1 ff 1d 1b ff 31 ff 2a 5f f1 8f
    000001b0: f3 9f f3 20 ff 4b ff cf f1 ef f2 ff 1c ff 2e ff
    000001c0: cf f1 cf 11 f2 ff 1c 33 f1 ef
  UrbLink              = 00000000
[3977 ms] UsbSnoop - DispatchAny(f23a0610) : IRP_MJ_INTERNAL_DEVICE_CONTROL
[3977 ms] UsbSnoop - MyDispatchInternalIOCTL(f23a1e80) : fdo=825ad5b0, Irp=825b9b28, IRQL=2
[3977 ms]  >>>  URB 59 going down  >>> 
-- URB_FUNCTION_BULK_OR_INTERRUPT_TRANSFER:
  PipeHandle           = 825e6cdc [endpoint 0x00000082]
  TransferFlags        = 00000003 (USBD_TRANSFER_DIRECTION_IN, USBD_SHORT_TRANSFER_OK)
  TransferBufferLength = 0000041c
  TransferBuffer       = 825cc008
  TransferBufferMDL    = 00000000
  UrbLink              = 00000000
[4037 ms] UsbSnoop - MyInternalIOCTLCompletion(f23a1db0) : fido=00000000, Irp=825b9b28, Context=825affa8, IRQL=2
[4037 ms]  <<<  URB 59 coming back  <<< 
-- URB_FUNCTION_BULK_OR_INTERRUPT_TRANSFER:
  PipeHandle           = 825e6cdc [endpoint 0x00000082]
  TransferFlags        = 00000003 (USBD_TRANSFER_DIRECTION_IN, USBD_SHORT_TRANSFER_OK)
  TransferBufferLength = 000001d2
  TransferBuffer       = 825cc008
  TransferBufferMDL    = 825aed88
    00000000: 01 01 17 01 00 20 9b 02 00 00 02 00 00 00 68 00
    00000010: 50 00 00 00 bc 01 f0 18 41 ff af f3 cf f4 ff 49
    00000020: ff 2d ff bf f2 df f5 ff 29 16 11 33 21 af f4 13
    00000030: 13 f2 2d 5f 19 1f 52 17 ff 1d 14 2d 22 11 15 11
    00000040: 17 ff 1f 21 12 21 27 2f 5f 11 b1 31 11 11 12 ff
    00000050: 1a 3f 1e 11 62 25 41 f1 ff 31 3f 11 f1 37 ff af
    00000060: f3 8f 41 f3 ff 3a ff 3c ff cf f2 0f b1 f3 ff 2c
    00000070: ff 3d ff cf f1 cf 11 f2 ff 3a ff 3c ff cf f2 cf
    00000080: f4 ff 4a 16 ff 54 ff 9f 64 f1 4f f4 ff 3a ff 14
    00000090: 47 ff bf f3 19 0f f5 ff 2b 1a ff 32 ff bf f2 cf
    000000a0: 11 f2 ff 2b ff 3d ff bf f2 ef f2 ff 3b ff 3c ff
    000000b0: bf f2 cf f4 ff 3b ff 3b ff cf f2 df f3 ff 4a ff
    000000c0: 3c ff bf f3 cf f4 18 ff 31 af f1 41 ff af f3 cf
    000000d0: f3 ff 4a ff 3c ff af 64 f1 5f f3 5f f1 44 16 ff
    000000e0: 35 ff bf f3 cf 34 f2 ff 35 ff 2d ff bf f3 df f2
    000000f0: ff 2c ff 3c ff 2b 3d ff 3c 6f f1 24 3d ff 3c ff
    00000100: bf f3 cf f3 ff 4a ff 1b 21 ff af f4 bf f5 ff 3a
    00000110: ff 3c ff bf f3 bf f4 26 ff 33 ff 4b 7f f1 3f f3
    00000120: cf f3 ff 1c ff 3d ff bf f3 df f2 ff 1a 21 ff 2d
    00000130: ff bf f3 cf f3 ff 3b ff 2d ff bf f3 df f3 ff 3a
    00000140: ff 3d ff af f3 ff ff bf f3 df f2 ff 2c ff 2d ff
    00000150: bf f3 df f2 ff 3b 2e bf f4 ff 1b 0f f2 14 27 ff
    00000160: bf f3 12 17 1f f4 18 19 11 11 2f 23 12 ff 25 14
    00000170: 6f f1 0f f2 bf 13 f1 3e 1e 17 31 df 81 12 12 81
    00000180: f1 21 19 16 d3 42 f1 17 0f f3 98 9f f2 df f3 89
    00000190: 9f f2 ef f2 ff 1b ff 3e ff bf f2 26 12 1f f3 ff
    000001a0: 3b ff 20 59 ff bf f2 0f a2 f4 1f f1 ff 9f f3 ff
    000001b0: 2b ff 4c ff 8f f5 df f3 ff 37 21 af 71 81 f4 ff
    000001c0: 18 22 af f1 32 ff bf f2 cf f4 ff 2b ff 5b ff bf
    000001d0: f2 11
  UrbLink              = 00000000
[4037 ms] UsbSnoop - DispatchAny(f23a0610) : IRP_MJ_INTERNAL_DEVICE_CONTROL
[4037 ms] UsbSnoop - MyDispatchInternalIOCTL(f23a1e80) : fdo=825ad5b0, Irp=825b9b28, IRQL=2
[4037 ms]  >>>  URB 60 going down  >>> 
-- URB_FUNCTION_BULK_OR_INTERRUPT_TRANSFER:
  PipeHandle           = 825e6cdc [endpoint 0x00000082]
  TransferFlags        = 00000003 (USBD_TRANSFER_DIRECTION_IN, USBD_SHORT_TRANSFER_OK)
  TransferBufferLength = 0000041c
  TransferBuffer       = 825cc008
  TransferBufferMDL    = 00000000
  UrbLink              = 00000000
[4084 ms] UsbSnoop - MyInternalIOCTLCompletion(f23a1db0) : fido=00000000, Irp=825b9b28, Context=825f0b68, IRQL=2
[4084 ms]  <<<  URB 60 coming back  <<< 
-- URB_FUNCTION_BULK_OR_INTERRUPT_TRANSFER:
  PipeHandle           = 825e6cdc [endpoint 0x00000082]
  TransferFlags        = 00000003 (USBD_TRANSFER_DIRECTION_IN, USBD_SHORT_TRANSFER_OK)
  TransferBufferLength = 000001d6
  TransferBuffer       = 825cc008
  TransferBufferMDL    = 825aed88
    00000000: 01 01 17 01 00 20 a8 02 00 00 02 00 00 00 68 00
    00000010: 50 00 00 00 c0 01 c0 14 f1 ff 37 ff 3e ff 9f f3
    00000020: ef f3 ff 39 ff 2e ff af 32 12 21 8f 3d 6f 31 15
    00000030: 11 4f f2 4f 19 33 11 44 11 b1 f1 1d 6f 11 11 17
    00000040: 23 11 42 f1 bf 41 41 27 ff 71 f1 14 32 11 11 61
    00000050: f1 1c ff 61 67 12 ff 4f f2 ef f2 ff 3a ff 2e ff
    00000060: bf f2 ef f3 ff 1b ff 1e 11 ff bf f1 ef f2 ff 2b
    00000070: ff 2e ff bf f2 ef f1 ff 2c ff 5d ff 5f 31 f3 5f
    00000080: 51 11 f3 ff 39 ff 4d ff 9f f3 ef c2 f1 df f3 8f
    00000090: 21 21 f2 ff 2a 2a ff 32 ff bf f2 ff ff cf e1 f1
    000000a0: 0f f1 ff 2b ff 3e ff af f3 ef f2 ff 39 ff 3e ff
    000000b0: af f3 ef f1 ff 4b ff 1e ff af f3 df f3 ff 3a ff
    000000c0: 3d 1d 8f f1 22 ff 3e ff af f2 af 31 f3 ff 3a ff
    000000d0: 3d ff bf f2 ef f2 ff 2b ff 3e ff af f2 ef f2 13
    000000e0: ff 36 ff 2e ff af f2 ff 20 ff bf f2 df f3 ff 49
    000000f0: ff 3d ff 24 3f f4 df f3 ff 2b ff 3d ff af f3 ef
    00000100: f2 ff 3a ff 4d ff af f2 df f3 ff 3a ff 3d ff 24
    00000110: 5f f2 df f3 4f f2 34 ff 3d ff bf f2 df f3 ff 3a
    00000120: ff ff ff 3b ff 0f f1 ff 1b ff 1e 11 ff af f3 df
    00000130: f3 ff 2b ff 0f f1 ff 2b ff 1d 11 ff af f3 ff 20
    00000140: ff 9f 11 f1 ff 10 ff bf f2 ef f2 ff 2b ff 0f 11
    00000150: f1 ff 29 df e2 f2 ff 2b df d2 11 f3 ff 17 21 ff
    00000160: 11 4b 19 3e 16 21 3f 32 11 ff 11 13 11 ff 0f f3
    00000170: ff 14 13 31 ff 5b 32 11 12 1a bf 11 11 55 11 71
    00000180: 51 21 43 44 21 43 1a 1e ff 11 ff 97 ff bf f3 7f
    00000190: 98 f1 ff 12 ff ff ff 3c ff af f1 2f 31 22 41 f3
    000001a0: ff 2a ff 4d 18 ff 2f f1 ef a2 f1 16 8f f2 ef f3
    000001b0: ff 1b ff 0f f2 ff 3a 28 ff 52 ff 9f 73 f3 1d 44
    000001c0: ff 8f f3 df 11 f3 ff 29 ff 0f f3 ff 29 ff 1b 51
    000001d0: ff 9f f2 ff 11 f3
  UrbLink              = 00000000
[4084 ms] UsbSnoop - DispatchAny(f23a0610) : IRP_MJ_INTERNAL_DEVICE_CONTROL
[4084 ms] UsbSnoop - MyDispatchInternalIOCTL(f23a1e80) : fdo=825ad5b0, Irp=825b9b28, IRQL=2
[4084 ms]  >>>  URB 61 going down  >>> 
-- URB_FUNCTION_BULK_OR_INTERRUPT_TRANSFER:
  PipeHandle           = 825e6cdc [endpoint 0x00000082]
  TransferFlags        = 00000003 (USBD_TRANSFER_DIRECTION_IN, USBD_SHORT_TRANSFER_OK)
  TransferBufferLength = 0000041c
  TransferBuffer       = 825cc008
  TransferBufferMDL    = 00000000
  UrbLink              = 00000000
[4162 ms] UsbSnoop - MyInternalIOCTLCompletion(f23a1db0) : fido=00000000, Irp=825b9b28, Context=825d5888, IRQL=2
[4163 ms]  <<<  URB 61 coming back  <<< 
-- URB_FUNCTION_BULK_OR_INTERRUPT_TRANSFER:
  PipeHandle           = 825e6cdc [endpoint 0x00000082]
  TransferFlags        = 00000003 (USBD_TRANSFER_DIRECTION_IN, USBD_SHORT_TRANSFER_OK)
  TransferBufferLength = 000001da
  TransferBuffer       = 825cc008
  TransferBufferMDL    = 825aed88
    00000000: 01 01 17 01 00 20 b6 02 00 00 02 00 00 00 68 00
    00000010: 50 00 00 00 c4 01 f3 ff 48 ff 2e ff 9f f3 ff 30
    00000020: ff 8f f3 ff 11 ff af a2 42 16 7f 11 ff 35 31 11
    00000030: 31 11 34 f1 ef 11 17 17 71 f1 1c 11 cf 22 12 11
    00000040: 11 39 f5 cf 12 24 1b ff f3 14 16 23 f4 17 ff 0f
    00000050: 26 12 51 f2 9f f1 ff 11 ff 9f f3 ff 20 ff af f2
    00000060: ff 20 ff af f2 ff 20 ff af f2 ff 11 ff af f2 ff
    00000070: 11 ff af f2 ff 11 ff af f2 ff 30 ff 9f 73 f1 6f
    00000080: f3 ff 39 1a 8f 91 f2 ff 3a ff 2e af f1 0f f2 ef
    00000090: f3 cf c1 a2 f1 4f f1 ff 2b ff 0f f1 ff bf f1 1f
    000000a0: f1 ff 2b ff 2e ff af f3 ef f2 ff 1b ff 0f f2 ff
    000000b0: 2b ff 0f f1 ff 3a ff 0f f1 ff 3a ff 3e ff af f2
    000000c0: ff 10 cf f1 18 33 ff 2e ff af f3 ef f2 ff 2b ff
    000000d0: 12 3b ff 9f f3 5f 81 f4 ff 38 ff 2e ff af 11 f1
    000000e0: ef f2 1f f2 37 ff 0f f2 ff 2a ff 0f f2 ff 2a ff
    000000f0: 3e ff af a2 f2 2f f3 ff 22 26 2a ff 23 ff bf f1
    00000100: ef f3 ff 2a ff 3e ff 9f f3 ef f2 ff 3a ff 0f f2
    00000110: ff 2a ff 3e ff 2f 62 f2 ef f2 ff 14 35 ff 0f f1
    00000120: ff 2b ff 0f f2 ff 2a ff 0f f1 ff 1c ff 2e ff bf
    00000130: f2 ff 20 ff af f2 ff 20 ff bf f1 ff 20 ff bf f1
    00000140: ff 20 ff 9f f3 ff ff df f1 ff 10 ff cf f2 ef f3
    00000150: ff 29 ff 0f f2 ff 2a ff 5c ff af f2 cf 12 f2 ff
    00000160: 2a ff 0f 62 11 e1 21 21 14 22 f2 20 33 f1 1a 1b
    00000170: 12 ff 5f 11 f2 ff 11 1d ff 11 13 73 ff 28 13 13
    00000180: 11 11 13 12 12 11 11 12 24 31 16 11 31 31 32 a4
    00000190: 61 f1 3a ff 4f f9 df f2 ff 86 ff 2d ff ff ff 3c
    000001a0: ff af f1 ef 14 f2 ff 17 ff 4e 2a 19 ff 23 ff 2e
    000001b0: 2b 1a 17 9f f1 ff 10 ff bf f2 ff 30 ff 9f f3 27
    000001c0: 5f f3 ff 39 6f f3 44 1d ff 3a ff 0f f2 ff 39 ff
    000001d0: 3e 1d ff 3a ff 4d ff 8f f5 cf
  UrbLink              = 00000000
[4163 ms] UsbSnoop - DispatchAny(f23a0610) : IRP_MJ_INTERNAL_DEVICE_CONTROL
[4163 ms] UsbSnoop - MyDispatchInternalIOCTL(f23a1e80) : fdo=825ad5b0, Irp=825b9b28, IRQL=2
[4163 ms]  >>>  URB 62 going down  >>> 
-- URB_FUNCTION_BULK_OR_INTERRUPT_TRANSFER:
  PipeHandle           = 825e6cdc [endpoint 0x00000082]
  TransferFlags        = 00000003 (USBD_TRANSFER_DIRECTION_IN, USBD_SHORT_TRANSFER_OK)
  TransferBufferLength = 0000041c
  TransferBuffer       = 825cc008
  TransferBufferMDL    = 00000000
  UrbLink              = 00000000
[4338 ms] UsbSnoop - MyInternalIOCTLCompletion(f23a1db0) : fido=00000000, Irp=825b9008, Context=825b2be8, IRQL=2
[4338 ms]  <<<  URB 10 coming back  <<< 
-- URB_FUNCTION_BULK_OR_INTERRUPT_TRANSFER:
  PipeHandle           = 825e6cc0 [endpoint 0x00000081]
  TransferFlags        = 00000003 (USBD_TRANSFER_DIRECTION_IN, USBD_SHORT_TRANSFER_OK)
  TransferBufferLength = 00000007
  TransferBuffer       = 825e1be8
  TransferBufferMDL    = 825e6988
    00000000: 01 01 17 01 00 30 04
  UrbLink              = 00000000
[4338 ms] UsbSnoop - DispatchAny(f23a0610) : IRP_MJ_INTERNAL_DEVICE_CONTROL
[4338 ms] UsbSnoop - MyDispatchInternalIOCTL(f23a1e80) : fdo=825ad5b0, Irp=825b9008, IRQL=2
[4338 ms]  >>>  URB 63 going down  >>> 
-- URB_FUNCTION_BULK_OR_INTERRUPT_TRANSFER:
  PipeHandle           = 825e6cc0 [endpoint 0x00000081]
  TransferFlags        = 00000003 (USBD_TRANSFER_DIRECTION_IN, USBD_SHORT_TRANSFER_OK)
  TransferBufferLength = 00000008
  TransferBuffer       = 825e1be8
  TransferBufferMDL    = 00000000
  UrbLink              = 00000000
[4377 ms] UsbSnoop - MyInternalIOCTLCompletion(f23a1db0) : fido=00000000, Irp=825b9008, Context=8268ec48, IRQL=2
[4377 ms]  <<<  URB 63 coming back  <<< 
-- URB_FUNCTION_BULK_OR_INTERRUPT_TRANSFER:
  PipeHandle           = 825e6cc0 [endpoint 0x00000081]
  TransferFlags        = 00000003 (USBD_TRANSFER_DIRECTION_IN, USBD_SHORT_TRANSFER_OK)
  TransferBufferLength = 00000007
  TransferBuffer       = 825e1be8
  TransferBufferMDL    = 825e6988
    00000000: 01 01 17 01 00 30 00
  UrbLink              = 00000000
[4377 ms] UsbSnoop - DispatchAny(f23a0610) : IRP_MJ_INTERNAL_DEVICE_CONTROL
[4377 ms] UsbSnoop - MyDispatchInternalIOCTL(f23a1e80) : fdo=825ad5b0, Irp=825b9008, IRQL=2
[4377 ms]  >>>  URB 64 going down  >>> 
-- URB_FUNCTION_BULK_OR_INTERRUPT_TRANSFER:
  PipeHandle           = 825e6cc0 [endpoint 0x00000081]
  TransferFlags        = 00000003 (USBD_TRANSFER_DIRECTION_IN, USBD_SHORT_TRANSFER_OK)
  TransferBufferLength = 00000008
  TransferBuffer       = 825e1be8
  TransferBufferMDL    = 00000000
  UrbLink              = 00000000
[4378 ms] UsbSnoop - MyInternalIOCTLCompletion(f23a1db0) : fido=00000000, Irp=825b9b28, Context=8261dbc8, IRQL=2
[4378 ms]  <<<  URB 62 coming back  <<< 
-- URB_FUNCTION_BULK_OR_INTERRUPT_TRANSFER:
  PipeHandle           = 825e6cdc [endpoint 0x00000082]
  TransferFlags        = 00000003 (USBD_TRANSFER_DIRECTION_IN, USBD_SHORT_TRANSFER_OK)
  TransferBufferLength = 0000012e
  TransferBuffer       = 825cc008
  TransferBufferMDL    = 825aed88
    00000000: 01 01 17 01 00 20 b6 02 00 00 02 00 00 00 68 00
    00000010: 50 00 00 00 18 01 ff ff ff ff ff ff ff ff ff ff
    00000020: ff ff ff ff ff ff ff ff ff ff ff ff ff ff ff ff
    00000030: ff ff ff ff ff ff ff ff ff ff ff ff ff ff ff ff
    00000040: ff ff ff ff ff ff ff ff ff ff ff ff ff ff ff ff
    00000050: ff ff ff ff ff ff ff ff ff ff ff ff ff ff ff ff
    00000060: ff ff ff ff ff ff ff ff ff ff ff ff ff ff ff ff
    00000070: ff ff ff ff ff ff ff ff ff ff ff ff ff ff ff ff
    00000080: ff ff ff ff ff ff ff ff ff ff ff ff ff ff ff ff
    00000090: ff ff ff ff ff ff ff ff ff ff ff ff ff ff ff ff
    000000a0: ff ff ff ff ff ff ff ff ff ff ff ff ff ff ff ff
    000000b0: ff ff ff ff ff ff ff ff ff ff ff ff ff ff ff ff
    000000c0: ff ff ff ff ff ff ff ff ff ff ff ff ff ff ff ff
    000000d0: ff ff ff ff ff ff ff ff ff ff ff ff ff ff ff ff
    000000e0: ff ff ff ff ff ff ff ff ff ff ff ff ff ff ff ff
    000000f0: ff ff ff ff ff ff ff ff ff ff ff ff ff ff ff ff
    00000100: ff ff ff ff ff ff ff ff ff ff ff ff ff ff ff ff
    00000110: ff ff ff ff ff ff ff ff ff ff ff ff ff ff ff ff
    00000120: ff ff ff ff ff ff ff ff ff ff ff aa ff ff
  UrbLink              = 00000000
[4378 ms] UsbSnoop - DispatchAny(f23a0610) : IRP_MJ_INTERNAL_DEVICE_CONTROL
[4378 ms] UsbSnoop - MyDispatchInternalIOCTL(f23a1e80) : fdo=825ad5b0, Irp=825b9b28, IRQL=2
[4378 ms]  >>>  URB 65 going down  >>> 
-- URB_FUNCTION_BULK_OR_INTERRUPT_TRANSFER:
  PipeHandle           = 825e6cdc [endpoint 0x00000082]
  TransferFlags        = 00000003 (USBD_TRANSFER_DIRECTION_IN, USBD_SHORT_TRANSFER_OK)
  TransferBufferLength = 0000041c
  TransferBuffer       = 825cc008
  TransferBufferMDL    = 00000000
  UrbLink              = 00000000
[4381 ms] UsbSnoop - MyInternalIOCTLCompletion(f23a1db0) : fido=00000000, Irp=825b9b28, Context=825f4d88, IRQL=2
[4382 ms]  <<<  URB 65 coming back  <<< 
-- URB_FUNCTION_BULK_OR_INTERRUPT_TRANSFER:
  PipeHandle           = 825e6cdc [endpoint 0x00000082]
  TransferFlags        = 00000003 (USBD_TRANSFER_DIRECTION_IN, USBD_SHORT_TRANSFER_OK)
  TransferBufferLength = 00000006
  TransferBuffer       = 825cc008
  TransferBufferMDL    = 825aed88
    00000000: 01 01 17 01 02 20
  UrbLink              = 00000000
[4382 ms] UsbSnoop - DispatchAny(f23a0610) : IRP_MJ_INTERNAL_DEVICE_CONTROL
[4382 ms] UsbSnoop - MyDispatchInternalIOCTL(f23a1e80) : fdo=825ad5b0, Irp=825b9b28, IRQL=2
[4382 ms]  >>>  URB 66 going down  >>> 
-- URB_FUNCTION_BULK_OR_INTERRUPT_TRANSFER:
  PipeHandle           = 825e6cdc [endpoint 0x00000082]
  TransferFlags        = 00000003 (USBD_TRANSFER_DIRECTION_IN, USBD_SHORT_TRANSFER_OK)
  TransferBufferLength = 0000041c
  TransferBuffer       = 825cc008
  TransferBufferMDL    = 00000000
  UrbLink              = 00000000
