[0 ms] UsbSnoop compiled on Jan 18 2003 22:41:32 loading
[0 ms] UsbSnoop - DriverEntry(f2342c40) : Windows NT WDM version 1.16
[27 ms] UsbSnoop - AddDevice(f2342f50) : DriverObject 827873d0, pdo 825ffaf0
[27 ms] UsbSnoop - DispatchAny(f2340610) : IRP_MJ_PNP (0x00000018)
[27 ms] UsbSnoop - MyDispatchPNP(f2342ee0) : IRP_MJ_PNP (0x00000018)
[27 ms] UsbSnoop - DispatchAny(f2340610) : IRP_MJ_PNP (IRP_MN_QUERY_RESOURCE_REQUIREMENTS)
[27 ms] UsbSnoop - MyDispatchPNP(f2342ee0) : IRP_MJ_PNP (IRP_MN_QUERY_RESOURCE_REQUIREMENTS)
[28 ms] UsbSnoop - DispatchAny(f2340610) : IRP_MJ_PNP (IRP_MN_FILTER_RESOURCE_REQUIREMENTS)
[28 ms] UsbSnoop - MyDispatchPNP(f2342ee0) : IRP_MJ_PNP (IRP_MN_FILTER_RESOURCE_REQUIREMENTS)
[28 ms] UsbSnoop - DispatchAny(f2340610) : IRP_MJ_PNP (IRP_MN_START_DEVICE)
[28 ms] UsbSnoop - MyDispatchPNP(f2342ee0) : IRP_MJ_PNP (IRP_MN_START_DEVICE)
[28 ms] UsbSnoop - DispatchAny(f2340610) : IRP_MJ_INTERNAL_DEVICE_CONTROL
[28 ms] UsbSnoop - MyDispatchInternalIOCTL(f2341e80) : fdo=825ffaf0, Irp=82521608, IRQL=0
[28 ms] >>> URB 1 going down >>>
-- URB_FUNCTION_GET_DESCRIPTOR_FROM_DEVICE:
TransferBufferLength = 00000012
TransferBuffer = 8252f068
TransferBufferMDL = 00000000
Index = 00000000
DescriptorType = 00000001 (USB_DEVICE_DESCRIPTOR_TYPE)
LanguageId = 00000000
[33 ms] UsbSnoop - MyInternalIOCTLCompletion(f2341db0) : fido=00000000, Irp=82521608, Context=8251e948, IRQL=2
[33 ms] <<< URB 1 coming back <<<
-- URB_FUNCTION_CONTROL_TRANSFER:
PipeHandle = 824f2b74
TransferFlags = 005c0077 (USBD_TRANSFER_DIRECTION_IN, USBD_SHORT_TRANSFER_OK)
TransferBufferLength = 00000012
TransferBuffer = 8252f068
TransferBufferMDL = 82644068
00000000: 12 01 00 02 ff 00 00 08 93 0a 02 00 17 01 01 02
00000010: 03 01
UrbLink = 00000000
SetupPacket =
00000000: 80 06 00 01 00 00 12 00
[33 ms] UsbSnoop - DispatchAny(f2340610) : IRP_MJ_INTERNAL_DEVICE_CONTROL
[33 ms] UsbSnoop - MyDispatchInternalIOCTL(f2341e80) : fdo=825ffaf0, Irp=82521608, IRQL=0
[33 ms] >>> URB 2 going down >>>
-- URB_FUNCTION_GET_DESCRIPTOR_FROM_DEVICE:
TransferBufferLength = 00000209
TransferBuffer = 824f3008
TransferBufferMDL = 00000000
Index = 00000000
DescriptorType = 00000002 (USB_CONFIGURATION_DESCRIPTOR_TYPE)
LanguageId = 00000000
[43 ms] UsbSnoop - MyInternalIOCTLCompletion(f2341db0) : fido=00000000, Irp=82521608, Context=826386a8, IRQL=2
[43 ms] <<< URB 2 coming back <<<
-- URB_FUNCTION_CONTROL_TRANSFER:
PipeHandle = 824f2b74
TransferFlags = 005c0077 (USBD_TRANSFER_DIRECTION_IN, USBD_SHORT_TRANSFER_OK)
TransferBufferLength = 00000028
TransferBuffer = 824f3008
TransferBufferMDL = 82644068
00000000: 09 02 20 00 01 01 00 a0 64 09 04 00 00 02 ff 00
00000010: ff 00 07 05 81 03 08 00 01 07 05 82 03 40 00 01
00000020: 00 00 00 00 00 00 00 00
UrbLink = 00000000
SetupPacket =
00000000: 80 06 00 02 00 00 09 02
[43 ms] UsbSnoop - DispatchAny(f2340610) : IRP_MJ_INTERNAL_DEVICE_CONTROL
[43 ms] UsbSnoop - MyDispatchInternalIOCTL(f2341e80) : fdo=825ffaf0, Irp=82521608, IRQL=0
[43 ms] >>> URB 3 going down >>>
-- URB_FUNCTION_SELECT_CONFIGURATION:
ConfigurationDescriptor = 0x824f3008 (configure)
ConfigurationDescriptor : bLength = 9
ConfigurationDescriptor : bDescriptorType = 0x00000002
ConfigurationDescriptor : wTotalLength = 0x00000020
ConfigurationDescriptor : bNumInterfaces = 0x00000001
ConfigurationDescriptor : bConfigurationValue = 0x00000001
ConfigurationDescriptor : iConfiguration = 0x00000000
ConfigurationDescriptor : bmAttributes = 0x000000a0
ConfigurationDescriptor : MaxPower = 0x00000064
ConfigurationHandle = 0x005c0077
Interface[0]: Length = 56
Interface[0]: InterfaceNumber = 0
Interface[0]: AlternateSetting = 0
[46 ms] UsbSnoop - MyInternalIOCTLCompletion(f2341db0) : fido=00000000, Irp=82521608, Context=82561c08, IRQL=0
[46 ms] <<< URB 3 coming back <<<
-- URB_FUNCTION_SELECT_CONFIGURATION:
ConfigurationDescriptor = 0x824f3008 (configure)
ConfigurationDescriptor : bLength = 9
ConfigurationDescriptor : bDescriptorType = 0x00000002
ConfigurationDescriptor : wTotalLength = 0x00000020
ConfigurationDescriptor : bNumInterfaces = 0x00000001
ConfigurationDescriptor : bConfigurationValue = 0x00000001
ConfigurationDescriptor : iConfiguration = 0x00000000
ConfigurationDescriptor : bmAttributes = 0x000000a0
ConfigurationDescriptor : MaxPower = 0x00000064
ConfigurationHandle = 0xe11e4bc8
Interface[0]: Length = 56
Interface[0]: InterfaceNumber = 0
Interface[0]: AlternateSetting = 0
Interface[0]: Class = 0x000000ff
Interface[0]: SubClass = 0x00000000
Interface[0]: Protocol = 0x000000ff
Interface[0]: InterfaceHandle = 0x82563828
Interface[0]: NumberOfPipes = 2
Interface[0]: Pipes[0] : MaximumPacketSize = 0x00000008
Interface[0]: Pipes[0] : EndpointAddress = 0x00000081
Interface[0]: Pipes[0] : Interval = 0x00000001
Interface[0]: Pipes[0] : PipeType = 0x00000003 (UsbdPipeTypeInterrupt)
Interface[0]: Pipes[0] : PipeHandle = 0x82563840
Interface[0]: Pipes[0] : MaxTransferSize = 0x00001000
Interface[0]: Pipes[0] : PipeFlags = 0x00000000
Interface[0]: Pipes[1] : MaximumPacketSize = 0x00000040
Interface[0]: Pipes[1] : EndpointAddress = 0x00000082
Interface[0]: Pipes[1] : Interval = 0x00000001
Interface[0]: Pipes[1] : PipeType = 0x00000003 (UsbdPipeTypeInterrupt)
Interface[0]: Pipes[1] : PipeHandle = 0x8256385c
Interface[0]: Pipes[1] : MaxTransferSize = 0x00001000
Interface[0]: Pipes[1] : PipeFlags = 0x00000000
[47 ms] UsbSnoop - DispatchAny(f2340610) : IRP_MJ_PNP (IRP_MN_QUERY_CAPABILITIES)
[47 ms] UsbSnoop - MyDispatchPNP(f2342ee0) : IRP_MJ_PNP (IRP_MN_QUERY_CAPABILITIES)
[47 ms] UsbSnoop - DispatchAny(f2340610) : IRP_MJ_PNP (IRP_MN_QUERY_PNP_DEVICE_STATE)
[47 ms] UsbSnoop - MyDispatchPNP(f2342ee0) : IRP_MJ_PNP (IRP_MN_QUERY_PNP_DEVICE_STATE)
[47 ms] UsbSnoop - DispatchAny(f2340610) : IRP_MJ_PNP (IRP_MN_QUERY_DEVICE_RELATIONS)
[47 ms] UsbSnoop - MyDispatchPNP(f2342ee0) : IRP_MJ_PNP (IRP_MN_QUERY_DEVICE_RELATIONS)
[47 ms] UsbSnoop - DispatchAny(f2340610) : IRP_MJ_PNP (IRP_MN_QUERY_DEVICE_RELATIONS)
[47 ms] UsbSnoop - MyDispatchPNP(f2342ee0) : IRP_MJ_PNP (IRP_MN_QUERY_DEVICE_RELATIONS)
[49 ms] UsbSnoop - DispatchAny(f2340610) : IRP_MJ_INTERNAL_DEVICE_CONTROL
[49 ms] UsbSnoop - MyDispatchInternalIOCTL(f2341e80) : fdo=825ffaf0, Irp=82521608, IRQL=0
[49 ms] >>> URB 4 going down >>>
-- URB_FUNCTION_BULK_OR_INTERRUPT_TRANSFER:
PipeHandle = 82563840 [endpoint 0x00000081]
TransferFlags = 00000003 (USBD_TRANSFER_DIRECTION_IN, USBD_SHORT_TRANSFER_OK)
TransferBufferLength = 00000008
TransferBuffer = 82546168
TransferBufferMDL = 00000000
UrbLink = 00000000
[50 ms] UsbSnoop - DispatchAny(f2340610) : IRP_MJ_INTERNAL_DEVICE_CONTROL
[50 ms] UsbSnoop - MyDispatchInternalIOCTL(f2341e80) : fdo=825ffaf0, Irp=82701008, IRQL=0
[50 ms] >>> URB 5 going down >>>
-- URB_FUNCTION_BULK_OR_INTERRUPT_TRANSFER:
PipeHandle = 8256385c [endpoint 0x00000082]
TransferFlags = 00000003 (USBD_TRANSFER_DIRECTION_IN, USBD_SHORT_TRANSFER_OK)
TransferBufferLength = 0000041c
TransferBuffer = 826de3e8
TransferBufferMDL = 00000000
UrbLink = 00000000
[50 ms] UsbSnoop - DispatchAny(f2340610) : IRP_MJ_INTERNAL_DEVICE_CONTROL
[50 ms] UsbSnoop - MyDispatchInternalIOCTL(f2341e80) : fdo=825ffaf0, Irp=82609848, IRQL=0
[50 ms] >>> URB 6 going down >>>
-- URB_FUNCTION_VENDOR_DEVICE:
TransferFlags = 00000000 (USBD_TRANSFER_DIRECTION_OUT, ~USBD_SHORT_TRANSFER_OK)
TransferBufferLength = 00000000
TransferBuffer = 00000000
TransferBufferMDL = 00000000

no data supplied
UrbLink = 00000000
RequestTypeReservedBits = 00000000
Request = 000000fe
Value = 000000de
Index = 00000005
[53 ms] UsbSnoop - MyInternalIOCTLCompletion(f2341db0) : fido=00000000, Irp=82609848, Context=82542268, IRQL=2
[53 ms] <<< URB 6 coming back <<<
-- URB_FUNCTION_CONTROL_TRANSFER:
PipeHandle = 824f2b74
TransferFlags = 00000002 (USBD_TRANSFER_DIRECTION_OUT, USBD_SHORT_TRANSFER_OK)
TransferBufferLength = 00000000
TransferBuffer = 00000000
TransferBufferMDL = 00000000
UrbLink = 00000000
SetupPacket =
00000000: 40 fe de 00 05 00 00 00
[7930 ms] UsbSnoop - MyInternalIOCTLCompletion(f2341db0) : fido=00000000, Irp=82521608, Context=825a32e8, IRQL=2
[7930 ms] <<< URB 4 coming back <<<
-- URB_FUNCTION_BULK_OR_INTERRUPT_TRANSFER:
PipeHandle = 82563840 [endpoint 0x00000081]
TransferFlags = 00000003 (USBD_TRANSFER_DIRECTION_IN, USBD_SHORT_TRANSFER_OK)
TransferBufferLength = 00000007
TransferBuffer = 82546168
TransferBufferMDL = 82644068
00000000: 01 01 17 01 00 30 05
UrbLink = 00000000
[7930 ms] UsbSnoop - DispatchAny(f2340610) : IRP_MJ_INTERNAL_DEVICE_CONTROL
[7930 ms] UsbSnoop - MyDispatchInternalIOCTL(f2341e80) : fdo=825ffaf0, Irp=82521608, IRQL=2
[7930 ms] >>> URB 7 going down >>>
-- URB_FUNCTION_BULK_OR_INTERRUPT_TRANSFER:
PipeHandle = 82563840 [endpoint 0x00000081]
TransferFlags = 00000003 (USBD_TRANSFER_DIRECTION_IN, USBD_SHORT_TRANSFER_OK)
TransferBufferLength = 00000008
TransferBuffer = 82546168
TransferBufferMDL = 00000000
UrbLink = 00000000
[7941 ms] UsbSnoop - MyInternalIOCTLCompletion(f2341db0) : fido=00000000, Irp=82701008, Context=825364a8, IRQL=2
[7941 ms] <<< URB 5 coming back <<<
-- URB_FUNCTION_BULK_OR_INTERRUPT_TRANSFER:
PipeHandle = 8256385c [endpoint 0x00000082]
TransferFlags = 00000003 (USBD_TRANSFER_DIRECTION_IN, USBD_SHORT_TRANSFER_OK)
TransferBufferLength = 00000006
TransferBuffer = 826de3e8
TransferBufferMDL = 8255c128
00000000: 01 01 17 01 01 20
UrbLink = 00000000
[7941 ms] UsbSnoop - DispatchAny(f2340610) : IRP_MJ_INTERNAL_DEVICE_CONTROL
[7941 ms] UsbSnoop - MyDispatchInternalIOCTL(f2341e80) : fdo=825ffaf0, Irp=82701008, IRQL=2
[7941 ms] >>> URB 8 going down >>>
-- URB_FUNCTION_BULK_OR_INTERRUPT_TRANSFER:
PipeHandle = 8256385c [endpoint 0x00000082]
TransferFlags = 00000003 (USBD_TRANSFER_DIRECTION_IN, USBD_SHORT_TRANSFER_OK)
TransferBufferLength = 0000041c
TransferBuffer = 826de3e8
TransferBufferMDL = 00000000
UrbLink = 00000000
[7978 ms] UsbSnoop - MyInternalIOCTLCompletion(f2341db0) : fido=00000000, Irp=82701008, Context=82546768, IRQL=2
[7978 ms] <<< URB 8 coming back <<<
-- URB_FUNCTION_BULK_OR_INTERRUPT_TRANSFER:
PipeHandle = 8256385c [endpoint 0x00000082]
TransferFlags = 00000003 (USBD_TRANSFER_DIRECTION_IN, USBD_SHORT_TRANSFER_OK)
TransferBufferLength = 0000014e
TransferBuffer = 826de3e8
TransferBufferMDL = 8255c128
00000000: 01 01 17 01 00 20 00 00 00 00 00 00 00 00 68 00
00000010: 50 00 00 00 38 01 f0 ff ff ff ff ff ff ff ff ff
00000020: ff ff ff ff ff ff ff ff ff ff ff ff ff ff ff ff
00000030: ff ff ff ff ff ff ff ff ff ff ff ff ff ff ff ff
00000040: ff ff ff ff ff ff ff ff ff ff ff ff ff ff ff ff
00000050: ff ff ff ff ff ff ff ff ff ff ff ff ff ff ff ff
00000060: ff ff ff ff ff ff ff ff ff ff ff ff ff ff ff ff
00000070: ff ff ff ff ff ff ff ff ff ff ff ff ff ff ff ff
00000080: ff ff ff ff ff ff ff ff ff ff ff ff ff ff ff 75
00000090: ff ff ff e3 ff ff df 2f ff ff cf 3f ff ff af 5f
000000a0: ff ff 9f 5f ff ff 8f 68 f7 ff ff 78 78 ff ff 7f
000000b0: 96 f7 ff ff 67 6a ff ff 6f a7 f6 ff ff 76 7a ff
000000c0: ff 5f a7 f7 ff ff 75 7a ff ff 5f a7 f7 ff ff 75
000000d0: 7a ff ff 6f a6 f7 ff ff 66 7a ff ff 5f a7 f7 ff
000000e0: ff 75 7a ff ff 5f a7 f7 ff ff 75 7a ff ff 6f a6
000000f0: f7 ff ff 75 7a ff ff 5f a7 f6 ff ff 67 6a ff ff
00000100: 7f 97 f6 ff ff 77 78 ff ff 7f 68 f8 ff ff f7 f6
00000110: ff ff f9 f5 ff ff f9 f5 ff 1f f7 f2 f3 ff ff fc
00000120: f1 ff ff 0f fc ff ff ff ff ff ff ff ff ff ff ff
00000130: ff ff ff ff ff ff ff ff ff ff ff ff ff ff ff ff
00000140: ff ff ff ff ff ff ff ff ff ff ff ff ff ff
UrbLink = 00000000
[7978 ms] UsbSnoop - DispatchAny(f2340610) : IRP_MJ_INTERNAL_DEVICE_CONTROL
[7978 ms] UsbSnoop - MyDispatchInternalIOCTL(f2341e80) : fdo=825ffaf0, Irp=82701008, IRQL=2
[7978 ms] >>> URB 9 going down >>>
-- URB_FUNCTION_BULK_OR_INTERRUPT_TRANSFER:
PipeHandle = 8256385c [endpoint 0x00000082]
TransferFlags = 00000003 (USBD_TRANSFER_DIRECTION_IN, USBD_SHORT_TRANSFER_OK)
TransferBufferLength = 0000041c
TransferBuffer = 826de3e8
TransferBufferMDL = 00000000
UrbLink = 00000000
[8329 ms] UsbSnoop - MyInternalIOCTLCompletion(f2341db0) : fido=00000000, Irp=82701008, Context=827cc288, IRQL=2
[8329 ms] <<< URB 9 coming back <<<
-- URB_FUNCTION_BULK_OR_INTERRUPT_TRANSFER:
PipeHandle = 8256385c [endpoint 0x00000082]
TransferFlags = 00000003 (USBD_TRANSFER_DIRECTION_IN, USBD_SHORT_TRANSFER_OK)
TransferBufferLength = 00000162
TransferBuffer = 826de3e8
TransferBufferMDL = 8255c128
00000000: 01 01 17 01 00 20 0d 00 00 00 02 00 00 00 68 00
00000010: 50 00 00 00 4c 01 f0 ff ff ff ff ff ff ff ff ff
00000020: ff ff ff ff ff ff ff ff ff ff ff ff ff ff ff ff
00000030: ff ff ff ff ff ff ff ff ff ff ff ff ff ff ff ff
00000040: ff ff ff ff ff ff ff ff ff ff ff ff ff ff ff ff
00000050: ff ff ff ff ff ff ff ff ff ff ff ff ff ff ff ff
00000060: ff ff ff ff ff ff ff ff ff ff ff ff ff ff ff ff
00000070: ff ff ff ff ff ff ff ff ff ff ff ff ff ff ff ff
00000080: ff ff ff ff ff 2b ff ff d7 3f f6 ff 5f 2f 0f f7
00000090: ff 5f 3f 8d ff ff f4 b5 f9 ff 4f 5f 9b ff ff a3
000000a0: 92 8a ff ff 75 68 7a ff ff 86 77 79 ff ff 75 79
000000b0: 69 ff ff 76 6a 69 ff ff 76 7a 68 ff ff 76 7a 68
000000c0: ff ff 76 7a 68 ff ff 66 7b 68 ff ff 66 7b 68 ff
000000d0: ff 66 7b 68 ff ff 76 7a 68 ff ff 66 7b 68 ff ff
000000e0: 66 7b 68 ff ff 66 7b 68 ff ff 76 7a 68 ff ff 76
000000f0: 7a 68 ff ff 76 7a 68 ff ff 76 7a 78 ff ff 75 6a
00000100: 79 ff ff 75 6a 79 ff ff 76 78 79 ff ff 76 78 8a
00000110: ff ff 94 94 9a ff ff f3 b6 f9 ff 4f 5f 8c ff ff
00000120: f4 c5 f8 ff 5f 3f 7e ff ff f7 f0 52 ff 9f 87 f9
00000130: ff ff ff ff ff ff ff ff ff ff ff ff ff ff ff ff
00000140: ff ff ff ff ff ff ff ff ff ff ff ff ff ff bf f1
00000150: ff ff ff ff ff ff ff ff ff ff ff ff ff ff 11 f1
00000160: ff ff
UrbLink = 00000000
[8329 ms] UsbSnoop - DispatchAny(f2340610) : IRP_MJ_INTERNAL_DEVICE_CONTROL
[8329 ms] UsbSnoop - MyDispatchInternalIOCTL(f2341e80) : fdo=825ffaf0, Irp=82701008, IRQL=2
[8329 ms] >>> URB 10 going down >>>
-- URB_FUNCTION_BULK_OR_INTERRUPT_TRANSFER:
PipeHandle = 8256385c [endpoint 0x00000082]
TransferFlags = 00000003 (USBD_TRANSFER_DIRECTION_IN, USBD_SHORT_TRANSFER_OK)
TransferBufferLength = 0000041c
TransferBuffer = 826de3e8
TransferBufferMDL = 00000000
UrbLink = 00000000
[8455 ms] UsbSnoop - MyInternalIOCTLCompletion(f2341db0) : fido=00000000, Irp=82701008, Context=82647068, IRQL=2
[8455 ms] <<< URB 10 coming back <<<
-- URB_FUNCTION_BULK_OR_INTERRUPT_TRANSFER:
PipeHandle = 8256385c [endpoint 0x00000082]
TransferFlags = 00000003 (USBD_TRANSFER_DIRECTION_IN, USBD_SHORT_TRANSFER_OK)
TransferBufferLength = 0000016a
TransferBuffer = 826de3e8
TransferBufferMDL = 8255c128
00000000: 01 01 17 01 00 20 1a 00 00 00 03 00 00 00 68 00
00000010: 50 00 00 00 54 01 f0 ff ff ff ff ff ff ff ff ff
00000020: ff ff ff ff ff ff ff ff ff ff ff ff ff ff ff ff
00000030: ff ff ff ff ff ff ff ff ff ff ff ff ff ff ff ff
00000040: ff ff ff ff ff ff ff ff ff ff ff ff ff ff ff ff
00000050: ff ff ff ff ff ff ff ff ff ff ff ff ff ff ff ff
00000060: ff ff ff ff ff ff ff ff ff ff ff ff ff ff ff ff
00000070: ff ff ff ff ff ff ff ff ff ff ff ff ff ff ff ff
00000080: ff ff ff 9f fc d4 ff df 1f 0f 1f ff bf 3f fd f3
00000090: ff f9 b5 5f ff 8f 5f fb f5 ff f8 a6 39 f8 ff 87
000000a0: 77 89 77 ff 6f 87 97 97 f6 ff 76 69 79 69 ff 5f
000000b0: a7 96 97 f6 ff 75 7a 78 79 ff 4f a7 87 a7 f6 ff
000000c0: 65 7a 68 7a ff 5f a6 87 a6 f7 ff 74 7a 68 7a ff
000000d0: 4f a7 87 a6 f7 ff 65 7a 68 7a ff 5f a6 87 a6 f7
000000e0: ff 65 7a 68 6b ff 5f a6 87 a6 f7 ff 74 7a 68 7a
000000f0: ff 4f a7 87 b6 f6 ff 65 7a 68 6b ff 5f a6 87 97
00000100: f7 ff 74 6a 79 79 ff 5f 97 96 97 f7 ff 75 78 79
00000110: 69 ff 6f 78 a7 77 f7 ff 96 85 9a a2 ff 7f 5f fb
00000120: f6 ff f7 b5 5f ff 9f 4f fc f4 ff f9 e3 2f ff cf
00000130: 0f 1f 0f ff ff 91 7f f8 ff 2f f8 ff ff ff ff ff
00000140: ff ff ff ff ff ff ff ff ff ff ff ff ff ff ff ff
00000150: ff ff ff ff ff ff ff ff ff ff 1c ff ff ff ff ff
00000160: ff ff ff ff ff ff ff ff ff 1f
UrbLink = 00000000
[8455 ms] UsbSnoop - DispatchAny(f2340610) : IRP_MJ_INTERNAL_DEVICE_CONTROL
[8455 ms] UsbSnoop - MyDispatchInternalIOCTL(f2341e80) : fdo=825ffaf0, Irp=82701008, IRQL=2
[8455 ms] >>> URB 11 going down >>>
-- URB_FUNCTION_BULK_OR_INTERRUPT_TRANSFER:
PipeHandle = 8256385c [endpoint 0x00000082]
TransferFlags = 00000003 (USBD_TRANSFER_DIRECTION_IN, USBD_SHORT_TRANSFER_OK)
TransferBufferLength = 0000041c
TransferBuffer = 826de3e8
TransferBufferMDL = 00000000
UrbLink = 00000000
[8507 ms] UsbSnoop - MyInternalIOCTLCompletion(f2341db0) : fido=00000000, Irp=82701008, Context=825a32e8, IRQL=2
[8507 ms] <<< URB 11 coming back <<<
-- URB_FUNCTION_BULK_OR_INTERRUPT_TRANSFER:
PipeHandle = 8256385c [endpoint 0x00000082]
TransferFlags = 00000003 (USBD_TRANSFER_DIRECTION_IN, USBD_SHORT_TRANSFER_OK)
TransferBufferLength = 0000016a
TransferBuffer = 826de3e8
TransferBufferMDL = 8255c128
00000000: 01 01 17 01 00 20 27 00 00 00 04 00 00 00 68 00
00000010: 50 00 00 00 54 01 f0 ff ff ff ff ff ff ff ff ff
00000020: ff ff ff ff ff ff ff ff ff ff ff ff ff ff ff ff
00000030: ff ff ff ff ff ff ff ff ff ff ff ff ff ff ff ff
00000040: ff ff ff ff ff ff ff ff ff ff ff ff ff ff ff ff
00000050: ff ff ff ff ff ff ff ff ff ff ff ff ff ff ff ff
00000060: ff ff ff ff ff ff ff ff ff ff ff ff ff ff ff ff
00000070: ff ff ff ff ff ff ff ff ff ff ff ff ff ff ff ff
00000080: 32 13 6f f9 ff 1f fe e2 ff cf 2f fe f3 ff fa d3
00000090: 3f ff 9f 5f fb f5 ff f8 b5 5f ff 7f 49 a8 68 f7
000000a0: ff 77 68 7a 78 ff 6f 96 97 96 f7 ff 76 78 69 6a
000000b0: ff 5f a7 96 a6 f6 ff 75 7a 68 6a ff 5f a7 87 a6
000000c0: f7 ff 74 7a 77 7a ff 4f a7 86 b6 f6 ff 65 6b 59
000000d0: 7b ff 4f b6 77 b6 f7 ff 55 7b 68 7a ff 4f b6 77
000000e0: a7 f6 ff 65 7b 68 7a ff 4f a7 86 a7 f6 ff 65 6b
000000f0: 69 7a ff 4f a7 87 a6 f6 ff 75 7a 77 6a ff 5f a7
00000100: 86 a7 f6 ff 75 79 78 6a ff 6f 96 97 97 f6 ff 76
00000110: 78 79 78 ff 6f 68 a7 59 f8 ff f6 b6 5f ff 8f 5f
00000120: fb f5 ff f8 b5 5f ff 9f 3f fd f3 ff fb f1 f0 f1
00000130: ff 0f fb c4 ff ff ff ff ff cf f7 ff ff ff ff ff
00000140: ff ff ff ff ff ff ff ff ff ff ff ff ff ff ff ff
00000150: ff ff ff ff ff ff ff ff ff ff 1d ff ff ff ff ff
00000160: ff ff ff ff ff ff ff ff ff 1f
UrbLink = 00000000
[8507 ms] UsbSnoop - DispatchAny(f2340610) : IRP_MJ_INTERNAL_DEVICE_CONTROL
[8507 ms] UsbSnoop - MyDispatchInternalIOCTL(f2341e80) : fdo=825ffaf0, Irp=82701008, IRQL=2
[8507 ms] >>> URB 12 going down >>>
-- URB_FUNCTION_BULK_OR_INTERRUPT_TRANSFER:
PipeHandle = 8256385c [endpoint 0x00000082]
TransferFlags = 00000003 (USBD_TRANSFER_DIRECTION_IN, USBD_SHORT_TRANSFER_OK)
TransferBufferLength = 0000041c
TransferBuffer = 826de3e8
TransferBufferMDL = 00000000
UrbLink = 00000000
[8544 ms] UsbSnoop - MyInternalIOCTLCompletion(f2341db0) : fido=00000000, Irp=82701008, Context=825364a8, IRQL=2
[8544 ms] <<< URB 12 coming back <<<
-- URB_FUNCTION_BULK_OR_INTERRUPT_TRANSFER:
PipeHandle = 8256385c [endpoint 0x00000082]
TransferFlags = 00000003 (USBD_TRANSFER_DIRECTION_IN, USBD_SHORT_TRANSFER_OK)
TransferBufferLength = 0000016e
TransferBuffer = 826de3e8
TransferBufferMDL = 8255c128
00000000: 01 01 17 01 00 20 35 00 00 00 04 00 00 00 68 00
00000010: 50 00 00 00 58 01 f0 ff ff ff ff ff ff ff ff ff
00000020: ff ff ff ff ff ff ff ff ff ff ff ff ff ff ff ff
00000030: ff ff ff ff ff ff ff ff ff ff ff ff ff ff ff ff
00000040: ff ff ff ff ff ff ff ff ff ff ff ff ff ff ff ff
00000050: ff ff ff ff ff ff ff ff ff ff ff ff ff ff ff ff
00000060: ff ff ff ff ff ff ff ff ff ff ff ff ff ff ff ff
00000070: ff ff ff ff ff ff ff ff ff ff ff ff ff ff ff 3f
00000080: 23 f1 98 ff ff e1 1f 0f ff cf 2f fe f2 ff fb c3
00000090: 3f ff af 4f fb f5 ff f9 b4 5f ff 8f 18 31 a8 67
000000a0: f8 ff 77 77 79 78 ff 7f 96 96 97 f6 ff 76 69 69
000000b0: 6a ff 6f 97 87 a6 f6 ff 76 79 68 7a ff 5f a6 87
000000c0: a6 f7 ff 65 7a 68 7a ff 5f a6 87 a6 f7 ff 65 7a
000000d0: 68 7a ff 5f a6 87 a6 f7 ff 65 7a 68 7a ff 5f a6
000000e0: 87 a6 f7 ff 65 7a 68 7a ff 5f a6 87 a6 f7 ff 65
000000f0: 7a 68 7a ff 5f a6 87 a6 f7 ff 75 79 68 7a ff 5f
00000100: 97 87 a6 f6 ff 76 69 69 6a ff 6f 97 96 97 f6 ff
00000110: 77 77 79 78 ff 7f 58 98 59 f8 ff f7 b5 6f ff 7f
00000120: 5f fb f5 ff f9 c4 4f ff 9f 3f fd f3 ff fc f0 f0
00000130: f1 ff 1f fa b5 ff ff ff ff ff ff 8b ff ff ff ff
00000140: ff ff ff ff ff ff ff ff ff ff ff ff ff ff ff ff
00000150: ff ff ff ff ff ff ff ff ff ff ff cf f1 ff ff ff
00000160: ff ff ff ff ff ff ff ff ff ff ff 11 f1 ff
UrbLink = 00000000
[8544 ms] UsbSnoop - DispatchAny(f2340610) : IRP_MJ_INTERNAL_DEVICE_CONTROL
[8544 ms] UsbSnoop - MyDispatchInternalIOCTL(f2341e80) : fdo=825ffaf0, Irp=82701008, IRQL=2
[8544 ms] >>> URB 13 going down >>>
-- URB_FUNCTION_BULK_OR_INTERRUPT_TRANSFER:
PipeHandle = 8256385c [endpoint 0x00000082]
TransferFlags = 00000003 (USBD_TRANSFER_DIRECTION_IN, USBD_SHORT_TRANSFER_OK)
TransferBufferLength = 0000041c
TransferBuffer = 826de3e8
TransferBufferMDL = 00000000
UrbLink = 00000000
[8587 ms] UsbSnoop - MyInternalIOCTLCompletion(f2341db0) : fido=00000000, Irp=82701008, Context=82546768, IRQL=2
[8587 ms] <<< URB 13 coming back <<<
-- URB_FUNCTION_BULK_OR_INTERRUPT_TRANSFER:
PipeHandle = 8256385c [endpoint 0x00000082]
TransferFlags = 00000003 (USBD_TRANSFER_DIRECTION_IN, USBD_SHORT_TRANSFER_OK)
TransferBufferLength = 0000016a
TransferBuffer = 826de3e8
TransferBufferMDL = 8255c128
00000000: 01 01 17 01 00 20 43 00 00 00 03 00 00 00 68 00
00000010: 50 00 00 00 54 01 f0 ff ff ff ff ff ff ff ff ff
00000020: ff ff ff ff ff ff ff ff ff ff ff ff ff ff ff ff
00000030: ff ff ff ff ff ff ff ff ff ff ff ff ff ff ff ff
00000040: ff ff ff ff ff ff ff ff ff ff ff ff ff ff ff ff
00000050: ff ff ff ff ff ff ff ff ff ff ff ff ff ff ff ff
00000060: ff ff ff ff ff ff ff ff ff ff ff ff ff ff ff ff
00000070: ff ff ff ff ff ff ff ff ff ff ff ff ff ff ff ff
00000080: ff ff 3f f6 a7 ff ff e1 1f 0f ff df 1f fe f2 ff
00000090: fb c3 4f ff af 3f fb f5 ff f9 a5 6f ff 8f 58 a7
000000a0: 77 f7 ff 68 68 6a 78 ff 7f 87 97 96 f6 ff 77 78
000000b0: 68 6a ff 7f a6 86 a6 f6 ff 67 6a 68 7a ff 6f a6
000000c0: 86 a6 f7 ff 66 6a 68 7a ff 6f a6 86 a6 f7 ff 66
000000d0: 6a 68 7a ff 6f a6 86 a6 f7 ff 66 6a 68 7a ff 6f
000000e0: a6 86 a6 f7 ff 56 6b 68 7a ff 6f a6 86 a6 f7 ff
000000f0: 66 6a 68 7a ff 6f a6 86 a6 f7 ff 66 79 68 7a ff
00000100: 6f a6 86 a6 f6 ff 67 79 78 69 ff 7f 87 87 97 f6
00000110: ff 87 76 79 78 ff 7f 3a a8 49 f8 ff f8 a5 5f ff
00000120: 9f 4f fb f5 ff fa c3 4f ff bf 1f fd f3 ff ed 0f
00000130: 0f ff ff 55 8f f9 ff ff bf f8 ff ff ff ff ff ff
00000140: ff ff ff ff ff ff ff ff ff ff ff ff ff ff ff ff
00000150: ff ff ff ff ff ff ff ff ff 1d ff ff ff ff ff ff
00000160: ff ff ff ff ff ff ff ff 1f 1d
UrbLink = 00000000
[8587 ms] UsbSnoop - DispatchAny(f2340610) : IRP_MJ_INTERNAL_DEVICE_CONTROL
[8588 ms] UsbSnoop - MyDispatchInternalIOCTL(f2341e80) : fdo=825ffaf0, Irp=82701008, IRQL=2
[8588 ms] >>> URB 14 going down >>>
-- URB_FUNCTION_BULK_OR_INTERRUPT_TRANSFER:
PipeHandle = 8256385c [endpoint 0x00000082]
TransferFlags = 00000003 (USBD_TRANSFER_DIRECTION_IN, USBD_SHORT_TRANSFER_OK)
TransferBufferLength = 0000041c
TransferBuffer = 826de3e8
TransferBufferMDL = 00000000
UrbLink = 00000000
[8713 ms] UsbSnoop - MyInternalIOCTLCompletion(f2341db0) : fido=00000000, Irp=82701008, Context=827cc288, IRQL=2
[8713 ms] <<< URB 14 coming back <<<
-- URB_FUNCTION_BULK_OR_INTERRUPT_TRANSFER:
PipeHandle = 8256385c [endpoint 0x00000082]
TransferFlags = 00000003 (USBD_TRANSFER_DIRECTION_IN, USBD_SHORT_TRANSFER_OK)
TransferBufferLength = 0000016e
TransferBuffer = 826de3e8
TransferBufferMDL = 8255c128
00000000: 01 01 17 01 00 20 50 00 00 00 03 00 00 00 68 00
00000010: 50 00 00 00 58 01 f0 ff ff ff ff ff ff ff ff ff
00000020: ff ff ff ff ff ff ff ff ff ff ff ff ff ff ff ff
00000030: ff ff ff ff ff ff ff ff ff ff ff ff ff ff ff ff
00000040: ff ff ff ff ff ff ff ff ff ff ff ff ff ff ff ff
00000050: ff ff ff ff ff ff ff ff ff ff ff ff ff ff ff ff
00000060: ff ff ff ff ff ff ff ff ff ff ff ff ff ff ff ff
00000070: ff ff ff ff ff ff ff ff ff ff ff ff ff ff ff ff
00000080: ff ff a3 4f fb ff 69 f1 f0 f0 f0 ff f6 d9 2f ff
00000090: 4f bf fb f3 ff f2 bd 4f ff 0f ef fa f5 ef 2f 77
000000a0: 79 77 ff fc 82 97 86 f7 cf 2f 69 69 78 ff fc 92
000000b0: 86 97 f6 bf 3f 69 78 69 ff 6c a1 79 77 79 ff 5b
000000c0: 83 7a 67 7a ff 4b 84 7a 67 7a ff 2b 86 6a 68 7a
000000d0: ff 4f a8 77 a6 f8 ff 83 7a 67 7a ff 4f a8 77 a6
000000e0: f7 ff 84 6a 68 7a ff 4f a8 86 a6 f6 ff 85 6a 68
000000f0: 6a ff 5f a8 86 a6 f7 ff 84 6a 68 6a ff 5f 99 86
00000100: 97 f6 ff 95 69 68 6a ff 5f 89 87 87 f7 ff a5 67
00000110: 79 78 ff 5f 6a 97 77 f7 ff f6 a8 5f ff 6f 8f fa
00000120: f5 ff f6 b7 5f ff 6f 7f fc f3 ff 57 f1 e0 2f ff
00000130: 7f 45 f9 e3 ff 9f f5 5f f6 ff ff ff 8c ff ff ff
00000140: ff ff ff ff ff ff ff ff ff ff ff ff ff ff ff ff
00000150: ff ff ff ff ff ff ff ff ff ff ff ff cf f1 ff ff
00000160: ff ff ff ff ff ff ff ff ff ff ff ff 11 f1
UrbLink = 00000000
[8713 ms] UsbSnoop - DispatchAny(f2340610) : IRP_MJ_INTERNAL_DEVICE_CONTROL
[8713 ms] UsbSnoop - MyDispatchInternalIOCTL(f2341e80) : fdo=825ffaf0, Irp=82701008, IRQL=2
[8713 ms] >>> URB 15 going down >>>
-- URB_FUNCTION_BULK_OR_INTERRUPT_TRANSFER:
PipeHandle = 8256385c [endpoint 0x00000082]
TransferFlags = 00000003 (USBD_TRANSFER_DIRECTION_IN, USBD_SHORT_TRANSFER_OK)
TransferBufferLength = 0000041c
TransferBuffer = 826de3e8
TransferBufferMDL = 00000000
UrbLink = 00000000
[8792 ms] UsbSnoop - MyInternalIOCTLCompletion(f2341db0) : fido=00000000, Irp=82701008, Context=82647068, IRQL=2
[8792 ms] <<< URB 15 coming back <<<
-- URB_FUNCTION_BULK_OR_INTERRUPT_TRANSFER:
PipeHandle = 8256385c [endpoint 0x00000082]
TransferFlags = 00000003 (USBD_TRANSFER_DIRECTION_IN, USBD_SHORT_TRANSFER_OK)
TransferBufferLength = 0000016e
TransferBuffer = 826de3e8
TransferBufferMDL = 8255c128
00000000: 01 01 17 01 00 20 5d 00 00 00 04 00 00 00 68 00
00000010: 50 00 00 00 58 01 f0 ff ff ff ff ff ff ff ff ff
00000020: ff ff ff ff ff ff ff ff ff ff ff ff ff ff ff ff
00000030: ff ff ff ff ff ff ff ff ff ff ff ff ff ff ff ff
00000040: ff ff ff ff ff ff ff ff ff ff ff ff ff ff ff ff
00000050: ff ff ff ff ff ff ff ff ff ff ff ff ff ff ff ff
00000060: ff ff ff ff ff ff ff ff ff ff ff ff ff ff ff ff
00000070: ff ff ff ff ff ff ff ff ff ff ff ff ff ff ff 1a
00000080: ff ff 3f f2 c2 ff 8f e6 e3 1f ff 5f d8 c4 3f ff
00000090: 2f da b5 3f ff 1f db a5 5f ff ce 5d 8a 84 ff dd
000000a0: 6d 79 67 ff ec 6d 69 68 ff ec 6d 68 69 ff ec 6d
000000b0: 68 79 ff fa d0 86 a6 f6 bf 16 d7 86 a6 f6 bf 34
000000c0: d7 86 96 f7 bf 43 d7 86 96 f7 cf 61 d6 86 96 f7
000000d0: ff 64 6d 68 79 ff 4f d6 86 96 f7 ff 64 6d 68 79
000000e0: ff 3f d7 86 a5 f7 ff 73 6d 68 79 ff 4f d6 86 96
000000f0: f7 ff 64 6d 68 79 ff 4f d6 86 96 f7 ff 64 6d 68
00000100: 79 ff 4f d6 86 96 f6 ff 65 5d 79 68 ff 5f d6 95
00000110: 77 f7 ff 74 5d 89 85 ff 5f d6 b4 4f ff 6f d6 b4
00000120: 4f ff 6f d6 b4 4f ff 6f d6 d3 2f ff 7f d6 f1 f1
00000130: f0 ff 68 ff a3 ff af f6 ff ff ff ff ff 86 ff ff
00000140: ff ff ff ff ff ff ff ff ff ff ff ff ff ff ff ff
00000150: ff ff ff ff ff ff ff ff ff ff ff ff ff cf f1 ff
00000160: ff ff ff ff ff ff ff ff ff ff ff ff ff 11
UrbLink = 00000000
[8792 ms] UsbSnoop - DispatchAny(f2340610) : IRP_MJ_INTERNAL_DEVICE_CONTROL
[8793 ms] UsbSnoop - MyDispatchInternalIOCTL(f2341e80) : fdo=825ffaf0, Irp=82701008, IRQL=2
[8793 ms] >>> URB 16 going down >>>
-- URB_FUNCTION_BULK_OR_INTERRUPT_TRANSFER:
PipeHandle = 8256385c [endpoint 0x00000082]
TransferFlags = 00000003 (USBD_TRANSFER_DIRECTION_IN, USBD_SHORT_TRANSFER_OK)
TransferBufferLength = 0000041c
TransferBuffer = 826de3e8
TransferBufferMDL = 00000000
UrbLink = 00000000
[8847 ms] UsbSnoop - MyInternalIOCTLCompletion(f2341db0) : fido=00000000, Irp=82701008, Context=825208c8, IRQL=2
[8847 ms] <<< URB 16 coming back <<<
-- URB_FUNCTION_BULK_OR_INTERRUPT_TRANSFER:
PipeHandle = 8256385c [endpoint 0x00000082]
TransferFlags = 00000003 (USBD_TRANSFER_DIRECTION_IN, USBD_SHORT_TRANSFER_OK)
TransferBufferLength = 00000182
TransferBuffer = 826de3e8
TransferBufferMDL = 8255c128
00000000: 01 01 17 01 00 20 6a 00 00 00 05 00 00 00 68 00
00000010: 50 00 00 00 6c 01 f0 ff ff ff ff ff ff ff ff ff
00000020: ff ff ff ff ff ff ff ff ff ff ff ff ff ff ff ff
00000030: ff ff ff ff ff ff ff ff ff ff ff ff ff ff ff ff
00000040: ff ff ff ff ff ff ff ff ff ff ff ff ff ff ff ff
00000050: ff ff ff ff ff ff ff ff ff ff ff ff ff ff ff ff
00000060: ff ff ff ff ff ff ff ff ff ff ff ff ff ff ff ff
00000070: ff ff ff ff ff ff ff ff ff ff ff ff ff ff 8f f9
00000080: ff 2b ff d5 ff 6f f7 39 f4 f1 ff 93 8f 34 3f ff
00000090: 1f fa 66 f3 f3 ff c0 4f 37 4f ff cd 4f 28 67 f7
000000a0: bf fe 93 62 68 ff eb 2f 2a 86 f6 bf fe a2 61 5a
000000b0: ff eb 2f 2a 95 f7 af 0f 1f 17 12 a6 f6 af 35 f7
000000c0: 51 23 61 79 ff 4a 74 1f 44 12 96 f7 af 53 f7 22
000000d0: 25 61 79 ff 3f f6 2a 51 7a ff 3f f6 2a 51 7a ff
000000e0: 3f f6 2a 51 7a ff 3f f6 2a 51 7a ff 3f f6 2a 51
000000f0: 7a ff 3f f6 1b 51 6a ff 4f f6 1b 51 6a ff 4f f6
00000100: 1b 61 69 ff 4f f6 1b 61 69 ff 4f f6 1b 61 69 ff
00000110: 4f f6 2a 61 69 ff 4f f6 1b 71 77 ff 4f f6 2a 81
00000120: 76 ff 4f f6 1b f2 f4 ff 65 af 22 4f ff 5f f6 2a
00000130: f3 f2 ff 66 af 32 2f ff 6f f6 2a f4 f0 ff 67 bf
00000140: 71 fa ff 69 bf f1 ff ff ff ff ff ff ff ff 87 ff
00000150: ff ff ff ff ff ff ff ff ff ff ff ff ff ff ff ff
00000160: ff ff ff ff ff ff ff ff ff ff ff ff ff ff cf f1
00000170: ff ff ff ff ff ff ff ff ff ff ff ff ff ff 11 f1
00000180: ff ff
UrbLink = 00000000
[8847 ms] UsbSnoop - DispatchAny(f2340610) : IRP_MJ_INTERNAL_DEVICE_CONTROL
[8847 ms] UsbSnoop - MyDispatchInternalIOCTL(f2341e80) : fdo=825ffaf0, Irp=82701008, IRQL=2
[8848 ms] >>> URB 17 going down >>>
-- URB_FUNCTION_BULK_OR_INTERRUPT_TRANSFER:
PipeHandle = 8256385c [endpoint 0x00000082]
TransferFlags = 00000003 (USBD_TRANSFER_DIRECTION_IN, USBD_SHORT_TRANSFER_OK)
TransferBufferLength = 0000041c
TransferBuffer = 826de3e8
TransferBufferMDL = 00000000
UrbLink = 00000000
[8952 ms] UsbSnoop - MyInternalIOCTLCompletion(f2341db0) : fido=00000000, Irp=82701008, Context=8251e948, IRQL=2
[8952 ms] <<< URB 17 coming back <<<
-- URB_FUNCTION_BULK_OR_INTERRUPT_TRANSFER:
PipeHandle = 8256385c [endpoint 0x00000082]
TransferFlags = 00000003 (USBD_TRANSFER_DIRECTION_IN, USBD_SHORT_TRANSFER_OK)
TransferBufferLength = 0000016a
TransferBuffer = 826de3e8
TransferBufferMDL = 8255c128
00000000: 01 01 17 01 00 20 77 00 00 00 06 00 00 00 68 00
00000010: 50 00 00 00 54 01 f0 ff ff ff ff ff ff ff ff ff
00000020: ff ff ff ff ff ff ff ff ff ff ff ff ff ff ff ff
00000030: ff ff ff ff ff ff ff ff ff ff ff ff ff ff ff ff
00000040: ff ff ff ff ff ff ff ff ff ff ff ff ff ff ff ff
00000050: ff ff ff ff ff ff ff ff ff ff ff ff ff ff ff ff
00000060: ff ff ff ff ff ff ff ff ff ff ff ff ff ff ff ff
00000070: ff ff ff ff ff ff ff ff ff ff ff 51 ff af f2 1f
00000080: a1 f7 ff 75 9f 97 f8 ff 83 8f 89 f9 ff a0 6f 8b
00000090: f9 ef fb c5 98 ff dd 3f bd f7 af fe d3 6d ff ea
000000a0: 2f 0f 6c ff ea 2f 0f 5d ff ea 2f 0f 5d ff 6a 62
000000b0: 2f 17 d7 f5 af 35 f6 62 72 6c ff 4a 64 2f 35 d6
000000c0: f6 af 53 f6 42 74 6c ff 3f f6 7a 6c ff 3f f6 7a
000000d0: 6c ff 3f f6 7a 6c ff 3f f6 7a 6c ff 3f f6 6a 6d
000000e0: ff 3f f6 7a 6c ff 3f f6 7a 6c ff 3f f6 7a 6c ff
000000f0: 3f f6 7a 6c ff 3f f6 7a 6c ff 3f f6 7a 6c ff 3f
00000100: f6 7a 6b ff 4f f6 7a 89 ff 4f f6 7a 98 ff 4f f6
00000110: 7a 88 ff 5f f6 7a 88 ff 5f f6 7a 78 ff 6f f6 6a
00000120: 69 ff 7f f6 7a 28 ff bf f6 6a ff ff ff 59 ff ff
00000130: ff ff ff ff ff ff ff 71 ff ff ff ff ff ff ff ff
00000140: ff ff ff ff ff ff ff ff ff ff ff ff ff ff ff ff
00000150: ff ff ff ff ff ff ff df f1 ff ff ff ff ff ff ff
00000160: ff ff ff ff ff ff ff 11 f1 ff
UrbLink = 00000000
[8953 ms] UsbSnoop - DispatchAny(f2340610) : IRP_MJ_INTERNAL_DEVICE_CONTROL
[8953 ms] UsbSnoop - MyDispatchInternalIOCTL(f2341e80) : fdo=825ffaf0, Irp=82701008, IRQL=2
[8953 ms] >>> URB 18 going down >>>
-- URB_FUNCTION_BULK_OR_INTERRUPT_TRANSFER:
PipeHandle = 8256385c [endpoint 0x00000082]
TransferFlags = 00000003 (USBD_TRANSFER_DIRECTION_IN, USBD_SHORT_TRANSFER_OK)
TransferBufferLength = 0000041c
TransferBuffer = 826de3e8
TransferBufferMDL = 00000000
UrbLink = 00000000
[9068 ms] UsbSnoop - MyInternalIOCTLCompletion(f2341db0) : fido=00000000, Irp=82701008, Context=825212e8, IRQL=2
[9068 ms] <<< URB 18 coming back <<<
-- URB_FUNCTION_BULK_OR_INTERRUPT_TRANSFER:
PipeHandle = 8256385c [endpoint 0x00000082]
TransferFlags = 00000003 (USBD_TRANSFER_DIRECTION_IN, USBD_SHORT_TRANSFER_OK)
TransferBufferLength = 0000016a
TransferBuffer = 826de3e8
TransferBufferMDL = 8255c128
00000000: 01 01 17 01 00 20 84 00 00 00 06 00 00 00 68 00
00000010: 50 00 00 00 54 01 f0 ff ff ff ff ff ff ff ff ff
00000020: ff ff ff ff ff ff ff ff ff ff ff ff ff ff ff ff
00000030: ff ff ff ff ff ff ff ff ff ff ff ff ff ff ff ff
00000040: ff ff ff ff ff ff ff ff ff ff ff ff ff ff ff ff
00000050: ff ff ff ff ff ff ff ff ff ff ff ff ff ff ff ff
00000060: ff ff ff ff ff ff ff ff ff ff ff ff ff ff ff ff
00000070: ff ff ff ff ff ff ff ff ff ff ff ff 1f f6 5b 3f
00000080: f4 df f8 79 2f f5 cf f9 88 2f f5 bf fa a6 2f f5
00000090: af fc b4 2f f5 9f fd c3 2f f5 8f fd d3 2f f5 7f
000000a0: fe e2 2f f5 7f fe f1 f0 52 ff e7 2f 0f 0f f6 7f
000000b0: 17 f6 62 72 0f f6 7f 35 f7 51 63 2f f5 7f 44 f6
000000c0: 42 64 2f f5 ff 60 2f 53 f6 52 ff 0f f6 6a 1f f6
000000d0: ff 60 af f6 61 ff 0f f6 6a 1f f6 ff 70 9f f6 ff
000000e0: 7f f6 6a ff ff 67 af f6 ff 7f f6 6a ff ff 67 af
000000f0: f6 ff 7f f6 6a ff ff 67 af f7 ff 6f f6 6a ff ff
00000100: 67 af f7 ff 6f f6 7a ff ff 66 af f6 ff 7f f6 6a
00000110: ff ff 67 af f6 61 ff 0f f6 6a 1f f6 ff 60 af f6
00000120: 61 ff 0f f6 6a 1f f6 ff 50 bf f6 61 ff ff ff 68
00000130: ff ff ff ff ff ff ff ff 7f f7 ff ff ff ff ff ff
00000140: ff ff ff ff ff ff ff ff ff ff ff ff ff ff ff ff
00000150: ff ff ff ff ff ff ff ff ff 1d ff ff ff ff ff ff
00000160: ff ff ff ff ff ff ff ff 1f 1d
UrbLink = 00000000
[9068 ms] UsbSnoop - DispatchAny(f2340610) : IRP_MJ_INTERNAL_DEVICE_CONTROL
[9068 ms] UsbSnoop - MyDispatchInternalIOCTL(f2341e80) : fdo=825ffaf0, Irp=82701008, IRQL=2
[9068 ms] >>> URB 19 going down >>>
-- URB_FUNCTION_BULK_OR_INTERRUPT_TRANSFER:
PipeHandle = 8256385c [endpoint 0x00000082]
TransferFlags = 00000003 (USBD_TRANSFER_DIRECTION_IN, USBD_SHORT_TRANSFER_OK)
TransferBufferLength = 0000041c
TransferBuffer = 826de3e8
TransferBufferMDL = 00000000
UrbLink = 00000000
[9121 ms] UsbSnoop - MyInternalIOCTLCompletion(f2341db0) : fido=00000000, Irp=82701008, Context=825364a8, IRQL=2
[9121 ms] <<< URB 19 coming back <<<
-- URB_FUNCTION_BULK_OR_INTERRUPT_TRANSFER:
PipeHandle = 8256385c [endpoint 0x00000082]
TransferFlags = 00000003 (USBD_TRANSFER_DIRECTION_IN, USBD_SHORT_TRANSFER_OK)
TransferBufferLength = 00000172
TransferBuffer = 826de3e8
TransferBufferMDL = 8255c128
00000000: 01 01 17 01 00 20 92 00 00 00 06 00 00 00 68 00
00000010: 50 00 00 00 5c 01 f0 ff ff ff ff ff ff ff ff ff
00000020: ff ff ff ff ff ff ff ff ff ff ff ff ff ff ff ff
00000030: ff ff ff ff ff ff ff ff ff ff ff ff ff ff ff ff
00000040: ff ff ff ff ff ff ff ff ff ff ff ff ff ff ff ff
00000050: ff ff ff ff ff ff ff ff ff ff ff ff ff ff ff ff
00000060: ff ff ff ff ff ff ff ff ff ff ff ff ff ff ff ff
00000070: ff ff ff ff ff ff ff ff ff ff ff ff 53 cf f4 73
00000080: 19 ff 81 8f f8 f1 f4 9e 7f f9 f2 f3 ad 5f fb f1
00000090: f4 cb 4f fc f1 f4 da 3f fd f1 f4 e9 2f fd f2 f3
000000a0: ea 1f 0f 1f f7 6f fe f1 f0 61 ff e7 1f 0f 1f f7
000000b0: 6f 16 f7 61 72 11 6e ff 47 64 1f 35 f6 b2 ff 32
000000c0: 65 1f 44 f6 e2 ff 67 2f 61 f6 f2 f1 5f f6 69 2f
000000d0: 2f ff 64 9f f7 f0 f4 3f f6 69 1f 4f ff 72 9f f6
000000e0: ab ff 61 af f6 8d ff 61 af f6 7e ff 61 af f7 6e
000000f0: ff 61 af f6 0f f6 1f f6 7a ef f6 1f f6 6a ff 60
00000100: ff 61 af f6 0f f6 1f f6 6a ef f7 1f f6 7a cf f8
00000110: 1f f6 7a bf f9 1f f6 6a 9f fb 2f f6 6a 1f 4f ff
00000120: 62 af f6 f1 f3 3f f6 6a 1f 2f ff 64 af f6 f1 f0
00000130: 8f f3 6b 1f fd ff ff 1f fa ff ff ff ff ff ff ff
00000140: ff 2f f7 ff ff ff ff ff ff ff ff ff ff ff ff ff
00000150: ff ff ff ff ff ff ff ff ff ff ff ff ff ff ff ff
00000160: ff ff 1d ff ff ff ff ff ff ff ff ff ff ff ff ff
00000170: ff 1f
UrbLink = 00000000
[9121 ms] UsbSnoop - DispatchAny(f2340610) : IRP_MJ_INTERNAL_DEVICE_CONTROL
[9121 ms] UsbSnoop - MyDispatchInternalIOCTL(f2341e80) : fdo=825ffaf0, Irp=82701008, IRQL=2
[9121 ms] >>> URB 20 going down >>>
-- URB_FUNCTION_BULK_OR_INTERRUPT_TRANSFER:
PipeHandle = 8256385c [endpoint 0x00000082]
TransferFlags = 00000003 (USBD_TRANSFER_DIRECTION_IN, USBD_SHORT_TRANSFER_OK)
TransferBufferLength = 0000041c
TransferBuffer = 826de3e8
TransferBufferMDL = 00000000
UrbLink = 00000000
[9175 ms] UsbSnoop - MyInternalIOCTLCompletion(f2341db0) : fido=00000000, Irp=82701008, Context=82647068, IRQL=2
[9175 ms] <<< URB 20 coming back <<<
-- URB_FUNCTION_BULK_OR_INTERRUPT_TRANSFER:
PipeHandle = 8256385c [endpoint 0x00000082]
TransferFlags = 00000003 (USBD_TRANSFER_DIRECTION_IN, USBD_SHORT_TRANSFER_OK)
TransferBufferLength = 0000017a
TransferBuffer = 826de3e8
TransferBufferMDL = 8255c128
00000000: 01 01 17 01 00 20 a1 00 00 00 06 00 00 00 68 00
00000010: 50 00 00 00 64 01 f0 ff ff ff ff ff ff ff ff ff
00000020: ff ff ff ff ff ff ff ff ff ff ff ff ff ff ff ff
00000030: ff ff ff ff ff ff ff ff ff ff ff ff ff ff ff ff
00000040: ff ff ff ff ff ff ff ff ff ff ff ff ff ff ff ff
00000050: ff ff ff ff ff ff ff ff ff ff ff ff ff ff ff ff
00000060: ff ff ff ff ff ff ff ff ff ff ff ff ff ff ff ff
00000070: ff ff ff ff ff ff ff ff ff ff ff 3f f6 69 3f 0f
00000080: 11 ff 81 8f f8 f1 f3 0f f9 a6 1f 3f ef fa b5 1f
00000090: 4f cf fb c4 1f 4f af fd c3 2f 3f bf fd d2 2f 1f
000000a0: df fd e1 2f f6 8f fd e1 1f f7 8f fd f1 f0 70 ff
000000b0: 48 63 1f 26 f6 71 ff 38 64 1f 35 f6 d1 ff 22 65
000000c0: 1f 53 f6 f1 f0 14 2f f6 69 1f 2f 2f f1 62 9f f6
000000d0: f1 f2 21 2f f6 69 1f 4f 2e 2f f6 69 1f 4f 2e 2f
000000e0: f5 6a bf d9 f3 52 af f6 8d 3c 2f f5 6a ef b7 f4
000000f0: 52 af f6 7e 4b 2f f5 6a ef a7 f5 61 af f6 0f a6
00000100: f5 52 af f6 7e 5a 2f f5 6a ef a7 f5 61 af f6 8d
00000110: 5a 1f f6 6a cf a9 f5 61 af f6 aa 2e 2f f5 6a 7f
00000120: fd 2f f6 6a 1f 3f ff 63 af f6 f0 f3 4f f6 6a 0f
00000130: 2f ff 56 af f6 f0 f1 ff 8f f4 d1 ff ff ff 72 ff
00000140: ff ff ff ff ff ff ff ff 5f f7 ff ff ff ff ff ff
00000150: ff ff ff ff ff ff ff ff ff ff ff ff ff ff ff ff
00000160: ff ff ff ff ff ff ff ff ff 1d ff ff ff ff ff ff
00000170: ff ff ff ff ff ff ff ff 1f 1d
UrbLink = 00000000
[9176 ms] UsbSnoop - DispatchAny(f2340610) : IRP_MJ_INTERNAL_DEVICE_CONTROL
[9176 ms] UsbSnoop - MyDispatchInternalIOCTL(f2341e80) : fdo=825ffaf0, Irp=82701008, IRQL=2
[9176 ms] >>> URB 21 going down >>>
-- URB_FUNCTION_BULK_OR_INTERRUPT_TRANSFER:
PipeHandle = 8256385c [endpoint 0x00000082]
TransferFlags = 00000003 (USBD_TRANSFER_DIRECTION_IN, USBD_SHORT_TRANSFER_OK)
TransferBufferLength = 0000041c
TransferBuffer = 826de3e8
TransferBufferMDL = 00000000
UrbLink = 00000000
[9222 ms] UsbSnoop - MyInternalIOCTLCompletion(f2341db0) : fido=00000000, Irp=82701008, Context=825208c8, IRQL=2
[9223 ms] <<< URB 21 coming back <<<
-- URB_FUNCTION_BULK_OR_INTERRUPT_TRANSFER:
PipeHandle = 8256385c [endpoint 0x00000082]
TransferFlags = 00000003 (USBD_TRANSFER_DIRECTION_IN, USBD_SHORT_TRANSFER_OK)
TransferBufferLength = 00000186
TransferBuffer = 826de3e8
TransferBufferMDL = 8255c128
00000000: 01 01 17 01 00 20 af 00 00 00 06 00 00 00 68 00
00000010: 50 00 00 00 70 01 f0 ff ff ff ff ff ff ff ff ff
00000020: ff ff ff ff ff ff ff ff ff ff ff ff ff ff ff ff
00000030: ff ff ff ff ff ff ff ff ff ff ff ff ff ff ff ff
00000040: ff ff ff ff ff ff ff ff ff ff ff ff ff ff ff ff
00000050: ff ff ff ff ff ff ff ff ff ff ff ff ff ff ff ff
00000060: ff ff ff ff ff ff ff ff ff ff ff ff ff ff ff ff
00000070: ff ff ff ff ff ff ff ff ff ff ff 64 9f f6 f2 f2
00000080: 3f f7 78 2f 3f 5f 47 f9 95 2f 3f 5f 37 fa b4 1f
00000090: 3f 4f 47 fa b3 2f 3f 4f 47 f9 c3 2f 3f 3f 48 fa
000000a0: d1 2f 2a f4 75 95 1f fe 71 ff 70 95 1f fe 71 ef
000000b0: 67 12 f6 e1 1f f7 8d 16 62 1f 16 f7 71 df a7 f6
000000c0: 51 63 1f fc 77 6b 1f 53 f6 f1 f0 74 6b 9f f6 f1
000000d0: f1 82 5c 9f f6 f1 f1 72 6c 9f f6 f0 e4 48 53 f6
000000e0: 69 1f 3f 7e 54 64 9f f6 9b 8c 73 63 9f f6 8c 8c
000000f0: 63 64 9f f6 7d 8b 74 63 9f f6 6e 7b 66 63 9f f6
00000100: 6e 9a 74 63 9f f6 6e fa 35 f6 69 ef a6 5f 63 9f
00000110: f6 7d fa 35 f6 78 cf 99 5f 53 af f6 9b fa 35 f5
00000120: 79 af ea 11 3e f5 79 6f fd 79 53 9f f7 f0 f3 7a
00000130: 53 9f f6 f1 f3 7a 62 9f f6 f1 f2 7b 35 9f f6 f1
00000140: f0 6d ff 35 2f fc 1f f6 ff 1b 11 ff 5a ff ff ff
00000150: ff ff ff ff ff 8f f8 ff ff ff ff ff ff ff ff ff
00000160: ff ff ff ff ff ff ff ff ff ff ff ff ff ff ff ff
00000170: ff ff ff ff ff ff 1c ff ff ff ff ff ff ff ff ff
00000180: ff ff ff ff ff 1f
UrbLink = 00000000
[9223 ms] UsbSnoop - DispatchAny(f2340610) : IRP_MJ_INTERNAL_DEVICE_CONTROL
[9223 ms] UsbSnoop - MyDispatchInternalIOCTL(f2341e80) : fdo=825ffaf0, Irp=82701008, IRQL=2
[9223 ms] >>> URB 22 going down >>>
-- URB_FUNCTION_BULK_OR_INTERRUPT_TRANSFER:
PipeHandle = 8256385c [endpoint 0x00000082]
TransferFlags = 00000003 (USBD_TRANSFER_DIRECTION_IN, USBD_SHORT_TRANSFER_OK)
TransferBufferLength = 0000041c
TransferBuffer = 826de3e8
TransferBufferMDL = 00000000
UrbLink = 00000000
[9275 ms] UsbSnoop - MyInternalIOCTLCompletion(f2341db0) : fido=00000000, Irp=82701008, Context=8251e948, IRQL=2
[9275 ms] <<< URB 22 coming back <<<
-- URB_FUNCTION_BULK_OR_INTERRUPT_TRANSFER:
PipeHandle = 8256385c [endpoint 0x00000082]
TransferFlags = 00000003 (USBD_TRANSFER_DIRECTION_IN, USBD_SHORT_TRANSFER_OK)
TransferBufferLength = 0000017a
TransferBuffer = 826de3e8
TransferBufferMDL = 8255c128
00000000: 01 01 17 01 00 20 bc 00 00 00 06 00 00 00 68 00
00000010: 50 00 00 00 64 01 f0 ff ff ff ff ff ff ff ff ff
00000020: ff ff ff ff ff ff ff ff ff ff ff ff ff ff ff ff
00000030: ff ff ff ff ff ff ff ff ff ff ff ff ff ff ff ff
00000040: ff ff ff ff ff ff ff ff ff ff ff ff ff ff ff ff
00000050: ff ff ff ff ff ff ff ff ff ff ff ff ff ff ff ff
00000060: ff ff ff ff ff ff ff ff ff ff ff ff ff ff ff ff
00000070: ff ff ff ff ff ff ff ff ff ff ff 6f f6 f2 f2 1a
00000080: ff 77 2f 3f 5f f6 4f f9 f2 f3 74 ff b3 0f 4f 4f
00000090: f7 2f fb f1 f4 73 ff c2 2f 3f 3f f7 12 dd 1f 49
000000a0: f1 87 2f d1 fd 71 ef f7 22 dd 1f f7 7d 3f d2 fd
000000b0: 61 ef f7 23 5d 62 1f f8 8b 3f d2 34 f6 c1 7f f7
000000c0: 24 3d 64 1f 0f 3f f7 25 5f f6 f1 f1 72 5f f2 65
000000d0: 0f 3f 0f f7 26 5f f6 f0 e4 47 d4 f2 65 8f db 38
000000e0: c6 f2 65 9f cb 47 d6 f1 65 cf b8 48 d6 f1 65 df
000000f0: b7 57 f6 4f f6 7d 8a 65 ff 64 df a7 58 f6 4f f6
00000100: 7d fa f7 1f f6 7d fa f8 0f f6 7d fa f8 0f f6 8c
00000110: fa f7 1f f6 8b fb f7 1f f6 b8 3f 22 fa 2f f6 f0
00000120: f3 6a ff 73 0f 2f bf f6 4f e6 3f bf f6 4f f5 f0
00000130: f2 6c ff 54 1f fe 6e ff af fb 2f f6 ff ff 8f f5
00000140: ff ff ff ff ff ff ff ff 7f f7 ff ff ff ff ff ff
00000150: ff ff ff ff ff ff ff ff ff ff ff ff ff ff ff ff
00000160: ff ff ff ff ff ff ff ff ff 1d ff ff ff ff ff ff
00000170: ff ff ff ff ff ff ff ff 1f 1d
UrbLink = 00000000
[9276 ms] UsbSnoop - DispatchAny(f2340610) : IRP_MJ_INTERNAL_DEVICE_CONTROL
[9276 ms] UsbSnoop - MyDispatchInternalIOCTL(f2341e80) : fdo=825ffaf0, Irp=82701008, IRQL=2
[9276 ms] >>> URB 23 going down >>>
-- URB_FUNCTION_BULK_OR_INTERRUPT_TRANSFER:
PipeHandle = 8256385c [endpoint 0x00000082]
TransferFlags = 00000003 (USBD_TRANSFER_DIRECTION_IN, USBD_SHORT_TRANSFER_OK)
TransferBufferLength = 0000041c
TransferBuffer = 826de3e8
TransferBufferMDL = 00000000
UrbLink = 00000000
[9328 ms] UsbSnoop - MyInternalIOCTLCompletion(f2341db0) : fido=00000000, Irp=82701008, Context=825212e8, IRQL=2
[9329 ms] <<< URB 23 coming back <<<
-- URB_FUNCTION_BULK_OR_INTERRUPT_TRANSFER:
PipeHandle = 8256385c [endpoint 0x00000082]
TransferFlags = 00000003 (USBD_TRANSFER_DIRECTION_IN, USBD_SHORT_TRANSFER_OK)
TransferBufferLength = 0000018a
TransferBuffer = 826de3e8
TransferBufferMDL = 8255c128
00000000: 01 01 17 01 00 20 ca 00 00 00 06 00 00 00 68 00
00000010: 50 00 00 00 74 01 f0 ff ff ff ff ff ff ff ff ff
00000020: ff ff ff ff ff ff ff ff ff ff ff ff ff ff ff ff
00000030: ff ff ff ff ff ff ff ff ff ff ff ff ff ff ff ff
00000040: ff ff ff ff ff ff ff ff ff ff ff ff ff ff ff ff
00000050: ff ff ff ff ff ff ff ff ff ff ff ff ff ff ff ff
00000060: ff ff ff ff ff ff ff ff ff ff ff ff ff ff ff ff
00000070: ff ff ff ff ff ff ff ff ff ff ff 4a 2f 28 14 f1
00000080: ff 4f f7 f1 f3 65 7f 59 f8 f1 f3 84 4f 3b fa f1
00000090: f3 74 3f 3d fa f1 f3 73 3f 1e fc f1 f3 73 2f df
000000a0: 1f 19 11 f3 76 2f df 1f f6 8e 2f 49 0f 0f f7 7e
000000b0: 2f 88 16 f6 70 df f7 73 59 62 0f f8 9b 2f 97 43
000000c0: f6 c0 7f f7 74 29 65 0f 0f 3f f8 74 1f f6 f0 f1
000000d0: 72 5f f7 61 0f 2f 0f f8 85 0f f6 f0 e3 57 d3 f8
000000e0: 60 1f 21 12 db 38 c6 69 71 f6 9a 7c 64 fc 71 f6
000000f0: 8b 8b 64 fd 70 f6 7c 7b 65 ee 67 df a6 58 f6 d0
00000100: 67 df a6 49 f6 c1 67 df a6 7f 0f 7a f5 7d fa f8
00000110: 63 57 df a7 8f 4f 75 f5 8c fa f7 64 57 bf a9 8f
00000120: 2f 77 f5 a9 1e 23 b2 3f 77 f5 f1 f3 69 5f 78 f5
00000130: f0 f3 6a 4f 79 f5 f0 f2 6b 3f 7a f5 f0 f1 6c 1f
00000140: 8b f5 e0 ef f6 b0 ef fb 2f f6 a0 ff ff 6d 0f f9
00000150: ff ff ff ff ff ff ff ff 7b ff ff ff ff ff ff ff
00000160: ff ff ff ff ff ff ff ff ff ff ff ff ff ff ff ff
00000170: ff ff ff ff ff ff ff ff df f1 ff ff ff ff ff ff
00000180: ff ff ff ff ff ff ff ff 11 f1
UrbLink = 00000000
[9329 ms] UsbSnoop - DispatchAny(f2340610) : IRP_MJ_INTERNAL_DEVICE_CONTROL
[9329 ms] UsbSnoop - MyDispatchInternalIOCTL(f2341e80) : fdo=825ffaf0, Irp=82701008, IRQL=2
[9329 ms] >>> URB 24 going down >>>
-- URB_FUNCTION_BULK_OR_INTERRUPT_TRANSFER:
PipeHandle = 8256385c [endpoint 0x00000082]
TransferFlags = 00000003 (USBD_TRANSFER_DIRECTION_IN, USBD_SHORT_TRANSFER_OK)
TransferBufferLength = 0000041c
TransferBuffer = 826de3e8
TransferBufferMDL = 00000000
UrbLink = 00000000
[9382 ms] UsbSnoop - MyInternalIOCTLCompletion(f2341db0) : fido=00000000, Irp=82701008, Context=825364a8, IRQL=2
[9383 ms] <<< URB 24 coming back <<<
-- URB_FUNCTION_BULK_OR_INTERRUPT_TRANSFER:
PipeHandle = 8256385c [endpoint 0x00000082]
TransferFlags = 00000003 (USBD_TRANSFER_DIRECTION_IN, USBD_SHORT_TRANSFER_OK)
TransferBufferLength = 00000182
TransferBuffer = 826de3e8
TransferBufferMDL = 8255c128
00000000: 01 01 17 01 00 20 d7 00 00 00 06 00 00 00 68 00
00000010: 50 00 00 00 6c 01 f0 ff ff ff ff ff ff ff ff ff
00000020: ff ff ff ff ff ff ff ff ff ff ff ff ff ff ff ff
00000030: ff ff ff ff ff ff ff ff ff ff ff ff ff ff ff ff
00000040: ff ff ff ff ff ff ff ff ff ff ff ff ff ff ff ff
00000050: ff ff ff ff ff ff ff ff ff ff ff ff ff ff ff ff
00000060: ff ff ff ff ff ff ff ff ff ff ff ff ff ff ff ff
00000070: ff ff ff ff ff ff ff ff ff ff ff 11 1f 2f ff ff
00000080: 1a 1f 2f 5f f7 b5 1c 1f 2f 5f f7 f3 a0 f1 f1 f2
00000090: 74 3f 2f 19 1f 2f 3f f8 f2 84 f1 f1 f2 73 2f 6f
000000a0: 17 1f 16 f1 7c 2f 6f 17 0f f6 8e 2f 59 68 f1 60
000000b0: ef f7 82 78 16 0f f6 7d 3f 88 67 f1 80 af f8 73
000000c0: 7a 15 0f fc 76 4f a7 66 f1 e0 3f f8 64 6b 16 0f
000000d0: 1f 1f f7 75 6a 16 fe f2 70 6f 97 67 f1 f0 e2 47
000000e0: d4 88 f7 be 7d 63 9c 86 16 af c8 38 c6 8f 16 bf
000000f0: c7 47 d6 7f ff 64 8b 64 fd f6 5f a6 58 f6 f0 f4
00000100: 5f a6 49 f6 f1 f2 6f a6 7f 0f 0f ff 76 f9 f8 a3
00000110: ff 76 fa f8 94 ff 85 fa f7 94 ff 95 fa f7 93 ff
00000120: a4 8f f8 a4 bf 2f af f6 a4 cf 2f af f6 a3 df 1f
00000130: bf f6 a2 ef 0f cf f6 a1 ff c0 ff 60 0f fb 0f f8
00000140: 4f e6 fb ff ef 11 f2 90 ff ff ff ff ff ff ff ff
00000150: ff 8a ff ff ff ff ff ff ff ff ff ff ff ff ff ff
00000160: ff ff ff ff ff ff ff ff ff ff ff ff ff ff ff ff
00000170: ff cf f1 ff ff ff ff ff ff ff ff ff ff ff ff ff
00000180: ff 11
UrbLink = 00000000
[9383 ms] UsbSnoop - DispatchAny(f2340610) : IRP_MJ_INTERNAL_DEVICE_CONTROL
[9383 ms] UsbSnoop - MyDispatchInternalIOCTL(f2341e80) : fdo=825ffaf0, Irp=82701008, IRQL=2
[9383 ms] >>> URB 25 going down >>>
-- URB_FUNCTION_BULK_OR_INTERRUPT_TRANSFER:
PipeHandle = 8256385c [endpoint 0x00000082]
TransferFlags = 00000003 (USBD_TRANSFER_DIRECTION_IN, USBD_SHORT_TRANSFER_OK)
TransferBufferLength = 0000041c
TransferBuffer = 826de3e8
TransferBufferMDL = 00000000
UrbLink = 00000000
[9436 ms] UsbSnoop - MyInternalIOCTLCompletion(f2341db0) : fido=00000000, Irp=82701008, Context=82647068, IRQL=2
[9437 ms] <<< URB 25 coming back <<<
-- URB_FUNCTION_BULK_OR_INTERRUPT_TRANSFER:
PipeHandle = 8256385c [endpoint 0x00000082]
TransferFlags = 00000003 (USBD_TRANSFER_DIRECTION_IN, USBD_SHORT_TRANSFER_OK)
TransferBufferLength = 00000172
TransferBuffer = 826de3e8
TransferBufferMDL = 8255c128
00000000: 01 01 17 01 00 20 e4 00 00 00 06 00 00 00 68 00
00000010: 50 00 00 00 5c 01 f0 ff ff ff ff ff ff ff ff ff
00000020: ff ff ff ff ff ff ff ff ff ff ff ff ff ff ff ff
00000030: ff ff ff ff ff ff ff ff ff ff ff ff ff ff ff ff
00000040: ff ff ff ff ff ff ff ff ff ff ff ff ff ff ff ff
00000050: ff ff ff ff ff ff ff ff ff ff ff ff ff ff ff ff
00000060: ff ff ff ff ff ff ff ff ff ff ff ff ff ff ff ff
00000070: ff ff ff ff ff ff ff ff ff ff ff f6 f1 47 af f2
00000080: 5f 2f 4f f6 c5 ff f0 f2 73 3f 1f cf 3f 3f f7 f2
00000090: f3 fc f2 72 2f 5f bf 1f 3f f7 f2 f6 69 df f7 a2
000000a0: 93 9f f6 7d 2f 69 f7 69 cf f7 73 88 7f f7 7c 3f
000000b0: 97 f7 88 9f f7 64 7a 7f fe 74 4f a6 f7 f7 f0 72
000000c0: 5f a6 f7 f7 f1 71 5f a6 f7 f7 e2 f7 85 79 8f 2f
000000d0: 7d 53 8d 87 ff 91 7c 64 9c 94 ff 74 7c 74 fb f7
000000e0: 5f a7 48 d6 6f ff 75 7a 65 fd f6 5f 97 58 f6 f0
000000f0: f3 7f 96 6f 0f 1f ff 76 f9 f7 d1 ff 67 fa f7 a4
00000100: ff 86 f9 f7 94 ff 86 fa f7 93 ff 95 fd f5 a2 ef
00000110: 12 fc 78 4f fa fc f1 7a 3f fa fd f2 79 2f fa fe
00000120: f1 6a 2f fa 0f fd 7d 0f fa 1f fb 0f f6 b0 ff ff
00000130: 5d 0f fa ff ff 5f f7 ff ff ff ff ff ff ff ff ff
00000140: 79 ff ff ff ff ff ff ff ff ff ff ff ff ff ff ff
00000150: ff ff ff ff ff ff ff ff ff ff ff ff ff ff ff ff
00000160: df f1 ff ff ff ff ff ff ff ff ff ff ff ff ff ff
00000170: 11 f1
UrbLink = 00000000
[9437 ms] UsbSnoop - DispatchAny(f2340610) : IRP_MJ_INTERNAL_DEVICE_CONTROL
[9437 ms] UsbSnoop - MyDispatchInternalIOCTL(f2341e80) : fdo=825ffaf0, Irp=82701008, IRQL=2
[9437 ms] >>> URB 26 going down >>>
-- URB_FUNCTION_BULK_OR_INTERRUPT_TRANSFER:
PipeHandle = 8256385c [endpoint 0x00000082]
TransferFlags = 00000003 (USBD_TRANSFER_DIRECTION_IN, USBD_SHORT_TRANSFER_OK)
TransferBufferLength = 0000041c
TransferBuffer = 826de3e8
TransferBufferMDL = 00000000
UrbLink = 00000000
[9497 ms] UsbSnoop - MyInternalIOCTLCompletion(f2341db0) : fido=00000000, Irp=82701008, Context=825208c8, IRQL=2
[9498 ms] <<< URB 26 coming back <<<
-- URB_FUNCTION_BULK_OR_INTERRUPT_TRANSFER:
PipeHandle = 8256385c [endpoint 0x00000082]
TransferFlags = 00000003 (USBD_TRANSFER_DIRECTION_IN, USBD_SHORT_TRANSFER_OK)
TransferBufferLength = 0000016e
TransferBuffer = 826de3e8
TransferBufferMDL = 8255c128
00000000: 01 01 17 01 00 20 f1 00 00 00 07 00 00 00 68 00
00000010: 50 00 00 00 58 01 f0 ff ff ff ff ff ff ff ff ff
00000020: ff ff ff ff ff ff ff ff ff ff ff ff ff ff ff ff
00000030: ff ff ff ff ff ff ff ff ff ff ff ff ff ff ff ff
00000040: ff ff ff ff ff ff ff ff ff ff ff ff ff ff ff ff
00000050: ff ff ff ff ff ff ff ff ff ff ff ff ff ff ff ff
00000060: ff ff ff ff ff ff ff ff ff ff ff ff ff ff ff ff
00000070: ff ff ff ff ff ff ff 2f f9 55 9f f6 af f9 74 3f
00000080: fd 8f f9 64 3f 1f ff 96 3f f7 f2 f3 5f f9 72 2f
00000090: 5f ff 84 3f f7 f1 f7 ff 7d 2f 3a f9 ff 7d 2f 78
000000a0: f7 ff 7c 2f 88 f8 ff 7b 2f a7 f7 2f f2 67 3f a7
000000b0: f7 2f f4 74 3f a7 f7 2f f6 71 4f a7 f7 2f f7 70
000000c0: 4f 97 f8 2f d8 57 d2 88 f8 2f d8 37 c6 68 f8 4f
000000d0: b8 38 c6 1a fb 5f b7 47 c6 7f ff 66 7a 65 fd f5
000000e0: 7f a6 57 e6 4f ff 67 99 64 0f 3f ff 67 f9 f6 f0
000000f0: f0 8f 96 7f 3f fb 7f 97 7f 4f f9 7f 98 7f 3f f9
00000100: 7f a8 7f 2f fa 7f f8 97 3f f9 8f f7 78 4f f9 9f
00000110: f6 5a 4f f9 af f6 69 3f f9 bf f4 5c 1f fa cf f2
00000120: 6d 0f fb ff df f5 a0 ff ff 0f f4 90 ff ff ff ff
00000130: ff ff ff ff ff ff ff ff ff ff ff ff ff 74 ff ff
00000140: ff ff ff ff ff ff ff ff ff ff ff ff ff ff ff ff
00000150: ff ff ff ff ff ff ff ff ff ff ff ff ff df f1 ff
00000160: ff ff ff ff ff ff ff ff ff ff ff ff ff 11
UrbLink = 00000000
[9498 ms] UsbSnoop - DispatchAny(f2340610) : IRP_MJ_INTERNAL_DEVICE_CONTROL
[9498 ms] UsbSnoop - MyDispatchInternalIOCTL(f2341e80) : fdo=825ffaf0, Irp=82701008, IRQL=2
[9498 ms] >>> URB 27 going down >>>
-- URB_FUNCTION_BULK_OR_INTERRUPT_TRANSFER:
PipeHandle = 8256385c [endpoint 0x00000082]
TransferFlags = 00000003 (USBD_TRANSFER_DIRECTION_IN, USBD_SHORT_TRANSFER_OK)
TransferBufferLength = 0000041c
TransferBuffer = 826de3e8
TransferBufferMDL = 00000000
UrbLink = 00000000
[9542 ms] UsbSnoop - MyInternalIOCTLCompletion(f2341db0) : fido=00000000, Irp=82701008, Context=8251e948, IRQL=2
[9543 ms] <<< URB 27 coming back <<<
-- URB_FUNCTION_BULK_OR_INTERRUPT_TRANSFER:
PipeHandle = 8256385c [endpoint 0x00000082]
TransferFlags = 00000003 (USBD_TRANSFER_DIRECTION_IN, USBD_SHORT_TRANSFER_OK)
TransferBufferLength = 0000016e
TransferBuffer = 826de3e8
TransferBufferMDL = 8255c128
00000000: 01 01 17 01 00 20 ff 00 00 00 07 00 00 00 68 00
00000010: 50 00 00 00 58 01 f0 ff ff ff ff ff ff ff ff ff
00000020: ff ff ff ff ff ff ff ff ff ff ff ff ff ff ff ff
00000030: ff ff ff ff ff ff ff ff ff ff ff ff ff ff ff ff
00000040: ff ff ff ff ff ff ff ff ff ff ff ff ff ff ff ff
00000050: ff ff ff ff ff ff ff ff ff ff ff ff ff ff ff ff
00000060: ff ff ff ff ff ff ff ff ff ff ff ff ff ff ff ff
00000070: ff ff ff ff ff ff ff ff 62 5f fa ff 8f f6 e3 ff
00000080: 5f e1 f6 f3 f1 ff 41 6e 2f 3f ff 0f d4 f7 f1 f5
00000090: df d5 f6 f1 f7 bf c6 f7 91 85 ff 6b 6c 2f 78 f7
000000a0: bf b6 f7 72 79 ff 6a 6b 3f 97 f7 af a6 f7 63 7a
000000b0: ff 6a 79 4f a6 f7 af 96 f7 74 88 ff 5b 78 5f 87
000000c0: f8 bf 85 46 c5 87 f8 cf 84 36 c6 49 f9 ef 73 37
000000d0: c6 7f ff 3e 67 64 fd f6 df 64 47 d6 5f ff 5d 75
000000e0: 65 fe f4 cf 56 5f fe f2 bf 57 6f 0f fe cf 57 7f
000000f0: 3f f9 df 57 6f 4f f9 cf 58 6f 3f f9 df 97 3f 2f
00000100: f9 ef f7 63 4f fa ef f7 63 3f fa ff 71 2f f6 a2
00000110: ff 1f f8 62 1f fa ff 82 2f f6 a0 ff 4f f7 62 ae
00000120: ff 5f f7 52 0f f9 ff 67 ff 78 ff 9f f5 ff ff bf
00000130: f3 ff ff ff ff ff ff ff ff ff ff ff 6f f7 ff ff
00000140: ff ff ff ff ff ff ff ff ff ff ff ff ff ff ff ff
00000150: ff ff ff ff ff ff ff ff ff ff ff ff ff 1d ff ff
00000160: ff ff ff ff ff ff ff ff ff ff ff ff 1f 1d
UrbLink = 00000000
[9543 ms] UsbSnoop - DispatchAny(f2340610) : IRP_MJ_INTERNAL_DEVICE_CONTROL
[9543 ms] UsbSnoop - MyDispatchInternalIOCTL(f2341e80) : fdo=825ffaf0, Irp=82701008, IRQL=2
[9543 ms] >>> URB 28 going down >>>
-- URB_FUNCTION_BULK_OR_INTERRUPT_TRANSFER:
PipeHandle = 8256385c [endpoint 0x00000082]
TransferFlags = 00000003 (USBD_TRANSFER_DIRECTION_IN, USBD_SHORT_TRANSFER_OK)
TransferBufferLength = 0000041c
TransferBuffer = 826de3e8
TransferBufferMDL = 00000000
UrbLink = 00000000
[9579 ms] UsbSnoop - MyInternalIOCTLCompletion(f2341db0) : fido=00000000, Irp=82701008, Context=825212e8, IRQL=2
[9579 ms] <<< URB 28 coming back <<<
-- URB_FUNCTION_BULK_OR_INTERRUPT_TRANSFER:
PipeHandle = 8256385c [endpoint 0x00000082]
TransferFlags = 00000003 (USBD_TRANSFER_DIRECTION_IN, USBD_SHORT_TRANSFER_OK)
TransferBufferLength = 00000176
TransferBuffer = 826de3e8
TransferBufferMDL = 8255c128
00000000: 01 01 17 01 00 20 0e 01 00 00 08 00 00 00 68 00
00000010: 50 00 00 00 60 01 f0 ff ff ff ff ff ff ff ff ff
00000020: ff ff ff ff ff ff ff ff ff ff ff ff ff ff ff ff
00000030: ff ff ff ff ff ff ff ff ff ff ff ff ff ff ff ff
00000040: ff ff ff ff ff ff ff ff ff ff ff ff ff ff ff ff
00000050: ff ff ff ff ff ff ff ff ff ff ff ff ff ff ff ff
00000060: ff ff ff ff ff ff ff ff ff ff ff ff ff ff ff ff
00000070: ff ff ff ff 36 8f f6 ff 9f f6 d4 ff 7f 11 93 f6
00000080: f2 f1 ff d2 65 1f 3f ff fe 32 f5 f2 f4 df 3f 52
00000090: 1f 5f ff fc 24 f4 91 94 ff fa 16 f4 81 77 ff aa
000000a0: 92 31 2f 87 f7 af 77 17 f2 63 7a ff 79 68 21 3f
000000b0: a6 f6 af 68 17 f2 63 6a ff 8a 85 11 4f a6 f6 bf
000000c0: 4f 7f 87 f7 bf 4f 17 7e 78 ff fc 62 c5 59 f8 df
000000d0: 1f 56 fc f7 ef 7e d5 6f ff fc 71 d5 5f ff fc 63
000000e0: e5 4f ff fc 24 11 f7 f0 f1 cf 6f b1 0f fe bf 3a
000000f0: 7f 2f fa cf 69 5f 3f f8 df 97 4f 2f f9 df 97 3f
00000100: 2f f9 ef a7 36 f6 93 ff 0f a7 36 f5 a3 ff 0f a7
00000110: 36 f5 93 ff 1f 88 37 f5 a1 ff 2f 4a 39 f5 a0 ff
00000120: 3f 8f 53 ae ff 4f 8f 53 9e ff 6f 7f 8f f7 ff f8
00000130: f5 ff ff fb f1 ff ff 0f fb ff ff ff ff ff ff ff
00000140: ff ff ff ff cf f8 ff ff ff ff ff ff ff ff ff ff
00000150: ff ff ff ff ff ff ff ff ff ff ff ff ff ff ff ff
00000160: ff ff ff ff ff 1c ff ff ff ff ff ff ff ff ff ff
00000170: ff ff ff ff 1f 1c
UrbLink = 00000000
[9579 ms] UsbSnoop - DispatchAny(f2340610) : IRP_MJ_INTERNAL_DEVICE_CONTROL
[9579 ms] UsbSnoop - MyDispatchInternalIOCTL(f2341e80) : fdo=825ffaf0, Irp=82701008, IRQL=2
[9579 ms] >>> URB 29 going down >>>
-- URB_FUNCTION_BULK_OR_INTERRUPT_TRANSFER:
PipeHandle = 8256385c [endpoint 0x00000082]
TransferFlags = 00000003 (USBD_TRANSFER_DIRECTION_IN, USBD_SHORT_TRANSFER_OK)
TransferBufferLength = 0000041c
TransferBuffer = 826de3e8
TransferBufferMDL = 00000000
UrbLink = 00000000
[9606 ms] UsbSnoop - MyInternalIOCTLCompletion(f2341db0) : fido=00000000, Irp=82701008, Context=825364a8, IRQL=2
[9606 ms] <<< URB 29 coming back <<<
-- URB_FUNCTION_BULK_OR_INTERRUPT_TRANSFER:
PipeHandle = 8256385c [endpoint 0x00000082]
TransferFlags = 00000003 (USBD_TRANSFER_DIRECTION_IN, USBD_SHORT_TRANSFER_OK)
TransferBufferLength = 00000162
TransferBuffer = 826de3e8
TransferBufferMDL = 8255c128
00000000: 01 01 17 01 00 20 1b 01 00 00 08 00 00 00 68 00
00000010: 50 00 00 00 4c 01 f0 ff ff ff ff ff ff ff ff ff
00000020: ff ff ff ff ff ff ff ff ff ff ff ff ff ff ff ff
00000030: ff ff ff ff ff ff ff ff ff ff ff ff ff ff ff ff
00000040: ff ff ff ff ff ff ff ff ff ff ff ff ff ff ff ff
00000050: ff ff ff ff ff ff ff ff ff ff ff ff ff ff ff ff
00000060: ff ff ff ff ff ff ff ff ff ff ff ff ff ff ff ff
00000070: ff ff ff ff 4f f6 ff ff 4f fd ff a4 ff f0 f1 ff
00000080: e1 cf 3f ff fd f2 fb f4 cf 3f 9f 5f ff fb f5 88
00000090: 94 ff fa f5 68 78 ff 8a 84 2d 68 69 ff 7a 76 3c
000000a0: 58 6a ff 7a 67 3c 67 6a ff 7a 76 3c 67 6a ff 8a
000000b0: 84 3c 67 6a ff fa c5 73 87 f7 bf 3f 2e 77 87 ff
000000c0: fc e2 82 48 f9 df 0f af 5f ff ee bf 5f ff fd f1
000000d0: fb f4 bf 4f bf 3f ff fb f5 fc f0 bf 6f ef fc cf
000000e0: 49 f9 1f f9 bf 69 f8 1f f8 cf 97 f8 9e ff 7c 7a
000000f0: df f9 df a7 f7 9c ff 7e 7a bf f9 ff 70 7a af fa
00000100: ff 90 96 9f f9 ff b1 c2 8f fa ff f2 f8 a8 ff 4f
00000110: 7f 8f f9 ff f6 f5 ff ff fa f3 ff ff fc f1 ff ff
00000120: 2f f8 ff ff ff ff ff ff ff ff ff ff ff ff 7c ff
00000130: ff ff ff ff ff ff ff ff ff ff ff ff ff ff ff ff
00000140: ff ff ff ff ff ff ff ff ff ff ff ff ff ff df f1
00000150: ff ff ff ff ff ff ff ff ff ff ff ff ff ff 11 f1
00000160: ff ff
UrbLink = 00000000
[9606 ms] UsbSnoop - DispatchAny(f2340610) : IRP_MJ_INTERNAL_DEVICE_CONTROL
[9606 ms] UsbSnoop - MyDispatchInternalIOCTL(f2341e80) : fdo=825ffaf0, Irp=82701008, IRQL=2
[9606 ms] >>> URB 30 going down >>>
-- URB_FUNCTION_BULK_OR_INTERRUPT_TRANSFER:
PipeHandle = 8256385c [endpoint 0x00000082]
TransferFlags = 00000003 (USBD_TRANSFER_DIRECTION_IN, USBD_SHORT_TRANSFER_OK)
TransferBufferLength = 0000041c
TransferBuffer = 826de3e8
TransferBufferMDL = 00000000
UrbLink = 00000000
[9633 ms] UsbSnoop - MyInternalIOCTLCompletion(f2341db0) : fido=00000000, Irp=82701008, Context=82647068, IRQL=2
[9633 ms] <<< URB 30 coming back <<<
-- URB_FUNCTION_BULK_OR_INTERRUPT_TRANSFER:
PipeHandle = 8256385c [endpoint 0x00000082]
TransferFlags = 00000003 (USBD_TRANSFER_DIRECTION_IN, USBD_SHORT_TRANSFER_OK)
TransferBufferLength = 00000176
TransferBuffer = 826de3e8
TransferBufferMDL = 8255c128
00000000: 01 01 17 01 00 20 28 01 00 00 08 00 00 00 68 00
00000010: 50 00 00 00 60 01 f0 ff ff ff ff ff ff ff ff ff
00000020: ff ff ff ff ff ff ff ff ff ff ff ff ff ff ff ff
00000030: ff ff ff ff ff ff ff ff ff ff ff ff ff ff ff ff
00000040: ff ff ff ff ff ff ff ff ff ff ff ff ff ff ff ff
00000050: ff ff ff ff ff ff ff ff ff ff ff ff ff ff ff ff
00000060: ff ff ff ff ff ff ff ff ff ff ff ff ff ff ff ff
00000070: ff ff ff ff 27 12 ff ff ff b5 ff 5f f9 4f fd ff
00000080: e0 8f 36 fe df 1f 6f 28 0f ff fb f4 92 f3 f0 bf
00000090: 4f 1f 3a 34 f9 9f 5f 0f 2c 72 f7 9f 5f dd 13 69
000000a0: ff 79 67 ed 12 69 ff 79 77 ec 6c ff 79 67 fc c0
000000b0: f6 9f 49 c7 de f6 af 4f 7c 71 12 78 ff fa d4 34
000000c0: 27 81 f7 bf 2f 2e 56 33 85 ff fc f0 67 f3 f0 df
000000d0: fe 78 f2 f0 cf 1f 8f 35 0f ff fb f3 57 e3 ff fb
000000e0: f5 75 e2 ff fa f7 64 c5 ff aa 93 4f 86 f7 cf 68
000000f0: f9 63 87 ff 7c 88 3f 66 f9 cf a6 f7 63 95 ff 7c
00000100: 7a 4f 45 f9 df a7 f7 54 93 ff 8e 79 3f 36 f9 ef
00000110: 79 f8 73 72 ff 1f 1b 11 fa 54 63 ff 3f 7f 4f 36
00000120: f6 ff f3 f7 64 53 ff 5f 6f 4f f6 ff fe f4 65 ff
00000130: ff f1 f0 67 ff ff 84 cf f5 ff ff ff ff ff ff ff
00000140: ff ff ff ff 9f f7 ff ff ff ff ff ff ff ff ff ff
00000150: ff ff ff ff ff ff ff ff ff ff ff ff ff ff ff ff
00000160: ff ff ff ff ff 1d ff ff ff ff ff ff ff ff ff ff
00000170: ff ff ff ff 1f 1d
UrbLink = 00000000
[9633 ms] UsbSnoop - DispatchAny(f2340610) : IRP_MJ_INTERNAL_DEVICE_CONTROL
[9633 ms] UsbSnoop - MyDispatchInternalIOCTL(f2341e80) : fdo=825ffaf0, Irp=82701008, IRQL=2
[9633 ms] >>> URB 31 going down >>>
-- URB_FUNCTION_BULK_OR_INTERRUPT_TRANSFER:
PipeHandle = 8256385c [endpoint 0x00000082]
TransferFlags = 00000003 (USBD_TRANSFER_DIRECTION_IN, USBD_SHORT_TRANSFER_OK)
TransferBufferLength = 0000041c
TransferBuffer = 826de3e8
TransferBufferMDL = 00000000
UrbLink = 00000000
[9660 ms] UsbSnoop - MyInternalIOCTLCompletion(f2341db0) : fido=00000000, Irp=82701008, Context=825208c8, IRQL=2
[9660 ms] <<< URB 31 coming back <<<
-- URB_FUNCTION_BULK_OR_INTERRUPT_TRANSFER:
PipeHandle = 8256385c [endpoint 0x00000082]
TransferFlags = 00000003 (USBD_TRANSFER_DIRECTION_IN, USBD_SHORT_TRANSFER_OK)
TransferBufferLength = 0000016e
TransferBuffer = 826de3e8
TransferBufferMDL = 8255c128
00000000: 01 01 17 01 00 20 35 01 00 00 09 00 00 00 68 00
00000010: 50 00 00 00 58 01 f0 ff ff ff ff ff ff ff ff ff
00000020: ff ff ff ff ff ff ff ff ff ff ff ff ff ff ff ff
00000030: ff ff ff ff ff ff ff ff ff ff ff ff ff ff ff ff
00000040: ff ff ff ff ff ff ff ff ff ff ff ff ff ff ff ff
00000050: ff ff ff ff ff ff ff ff ff ff ff ff ff ff ff ff
00000060: ff ff ff ff ff ff ff ff ff ff ff ff ff ff ff ff
00000070: ff ff ff ff ff ff ff ff ff c3 9f f6 11 ff fd f1
00000080: 85 1f f2 bf 3f 3f f9 21 ff fb f3 a2 1f f3 9f 5f
00000090: 0f fb 31 ff f9 e5 fc 41 ff 78 76 ec 1f f4 8f 77
000000a0: c6 fe 41 ff 78 76 ec 1f f4 8f 58 c7 fe 41 ff 98
000000b0: 92 7c 61 1f f4 9f 4f 5c 63 1f f4 9f 3f 3d 65 1f
000000c0: f3 bf 1f 0f 61 f6 31 ff ec 8f f6 31 ff fb f0 68
000000d0: 1f f2 bf 2f 7f f6 21 ff fa f4 66 1f f2 9f 6f 5f
000000e0: f6 11 ff ba a1 4f f6 ff 8c 86 4f f6 ff 8b 78 4f
000000f0: f6 ff 7b 89 3f f6 ff 7b 7a 3f f6 ff 7b 7a 3f f6
00000100: ff 7b 7a 3f f6 ff 8b 88 3f f6 ff 9b 95 4f f6 ff
00000110: fb f8 64 ff cf 7f 4f f6 ff fd f5 65 ff df 4f 6f
00000120: f6 ff 0f 1f 7f f6 ff 2f fd 68 ff ff ff ff ff ff
00000130: ff ff ff ff ff ff ff ff ff ff 76 ff ff ff ff ff
00000140: ff ff ff ff ff ff ff ff ff ff ff ff ff ff ff ff
00000150: ff ff ff ff ff ff ff ff ff ff df f1 ff ff ff ff
00000160: ff ff ff ff ff ff ff ff ff ff 11 f1 ff ff
UrbLink = 00000000
[9660 ms] UsbSnoop - DispatchAny(f2340610) : IRP_MJ_INTERNAL_DEVICE_CONTROL
[9660 ms] UsbSnoop - MyDispatchInternalIOCTL(f2341e80) : fdo=825ffaf0, Irp=82701008, IRQL=2
[9660 ms] >>> URB 32 going down >>>
-- URB_FUNCTION_BULK_OR_INTERRUPT_TRANSFER:
PipeHandle = 8256385c [endpoint 0x00000082]
TransferFlags = 00000003 (USBD_TRANSFER_DIRECTION_IN, USBD_SHORT_TRANSFER_OK)
TransferBufferLength = 0000041c
TransferBuffer = 826de3e8
TransferBufferMDL = 00000000
UrbLink = 00000000
[9687 ms] UsbSnoop - MyInternalIOCTLCompletion(f2341db0) : fido=00000000, Irp=82701008, Context=825a32e8, IRQL=2
[9688 ms] <<< URB 32 coming back <<<
-- URB_FUNCTION_BULK_OR_INTERRUPT_TRANSFER:
PipeHandle = 8256385c [endpoint 0x00000082]
TransferFlags = 00000003 (USBD_TRANSFER_DIRECTION_IN, USBD_SHORT_TRANSFER_OK)
TransferBufferLength = 00000172
TransferBuffer = 826de3e8
TransferBufferMDL = 8255c128
00000000: 01 01 17 01 00 20 43 01 00 00 0a 00 00 00 68 00
00000010: 50 00 00 00 5c 01 f0 ff ff ff ff ff ff ff ff ff
00000020: ff ff ff ff ff ff ff ff ff ff ff ff ff ff ff ff
00000030: ff ff ff ff ff ff ff ff ff ff ff ff ff ff ff ff
00000040: ff ff ff ff ff ff ff ff ff ff ff ff ff ff ff ff
00000050: ff ff ff ff ff ff ff ff ff ff ff ff ff ff ff ff
00000060: ff ff ff ff ff ff ff ff ff ff ff ff ff ff ff ff
00000070: ff ff ff ff ff b6 9f f3 ff 5f fe 76 8f f7 0f 2f
00000080: 4f f8 78 ff f0 f3 a1 6f f9 fe f4 b0 5f fa fe e4
00000090: fc c3 ef 57 d7 fd e1 ef 76 c6 fe e1 ef 67 c6 fe
000000a0: e1 ef 67 c6 fe e1 ef 38 c8 17 f6 71 61 ef 4f 5c
000000b0: 63 1f 26 f6 0f 3f 4c 64 1f 44 f6 1f 0f 0f 52 f6
000000c0: 22 65 ff e2 7f f6 69 ff e1 8f f6 69 ff f0 f2 66
000000d0: 9f f6 fe f3 66 9f f6 fd f5 65 9f f6 ac 93 11 2f
000000e0: f6 69 cf 68 f8 64 9f f6 7c 88 3f f6 69 cf 97 f7
000000f0: 63 9f f6 6c 7a 3f f6 69 cf a6 f7 63 9f f6 7c 79
00000100: 3f f6 69 cf 87 f8 63 9f f6 9c 95 3f f6 69 cf 7f
00000110: 4f f6 69 cf 7f 4f f6 69 df 5f 5f f6 69 ef 4f 5f
00000120: f6 69 ff f1 f0 67 9f f6 3f fb 69 9f f6 ff ff 8f
00000130: f6 ff ff ff ff ff ff ff ff ff ff ff ff ff ff ff
00000140: 75 ff ff ff ff ff ff ff ff ff ff ff ff ff ff ff
00000150: ff ff ff ff ff ff ff ff ff ff ff ff ff ff ff ff
00000160: df f1 ff ff ff ff ff ff ff ff ff ff ff ff ff ff
00000170: 11 f1
UrbLink = 00000000
[9688 ms] UsbSnoop - DispatchAny(f2340610) : IRP_MJ_INTERNAL_DEVICE_CONTROL
[9688 ms] UsbSnoop - MyDispatchInternalIOCTL(f2341e80) : fdo=825ffaf0, Irp=82701008, IRQL=2
[9688 ms] >>> URB 33 going down >>>
-- URB_FUNCTION_BULK_OR_INTERRUPT_TRANSFER:
PipeHandle = 8256385c [endpoint 0x00000082]
TransferFlags = 00000003 (USBD_TRANSFER_DIRECTION_IN, USBD_SHORT_TRANSFER_OK)
TransferBufferLength = 0000041c
TransferBuffer = 826de3e8
TransferBufferMDL = 00000000
UrbLink = 00000000
[9714 ms] UsbSnoop - MyInternalIOCTLCompletion(f2341db0) : fido=00000000, Irp=82701008, Context=8251f148, IRQL=2
[9714 ms] <<< URB 33 coming back <<<
-- URB_FUNCTION_BULK_OR_INTERRUPT_TRANSFER:
PipeHandle = 8256385c [endpoint 0x00000082]
TransferFlags = 00000003 (USBD_TRANSFER_DIRECTION_IN, USBD_SHORT_TRANSFER_OK)
TransferBufferLength = 00000172
TransferBuffer = 826de3e8
TransferBufferMDL = 8255c128
00000000: 01 01 17 01 00 20 50 01 00 00 0b 00 00 00 68 00
00000010: 50 00 00 00 5c 01 f0 ff ff ff ff ff ff ff ff ff
00000020: ff ff ff ff ff ff ff ff ff ff ff ff ff ff ff ff
00000030: ff ff ff ff ff ff ff ff ff ff ff ff ff ff ff ff
00000040: ff ff ff ff ff ff ff ff ff ff ff ff ff ff ff ff
00000050: ff ff ff ff ff ff ff ff ff ff ff ff ff ff ff ff
00000060: ff ff ff ff ff ff ff ff ff ff ff ff ff ff ff ff
00000070: ff 7c ff ff ff d4 7f f6 69 ff f1 f1 94 7f f7 1f
00000080: 2f 2f fa a5 ef 4f 0f fb a4 ef 5f ce 3f fc 8d 93
00000090: ec 2f fc 7e 76 ec 1f fd 7e 67 ec 0f 0f df 67 c7
000000a0: fd e1 ff 80 83 7b 71 0f 0f ef 4f 6b 72 0f 26 f7
000000b0: fe d3 43 f6 51 63 ff f2 e0 52 f6 32 64 ff e2 7f
000000c0: f6 79 ff e1 7f f6 69 ff f1 f1 66 9f f6 0f 3f 5f
000000d0: f6 69 ef 4f 5f f7 68 df 6f 4f f6 69 df 58 f9 63
000000e0: 9f f6 7d 87 3f f6 69 df 96 f7 63 9f f6 6d 79 3f
000000f0: f6 69 df a6 f6 63 9f f6 6d 79 3f f6 69 df 87 f7
00000100: 63 9f f6 8d 95 3f f6 69 df 6f 4f f6 69 df 6f 4f
00000110: f6 69 ef 5f 4f f6 69 ef 4f 5f f6 69 ff f1 f1 66
00000120: 9f f6 3f fc 68 9f f6 ff af f2 6b ff ff ff ff ff
00000130: ff ff ff ff ff ff ff ff ff ff ff ff ff ff 2f f7
00000140: ff ff ff ff ff ff ff ff ff ff ff ff ff ff ff ff
00000150: ff ff ff ff ff ff ff ff ff ff ff ff ff ff ff 1d
00000160: ff ff ff ff ff ff ff ff ff ff ff ff ff ff 1f 1d
00000170: ff ff
UrbLink = 00000000
[9714 ms] UsbSnoop - DispatchAny(f2340610) : IRP_MJ_INTERNAL_DEVICE_CONTROL
[9714 ms] UsbSnoop - MyDispatchInternalIOCTL(f2341e80) : fdo=825ffaf0, Irp=82701008, IRQL=2
[9714 ms] >>> URB 34 going down >>>
-- URB_FUNCTION_BULK_OR_INTERRUPT_TRANSFER:
PipeHandle = 8256385c [endpoint 0x00000082]
TransferFlags = 00000003 (USBD_TRANSFER_DIRECTION_IN, USBD_SHORT_TRANSFER_OK)
TransferBufferLength = 0000041c
TransferBuffer = 826de3e8
TransferBufferMDL = 00000000
UrbLink = 00000000
[9744 ms] UsbSnoop - MyInternalIOCTLCompletion(f2341db0) : fido=00000000, Irp=82701008, Context=82632b08, IRQL=2
[9744 ms] <<< URB 34 coming back <<<
-- URB_FUNCTION_BULK_OR_INTERRUPT_TRANSFER:
PipeHandle = 8256385c [endpoint 0x00000082]
TransferFlags = 00000003 (USBD_TRANSFER_DIRECTION_IN, USBD_SHORT_TRANSFER_OK)
TransferBufferLength = 00000192
TransferBuffer = 826de3e8
TransferBufferMDL = 8255c128
00000000: 01 01 17 01 00 20 5d 01 00 00 0b 00 00 00 68 00
00000010: 50 00 00 00 7c 01 f0 ff ff ff ff ff ff ff ff ff
00000020: ff ff ff ff ff ff ff ff ff ff ff ff ff ff ff ff
00000030: ff ff ff ff ff ff ff ff ff ff ff ff ff ff ff ff
00000040: ff ff ff ff ff ff ff ff ff ff ff ff ff ff ff ff
00000050: ff ff ff ff ff ff ff ff ff ff ff ff ff ff ff ff
00000060: ff ff ff ff ff ff ff ff ff ff ff ff ff ff ff ff
00000070: df f9 39 ff ff d6 6f f7 78 ff f1 f1 84 7f f8 38
00000080: f5 f2 a1 5f fa 47 f4 e4 fb b4 5f 46 4f cd 3f fc
00000090: 65 74 75 dc 1f fe 83 64 67 eb 1f fe 92 64 76 eb
000000a0: 1f fe 92 74 75 eb 1f fe 92 84 82 ec 1f 16 f7 92
000000b0: f4 c3 35 f6 51 72 2f 16 52 2f 4c 64 1f 34 f7 52
000000c0: 22 f6 e0 61 f6 31 92 2f 43 72 fd 67 8f f7 12 26
000000d0: e6 7f f6 69 9f 52 1f 6f f6 69 af 41 3f 5f f6 69
000000e0: af 31 4f 5f f6 69 af 21 2a f9 64 9f f6 1a 82 86
000000f0: 3f 26 f1 66 af 21 96 f7 63 9f f6 1a 62 79 3f f6
00000100: 78 9f 22 96 f7 63 8f f7 1a 62 79 3f f5 79 9f 22
00000110: 96 f7 53 9f f6 1b 72 87 3f f6 78 af 21 58 f9 53
00000120: 9f f7 29 f2 f6 64 8f f7 1a f3 f5 63 9f f7 29 f3
00000130: f4 74 8f f6 2a f5 f1 65 9f f7 29 e6 6f f6 69 af
00000140: 92 17 f1 68 9f f6 2a ff ff 5c af f2 ff ff ff ff
00000150: ff ff ff ff ff ff ff ff ff ff ff ff ff ff 4f f7
00000160: ff ff ff ff ff ff ff ff ff ff ff ff ff ff ff ff
00000170: ff ff ff ff ff ff ff ff ff ff ff ff ff ff ff 1d
00000180: ff ff ff ff ff ff ff ff ff ff ff ff ff ff 1f 1d
00000190: ff ff
UrbLink = 00000000
[9744 ms] UsbSnoop - DispatchAny(f2340610) : IRP_MJ_INTERNAL_DEVICE_CONTROL
[9744 ms] UsbSnoop - MyDispatchInternalIOCTL(f2341e80) : fdo=825ffaf0, Irp=82701008, IRQL=2
[9744 ms] >>> URB 35 going down >>>
-- URB_FUNCTION_BULK_OR_INTERRUPT_TRANSFER:
PipeHandle = 8256385c [endpoint 0x00000082]
TransferFlags = 00000003 (USBD_TRANSFER_DIRECTION_IN, USBD_SHORT_TRANSFER_OK)
TransferBufferLength = 0000041c
TransferBuffer = 826de3e8
TransferBufferMDL = 00000000
UrbLink = 00000000
[9768 ms] UsbSnoop - MyInternalIOCTLCompletion(f2341db0) : fido=00000000, Irp=82701008, Context=82521e48, IRQL=2
[9769 ms] <<< URB 35 coming back <<<
-- URB_FUNCTION_BULK_OR_INTERRUPT_TRANSFER:
PipeHandle = 8256385c [endpoint 0x00000082]
TransferFlags = 00000003 (USBD_TRANSFER_DIRECTION_IN, USBD_SHORT_TRANSFER_OK)
TransferBufferLength = 00000176
TransferBuffer = 826de3e8
TransferBufferMDL = 8255c128
00000000: 01 01 17 01 00 20 6a 01 00 00 0c 00 00 00 68 00
00000010: 50 00 00 00 60 01 f0 ff ff ff ff ff ff ff ff ff
00000020: ff ff ff ff ff ff ff ff ff ff ff ff ff ff ff ff
00000030: ff ff ff ff ff ff ff ff ff ff ff ff ff ff ff ff
00000040: ff ff ff ff ff ff ff ff ff ff ff ff ff ff ff ff
00000050: ff ff ff ff ff ff ff ff ff ff ff ff ff ff ff ff
00000060: ff ff ff ff ff ff ff ff ff ff ff ff ff ff ff ff
00000070: 4f f8 76 7f f7 9f f9 84 6f f8 79 a8 1f fa 95 7f
00000080: 89 fa b0 4f fa a6 b8 cd 2f fc b5 8b dc 1f fd c4
00000090: 6d eb 0f fe e2 6d eb 0f fe e2 7c eb 0f fe e2 7b
000000a0: dc 1f fe e2 a8 5c 72 0f 16 f7 e2 a8 4c 63 1f 34
000000b0: f7 52 72 98 1e 56 1f 43 f7 32 74 88 6f f6 69 2f
000000c0: 52 87 f8 66 9f f6 6a 98 5f f6 69 af 86 fa 64 9f
000000d0: f6 5a a9 4f f6 69 af a6 f9 63 9f f6 6a 7c 3f f6
000000e0: 69 af e5 f7 62 9f f6 6a 7d 2f f6 69 af e6 f6 62
000000f0: 9f f6 6a 6e 2f f6 69 af e6 f6 62 9f f6 6a 7d 2f
00000100: f6 78 af b6 f8 63 8f f7 79 b8 3f f6 78 af 95 fb
00000110: 63 8f f7 5a a9 4f f6 68 af 96 f9 65 8f f7 69 89
00000120: 6f f6 78 9f 96 f4 5a 9f f6 7a ff ff 57 af f6 ff
00000130: ff 9f f5 ff ff ff ff ff ff ff ff ff ff ff ff ff
00000140: ff ff ff ff ff df f8 ff ff ff ff ff ff ff ff ff
00000150: ff ff ff ff ff ff ff ff ff ff ff ff ff ff ff ff
00000160: ff ff ff ff ff ff 1c ff ff ff ff ff ff ff ff ff
00000170: ff ff ff ff ff 1f
UrbLink = 00000000
[9769 ms] UsbSnoop - DispatchAny(f2340610) : IRP_MJ_INTERNAL_DEVICE_CONTROL
[9769 ms] UsbSnoop - MyDispatchInternalIOCTL(f2341e80) : fdo=825ffaf0, Irp=82701008, IRQL=2
[9769 ms] >>> URB 36 going down >>>
-- URB_FUNCTION_BULK_OR_INTERRUPT_TRANSFER:
PipeHandle = 8256385c [endpoint 0x00000082]
TransferFlags = 00000003 (USBD_TRANSFER_DIRECTION_IN, USBD_SHORT_TRANSFER_OK)
TransferBufferLength = 0000041c
TransferBuffer = 826de3e8
TransferBufferMDL = 00000000
UrbLink = 00000000
[9797 ms] UsbSnoop - MyInternalIOCTLCompletion(f2341db0) : fido=00000000, Irp=82701008, Context=82596808, IRQL=2
[9797 ms] <<< URB 36 coming back <<<
-- URB_FUNCTION_BULK_OR_INTERRUPT_TRANSFER:
PipeHandle = 8256385c [endpoint 0x00000082]
TransferFlags = 00000003 (USBD_TRANSFER_DIRECTION_IN, USBD_SHORT_TRANSFER_OK)
TransferBufferLength = 0000017e
TransferBuffer = 826de3e8
TransferBufferMDL = 8255c128
00000000: 01 01 17 01 00 20 77 01 00 00 0d 00 00 00 68 00
00000010: 50 00 00 00 68 01 f0 ff ff ff ff ff ff ff ff ff
00000020: ff ff ff ff ff ff ff ff ff ff ff ff ff ff ff ff
00000030: ff ff ff ff ff ff ff ff ff ff ff ff ff ff ff ff
00000040: ff ff ff ff ff ff ff ff ff ff ff ff ff ff ff ff
00000050: ff ff ff ff ff ff ff ff ff ff ff ff ff ff ff ff
00000060: ff ff ff ff ff ff ff ff ff ff ff ff ff 7f f6 68
00000070: ff ff 78 7f f7 79 2f e4 f9 a5 6f f9 42 ad 4f fa
00000080: a6 2f c4 fb c3 4f fb 42 cb 2f fe c2 2f a4 fd d1
00000090: 2f fe 42 da 0f 0f 1f fe 42 da 1f fd e2 1f a5 16
000000a0: f6 e0 2f fe 51 4a 72 1f 25 f6 e2 1f a5 43 f6 40
000000b0: 64 2f 25 f7 51 1b 65 1f 43 f6 42 73 1f f5 62 8f
000000c0: f6 22 75 1f f5 62 8f f6 13 66 1f f5 62 8f f6 6a
000000d0: 1f f5 62 8f f6 5a 2f f5 62 8f f6 6a ff 68 8f f6
000000e0: 6a ff 68 8f f6 5a ff 69 8f f6 6a ff 68 8f f6 6a
000000f0: ff 68 8f f6 6a ff 58 9f f6 6a ff 58 9f f6 6a ff
00000100: 68 8f f6 6a ff 58 9f f6 79 ff 58 9f f6 6a ff 58
00000110: 9f f6 69 ff 59 9f f6 79 4f f1 53 9f f6 79 0f f6
00000120: 61 9f f6 69 1f f6 52 9f f6 79 0f f6 ff 51 af f7
00000130: 60 ff ff 3f f4 61 ff ff ff 1b ff ff ff ff ff ff
00000140: ff ff ff ff ff ff ff ff ff ff ff ff ff 86 ff ff
00000150: ff ff ff ff ff ff ff ff ff ff ff ff ff ff ff ff
00000160: ff ff ff ff ff ff ff ff ff ff ff ff ff cf f1 ff
00000170: ff ff ff ff ff ff ff ff ff ff ff ff ff 11
UrbLink = 00000000
[9797 ms] UsbSnoop - DispatchAny(f2340610) : IRP_MJ_INTERNAL_DEVICE_CONTROL
[9797 ms] UsbSnoop - MyDispatchInternalIOCTL(f2341e80) : fdo=825ffaf0, Irp=82701008, IRQL=2
[9797 ms] >>> URB 37 going down >>>
-- URB_FUNCTION_BULK_OR_INTERRUPT_TRANSFER:
PipeHandle = 8256385c [endpoint 0x00000082]
TransferFlags = 00000003 (USBD_TRANSFER_DIRECTION_IN, USBD_SHORT_TRANSFER_OK)
TransferBufferLength = 0000041c
TransferBuffer = 826de3e8
TransferBufferMDL = 00000000
UrbLink = 00000000
[9827 ms] UsbSnoop - MyInternalIOCTLCompletion(f2341db0) : fido=00000000, Irp=82701008, Context=8260bca8, IRQL=2
[9827 ms] <<< URB 37 coming back <<<
-- URB_FUNCTION_BULK_OR_INTERRUPT_TRANSFER:
PipeHandle = 8256385c [endpoint 0x00000082]
TransferFlags = 00000003 (USBD_TRANSFER_DIRECTION_IN, USBD_SHORT_TRANSFER_OK)
TransferBufferLength = 00000182
TransferBuffer = 826de3e8
TransferBufferMDL = 8255c128
00000000: 01 01 17 01 00 20 85 01 00 00 0e 00 00 00 68 00
00000010: 50 00 00 00 6c 01 f0 ff ff ff ff ff ff ff ff ff
00000020: ff ff ff ff ff ff ff ff ff ff ff ff ff ff ff ff
00000030: ff ff ff ff ff ff ff ff ff ff ff ff ff ff ff ff
00000040: ff ff ff ff ff ff ff ff ff ff ff ff ff ff ff ff
00000050: ff ff ff ff ff ff ff ff ff ff ff ff ff ff ff ff
00000060: ff ff ff ff ff ff ff ff ff af f6 67 cf f1 af f8
00000070: 76 8f f8 f2 22 f9 a4 6f f8 f3 fd b3 5f fa f1 fe
00000080: b2 5f fb f1 fe c1 4f fc f1 fe d0 2f fe f2 12 fa
00000090: d0 2f fe 71 ac 0f fd e2 1f c7 fa 60 61 2f fe 61
000000a0: 1d 63 0f 25 f6 62 71 1f f6 62 0f 43 f6 52 72 1f
000000b0: e9 f5 31 64 2f 43 f7 d1 5a 8f f6 22 75 1f 0f 58
000000c0: 8f f6 79 0f 2f 57 8f f6 5a 12 fd 63 f5 68 9f f6
000000d0: f1 54 f5 68 9f f6 b9 55 8f f6 69 cf 49 f5 68 9f
000000e0: f6 8d 54 8f f6 69 ef 47 f5 68 9f f6 0f 46 f5 68
000000f0: 9f f6 0f 46 f5 68 9f f6 0f 36 f6 68 9f f6 7e 54
00000100: 8f f6 69 ef 37 f6 68 9f f6 8d 63 8f f6 69 cf 48
00000110: f6 68 9f f6 aa 64 8f f6 69 3f 1f 65 8f f6 69 1f
00000120: 3f 55 9f f6 69 1f 2f 18 bf f5 6a 1f 0f ff ff 67
00000130: 1f fe ff af f3 c2 ff ff ff 24 ff ff ff ff ff ff
00000140: ff ff ff ff ff ff ff ff ff ff ff ff ff ff ff ff
00000150: ff 84 ff ff ff ff ff ff ff ff ff ff ff ff ff ff
00000160: ff ff ff ff ff ff ff ff ff ff ff ff ff ff ff ff
00000170: ff cf f1 ff ff ff ff ff ff ff ff ff ff ff ff ff
00000180: ff 11
UrbLink = 00000000
[9827 ms] UsbSnoop - DispatchAny(f2340610) : IRP_MJ_INTERNAL_DEVICE_CONTROL
[9827 ms] UsbSnoop - MyDispatchInternalIOCTL(f2341e80) : fdo=825ffaf0, Irp=82701008, IRQL=2
[9827 ms] >>> URB 38 going down >>>
-- URB_FUNCTION_BULK_OR_INTERRUPT_TRANSFER:
PipeHandle = 8256385c [endpoint 0x00000082]
TransferFlags = 00000003 (USBD_TRANSFER_DIRECTION_IN, USBD_SHORT_TRANSFER_OK)
TransferBufferLength = 0000041c
TransferBuffer = 826de3e8
TransferBufferMDL = 00000000
UrbLink = 00000000
[9851 ms] UsbSnoop - MyInternalIOCTLCompletion(f2341db0) : fido=00000000, Irp=82701008, Context=825df068, IRQL=2
[9851 ms] <<< URB 38 coming back <<<
-- URB_FUNCTION_BULK_OR_INTERRUPT_TRANSFER:
PipeHandle = 8256385c [endpoint 0x00000082]
TransferFlags = 00000003 (USBD_TRANSFER_DIRECTION_IN, USBD_SHORT_TRANSFER_OK)
TransferBufferLength = 00000172
TransferBuffer = 826de3e8
TransferBufferMDL = 8255c128
00000000: 01 01 17 01 00 20 94 01 00 00 0f 00 00 00 68 00
00000010: 50 00 00 00 5c 01 f0 ff ff ff ff ff ff ff ff ff
00000020: ff ff ff ff ff ff ff ff ff ff ff ff ff ff ff ff
00000030: ff ff ff ff ff ff ff ff ff ff ff ff ff ff ff ff
00000040: ff ff ff ff ff ff ff ff ff ff ff ff ff ff ff ff
00000050: ff ff ff ff ff ff ff ff ff ff ff ff ff ff ff ff
00000060: ff ff ff ff ff ff 9f f6 ff ff 7f f7 78 2f 3f ff
00000070: 91 6f f8 f2 f3 0f f9 a5 2f 3f ef fb a4 2f 3f cf
00000080: fc c3 2f 3f bf fd e2 1f 3f bf fd e2 1f f7 7f fd
00000090: e1 1f f7 8f fd e1 1f f7 8f 25 f6 e1 1f f7 8f 43
000000a0: f6 51 63 1f f9 6f 43 f6 41 64 1f fd 9f f6 22 65
000000b0: 1f 0f ff 67 9f f6 f1 f1 6f f6 69 1f 2f ff 65 9f
000000c0: f5 f1 f4 4f f6 69 2f 22 fd 4f f6 69 cf f8 3f f6
000000d0: 59 df f8 3f f6 69 df f7 3f f6 69 ef f6 3f f6 69
000000e0: ef f6 3f f6 69 ef f6 3f f5 6a ef f6 3f f6 69 df
000000f0: f7 3f f6 69 cf f8 3f f5 5a cf f9 3f f5 5a af fa
00000100: 4f f5 79 2f 2f ff 54 9f f6 f1 f4 4f f5 69 1f 3f
00000110: ff 55 af f5 f1 f1 ff 7f f5 f1 f0 ff af f3 c1 ff
00000120: ff ff 24 ff ff ff ff ff ff ff ff ff ff ff ff ff
00000130: ff ff ff ff ff ff ff ff ff ff ff ff ff ff 84 ff
00000140: ff ff ff ff ff ff ff ff ff ff ff ff ff ff ff ff
00000150: ff ff ff ff ff ff ff ff ff ff ff ff ff ff cf f1
00000160: ff ff ff ff ff ff ff ff ff ff ff ff ff ff 11 f1
00000170: ff ff
UrbLink = 00000000
[9851 ms] UsbSnoop - DispatchAny(f2340610) : IRP_MJ_INTERNAL_DEVICE_CONTROL
[9851 ms] UsbSnoop - MyDispatchInternalIOCTL(f2341e80) : fdo=825ffaf0, Irp=82701008, IRQL=2
[9851 ms] >>> URB 39 going down >>>
-- URB_FUNCTION_BULK_OR_INTERRUPT_TRANSFER:
PipeHandle = 8256385c [endpoint 0x00000082]
TransferFlags = 00000003 (USBD_TRANSFER_DIRECTION_IN, USBD_SHORT_TRANSFER_OK)
TransferBufferLength = 0000041c
TransferBuffer = 826de3e8
TransferBufferMDL = 00000000
UrbLink = 00000000
[9877 ms] UsbSnoop - MyInternalIOCTLCompletion(f2341db0) : fido=00000000, Irp=82701008, Context=82524a28, IRQL=2
[9877 ms] <<< URB 39 coming back <<<
-- URB_FUNCTION_BULK_OR_INTERRUPT_TRANSFER:
PipeHandle = 8256385c [endpoint 0x00000082]
TransferFlags = 00000003 (USBD_TRANSFER_DIRECTION_IN, USBD_SHORT_TRANSFER_OK)
TransferBufferLength = 00000172
TransferBuffer = 826de3e8
TransferBufferMDL = 8255c128
00000000: 01 01 17 01 00 20 a2 01 00 00 10 00 00 00 68 00
00000010: 50 00 00 00 5c 01 f0 ff ff ff ff ff ff ff ff ff
00000020: ff ff ff ff ff ff ff ff ff ff ff ff ff ff ff ff
00000030: ff ff ff ff ff ff ff ff ff ff ff ff ff ff ff ff
00000040: ff ff ff ff ff ff ff ff ff ff ff ff ff ff ff ff
00000050: ff ff ff ff ff ff ff ff ff ff ff ff ff ff ff ff
00000060: ff ff ff ff ff ff 6b 8f f5 f3 f0 6f f7 86 2f 3f
00000070: ff 91 5f f9 f2 f3 0f fa a4 2f 3f ff a0 3f fb f1
00000080: f4 0f fa d1 1f 4f ff a0 1f fd f2 f1 2f fa e0 1f
00000090: f7 cf fa e0 1f f6 df 12 f7 e0 1f f6 ff 71 1f 34
000000a0: f6 71 ff 0f f6 41 64 1f fc af f7 30 65 0f 0f ff
000000b0: 59 9f f6 f0 f1 8f f5 69 0f 2f ff 57 9f f5 f1 f3
000000c0: 6f f5 59 1f 12 1f ff 55 9f f6 9a ff 55 9f f5 8d
000000d0: ff 54 9f f5 8d ff 63 9f f5 7e ff 63 9f f5 7e ff
000000e0: 63 9f f6 7d ff 63 9f f5 7e ff 63 9f f5 7e ff 63
000000f0: 8f f6 8d ff 63 9f f5 9c ff 63 8f f6 aa ff 64 8f
00000100: f6 d6 ff 65 8f f6 f1 f3 5f f6 68 1f 2f ff 56 9f
00000110: f6 f0 f2 9f f1 6b 0f 1f ff ff 48 2f fc ff ff 2f
00000120: 14 f3 ff ff ff ff ff ff ff ff ff ff ff ff ff ff
00000130: ff ff ff ff ff ff ff ff ff ff ff ff ff ff ff ff
00000140: 7d ff ff ff ff ff ff ff ff ff ff ff ff ff ff ff
00000150: ff ff ff ff ff ff ff ff ff ff ff ff ff ff ff ff
00000160: df f1 ff ff ff ff ff ff ff ff ff ff ff ff ff ff
00000170: 11 f1
UrbLink = 00000000
[9877 ms] UsbSnoop - DispatchAny(f2340610) : IRP_MJ_INTERNAL_DEVICE_CONTROL
[9877 ms] UsbSnoop - MyDispatchInternalIOCTL(f2341e80) : fdo=825ffaf0, Irp=82701008, IRQL=2
[9877 ms] >>> URB 40 going down >>>
-- URB_FUNCTION_BULK_OR_INTERRUPT_TRANSFER:
PipeHandle = 8256385c [endpoint 0x00000082]
TransferFlags = 00000003 (USBD_TRANSFER_DIRECTION_IN, USBD_SHORT_TRANSFER_OK)
TransferBufferLength = 0000041c
TransferBuffer = 826de3e8
TransferBufferMDL = 00000000
UrbLink = 00000000
[9904 ms] UsbSnoop - MyInternalIOCTLCompletion(f2341db0) : fido=00000000, Irp=82701008, Context=82521488, IRQL=2
[9904 ms] <<< URB 40 coming back <<<
-- URB_FUNCTION_BULK_OR_INTERRUPT_TRANSFER:
PipeHandle = 8256385c [endpoint 0x00000082]
TransferFlags = 00000003 (USBD_TRANSFER_DIRECTION_IN, USBD_SHORT_TRANSFER_OK)
TransferBufferLength = 00000166
TransferBuffer = 826de3e8
TransferBufferMDL = 8255c128
00000000: 01 01 17 01 00 20 b2 01 00 00 11 00 00 00 68 00
00000010: 50 00 00 00 50 01 f0 ff ff ff ff ff ff ff ff ff
00000020: ff ff ff ff ff ff ff ff ff ff ff ff ff ff ff ff
00000030: ff ff ff ff ff ff ff ff ff ff ff ff ff ff ff ff
00000040: ff ff ff ff ff ff ff ff ff ff ff ff ff ff ff ff
00000050: ff ff ff ff ff ff ff ff ff ff ff ff ff ff ff ff
00000060: ff ff ff ff 1c ff ff 7b 1f 3f ff ff 82 1f 3f ff
00000070: ff a0 1f 3f ff ef fb f1 f3 ff cd 1f 3f ff cf fd
00000080: f1 f2 ff ec 0f f7 ff 8f fe 70 ff ff e8 0f f7 ff
00000090: 8f 16 f6 81 ff bf a1 34 f7 c0 ff 7f a1 43 f6 e1
000000a0: ff 5f f1 62 1f 0f ff 3f f2 53 1f 2f ff 1f f2 62
000000b0: 1f 2f ff 0f f3 53 1f 3f ff 3e 2f f6 9a ff 4d 3f
000000c0: f5 8c ff 4c 2f f6 8c ff 4c 2f f6 7d ff 5b 2f f6
000000d0: 7d ff 6a 2f f6 7d ff 6a 2f f6 7d ff 6a 2f f6 8c
000000e0: ff 6a 2f f6 8c ff 6a 2f f6 9b ff 6a 2f f6 a9 ff
000000f0: 6b 2f f6 c6 ff ff 65 0f 3f ff ff 65 0f 2f ff ff
00000100: 66 0f 1f ff ff 67 0f 0f ff ff 49 1f fc ff ff 3f
00000110: 13 f4 ff ff ff ff ff ff ff ff ff ff ff ff ff ff
00000120: ff ff ff ff ff ff ff ff ff ff ff ff ff ff ff ff
00000130: ff ff ff ff 8c ff ff ff ff ff ff ff ff ff ff ff
00000140: ff ff ff ff ff ff ff ff ff ff ff ff ff ff ff ff
00000150: ff ff ff ff cf f1 ff ff ff ff ff ff ff ff ff ff
00000160: ff ff ff ff 11 f1
UrbLink = 00000000
[9904 ms] UsbSnoop - DispatchAny(f2340610) : IRP_MJ_INTERNAL_DEVICE_CONTROL
[9904 ms] UsbSnoop - MyDispatchInternalIOCTL(f2341e80) : fdo=825ffaf0, Irp=82701008, IRQL=2
[9904 ms] >>> URB 41 going down >>>
-- URB_FUNCTION_BULK_OR_INTERRUPT_TRANSFER:
PipeHandle = 8256385c [endpoint 0x00000082]
TransferFlags = 00000003 (USBD_TRANSFER_DIRECTION_IN, USBD_SHORT_TRANSFER_OK)
TransferBufferLength = 0000041c
TransferBuffer = 826de3e8
TransferBufferMDL = 00000000
UrbLink = 00000000
[9931 ms] UsbSnoop - MyInternalIOCTLCompletion(f2341db0) : fido=00000000, Irp=82701008, Context=8252c248, IRQL=2
[9931 ms] <<< URB 41 coming back <<<
-- URB_FUNCTION_BULK_OR_INTERRUPT_TRANSFER:
PipeHandle = 8256385c [endpoint 0x00000082]
TransferFlags = 00000003 (USBD_TRANSFER_DIRECTION_IN, USBD_SHORT_TRANSFER_OK)
TransferBufferLength = 0000016e
TransferBuffer = 826de3e8
TransferBufferMDL = 8255c128
00000000: 01 01 17 01 00 20 c1 01 00 00 12 00 00 00 68 00
00000010: 50 00 00 00 58 01 f0 ff ff ff ff ff ff ff ff ff
00000020: ff ff ff ff ff ff ff ff ff ff ff ff ff ff ff ff
00000030: ff ff ff ff ff ff ff ff ff ff ff ff ff ff ff ff
00000040: ff ff ff ff ff ff ff ff ff ff ff ff ff ff ff ff
00000050: ff ff ff ff ff ff ff ff ff ff ff ff ff ff ff ff
00000060: ff ff bf f6 f1 f2 ff 65 87 1f 2f ff 5f 66 f9 f1
00000070: f2 ff 74 96 0f 3f ff 3f 68 f9 f1 f2 ff 73 97 1f
00000080: 2f ff 3f 77 f9 60 ff ef 87 f9 60 ff ef 87 f9 60
00000090: ff df 97 11 f7 60 ff df b7 f7 b0 ff 7f c8 f5 d1
000000a0: ff 5f d7 f6 f0 f0 ff 72 5e 0f 2f ff 1f e7 f5 f0
000000b0: f3 ef f7 50 0f 3f ff 7e 63 56 af f9 cf 47 66 f5
000000c0: 8b ff 7c 64 56 cf f7 cf 37 67 f5 6d ff 7b 74 56
000000d0: df f6 af 58 66 f5 6d ff fa 46 f5 6d ff fa 37 f5
000000e0: 7c ff fa 27 f6 8b ff fa 37 f5 8b ff fa 27 f6 a9
000000f0: ff fb 26 f6 d5 ff 9f 47 f6 f0 f2 ff 6a 65 0f 2f
00000100: ff af 56 f6 f0 f0 ff 6c 65 fe f0 ff 6d bf fc ff
00000110: 0f f6 2c ff ff 69 ff ff ff ff ff ff ff ff ff ff
00000120: ff ff ff ff ff ff ff ff ff ff ff ff ff ff ff ff
00000130: ff ff ff ff ff ff ff ff ff ff 2f f8 ff ff ff ff
00000140: ff ff ff ff ff ff ff ff ff ff ff ff ff ff ff ff
00000150: ff ff ff ff ff ff ff ff ff ff ff 1c ff ff ff ff
00000160: ff ff ff ff ff ff ff ff ff ff 1f 1c ff ff
UrbLink = 00000000
[9931 ms] UsbSnoop - DispatchAny(f2340610) : IRP_MJ_INTERNAL_DEVICE_CONTROL
[9931 ms] UsbSnoop - MyDispatchInternalIOCTL(f2341e80) : fdo=825ffaf0, Irp=82701008, IRQL=2
[9931 ms] >>> URB 42 going down >>>
-- URB_FUNCTION_BULK_OR_INTERRUPT_TRANSFER:
PipeHandle = 8256385c [endpoint 0x00000082]
TransferFlags = 00000003 (USBD_TRANSFER_DIRECTION_IN, USBD_SHORT_TRANSFER_OK)
TransferBufferLength = 0000041c
TransferBuffer = 826de3e8
TransferBufferMDL = 00000000
UrbLink = 00000000
[9958 ms] UsbSnoop - MyInternalIOCTLCompletion(f2341db0) : fido=00000000, Irp=82701008, Context=825e8328, IRQL=2
[9958 ms] <<< URB 42 coming back <<<
-- URB_FUNCTION_BULK_OR_INTERRUPT_TRANSFER:
PipeHandle = 8256385c [endpoint 0x00000082]
TransferFlags = 00000003 (USBD_TRANSFER_DIRECTION_IN, USBD_SHORT_TRANSFER_OK)
TransferBufferLength = 0000016a
TransferBuffer = 826de3e8
TransferBufferMDL = 8255c128
00000000: 01 01 17 01 00 20 cf 01 00 00 13 00 00 00 68 00
00000010: 50 00 00 00 54 01 f0 ff ff ff ff ff ff ff ff ff
00000020: ff ff ff ff ff ff ff ff ff ff ff ff ff ff ff ff
00000030: ff ff ff ff ff ff ff ff ff ff ff ff ff ff ff ff
00000040: ff ff ff ff ff ff ff ff ff ff ff ff ff ff ff ff
00000050: ff ff ff ff ff ff ff ff ff ff ff ff ff ff ff 6f
00000060: 1f ff 8f f3 1f 3f ff 3f f7 1f 2f ff 4f f7 23 fb
00000070: f3 ff 82 2f b3 3f ff 2f f7 42 fb f2 ff 73 2f b4
00000080: f9 ff 7a 2f b5 f6 ff 8c 2f b5 f6 ff 7c 3f b5 f6
00000090: ff 7c 3f b5 f8 ff 89 3f a5 fd ff 75 4f a5 0f ff
000000a0: 2f f8 54 fa f1 ff 71 5f a5 2f ff 7e 6f a5 2f ff
000000b0: 7e 53 5d 2f fb cf 37 c7 f5 85 ff 7c 73 4d 6f f8
000000c0: af 38 d7 f4 77 ff 7a 65 3e 7f f6 af 58 f6 20 7f
000000d0: f6 af 5f 0f f1 77 ff f9 f8 5f f6 af 8f ff 84 ff
000000e0: f9 f8 3f f8 af 8f ff 92 ff fa f8 be ff 6f 11 f8
000000f0: fa f3 ff 69 bf 2f ff af f6 fb f1 ff 6b bf 0f ff
00000100: cf f6 11 d9 ff ef f6 20 8a ff ff 63 3e ff ff 8f
00000110: f3 21 ff ff ff ff ff ff ff ff ff ff ff ff ff ff
00000120: ff ff ff ff ff ff ff ff ff ff ff ff ff ff ff ff
00000130: ff ff ff ff ff ff 8e ff ff ff ff ff ff ff ff ff
00000140: ff ff ff ff ff ff ff ff ff ff ff ff ff ff ff ff
00000150: ff ff ff ff ff ff cf f1 ff ff ff ff ff ff ff ff
00000160: ff ff ff ff ff ff 11 f1 ff ff
UrbLink = 00000000
[9958 ms] UsbSnoop - DispatchAny(f2340610) : IRP_MJ_INTERNAL_DEVICE_CONTROL
[9958 ms] UsbSnoop - MyDispatchInternalIOCTL(f2341e80) : fdo=825ffaf0, Irp=82701008, IRQL=2
[9958 ms] >>> URB 43 going down >>>
-- URB_FUNCTION_BULK_OR_INTERRUPT_TRANSFER:
PipeHandle = 8256385c [endpoint 0x00000082]
TransferFlags = 00000003 (USBD_TRANSFER_DIRECTION_IN, USBD_SHORT_TRANSFER_OK)
TransferBufferLength = 0000041c
TransferBuffer = 826de3e8
TransferBufferMDL = 00000000
UrbLink = 00000000
[9985 ms] UsbSnoop - MyInternalIOCTLCompletion(f2341db0) : fido=00000000, Irp=82701008, Context=825a1928, IRQL=2
[9985 ms] <<< URB 43 coming back <<<
-- URB_FUNCTION_BULK_OR_INTERRUPT_TRANSFER:
PipeHandle = 8256385c [endpoint 0x00000082]
TransferFlags = 00000003 (USBD_TRANSFER_DIRECTION_IN, USBD_SHORT_TRANSFER_OK)
TransferBufferLength = 0000016e
TransferBuffer = 826de3e8
TransferBufferMDL = 8255c128
00000000: 01 01 17 01 00 20 dc 01 00 00 14 00 00 00 68 00
00000010: 50 00 00 00 58 01 f0 ff ff ff ff ff ff ff ff ff
00000020: ff ff ff ff ff ff ff ff ff ff ff ff ff ff ff ff
00000030: ff ff ff ff ff ff ff ff ff ff ff ff ff ff ff ff
00000040: ff ff ff ff ff ff ff ff ff ff ff ff ff ff ff ff
00000050: ff ff ff ff ff ff ff ff ff ff ff ff 53 ff bf f2
00000060: 3f 1f ff 4f f7 f5 fd ff 73 4f ff f0 ff 73 3f ff
00000070: f1 ff 82 2f ff f2 ff 72 2f ff f2 ff 82 1f 2a fb
00000080: ff 7c 2f 78 f8 ff 8b 2f 88 f6 ff 7c 3f a7 f6 ff
00000090: 8a 3f a7 fb ff 85 3f b6 fd ff 82 4f a7 0f ff 0f
000000a0: f7 75 f9 f1 ef f8 75 f9 f2 df 37 c6 78 33 11 fb
000000b0: cf 46 c6 3a 85 f8 bf 47 d6 2f 79 ff 7b 64 fd a2
000000c0: f6 af 57 e6 1f 6a ff 7a 65 0f 0f 6a ff 99 21 71
000000d0: 1f ad f6 9f 8f 0f ab f6 9f 8f 5f 96 f8 8f 8f 4f
000000e0: 87 f8 9f 8f 3f 78 f8 af 8f 2f 59 fa ff 15 81 4f
000000f0: 19 0f ff 8f f6 a4 e1 ff 9f f6 a3 d2 ff af f6 a2
00000100: b3 ff cf f6 a1 94 ff ef f6 a0 65 ff ff 62 0f f9
00000110: ff ff 31 1f f8 ff ff ff ff ff ff ff ff ff ff ff
00000120: ff ff ff ff ff ff ff ff ff ff ff ff ff ff ff ff
00000130: ff ff ff ff ff ff ff ff ff ff ff ff 5f f8 ff ff
00000140: ff ff ff ff ff ff ff ff ff ff ff ff ff ff ff ff
00000150: ff ff ff ff ff ff ff ff ff ff ff ff ff 1c ff ff
00000160: ff ff ff ff ff ff ff ff ff ff ff ff 1f 1c
UrbLink = 00000000
[9985 ms] UsbSnoop - DispatchAny(f2340610) : IRP_MJ_INTERNAL_DEVICE_CONTROL
[9985 ms] UsbSnoop - MyDispatchInternalIOCTL(f2341e80) : fdo=825ffaf0, Irp=82701008, IRQL=2
[9985 ms] >>> URB 44 going down >>>
-- URB_FUNCTION_BULK_OR_INTERRUPT_TRANSFER:
PipeHandle = 8256385c [endpoint 0x00000082]
TransferFlags = 00000003 (USBD_TRANSFER_DIRECTION_IN, USBD_SHORT_TRANSFER_OK)
TransferBufferLength = 0000041c
TransferBuffer = 826de3e8
TransferBufferMDL = 00000000
UrbLink = 00000000
[10012 ms] UsbSnoop - MyInternalIOCTLCompletion(f2341db0) : fido=00000000, Irp=82701008, Context=8251cee8, IRQL=2
[10012 ms] <<< URB 44 coming back <<<
-- URB_FUNCTION_BULK_OR_INTERRUPT_TRANSFER:
PipeHandle = 8256385c [endpoint 0x00000082]
TransferFlags = 00000003 (USBD_TRANSFER_DIRECTION_IN, USBD_SHORT_TRANSFER_OK)
TransferBufferLength = 0000016e
TransferBuffer = 826de3e8
TransferBufferMDL = 8255c128
00000000: 01 01 17 01 00 20 ea 01 00 00 15 00 00 00 68 00
00000010: 50 00 00 00 58 01 f0 ff ff ff ff ff ff ff ff ff
00000020: ff ff ff ff ff ff ff ff ff ff ff ff ff ff ff ff
00000030: ff ff ff ff ff ff ff ff ff ff ff ff ff ff ff ff
00000040: ff ff ff ff ff ff ff ff ff ff ff ff ff ff ff ff
00000050: ff ff ff ff ff ff ff ff ff ff ff af f3 ff 64 6f
00000060: fa 40 ff 2f f7 f3 d0 f3 ff 82 2f 2f 3c ff 2f f7
00000070: f2 b4 f3 ff 81 1f 6f 3a ff 1f f7 f2 f7 ff 8c 2f
00000080: 68 f8 ff 7c 2f 88 f7 ff 8b 2f 98 f7 ff 7a 3f a7
00000090: f7 ff 7a 3f a7 f7 ff 79 4f a7 f7 ff 88 4f a7 96
000000a0: f1 ef f7 75 89 28 ff 8c 52 8d 87 29 ff 7c 63 8d
000000b0: 95 39 ff 7b 63 fd 97 f3 af 47 d6 7f 39 ff 7a 64
000000c0: fe a5 f3 9f 48 f6 f0 a4 f3 9f 2a f7 f0 a3 f3 9f
000000d0: 7f fe b0 f3 9f 7f 4f ba f3 9f 7f 5f c8 f3 8f 8f
000000e0: 3f d9 f3 9f 7f 2f e9 f2 ff f1 f0 92 0f f2 ff 67
000000f0: 5f f9 10 ff 8f f6 a3 ff ff 6a 3f fa ff af f6 92
00000100: ff ff 6c 0f fb ff cf f6 a0 ff ff 1d 41 0f f9 ff
00000110: ff ff ff ff ff ff ff ff ff ff ff ff ff ff ff ff
00000120: ff ff ff ff ff ff ff ff ff ff ff ff ff ff ff ff
00000130: ff ff ff ff ff ff ff ff ff ff 2f f8 ff ff ff ff
00000140: ff ff ff ff ff ff ff ff ff ff ff ff ff ff ff ff
00000150: ff ff ff ff ff ff ff ff ff ff ff 1c ff ff ff ff
00000160: ff ff ff ff ff ff ff ff ff ff 1f 1c ff ff
UrbLink = 00000000
[10012 ms] UsbSnoop - DispatchAny(f2340610) : IRP_MJ_INTERNAL_DEVICE_CONTROL
[10012 ms] UsbSnoop - MyDispatchInternalIOCTL(f2341e80) : fdo=825ffaf0, Irp=82701008, IRQL=2
[10012 ms] >>> URB 45 going down >>>
-- URB_FUNCTION_BULK_OR_INTERRUPT_TRANSFER:
PipeHandle = 8256385c [endpoint 0x00000082]
TransferFlags = 00000003 (USBD_TRANSFER_DIRECTION_IN, USBD_SHORT_TRANSFER_OK)
TransferBufferLength = 0000041c
TransferBuffer = 826de3e8
TransferBufferMDL = 00000000
UrbLink = 00000000
[10041 ms] UsbSnoop - MyInternalIOCTLCompletion(f2341db0) : fido=00000000, Irp=82701008, Context=8252e608, IRQL=2
[10041 ms] <<< URB 45 coming back <<<
-- URB_FUNCTION_BULK_OR_INTERRUPT_TRANSFER:
PipeHandle = 8256385c [endpoint 0x00000082]
TransferFlags = 00000003 (USBD_TRANSFER_DIRECTION_IN, USBD_SHORT_TRANSFER_OK)
TransferBufferLength = 00000172
TransferBuffer = 826de3e8
TransferBufferMDL = 8255c128
00000000: 01 01 17 01 00 20 f7 01 00 00 15 00 00 00 68 00
00000010: 50 00 00 00 5c 01 f0 ff ff ff ff ff ff ff ff ff
00000020: ff ff ff ff ff ff ff ff ff ff ff ff ff ff ff ff
00000030: ff ff ff ff ff ff ff ff ff ff ff ff ff ff ff ff
00000040: ff ff ff ff ff ff ff ff ff ff ff ff ff ff ff ff
00000050: ff ff ff ff ff ff ff ff ff 8f f3 59 ff ff 79 3f
00000060: fe 74 ff 78 3f 1f 0f fa 8f f7 f2 d3 fb 7f f7 f2
00000070: c5 fb 7f f7 f1 a7 fc 6f f7 92 94 8a ff 7a 2f 78
00000080: a7 f7 af f7 73 88 79 ff 7a 3f a6 97 f7 9f f7 64
00000090: 7a 89 ff 78 4f a6 a7 28 f1 3f f7 65 7a ba ff 73
000000a0: 5f a6 b7 fa 2f f7 76 88 9c ff 72 53 8d 96 9c ff
000000b0: 62 73 fc d7 f9 1f 37 c7 7f ac ff 71 64 fd a6 fc
000000c0: 0f 57 e6 4f cb ff 70 65 0f 3f 9a ff f3 e7 1f 8a
000000d0: ff f4 f7 b3 7b ff f5 f7 85 6c ff f6 f7 94 6c ff
000000e0: f6 f7 93 6d ff f7 f6 92 6e ff 3f 27 f1 91 0f f7
000000f0: ff 63 3f fa 90 ff 0f f7 a2 1f fd cf f6 a1 2f fd
00000100: cf f6 a0 4f fc cf f5 a0 6f fb cf f5 a0 8f f9 ff
00000110: 3f f7 7c ff ff ff ff ff ff ff ff ff ff ff ff ff
00000120: ff ff ff ff ff ff ff ff ff ff ff ff ff ff ff ff
00000130: ff ff ff ff ff ff ff ff ff ff ff ff ff ff 8c ff
00000140: ff ff ff ff ff ff ff ff ff ff ff ff ff ff ff ff
00000150: ff ff ff ff ff ff ff ff ff ff ff ff ff ff cf f1
00000160: ff ff ff ff ff ff ff ff ff ff ff ff ff ff 11 f1
00000170: ff ff
UrbLink = 00000000
[10041 ms] UsbSnoop - DispatchAny(f2340610) : IRP_MJ_INTERNAL_DEVICE_CONTROL
[10041 ms] UsbSnoop - MyDispatchInternalIOCTL(f2341e80) : fdo=825ffaf0, Irp=82701008, IRQL=2
[10041 ms] >>> URB 46 going down >>>
-- URB_FUNCTION_BULK_OR_INTERRUPT_TRANSFER:
PipeHandle = 8256385c [endpoint 0x00000082]
TransferFlags = 00000003 (USBD_TRANSFER_DIRECTION_IN, USBD_SHORT_TRANSFER_OK)
TransferBufferLength = 0000041c
TransferBuffer = 826de3e8
TransferBufferMDL = 00000000
UrbLink = 00000000
[10071 ms] UsbSnoop - MyInternalIOCTLCompletion(f2341db0) : fido=00000000, Irp=82701008, Context=825200c8, IRQL=2
[10071 ms] <<< URB 46 coming back <<<
-- URB_FUNCTION_BULK_OR_INTERRUPT_TRANSFER:
PipeHandle = 8256385c [endpoint 0x00000082]
TransferFlags = 00000003 (USBD_TRANSFER_DIRECTION_IN, USBD_SHORT_TRANSFER_OK)
TransferBufferLength = 0000017a
TransferBuffer = 826de3e8
TransferBufferMDL = 8255c128
00000000: 01 01 17 01 00 20 04 02 00 00 15 00 00 00 68 00
00000010: 50 00 00 00 64 01 f0 ff ff ff ff ff ff ff ff ff
00000020: ff ff ff ff ff ff ff ff ff ff ff ff ff ff ff ff
00000030: ff ff ff ff ff ff ff ff ff ff ff ff ff ff ff ff
00000040: ff ff ff ff ff ff ff ff ff ff ff ff ff ff ff ff
00000050: ff ff ff ff ff ff ff ff ff 68 6f f9 97 ff 76 3f
00000060: fe e2 ff 64 3f 2f fe f1 2f f7 f2 c4 3f ff 71 1f
00000070: 5f fc f4 7e 1f 7f fa f5 7e 1f 59 a8 48 f8 7d 2f
00000080: 87 a7 77 f6 7d 2f 97 97 77 f6 7c 3f 97 97 67 f7
00000090: 7c 3f a6 a7 47 f8 9b 2f 97 a7 4f bf f7 64 7a fa
000000a0: f3 7b 4f 88 b8 2f bf 37 f1 71 88 fc f0 7b 63 9c
000000b0: 95 ec cf 37 c6 7f fd f0 6b 64 fd b6 4f 8f 47 d6
000000c0: 6f fa f5 87 64 fe b4 6f 6f 57 f6 f0 23 71 49 f9
000000d0: f6 f6 e0 8b 87 5f 7f 3f ba 97 f7 f5 f7 84 6c 7a
000000e0: 5f 7f 3f c9 a6 f7 f5 f6 93 6d 7a af 1f 2f e9 97
000000f0: f7 2f f6 94 0f 78 f8 2f f6 93 1f 1b fa 3f f6 92
00000100: 2f 7f ff 63 1f fa f2 f7 3f f6 a0 4f 5f ff 64 ae
00000110: 7f 3f ff 14 31 0f f9 f9 f0 ff ff 3f f8 ff ff ff
00000120: ff ff ff ff ff ff ff ff ff ff ff ff ff ff ff ff
00000130: ff ff ff ff ff ff ff ff ff ff ff ff ff ff ff ff
00000140: ff ff ff ff ff ff ff ff 77 ff ff ff ff ff ff ff
00000150: ff ff ff ff ff ff ff ff ff ff ff ff ff ff ff ff
00000160: ff ff ff ff ff ff ff ff df f1 ff ff ff ff ff ff
00000170: ff ff ff ff ff ff ff ff 11 f1
UrbLink = 00000000
[10071 ms] UsbSnoop - DispatchAny(f2340610) : IRP_MJ_INTERNAL_DEVICE_CONTROL
[10071 ms] UsbSnoop - MyDispatchInternalIOCTL(f2341e80) : fdo=825ffaf0, Irp=82701008, IRQL=2
[10071 ms] >>> URB 47 going down >>>
-- URB_FUNCTION_BULK_OR_INTERRUPT_TRANSFER:
PipeHandle = 8256385c [endpoint 0x00000082]
TransferFlags = 00000003 (USBD_TRANSFER_DIRECTION_IN, USBD_SHORT_TRANSFER_OK)
TransferBufferLength = 0000041c
TransferBuffer = 826de3e8
TransferBufferMDL = 00000000
UrbLink = 00000000
[10094 ms] UsbSnoop - MyInternalIOCTLCompletion(f2341db0) : fido=00000000, Irp=82701008, Context=82520368, IRQL=2
[10094 ms] <<< URB 47 coming back <<<
-- URB_FUNCTION_BULK_OR_INTERRUPT_TRANSFER:
PipeHandle = 8256385c [endpoint 0x00000082]
TransferFlags = 00000003 (USBD_TRANSFER_DIRECTION_IN, USBD_SHORT_TRANSFER_OK)
TransferBufferLength = 0000017e
TransferBuffer = 826de3e8
TransferBufferMDL = 8255c128
00000000: 01 01 17 01 00 20 11 02 00 00 15 00 00 00 68 00
00000010: 50 00 00 00 68 01 f0 ff ff ff ff ff ff ff ff ff
00000020: ff ff ff ff ff ff ff ff ff ff ff ff ff ff ff ff
00000030: ff ff ff ff ff ff ff ff ff ff ff ff ff ff ff ff
00000040: ff ff ff ff ff ff ff ff ff ff ff ff ff ff ff ff
00000050: ff ff ff ff ff ff ff ff df f3 96 7f f9 7f f6 e4
00000060: 1f fe 4f f7 f2 e2 1f 4f d1 f6 f2 c4 3f 2f c2 f7
00000070: f1 b6 4f 0f c3 f7 f1 a6 5f 5d 7b 1f 59 a8 48 c8
00000080: b6 f7 81 77 7a 67 6c 7a 2f 97 97 77 c6 a6 f7 72
00000090: 79 89 75 6c 6a 3f a6 a7 47 c8 a5 f7 63 7a fa c4
000000a0: a4 f7 64 7a fa d3 b3 f6 75 79 fb f2 7b 13 11 8e
000000b0: 87 fc f0 6c 63 9c 95 ec df 36 c6 7f fc f1 7b 63
000000c0: fd b6 3f af 46 e6 5f fa f5 78 64 0f 3f 9b b1 7f
000000d0: 47 f6 f1 a2 59 f8 f7 e6 be 87 f8 f6 f6 a3 7b 79
000000e0: 6f 6f 4f c8 a6 f7 f5 f7 83 6d 7a 6f 6f 2f e8 a6
000000f0: f7 0f fa 83 0f 97 f7 2f f6 b4 8d 96 ff 62 3f f9
00000100: f1 f8 2f f6 92 2f 7f ff 63 1f fa f2 f7 3f f6 a0
00000110: 4f 5f ff 64 ae 7f 3f ff 27 1f f7 db ff ff ff 74
00000120: ff ff ff ff ff ff ff ff ff ff ff ff ff ff ff ff
00000130: ff ff ff ff ff ff ff ff ff ff ff ff ff ff ff ff
00000140: ff ff ff ff ff ff ff ff ff ff ff ff 86 ff ff ff
00000150: ff ff ff ff ff ff ff ff ff ff ff ff ff ff ff ff
00000160: ff ff ff ff ff ff ff ff ff ff ff ff cf f1 ff ff
00000170: ff ff ff ff ff ff ff ff ff ff ff ff 11 f1
UrbLink = 00000000
[10094 ms] UsbSnoop - DispatchAny(f2340610) : IRP_MJ_INTERNAL_DEVICE_CONTROL
[10094 ms] UsbSnoop - MyDispatchInternalIOCTL(f2341e80) : fdo=825ffaf0, Irp=82701008, IRQL=2
[10094 ms] >>> URB 48 going down >>>
-- URB_FUNCTION_BULK_OR_INTERRUPT_TRANSFER:
PipeHandle = 8256385c [endpoint 0x00000082]
TransferFlags = 00000003 (USBD_TRANSFER_DIRECTION_IN, USBD_SHORT_TRANSFER_OK)
TransferBufferLength = 0000041c
TransferBuffer = 826de3e8
TransferBufferMDL = 00000000
UrbLink = 00000000
[10122 ms] UsbSnoop - MyInternalIOCTLCompletion(f2341db0) : fido=00000000, Irp=82701008, Context=82510e68, IRQL=2
[10122 ms] <<< URB 48 coming back <<<
-- URB_FUNCTION_BULK_OR_INTERRUPT_TRANSFER:
PipeHandle = 8256385c [endpoint 0x00000082]
TransferFlags = 00000003 (USBD_TRANSFER_DIRECTION_IN, USBD_SHORT_TRANSFER_OK)
TransferBufferLength = 0000018a
TransferBuffer = 826de3e8
TransferBufferMDL = 8255c128
00000000: 01 01 17 01 00 20 1f 02 00 00 15 00 00 00 68 00
00000010: 50 00 00 00 74 01 f0 ff ff ff ff ff ff ff ff ff
00000020: ff ff ff ff ff ff ff ff ff ff ff ff ff ff ff ff
00000030: ff ff ff ff ff ff ff ff ff ff ff ff ff ff ff ff
00000040: ff ff ff ff ff ff ff ff ff ff ff ff ff ff ff ff
00000050: ff ff ff ff ff ff ff ff 1f f2 a5 6f fa 78 67 3f
00000060: fe e2 5f 78 f6 f2 e1 2f 3f 69 f6 f2 c3 3f 1f 6b
00000070: f6 f1 b5 4f 0f 6b f6 f0 b6 4f dd 56 1f 68 98 58
00000080: c7 6e f4 72 78 79 67 ec 46 2f 87 97 77 c6 6e f4
00000090: 62 6a 7a 75 7c 61 36 3f a6 a6 28 c9 26 66 f2 64
000000a0: 6a fa c4 44 66 f2 64 6a fb d2 53 66 f2 64 79 fb
000000b0: f2 66 16 13 1f 77 c8 0f 7f 96 c6 39 ca fe 68 69
000000c0: fc b7 2f 6f 96 d6 5f fb f4 65 69 fe a4 5f 5f a6
000000d0: f5 f0 a3 29 fa 64 69 1f 1f 9a 85 4f 66 fc e0 7a
000000e0: 88 3f 66 fd 93 7b 79 3f 66 fd 83 6c 7a 3f 66 fc
000000f0: 93 6c 7a 3f 66 fc 92 6d 7a 3f 96 f7 93 7e 88 3f
00000100: 96 f6 93 9e 96 3f 87 f6 a2 0f 8f 3f 87 f6 a1 1f
00000110: 7f 4f 96 f6 a0 3f 6f 4f 96 e6 fa f5 f4 65 5a 9e
00000120: 7f 3f 5f f6 0f f6 db 8f f6 ff 5f f7 ff ff ff ff
00000130: ff ff ff ff ff ff ff ff ff ff ff ff ff ff ff ff
00000140: ff ff ff ff ff ff ff ff ff ff ff ff ff ff ff ff
00000150: ff ff ff ff ff ff ff ff 85 ff ff ff ff ff ff ff
00000160: ff ff ff ff ff ff ff ff ff ff ff ff ff ff ff ff
00000170: ff ff ff ff ff ff ff ff cf f1 ff ff ff ff ff ff
00000180: ff ff ff ff ff ff ff ff 11 f1
UrbLink = 00000000
[10122 ms] UsbSnoop - DispatchAny(f2340610) : IRP_MJ_INTERNAL_DEVICE_CONTROL
[10122 ms] UsbSnoop - MyDispatchInternalIOCTL(f2341e80) : fdo=825ffaf0, Irp=82701008, IRQL=2
[10122 ms] >>> URB 49 going down >>>
-- URB_FUNCTION_BULK_OR_INTERRUPT_TRANSFER:
PipeHandle = 8256385c [endpoint 0x00000082]
TransferFlags = 00000003 (USBD_TRANSFER_DIRECTION_IN, USBD_SHORT_TRANSFER_OK)
TransferBufferLength = 0000041c
TransferBuffer = 826de3e8
TransferBufferMDL = 00000000
UrbLink = 00000000
[10149 ms] UsbSnoop - MyInternalIOCTLCompletion(f2341db0) : fido=00000000, Irp=82701008, Context=8251b1a8, IRQL=2
[10149 ms] <<< URB 49 coming back <<<
-- URB_FUNCTION_BULK_OR_INTERRUPT_TRANSFER:
PipeHandle = 8256385c [endpoint 0x00000082]
TransferFlags = 00000003 (USBD_TRANSFER_DIRECTION_IN, USBD_SHORT_TRANSFER_OK)
TransferBufferLength = 0000018a
TransferBuffer = 826de3e8
TransferBufferMDL = 8255c128
00000000: 01 01 17 01 00 20 2c 02 00 00 15 00 00 00 68 00
00000010: 50 00 00 00 74 01 f0 ff ff ff ff ff ff ff ff ff
00000020: ff ff ff ff ff ff ff ff ff ff ff ff ff ff ff ff
00000030: ff ff ff ff ff ff ff ff ff ff ff ff ff ff ff ff
00000040: ff ff ff ff ff ff ff ff ff ff ff ff ff ff ff ff
00000050: ff ff ff ff ff ff ff ff bf f9 a6 8f f7 2f fe e1
00000060: 5f f8 1f 1f fd f2 93 3f b1 3f fc f3 b0 2f a2 5f
00000070: fa e4 fc 22 f9 a6 4f dd 1f 93 58 a8 57 c7 fe 31
00000080: 79 77 6a 77 eb 1f 93 96 97 76 c6 fe 31 78 79 79
00000090: 75 ec 0f 94 a5 97 18 ca 35 f6 40 59 6a fa c4 44
000000a0: f6 40 78 69 fb d2 53 f6 40 78 78 fc f1 66 0f 84
000000b0: 78 d7 fd 68 0f 94 39 c9 fe 68 0f 94 6f fb f2 66
000000c0: 0f 94 6f fa f4 65 0f a4 5f f9 f5 65 0f b4 3f 9a
000000d0: a2 4f f6 40 fd 91 69 f7 64 1f f3 c1 8a 87 3f e7
000000e0: f4 84 7b 79 3f e7 f5 92 6b 7a 3f f6 40 2f c9 a6
000000f0: f7 63 0f f4 91 6d 7a 3f f6 40 1f e8 87 f8 73 0f
00000100: f3 90 9e b3 3f f7 30 9e 0f 7f 4f f7 30 9d 2f 6f
00000110: 4f f6 22 9c 3f 6f 4f f6 22 9b 5f 4f 5f f6 13 9b
00000120: 7f 1f 6f f6 13 1f f1 cc 8f f6 ff ff ff ff ff ff
00000130: ff ff ff ff ff ff ff ff ff ff ff ff ff ff ff ff
00000140: ff ff ff ff ff ff ff ff ff ff ff ff ff ff ff ff
00000150: ff ff ff ff ff ff ff ff ff 80 ff ff ff ff ff ff
00000160: ff ff ff ff ff ff ff ff ff ff ff ff ff ff ff ff
00000170: ff ff ff ff ff ff ff ff ff cf f1 ff ff ff ff ff
00000180: ff ff ff ff ff ff ff ff ff 11
UrbLink = 00000000
[10149 ms] UsbSnoop - DispatchAny(f2340610) : IRP_MJ_INTERNAL_DEVICE_CONTROL
[10149 ms] UsbSnoop - MyDispatchInternalIOCTL(f2341e80) : fdo=825ffaf0, Irp=82701008, IRQL=2
[10149 ms] >>> URB 50 going down >>>
-- URB_FUNCTION_BULK_OR_INTERRUPT_TRANSFER:
PipeHandle = 8256385c [endpoint 0x00000082]
TransferFlags = 00000003 (USBD_TRANSFER_DIRECTION_IN, USBD_SHORT_TRANSFER_OK)
TransferBufferLength = 0000041c
TransferBuffer = 826de3e8
TransferBufferMDL = 00000000
UrbLink = 00000000
[10176 ms] UsbSnoop - MyInternalIOCTLCompletion(f2341db0) : fido=00000000, Irp=82701008, Context=8251f148, IRQL=2
[10176 ms] <<< URB 50 coming back <<<
-- URB_FUNCTION_BULK_OR_INTERRUPT_TRANSFER:
PipeHandle = 8256385c [endpoint 0x00000082]
TransferFlags = 00000003 (USBD_TRANSFER_DIRECTION_IN, USBD_SHORT_TRANSFER_OK)
TransferBufferLength = 0000018e
TransferBuffer = 826de3e8
TransferBufferMDL = 8255c128
00000000: 01 01 17 01 00 20 39 02 00 00 15 00 00 00 68 00
00000010: 50 00 00 00 78 01 f0 ff ff ff ff ff ff ff ff ff
00000020: ff ff ff ff ff ff ff ff ff ff ff ff ff ff ff ff
00000030: ff ff ff ff ff ff ff ff ff ff ff ff ff ff ff ff
00000040: ff ff ff ff ff ff ff ff ff ff ff ff ff ff ff ff
00000050: ff ff ff ff ff ff ff ff 1f f7 96 8f f7 c5 d1 1f
00000060: fe 85 3f ef fe f1 93 3f ff c0 3f 0f fb f2 2f fb
00000070: e3 fc f2 3f f9 d4 fd 81 75 86 79 76 eb 1f 87 75
00000080: 97 67 c6 fe 61 49 69 79 66 ec 0f 97 a3 96 67 c6
00000090: 17 f6 70 2a 6a 7a 83 6c 62 0f a7 a2 a6 3f 4c 64
000000a0: 0f a7 a2 a6 3f 3c 65 0f b6 83 b7 1f 6f f6 60 4b
000000b0: 86 ec 7f f6 70 5a b2 ec 7f f6 70 fa b3 1f 6f f6
000000c0: 60 fb a2 4f 5f f6 60 fb a2 5f 4f f6 60 fb a1 29
000000d0: fa 64 0f c6 0f 8a 86 3f f6 70 0f ba 87 f7 63 0f
000000e0: f7 72 6c 79 3f f6 70 1f c8 96 f7 63 0f f7 80 7c
000000f0: 79 3f f6 70 8e 6e 79 3f f6 70 19 93 7d 79 3f f7
00000100: 70 18 83 ae 94 12 0f f6 71 18 82 1f 6f 4f f6 f1
00000110: 11 f8 f2 f6 64 1f af 3f 4f 5f f6 f2 f8 f5 f3 65
00000120: 3f 6f 7f 0f 7f f6 e3 ff c1 8f f6 c5 ff ff ff 17
00000130: 31 ff ff ff ff ff ff ff ff ff ff ff ff ff ff ff
00000140: ff ff ff ff ff ff ff ff ff ff ff ff ff ff ff ff
00000150: ff ff ff ff ff ff ff ff ff ff ff ff 8e ff ff ff
00000160: ff ff ff ff ff ff ff ff ff ff ff ff ff ff ff ff
00000170: ff ff ff ff ff ff ff ff ff ff ff ff cf f1 ff ff
00000180: ff ff ff ff ff ff ff ff ff ff ff ff 11 f1
UrbLink = 00000000
[10176 ms] UsbSnoop - DispatchAny(f2340610) : IRP_MJ_INTERNAL_DEVICE_CONTROL
[10176 ms] UsbSnoop - MyDispatchInternalIOCTL(f2341e80) : fdo=825ffaf0, Irp=82701008, IRQL=2
[10176 ms] >>> URB 51 going down >>>
-- URB_FUNCTION_BULK_OR_INTERRUPT_TRANSFER:
PipeHandle = 8256385c [endpoint 0x00000082]
TransferFlags = 00000003 (USBD_TRANSFER_DIRECTION_IN, USBD_SHORT_TRANSFER_OK)
TransferBufferLength = 0000041c
TransferBuffer = 826de3e8
TransferBufferMDL = 00000000
UrbLink = 00000000
[10212 ms] UsbSnoop - MyInternalIOCTLCompletion(f2341db0) : fido=00000000, Irp=82701008, Context=825a32e8, IRQL=2
[10212 ms] <<< URB 51 coming back <<<
-- URB_FUNCTION_BULK_OR_INTERRUPT_TRANSFER:
PipeHandle = 8256385c [endpoint 0x00000082]
TransferFlags = 00000003 (USBD_TRANSFER_DIRECTION_IN, USBD_SHORT_TRANSFER_OK)
TransferBufferLength = 00000186
TransferBuffer = 826de3e8
TransferBufferMDL = 8255c128
00000000: 01 01 17 01 00 20 47 02 00 00 15 00 00 00 68 00
00000010: 50 00 00 00 70 01 f0 ff ff ff ff ff ff ff ff ff
00000020: ff ff ff ff ff ff ff ff ff ff ff ff ff ff ff ff
00000030: ff ff ff ff ff ff ff ff ff ff ff ff ff ff ff ff
00000040: ff ff ff ff ff ff ff ff ff ff ff ff ff ff ff ff
00000050: ff ff ff ff ff ff ff 3f f8 3f fa 77 5f 0f df fe
00000060: 94 2f 3f 2b fd f1 b1 2f 4f 3a fb f3 b0 1f 5f 3a
00000070: fb d3 fd f1 a5 94 4f ec 0f 68 98 94 57 c7 fe 70
00000080: 78 49 79 66 fb f0 70 78 49 79 66 ec 7e 6a 49 79
00000090: 75 6c 71 7e 6a 49 7a 92 5c 72 7e 7a 48 fa d2 34
000000a0: e7 a7 87 b4 1f 2d 75 7e 7a 48 ec 6f e7 a7 87 c4
000000b0: fd 77 7e 7a 48 fb f0 76 7e 7a 38 fc f1 66 7e 7a
000000c0: 38 fa f4 65 7e 7a 38 fa f4 74 7e 7a 28 9a 93 3f
000000d0: f6 70 7a 28 8a 76 3f f6 70 7a 18 6b 88 2f e7 a7
000000e0: f7 65 79 2f e7 a7 f7 74 79 2f e7 a7 f7 74 79 2f
000000f0: f6 80 79 5f 86 f8 81 0f 87 f7 85 87 2f f7 70 78
00000100: 5f 1b fa 73 0f 68 f8 f6 f6 73 0f 7f 6f 5f 4f f6
00000110: f2 f5 f8 f4 74 1f 5f 9f 2f 5f f6 f3 f3 ec 6f f7
00000120: f3 f2 0f f8 ff d6 ff ff ff 19 ff ff ff ff ff ff
00000130: ff ff ff ff ff ff ff ff ff ff ff ff ff ff ff ff
00000140: ff ff ff ff ff ff ff ff ff ff ff ff ff ff ff ff
00000150: ff ff ff ff ff ef f8 ff ff ff ff ff ff ff ff ff
00000160: ff ff ff ff ff ff ff ff ff ff ff ff ff ff ff ff
00000170: ff ff ff ff ff ff 1c ff ff ff ff ff ff ff ff ff
00000180: ff ff ff ff ff 1f
UrbLink = 00000000
[10212 ms] UsbSnoop - DispatchAny(f2340610) : IRP_MJ_INTERNAL_DEVICE_CONTROL
[10212 ms] UsbSnoop - MyDispatchInternalIOCTL(f2341e80) : fdo=825ffaf0, Irp=82701008, IRQL=2
[10212 ms] >>> URB 52 going down >>>
-- URB_FUNCTION_BULK_OR_INTERRUPT_TRANSFER:
PipeHandle = 8256385c [endpoint 0x00000082]
TransferFlags = 00000003 (USBD_TRANSFER_DIRECTION_IN, USBD_SHORT_TRANSFER_OK)
TransferBufferLength = 0000041c
TransferBuffer = 826de3e8
TransferBufferMDL = 00000000
UrbLink = 00000000
[10256 ms] UsbSnoop - MyInternalIOCTLCompletion(f2341db0) : fido=00000000, Irp=82701008, Context=8251b2a8, IRQL=2
[10256 ms] <<< URB 52 coming back <<<
-- URB_FUNCTION_BULK_OR_INTERRUPT_TRANSFER:
PipeHandle = 8256385c [endpoint 0x00000082]
TransferFlags = 00000003 (USBD_TRANSFER_DIRECTION_IN, USBD_SHORT_TRANSFER_OK)
TransferBufferLength = 00000182
TransferBuffer = 826de3e8
TransferBufferMDL = 8255c128
00000000: 01 01 17 01 00 20 54 02 00 00 15 00 00 00 68 00
00000010: 50 00 00 00 6c 01 f0 ff ff ff ff ff ff ff ff ff
00000020: ff ff ff ff ff ff ff ff ff ff ff ff ff ff ff ff
00000030: ff ff ff ff ff ff ff ff ff ff ff ff ff ff ff ff
00000040: ff ff ff ff ff ff ff ff ff ff ff ff ff ff ff ff
00000050: ff ff ff ff ff ff 65 6f fc 2f fb 76 4f 1f df 0f
00000060: 3f f9 f2 f3 fb f1 a1 2f 4f bf 2f be 2f 5f 9f 3f
00000070: cd 1f 6f 9f 28 b9 fe 70 77 9f 66 b6 0f 0f 96 f7
00000080: 68 66 fb e0 97 f7 68 66 dc 0f 97 f7 78 74 5c 62
00000090: 0f a7 f6 f8 c3 25 f6 70 6a 9f 1f 3d 64 0f b6 f6
000000a0: f9 f1 65 0f b6 f7 e9 6f f6 60 6b af fd 67 0f a7
000000b0: f6 ea 6f f6 70 6a 9f 2f 4f f6 60 7b 6f 4f 4f f6
000000c0: 60 6b 7f 5f 3f f6 60 7b 6f 48 f8 63 0f a6 f8 66
000000d0: 77 3f f6 60 6b 7f 95 f7 62 0f a7 f6 57 79 2f f6
000000e0: 70 6a 7f 95 f7 62 0f 97 f7 57 79 2f f6 70 79 7f
000000f0: 95 f7 62 0f 97 f7 67 86 3f f6 80 87 7f 5f 3f f6
00000100: a1 83 8f 5f 3f f6 f1 f6 f8 f4 64 1f 6f 9f 3f 4f
00000110: f6 f2 f4 ec 6f f6 f3 f3 bd 8f f6 f4 f1 ff ff 1f
00000120: fa ff ff ff ff ff ff ff ff ff ff ff ff ff ff ff
00000130: ff ff ff ff ff ff ff ff ff ff ff ff ff ff ff ff
00000140: ff ff ff ff ff ff ff ff ff ff ff ff ff ff ff ff
00000150: 89 ff ff ff ff ff ff ff ff ff ff ff ff ff ff ff
00000160: ff ff ff ff ff ff ff ff ff ff ff ff ff ff ff ff
00000170: cf f1 ff ff ff ff ff ff ff ff ff ff ff ff ff ff
00000180: 11 f1
UrbLink = 00000000
[10256 ms] UsbSnoop - DispatchAny(f2340610) : IRP_MJ_INTERNAL_DEVICE_CONTROL
[10256 ms] UsbSnoop - MyDispatchInternalIOCTL(f2341e80) : fdo=825ffaf0, Irp=82701008, IRQL=2
[10256 ms] >>> URB 53 going down >>>
-- URB_FUNCTION_BULK_OR_INTERRUPT_TRANSFER:
PipeHandle = 8256385c [endpoint 0x00000082]
TransferFlags = 00000003 (USBD_TRANSFER_DIRECTION_IN, USBD_SHORT_TRANSFER_OK)
TransferBufferLength = 0000041c
TransferBuffer = 826de3e8
TransferBufferMDL = 00000000
UrbLink = 00000000
[10300 ms] UsbSnoop - MyInternalIOCTLCompletion(f2341db0) : fido=00000000, Irp=82701008, Context=82510e68, IRQL=2
[10300 ms] <<< URB 53 coming back <<<
-- URB_FUNCTION_BULK_OR_INTERRUPT_TRANSFER:
PipeHandle = 8256385c [endpoint 0x00000082]
TransferFlags = 00000003 (USBD_TRANSFER_DIRECTION_IN, USBD_SHORT_TRANSFER_OK)
TransferBufferLength = 0000017a
TransferBuffer = 826de3e8
TransferBufferMDL = 8255c128
00000000: 01 01 17 01 00 20 63 02 00 00 15 00 00 00 68 00
00000010: 50 00 00 00 64 01 f0 ff ff ff ff ff ff ff ff ff
00000020: ff ff ff ff ff ff ff ff ff ff ff ff ff ff ff ff
00000030: ff ff ff ff ff ff ff ff ff ff ff ff ff ff ff ff
00000040: ff ff ff ff ff ff ff ff ff ff ff ff ff ff ff ff
00000050: ff ff ff ff ff ff 4f f9 ff 5f f7 f4 f1 af f2 94
00000060: 2f 2f ff 4a 1f fa f1 f4 9f f4 b0 1f 4f ff 49 ce
00000070: 0f 6f ff 58 eb 8e 77 ff 58 eb 7e 78 ff 58 db 0f
00000080: 97 f6 8f b5 fd 70 79 ff 57 5b 62 0f 97 f7 7f c4
00000090: 34 f6 70 79 ff 47 4c 73 6e 7a ff 47 2c 65 0f a6
000000a0: f7 7f f2 66 0f a6 f7 7f f2 66 0f a6 f7 7f f2 57
000000b0: 0f a6 f7 7f f4 55 0f a6 f7 7f f4 64 0f a6 f7 7f
000000c0: f5 63 0f a6 f7 7f f5 63 0f a6 f7 7f f6 62 0f a6
000000d0: f7 7f f6 72 7e 79 ff 67 2f f6 60 7a ff 67 2f f6
000000e0: 60 6a ff 68 2f f6 60 6a ff 68 2f e7 87 f7 8f f6
000000f0: 62 0f 87 f7 8f f5 63 0f 59 f8 8f f5 63 1f 6f ff
00000100: 48 4f f6 f1 f5 9f f4 64 2f 4f ff 39 5f f6 f2 f3
00000110: af f1 67 3f 2f ff ff ff 91 ff ff ff ff ff ff ff
00000120: ff ff ff ff ff ff ff ff ff ff ff ff ff ff ff ff
00000130: ff ff ff ff ff ff ff ff ff ff ff ff ff ff ff ff
00000140: ff ff ff ff ff ff ff ff ff 7a ff ff ff ff ff ff
00000150: ff ff ff ff ff ff ff ff ff ff ff ff ff ff ff ff
00000160: ff ff ff ff ff ff ff ff ff df f1 ff ff ff ff ff
00000170: ff ff ff ff ff ff ff ff ff 11
UrbLink = 00000000
[10300 ms] UsbSnoop - DispatchAny(f2340610) : IRP_MJ_INTERNAL_DEVICE_CONTROL
[10300 ms] UsbSnoop - MyDispatchInternalIOCTL(f2341e80) : fdo=825ffaf0, Irp=82701008, IRQL=2
[10300 ms] >>> URB 54 going down >>>
-- URB_FUNCTION_BULK_OR_INTERRUPT_TRANSFER:
PipeHandle = 8256385c [endpoint 0x00000082]
TransferFlags = 00000003 (USBD_TRANSFER_DIRECTION_IN, USBD_SHORT_TRANSFER_OK)
TransferBufferLength = 0000041c
TransferBuffer = 826de3e8
TransferBufferMDL = 00000000
UrbLink = 00000000
[10336 ms] UsbSnoop - MyInternalIOCTLCompletion(f2341db0) : fido=00000000, Irp=82701008, Context=82549948, IRQL=2
[10336 ms] <<< URB 54 coming back <<<
-- URB_FUNCTION_BULK_OR_INTERRUPT_TRANSFER:
PipeHandle = 8256385c [endpoint 0x00000082]
TransferFlags = 00000003 (USBD_TRANSFER_DIRECTION_IN, USBD_SHORT_TRANSFER_OK)
TransferBufferLength = 00000172
TransferBuffer = 826de3e8
TransferBufferMDL = 8255c128
00000000: 01 01 17 01 00 20 70 02 00 00 15 00 00 00 68 00
00000010: 50 00 00 00 5c 01 f0 ff ff ff ff ff ff ff ff ff
00000020: ff ff ff ff ff ff ff ff ff ff ff ff ff ff ff ff
00000030: ff ff ff ff ff ff ff ff ff ff ff ff ff ff ff ff
00000040: ff ff ff ff ff ff ff ff ff ff ff ff ff ff ff ff
00000050: ff ff ff ff ff ff 96 ff 5f a6 f7 f3 f0 ff 81 89
00000060: 2f 2f ff 9e 98 1f 4f ff 9d a7 1f 4f ff ac b6 0f
00000070: 5f ff ac d4 0f 67 f8 bf 77 fd 60 78 ff 6b e7 7e
00000080: 78 ff 7a e7 7e 69 ff 7a 58 71 7e 79 ff 79 57 63
00000090: 7e 79 ff 79 28 65 6e 7a ff 69 1f e6 a6 f7 9f f6
000000a0: 61 6e 7a ff 69 1f e6 a6 f7 9f f6 51 0f a6 f7 9f
000000b0: f6 51 0f a6 f7 9f f6 51 0f a6 f7 9f f6 51 0f a6
000000c0: f7 9f f6 51 0f a6 f7 9f f6 51 0f a6 f7 9f f6 61
000000d0: 6e 7a ff 79 6e 0f a6 f6 af e7 f6 60 6a ff 7a 6e
000000e0: 0f 87 f7 af e7 e7 87 f7 bf e6 e7 87 f7 bf d7 f6
000000f0: b0 92 ff ab 6a 1f 5f ff ac 6a 1f 5f ff 9d 6a 2f
00000100: 3f ff 9e 6a 2f 3f ff 0f b8 f5 f3 f1 ff 72 ff 88
00000110: ff af f3 ff ff ff ff ff ff ff ff ff ff ff ff ff
00000120: ff ff ff ff ff ff ff ff ff ff ff ff ff ff ff ff
00000130: ff ff ff ff ff ff ff ff ff ff ff ff ff ff ff ff
00000140: ff 8b ff ff ff ff ff ff ff ff ff ff ff ff ff ff
00000150: ff ff ff ff ff ff ff ff ff ff ff ff ff ff ff ff
00000160: ff cf f1 ff ff ff ff ff ff ff ff ff ff ff ff ff
00000170: ff 11
UrbLink = 00000000
[10336 ms] UsbSnoop - DispatchAny(f2340610) : IRP_MJ_INTERNAL_DEVICE_CONTROL
[10336 ms] UsbSnoop - MyDispatchInternalIOCTL(f2341e80) : fdo=825ffaf0, Irp=82701008, IRQL=2
[10336 ms] >>> URB 55 going down >>>
-- URB_FUNCTION_BULK_OR_INTERRUPT_TRANSFER:
PipeHandle = 8256385c [endpoint 0x00000082]
TransferFlags = 00000003 (USBD_TRANSFER_DIRECTION_IN, USBD_SHORT_TRANSFER_OK)
TransferBufferLength = 0000041c
TransferBuffer = 826de3e8
TransferBufferMDL = 00000000
UrbLink = 00000000
[10364 ms] UsbSnoop - MyInternalIOCTLCompletion(f2341db0) : fido=00000000, Irp=82701008, Context=825114a8, IRQL=2
[10364 ms] <<< URB 55 coming back <<<
-- URB_FUNCTION_BULK_OR_INTERRUPT_TRANSFER:
PipeHandle = 8256385c [endpoint 0x00000082]
TransferFlags = 00000003 (USBD_TRANSFER_DIRECTION_IN, USBD_SHORT_TRANSFER_OK)
TransferBufferLength = 00000182
TransferBuffer = 826de3e8
TransferBufferMDL = 8255c128
00000000: 01 01 17 01 00 20 7d 02 00 00 15 00 00 00 68 00
00000010: 50 00 00 00 6c 01 f0 ff ff ff ff ff ff ff ff ff
00000020: ff ff ff ff ff ff ff ff ff ff ff ff ff ff ff ff
00000030: ff ff ff ff ff ff ff ff ff ff ff ff ff ff ff ff
00000040: ff ff ff ff ff ff ff ff ff ff ff ff ff ff ff ff
00000050: ff ff ff ff ff af f7 ff d5 46 4f 0f ff 0f 2f 44
00000060: 2f 2f ff fe 34 f4 f1 f4 df 4f 43 1f 4f ff fc 35
00000070: f4 f1 f5 bf 2b 28 f4 70 77 ff 7b 77 42 0f 77 f7
00000080: bf 96 17 f4 60 69 ff 7a 79 41 0f 96 f6 af 97 17
00000090: e4 97 f7 9f a7 16 e4 97 f7 9f a7 16 e4 a6 f7 9f
000000a0: b6 eb a6 f7 9f b6 eb a6 f7 9f b6 eb 97 f7 9f b6
000000b0: 16 e4 97 f7 9f b6 16 e4 a6 f7 9f b6 16 e4 a6 f7
000000c0: 9f b6 16 e4 a6 f7 9f b6 eb a6 f7 9f b6 16 e4 a6
000000d0: f7 9f b6 16 e4 a6 f7 9f a7 16 e4 97 f7 9f a7 16
000000e0: e4 97 f6 af 97 17 e4 97 f6 af 97 17 f4 60 78 ff
000000f0: 8a 78 41 0f 77 f7 bf 77 18 f4 f0 f6 bf 7f 41 0f
00000100: 6f ff fb 26 f4 f0 f5 df 5f 42 1f 3f ff fe 34 f4
00000110: f2 f2 ff f0 33 f3 f4 f0 ff f2 f0 0f f8 ff 79 ff
00000120: ff ff ff ff ff ff ff ff ff ff ff ff ff ff ff ff
00000130: ff ff ff ff ff ff ff ff ff ff ff ff ff ff ff ff
00000140: ff ff ff ff ff ff ff ff ff ff ff ff ff ff 86 ff
00000150: ff ff ff ff ff ff ff ff ff ff ff ff ff ff ff ff
00000160: ff ff ff ff ff ff ff ff ff ff ff ff ff ff cf f1
00000170: ff ff ff ff ff ff ff ff ff ff ff ff ff ff 11 f1
00000180: ff ff
UrbLink = 00000000
[10364 ms] UsbSnoop - DispatchAny(f2340610) : IRP_MJ_INTERNAL_DEVICE_CONTROL
[10364 ms] UsbSnoop - MyDispatchInternalIOCTL(f2341e80) : fdo=825ffaf0, Irp=82701008, IRQL=2
[10364 ms] >>> URB 56 going down >>>
-- URB_FUNCTION_BULK_OR_INTERRUPT_TRANSFER:
PipeHandle = 8256385c [endpoint 0x00000082]
TransferFlags = 00000003 (USBD_TRANSFER_DIRECTION_IN, USBD_SHORT_TRANSFER_OK)
TransferBufferLength = 0000041c
TransferBuffer = 826de3e8
TransferBufferMDL = 00000000
UrbLink = 00000000
[10390 ms] UsbSnoop - MyInternalIOCTLCompletion(f2341db0) : fido=00000000, Irp=82701008, Context=825a32e8, IRQL=2
[10390 ms] <<< URB 56 coming back <<<
-- URB_FUNCTION_BULK_OR_INTERRUPT_TRANSFER:
PipeHandle = 8256385c [endpoint 0x00000082]
TransferFlags = 00000003 (USBD_TRANSFER_DIRECTION_IN, USBD_SHORT_TRANSFER_OK)
TransferBufferLength = 00000176
TransferBuffer = 826de3e8
TransferBufferMDL = 8255c128
00000000: 01 01 17 01 00 20 8b 02 00 00 15 00 00 00 68 00
00000010: 50 00 00 00 60 01 f0 ff ff ff ff ff ff ff ff ff
00000020: ff ff ff ff ff ff ff ff ff ff ff ff ff ff ff ff
00000030: ff ff ff ff ff ff ff ff ff ff ff ff ff ff ff ff
00000040: ff ff ff ff ff ff ff ff ff ff ff ff ff ff ff ff
00000050: ff ff ff ff ff ff ff e8 0f a4 fe ff f0 e2 84 2f
00000060: ff fd d4 84 2f ff fd c5 84 3f ff fb c6 74 4f ff
00000070: fb c6 64 67 f7 bf 77 c7 64 86 f7 af 96 a7 65 86
00000080: f7 9f 97 a7 65 96 f6 9f 97 a7 55 97 f6 9f a7 a6
00000090: 55 97 f6 9f a7 97 55 a6 f6 9f b6 97 55 a6 f7 8f
000000a0: b6 97 55 a6 f6 9f b6 87 56 a6 f6 9f b6 96 56 a6
000000b0: f6 9f b6 f7 64 6a ff 69 6b 5f a6 f6 9f b6 f6 65
000000c0: 6a ff 69 7b 4f a6 f6 9f b6 f7 64 6a ff 69 7b 4f
000000d0: a6 f6 9f a7 f6 65 6a ff 79 6a 5f a6 f6 9f 97 f7
000000e0: 65 79 ff 79 79 5f 87 f6 bf 87 f7 66 77 ff 8b 76
000000f0: 7f 5f ff fb c6 64 5f ff fb a6 66 5f ff fc a5 76
00000100: 3f ff fd b4 86 1f ff 0f 2f 6c e9 ff 2f 0f 5e 0f
00000110: f4 ff 79 ff ff ff ff ff ff ff ff ff ff ff ff ff
00000120: ff ff ff ff ff ff ff ff ff ff ff ff ff ff ff ff
00000130: ff ff ff ff ff ff ff ff ff ff ff ff ff ff ff ff
00000140: ff ff 5f f8 ff ff ff ff ff ff ff ff ff ff ff ff
00000150: ff ff ff ff ff ff ff ff ff ff ff ff ff ff ff ff
00000160: ff ff ff 1c ff ff ff ff ff ff ff ff ff ff ff ff
00000170: ff ff 1f 1c ff ff
UrbLink = 00000000
[10390 ms] UsbSnoop - DispatchAny(f2340610) : IRP_MJ_INTERNAL_DEVICE_CONTROL
[10390 ms] UsbSnoop - MyDispatchInternalIOCTL(f2341e80) : fdo=825ffaf0, Irp=82701008, IRQL=2
[10390 ms] >>> URB 57 going down >>>
-- URB_FUNCTION_BULK_OR_INTERRUPT_TRANSFER:
PipeHandle = 8256385c [endpoint 0x00000082]
TransferFlags = 00000003 (USBD_TRANSFER_DIRECTION_IN, USBD_SHORT_TRANSFER_OK)
TransferBufferLength = 0000041c
TransferBuffer = 826de3e8
TransferBufferMDL = 00000000
UrbLink = 00000000
[10418 ms] UsbSnoop - MyInternalIOCTLCompletion(f2341db0) : fido=00000000, Irp=82701008, Context=8251b2a8, IRQL=2
[10418 ms] <<< URB 57 coming back <<<
-- URB_FUNCTION_BULK_OR_INTERRUPT_TRANSFER:
PipeHandle = 8256385c [endpoint 0x00000082]
TransferFlags = 00000003 (USBD_TRANSFER_DIRECTION_IN, USBD_SHORT_TRANSFER_OK)
TransferBufferLength = 0000016e
TransferBuffer = 826de3e8
TransferBufferMDL = 8255c128
00000000: 01 01 17 01 00 20 9d 02 00 00 15 00 00 00 68 00
00000010: 50 00 00 00 58 01 f0 ff ff ff ff ff ff ff ff ff
00000020: ff ff ff ff ff ff ff ff ff ff ff ff ff ff ff ff
00000030: ff ff ff ff ff ff ff ff ff ff ff ff ff ff ff ff
00000040: ff ff ff ff ff ff ff ff ff ff ff ff ff ff ff ff
00000050: ff ff ff ff ff ff 6f fd f0 43 f6 ff f0 d3 3f 84
00000060: ff fd d3 4f 93 ff fb c5 3f 94 ff fb c5 3f 94 ff
00000070: ca 81 fc 82 f6 af 77 b8 f6 74 ff 79 78 7a 5f f6
00000080: 8f a7 a6 f7 65 ff 69 6a 7a 5f f6 8f a7 97 fb 61
00000090: ff 78 7a e9 6d ff 78 7a f9 b1 f6 8f b6 97 2f 6a
000000a0: ff 68 7b f9 93 f6 8f b6 97 4f 68 ff 68 7b 3f 8a
000000b0: f6 8f b6 f7 95 67 ff 68 7b 7f 77 f6 8f a7 f7 77
000000c0: 67 ff 68 7b 7f 77 f6 8f a7 f7 68 67 ff 78 7a 7f
000000d0: 77 f6 8f a7 f6 78 67 ff 78 79 8f 67 f7 8f 97 f7
000000e0: 87 66 ff 7a 78 5f 5a f7 af 68 f8 b3 94 ff fa a7
000000f0: 3f 95 ff fa a6 4f 85 ff fc a5 3f 76 ff fd b4 1f
00000100: 78 ff fe b3 ae f5 ff e3 ae ff ff 69 ff ff ff ff
00000110: ff ff ff ff ff ff ff ff ff ff ff ff ff ff ff ff
00000120: ff ff ff ff ff ff ff ff ff ff ff ff ff ff ff ff
00000130: ff ff ff ff ff ff ff ff ff ff ff ff 88 ff ff ff
00000140: ff ff ff ff ff ff ff ff ff ff ff ff ff ff ff ff
00000150: ff ff ff ff ff ff ff ff ff ff ff ff cf f1 ff ff
00000160: ff ff ff ff ff ff ff ff ff ff ff ff 11 f1
UrbLink = 00000000
[10418 ms] UsbSnoop - DispatchAny(f2340610) : IRP_MJ_INTERNAL_DEVICE_CONTROL
[10418 ms] UsbSnoop - MyDispatchInternalIOCTL(f2341e80) : fdo=825ffaf0, Irp=82701008, IRQL=2
[10418 ms] >>> URB 58 going down >>>
-- URB_FUNCTION_BULK_OR_INTERRUPT_TRANSFER:
PipeHandle = 8256385c [endpoint 0x00000082]
TransferFlags = 00000003 (USBD_TRANSFER_DIRECTION_IN, USBD_SHORT_TRANSFER_OK)
TransferBufferLength = 0000041c
TransferBuffer = 826de3e8
TransferBufferMDL = 00000000
UrbLink = 00000000
[10445 ms] UsbSnoop - MyInternalIOCTLCompletion(f2341db0) : fido=00000000, Irp=82701008, Context=82510e68, IRQL=2
[10445 ms] <<< URB 58 coming back <<<
-- URB_FUNCTION_BULK_OR_INTERRUPT_TRANSFER:
PipeHandle = 8256385c [endpoint 0x00000082]
TransferFlags = 00000003 (USBD_TRANSFER_DIRECTION_IN, USBD_SHORT_TRANSFER_OK)
TransferBufferLength = 00000176
TransferBuffer = 826de3e8
TransferBufferMDL = 8255c128
00000000: 01 01 17 01 00 20 b0 02 00 00 15 00 00 00 68 00
00000010: 50 00 00 00 60 01 f0 ff ff ff ff ff ff ff ff ff
00000020: ff ff ff ff ff ff ff ff ff ff ff ff ff ff ff ff
00000030: ff ff ff ff ff ff ff ff ff ff ff ff ff ff ff ff
00000040: ff ff ff ff ff ff ff ff ff ff ff ff ff ff ff ff
00000050: ff ff 9f 12 f2 f4 f1 53 ff e5 fe f4 70 ff f3 d2
00000060: 4f 9d ff f3 c3 4f ac ff f2 c4 4f ac ff f1 b6 4f
00000070: ac ff 81 85 eb 1f f7 5f 77 b7 f6 79 ff 65 69 7a
00000080: 9f f6 5f 97 a6 f7 69 ff 65 7a 89 8f f6 5f a7 96
00000090: fe 62 ff 65 7a f9 f1 60 ff 65 8a f8 e2 f5 6f a6
000000a0: 97 3f 5d ff 66 7a f9 b4 f7 5f a6 97 4f 6b ff 66
000000b0: 7a 5f b9 f5 6f a6 f7 86 5b ff 66 7a 7f b7 f5 6f
000000c0: a6 f7 68 5b ff 66 7a 8f a6 f7 5f a6 f7 68 7a ff
000000d0: 65 7a 8f b6 f6 5f a6 f6 78 6b ff 65 6a 7f b8 f6
000000e0: 5f 97 f6 87 7b ff 84 77 5f ba f7 4f 49 f9 c2 ac
000000f0: ff f2 a6 3f ae ff f1 a6 3f ae ff f2 b4 2f 1f f9
00000100: 2f 3f fc f0 93 ff f3 d1 fd 86 ff c5 0f 14 f4 1c
00000110: 41 ff ff ff ff ff ff ff ff ff ff ff ff ff ff ff
00000120: ff ff ff ff ff ff ff ff ff ff ff ff ff ff ff ff
00000130: ff ff ff ff ff ff ff ff ff ff ff ff ff ff ff ff
00000140: ff ff ff 8a ff ff ff ff ff ff ff ff ff ff ff ff
00000150: ff ff ff ff ff ff ff ff ff ff ff ff ff ff ff ff
00000160: ff ff ff cf f1 ff ff ff ff ff ff ff ff ff ff ff
00000170: ff ff ff 11 f1 ff
UrbLink = 00000000
[10445 ms] UsbSnoop - DispatchAny(f2340610) : IRP_MJ_INTERNAL_DEVICE_CONTROL
[10445 ms] UsbSnoop - MyDispatchInternalIOCTL(f2341e80) : fdo=825ffaf0, Irp=82701008, IRQL=2
[10445 ms] >>> URB 59 going down >>>
-- URB_FUNCTION_BULK_OR_INTERRUPT_TRANSFER:
PipeHandle = 8256385c [endpoint 0x00000082]
TransferFlags = 00000003 (USBD_TRANSFER_DIRECTION_IN, USBD_SHORT_TRANSFER_OK)
TransferBufferLength = 0000041c
TransferBuffer = 826de3e8
TransferBufferMDL = 00000000
UrbLink = 00000000
[10463 ms] UsbSnoop - MyInternalIOCTLCompletion(f2341db0) : fido=00000000, Irp=82701008, Context=82549948, IRQL=2
[10463 ms] <<< URB 59 coming back <<<
-- URB_FUNCTION_BULK_OR_INTERRUPT_TRANSFER:
PipeHandle = 8256385c [endpoint 0x00000082]
TransferFlags = 00000003 (USBD_TRANSFER_DIRECTION_IN, USBD_SHORT_TRANSFER_OK)
TransferBufferLength = 00000182
TransferBuffer = 826de3e8
TransferBufferMDL = 8255c128
00000000: 01 01 17 01 00 20 bd 02 00 00 15 00 00 00 68 00
00000010: 50 00 00 00 6c 01 f0 ff ff ff ff ff ff ff ff ff
00000020: ff ff ff ff ff ff ff ff ff ff ff ff ff ff ff ff
00000030: ff ff ff ff ff ff ff ff ff ff ff ff ff ff ff ff
00000040: ff ff ff ff ff ff ff ff ff ff ff ff ff ff ff ff
00000050: ff ff 2b 31 2f 2f 2f fc ee fe e4 1f af 3f fc d4
00000060: 3f 9f 3f fc c4 5f 7f 4f fc c4 5f 7f 5f fb c3 6f
00000070: 6f 58 b8 16 13 11 f1 71 78 5f 77 b7 f6 79 78 5f
00000080: 96 a6 f7 69 6a 5f 96 a6 f7 69 6a 5f 96 97 f8 77
00000090: 6a 5f a6 96 fe 71 7a 4f a5 97 1f 6e 7b 3f b6 96
000000a0: 2f 6d 7b 3f a6 97 3f 5d 7b 3f b6 96 4f 6b 7b 3f
000000b0: a6 97 4f 6b 7b 3f a6 f7 a4 6a 7b 3f a6 f7 86 5b
000000c0: 7b 3f a6 f7 77 6a 7b 3f a6 f7 77 6a 7b 3f a6 f7
000000d0: 68 6a 7b 3f a6 f7 68 11 78 7a 3f 97 f7 77 7a 6a
000000e0: 4f 97 f6 78 7a 6a 4f 97 f6 87 7a 6a 5f 96 f6 96
000000f0: 6b 79 5f 77 f7 b4 7b 78 5f 1a fa d1 fc f7 f5 a6
00000100: 3f fd f7 f5 b5 2f 0f 5f 7f 4f fb f1 f1 f5 f8 b2
00000110: 0f 4f 3f af 0f cd 7f 1f df f8 33 ff 94 ff ff ff
00000120: ff ff ff ff ff ff ff ff ff ff ff ff ff ff ff ff
00000130: ff ff ff ff ff ff ff ff ff ff ff ff ff ff ff ff
00000140: ff ff ff ff ff ff ff ff ff ff ff ff ff ff ff 4f
00000150: f8 ff ff ff ff ff ff ff ff ff ff ff ff ff ff ff
00000160: ff ff ff ff ff ff ff ff ff ff ff ff ff ff ff ff
00000170: 1c ff ff ff ff ff ff ff ff ff ff ff ff ff ff 1f
00000180: 1c ff
UrbLink = 00000000
[10463 ms] UsbSnoop - DispatchAny(f2340610) : IRP_MJ_INTERNAL_DEVICE_CONTROL
[10463 ms] UsbSnoop - MyDispatchInternalIOCTL(f2341e80) : fdo=825ffaf0, Irp=82701008, IRQL=2
[10463 ms] >>> URB 60 going down >>>
-- URB_FUNCTION_BULK_OR_INTERRUPT_TRANSFER:
PipeHandle = 8256385c [endpoint 0x00000082]
TransferFlags = 00000003 (USBD_TRANSFER_DIRECTION_IN, USBD_SHORT_TRANSFER_OK)
TransferBufferLength = 0000041c
TransferBuffer = 826de3e8
TransferBufferMDL = 00000000
UrbLink = 00000000
[10490 ms] UsbSnoop - MyInternalIOCTLCompletion(f2341db0) : fido=00000000, Irp=82701008, Context=825114a8, IRQL=2
[10490 ms] <<< URB 60 coming back <<<
-- URB_FUNCTION_BULK_OR_INTERRUPT_TRANSFER:
PipeHandle = 8256385c [endpoint 0x00000082]
TransferFlags = 00000003 (USBD_TRANSFER_DIRECTION_IN, USBD_SHORT_TRANSFER_OK)
TransferBufferLength = 0000018e
TransferBuffer = 826de3e8
TransferBufferMDL = 8255c128
00000000: 01 01 17 01 00 20 cf 02 00 00 16 00 00 00 68 00
00000010: 50 00 00 00 78 01 f0 ff ff ff ff ff ff ff ff ff
00000020: ff ff ff ff ff ff ff ff ff ff ff ff ff ff ff ff
00000030: ff ff ff ff ff ff ff ff ff ff ff ff ff ff ff ff
00000040: ff ff ff ff ff ff ff ff ff ff ff ff ff ff ff ff
00000050: b6 9f 82 f9 f0 f3 f0 f0 81 e5 fd d3 3f 9e f3 c2
00000060: 4f fc c4 2a 3f fc c3 5f ac f2 c3 3f fc a6 1b 5f
00000070: fb d2 77 a7 48 77 b6 f6 78 79 79 65 68 6b 8f 97
00000080: 87 67 86 97 f7 78 79 78 65 6a 79 8f a7 86 57 a6
00000090: 96 fb 74 6a 78 65 6a e9 1f b6 86 66 a6 96 1f 6e
000000a0: 6b 68 56 6b f9 d2 b6 86 66 b5 96 3f 6c 6b 68 56
000000b0: 6b f9 b4 b6 86 66 b5 f6 a3 6b 6b 68 56 7a 5f a9
000000c0: b6 86 66 b5 f6 86 6a 6b 68 66 6a 7f a7 b6 86 66
000000d0: b5 f6 77 6a 6b 68 66 79 7f a7 b6 86 66 96 f7 77
000000e0: 6a 13 67 78 65 79 6f a8 97 87 57 96 f6 87 7a 79
000000f0: 78 65 69 6f b8 97 87 57 77 f7 a4 7b 88 79 84 85
00000100: 1f cc 59 a8 57 5f fa d3 6f ba f1 a4 3f 12 fb a6
00000110: 1b 4f fa f2 f1 c4 2a 2f fb f0 f3 d4 39 0f dc 6f
00000120: 2f 0f 58 fb 90 bf fd 64 ff ff ff ff ff ff ff ff
00000130: ff ff ff ff ff ff ff ff ff ff ff ff ff ff ff ff
00000140: ff ff ff ff ff ff ff ff ff ff ff ff ff ff ff ff
00000150: ff ff ff ff ff ff ff ff ff ff ff ff ff 9f f8 ff
00000160: ff ff ff ff ff ff ff ff ff ff ff ff ff ff ff ff
00000170: ff ff ff ff ff ff ff ff ff ff ff ff ff ff 1c ff
00000180: ff ff ff ff ff ff ff ff ff ff ff ff ff 1f
UrbLink = 00000000
[10490 ms] UsbSnoop - DispatchAny(f2340610) : IRP_MJ_INTERNAL_DEVICE_CONTROL
[10490 ms] UsbSnoop - MyDispatchInternalIOCTL(f2341e80) : fdo=825ffaf0, Irp=82701008, IRQL=2
[10490 ms] >>> URB 61 going down >>>
-- URB_FUNCTION_BULK_OR_INTERRUPT_TRANSFER:
PipeHandle = 8256385c [endpoint 0x00000082]
TransferFlags = 00000003 (USBD_TRANSFER_DIRECTION_IN, USBD_SHORT_TRANSFER_OK)
TransferBufferLength = 0000041c
TransferBuffer = 826de3e8
TransferBufferMDL = 00000000
UrbLink = 00000000
[10517 ms] UsbSnoop - MyInternalIOCTLCompletion(f2341db0) : fido=00000000, Irp=82701008, Context=825a32e8, IRQL=2
[10517 ms] <<< URB 61 coming back <<<
-- URB_FUNCTION_BULK_OR_INTERRUPT_TRANSFER:
PipeHandle = 8256385c [endpoint 0x00000082]
TransferFlags = 00000003 (USBD_TRANSFER_DIRECTION_IN, USBD_SHORT_TRANSFER_OK)
TransferBufferLength = 00000192
TransferBuffer = 826de3e8
TransferBufferMDL = 8255c128
00000000: 01 01 17 01 00 20 df 02 00 00 16 00 00 00 68 00
00000010: 50 00 00 00 7c 01 f0 ff ff ff ff ff ff ff ff ff
00000020: ff ff ff ff ff ff ff ff ff ff ff ff ff ff ff ff
00000030: ff ff ff ff ff ff ff ff ff ff ff ff ff ff ff ff
00000040: ff ff ff ff ff ff ff ff ff ff ff ff ff ff 3f 41
00000050: f9 d2 2f 0f 29 0f 2f fd e3 2f 48 fc c4 4f fc 83
00000060: c4 3f fc b5 5f 57 fb c3 5f fb 75 b5 3f fb 97 7f
00000070: 56 db 1f 87 97 78 67 a6 f6 78 78 79 69 66 6a 8f
00000080: a6 96 a6 66 a6 f6 68 6a 78 7a 65 89 6f a7 77 a7
00000090: 57 a6 fc 71 7a 77 7a 65 f9 f0 60 7a 77 7a 65 f9
000000a0: e1 a6 77 b6 57 96 2f 6d 7a 67 7b 56 f9 b3 a7 77
000000b0: b6 57 96 4f 6a 7b 58 7b 65 4f a9 a7 77 c6 56 f6
000000c0: 76 6a 7b 68 7a 65 7f 97 a7 77 b7 56 f6 77 79 7a
000000d0: 77 7a 65 7f 97 a7 77 b7 56 f6 77 79 7a 77 7a 65
000000e0: 7f 97 a7 36 51 a6 57 f6 76 7a 6a 78 7a 65 5f a8
000000f0: 97 97 a6 57 f6 94 7b 78 79 79 55 3f bb 78 97 87
00000100: 67 b5 22 cd 7f f9 67 a5 2f fe a6 6f 46 fb f1 f0
00000110: b5 6f 46 fb f0 f2 c4 4f 37 eb 4f 3f fd 83 d2 fb
00000120: f7 f0 f2 f0 1a ff 57 9f f9 ff ff ff ff ff ff ff
00000130: ff ff ff ff ff ff ff ff ff ff ff ff ff ff ff ff
00000140: ff ff ff ff ff ff ff ff ff ff ff ff ff ff ff ff
00000150: ff ff ff ff ff ff ff ff ff ff ff ff ff ff 6f f8
00000160: ff ff ff ff ff ff ff ff ff ff ff ff ff ff ff ff
00000170: ff ff ff ff ff ff ff ff ff ff ff ff ff ff ff 1c
00000180: ff ff ff ff ff ff ff ff ff ff ff ff ff ff 1f 1c
00000190: ff ff
UrbLink = 00000000
[10517 ms] UsbSnoop - DispatchAny(f2340610) : IRP_MJ_INTERNAL_DEVICE_CONTROL
[10517 ms] UsbSnoop - MyDispatchInternalIOCTL(f2341e80) : fdo=825ffaf0, Irp=82701008, IRQL=2
[10517 ms] >>> URB 62 going down >>>
-- URB_FUNCTION_BULK_OR_INTERRUPT_TRANSFER:
PipeHandle = 8256385c [endpoint 0x00000082]
TransferFlags = 00000003 (USBD_TRANSFER_DIRECTION_IN, USBD_SHORT_TRANSFER_OK)
TransferBufferLength = 0000041c
TransferBuffer = 826de3e8
TransferBufferMDL = 00000000
UrbLink = 00000000
[10544 ms] UsbSnoop - MyInternalIOCTLCompletion(f2341db0) : fido=00000000, Irp=82701008, Context=8251b2a8, IRQL=2
[10544 ms] <<< URB 62 coming back <<<
-- URB_FUNCTION_BULK_OR_INTERRUPT_TRANSFER:
PipeHandle = 8256385c [endpoint 0x00000082]
TransferFlags = 00000003 (USBD_TRANSFER_DIRECTION_IN, USBD_SHORT_TRANSFER_OK)
TransferBufferLength = 00000192
TransferBuffer = 826de3e8
TransferBufferMDL = 8255c128
00000000: 01 01 17 01 00 20 ef 02 00 00 16 00 00 00 68 00
00000010: 50 00 00 00 7c 01 f0 ff ff ff ff ff ff ff ff ff
00000020: ff ff ff ff ff ff ff ff ff ff ff ff ff ff ff ff
00000030: ff ff ff ff ff ff ff ff ff ff ff ff ff ff ff ff
00000040: ff ff ff ff ff ff ff ff ff ff ff ff af f2 0f 92
00000050: f9 e1 1f 0f 7f 23 2f fd d2 3f 4f 15 3f fc c4 3f
00000060: 3f 16 3f fc b4 5f 1f 17 3f fb b5 5f 9e f1 c2 19
00000070: 9b 3a c9 1a 19 11 f1 61 78 79 78 ac 51 8f 97 96
00000080: 87 c7 1f 8f 97 96 96 c7 2f 7f a6 86 a7 b7 26 fa
00000090: 66 7a 77 7a 4b f4 f0 61 7a 77 7a 3b f5 e2 a6 77
000000a0: a7 b7 62 3f 6d 7a 67 7b 4f 4f 6c 7a 67 7b 4f 5f
000000b0: 6b 7a 67 7b 4f 12 31 11 bb a6 77 b6 f7 24 8a 6b
000000c0: 7a 67 7b 4f b2 a8 b5 77 a7 f7 24 7c 6a 7a 77 7a
000000d0: 4f d2 a6 a6 77 a7 f7 24 6d 6a 7a 77 7a 4f d2 a6
000000e0: a6 77 a7 f7 24 7c 6a 6a 78 14 75 4f c2 a7 a6 86
000000f0: a7 f7 24 8b 7a 78 78 6a 5f 92 b9 87 97 87 f7 25
00000100: b7 9b 85 79 87 5f 12 1f fc a6 7f 5f 3f fe a5 7f
00000110: 5f 2f 0f 7f f9 f5 f6 f1 f2 d3 3f 7f fe f5 e1 3f
00000120: 7f 15 f4 da 3f 0f ff ff ff 16 ff ff ff ff ff ff
00000130: ff ff ff ff ff ff ff ff ff ff ff ff ff ff ff ff
00000140: ff ff ff ff ff ff ff ff ff ff ff ff ff ff ff ff
00000150: ff ff ff ff ff ff ff ff ff ff ff ff ff ff ff ff
00000160: bf f8 ff ff ff ff ff ff ff ff ff ff ff ff ff ff
00000170: ff ff ff ff ff ff ff ff ff ff ff ff ff ff ff ff
00000180: ff 1c ff ff ff ff ff ff ff ff ff ff ff ff ff ff
00000190: 1f 1c
UrbLink = 00000000
[10544 ms] UsbSnoop - DispatchAny(f2340610) : IRP_MJ_INTERNAL_DEVICE_CONTROL
[10544 ms] UsbSnoop - MyDispatchInternalIOCTL(f2341e80) : fdo=825ffaf0, Irp=82701008, IRQL=2
[10544 ms] >>> URB 63 going down >>>
-- URB_FUNCTION_BULK_OR_INTERRUPT_TRANSFER:
PipeHandle = 8256385c [endpoint 0x00000082]
TransferFlags = 00000003 (USBD_TRANSFER_DIRECTION_IN, USBD_SHORT_TRANSFER_OK)
TransferBufferLength = 0000041c
TransferBuffer = 826de3e8
TransferBufferMDL = 00000000
UrbLink = 00000000
[10571 ms] UsbSnoop - MyInternalIOCTLCompletion(f2341db0) : fido=00000000, Irp=82701008, Context=82510e68, IRQL=2
[10571 ms] <<< URB 63 coming back <<<
-- URB_FUNCTION_BULK_OR_INTERRUPT_TRANSFER:
PipeHandle = 8256385c [endpoint 0x00000082]
TransferFlags = 00000003 (USBD_TRANSFER_DIRECTION_IN, USBD_SHORT_TRANSFER_OK)
TransferBufferLength = 0000018a
TransferBuffer = 826de3e8
TransferBufferMDL = 8255c128
00000000: 01 01 17 01 00 20 fe 02 00 00 16 00 00 00 68 00
00000010: 50 00 00 00 74 01 f0 ff ff ff ff ff ff ff ff ff
00000020: ff ff ff ff ff ff ff ff ff ff ff ff ff ff ff ff
00000030: ff ff ff ff ff ff ff ff ff ff ff ff ff ff ff ff
00000040: ff ff ff ff ff ff ff ff ff ff ff ff 3a df c6 f2
00000050: d2 2f 0f 6f b8 d4 2f fd f3 a3 5b fc c3 3f 2f bb
00000060: c4 4f fb f5 c0 4b fc a4 6f ed 4b 9b b1 99 84 fc
00000070: f0 7b 77 79 78 fb f0 6b 69 69 79 fb f0 6b 69 78
00000080: 79 fb f0 7a 69 78 7a 6a 72 af 97 77 a7 a7 35 f7
00000090: 6a 7a 77 7a 4a 74 af a6 77 a7 b7 52 b7 c2 a6 77
000000a0: b6 f6 65 2b 6c 7a 67 7b 4f b6 b3 a6 77 b6 f7 64
000000b0: 4b 6a 7a 67 7b 4f b6 a4 a6 77 b6 f7 64 4b 6a 7a
000000c0: 77 7a 4f b6 a4 a6 77 a7 f7 64 4b 6a 7a 67 7b 4f
000000d0: b6 a4 a6 77 b6 f7 64 4b 6a 7a 77 7a 4f b6 a4 a6
000000e0: 86 a7 36 f1 61 4b 6a 6a 78 6a 5f b6 a4 87 87 97
000000f0: f7 65 4b 6b 78 79 78 5f b6 c3 18 12 99 67 f9 65
00000100: 2b fd 96 6f 6f b6 d2 5f fa f6 66 1b 0f 4f fb f5
00000110: 66 cf 3f fd f3 67 df 1f fe f2 68 ff c0 3f fd ff
00000120: ff ff ff ff ff ff ff ff ff ff ff ff ff ff ff ff
00000130: ff ff ff ff ff ff ff ff ff ff ff ff ff ff ff ff
00000140: ff ff ff ff ff ff ff ff ff ff ff ff ff ff ff ff
00000150: ff ff ff ff ff ff ff ff ff 85 ff ff ff ff ff ff
00000160: ff ff ff ff ff ff ff ff ff ff ff ff ff ff ff ff
00000170: ff ff ff ff ff ff 1d ff ff ff 1d ff ff ff ff ff
00000180: ff ff ff ff ff ff ff ff ff 1f
UrbLink = 00000000
[10571 ms] UsbSnoop - DispatchAny(f2340610) : IRP_MJ_INTERNAL_DEVICE_CONTROL
[10571 ms] UsbSnoop - MyDispatchInternalIOCTL(f2341e80) : fdo=825ffaf0, Irp=82701008, IRQL=2
[10571 ms] >>> URB 64 going down >>>
-- URB_FUNCTION_BULK_OR_INTERRUPT_TRANSFER:
PipeHandle = 8256385c [endpoint 0x00000082]
TransferFlags = 00000003 (USBD_TRANSFER_DIRECTION_IN, USBD_SHORT_TRANSFER_OK)
TransferBufferLength = 0000041c
TransferBuffer = 826de3e8
TransferBufferMDL = 00000000
UrbLink = 00000000
[10597 ms] UsbSnoop - MyInternalIOCTLCompletion(f2341db0) : fido=00000000, Irp=82701008, Context=82549948, IRQL=2
[10597 ms] <<< URB 64 coming back <<<
-- URB_FUNCTION_BULK_OR_INTERRUPT_TRANSFER:
PipeHandle = 8256385c [endpoint 0x00000082]
TransferFlags = 00000003 (USBD_TRANSFER_DIRECTION_IN, USBD_SHORT_TRANSFER_OK)
TransferBufferLength = 0000017e
TransferBuffer = 826de3e8
TransferBufferMDL = 8255c128
00000000: 01 01 17 01 00 20 0b 03 00 00 16 00 00 00 68 00
00000010: 50 00 00 00 68 01 f0 ff ff ff ff ff ff ff ff ff
00000020: ff ff ff ff ff ff ff ff ff ff ff ff ff ff ff ff
00000030: ff ff ff ff ff ff ff ff ff ff ff ff ff ff ff ff
00000040: ff ff ff ff ff ff ff ff ff ff ff df f1 6e ff c3
00000050: 1f 0f 6f f8 0f 0f fe f2 a3 ef 2f fc f3 b2 df 4f
00000060: fa f5 c0 df 4f fa d5 fe fc 95 49 c9 fe 7c 67 79
00000070: 78 fb f0 6c 78 78 78 fb f0 5c 79 68 79 fb f0 6b
00000080: 6a 68 6a 7b 71 bf a6 76 a7 a7 35 f7 6b 6a 77 7a
00000090: 4a 74 bf a6 76 a7 b7 52 f7 6b 6a 67 6b 5f f6 6b
000000a0: 6a 58 7b 4f f6 6b 6a 58 7b 4f f6 6b 6a 67 7b 4f
000000b0: f6 6b 6a 68 7a 4f f6 6b 6a 68 7a 4f f6 6b 6a 77
000000c0: 7a 4f f6 5b 6b 77 7a 4f f6 6b 6a 77 7a 4f f6 6b
000000d0: 6a 77 7a 4f f6 6b 69 78 6a 5f f6 6b 69 78 6a 5f
000000e0: f6 6b 69 69 79 5f f6 7b 77 79 78 5f f6 8b 85 89
000000f0: 86 5f f6 fc 95 6f 6f f6 fc b4 5f 6f f6 fd b3 5f
00000100: 6f f6 fd d2 3f 7f f6 fe f0 f0 f1 68 ff 82 11 5f
00000110: fb ff ff ff ff ff ff ff ff ff ff ff ff ff ff ff
00000120: ff ff ff ff ff ff ff ff ff ff ff ff ff ff ff ff
00000130: ff ff ff ff ff ff ff ff ff ff ff ff ff ff ff ff
00000140: ff ff ff ff ff ff ff ff ff ff ff 3f f8 ff ff ff
00000150: ff ff ff ff ff ff ff ff ff ff ff ff ff ff ff ff
00000160: ff ff ff ff ff ff ff ff df f1 ff ff df f1 ff ff
00000170: ff ff ff ff ff ff ff ff ff ff ff ff 11 f1
UrbLink = 00000000
[10597 ms] UsbSnoop - DispatchAny(f2340610) : IRP_MJ_INTERNAL_DEVICE_CONTROL
[10597 ms] UsbSnoop - MyDispatchInternalIOCTL(f2341e80) : fdo=825ffaf0, Irp=82701008, IRQL=2
[10597 ms] >>> URB 65 going down >>>
-- URB_FUNCTION_BULK_OR_INTERRUPT_TRANSFER:
PipeHandle = 8256385c [endpoint 0x00000082]
TransferFlags = 00000003 (USBD_TRANSFER_DIRECTION_IN, USBD_SHORT_TRANSFER_OK)
TransferBufferLength = 0000041c
TransferBuffer = 826de3e8
TransferBufferMDL = 00000000
UrbLink = 00000000
[10633 ms] UsbSnoop - MyInternalIOCTLCompletion(f2341db0) : fido=00000000, Irp=82701008, Context=825114a8, IRQL=2
[10633 ms] <<< URB 65 coming back <<<
-- URB_FUNCTION_BULK_OR_INTERRUPT_TRANSFER:
PipeHandle = 8256385c [endpoint 0x00000082]
TransferFlags = 00000003 (USBD_TRANSFER_DIRECTION_IN, USBD_SHORT_TRANSFER_OK)
TransferBufferLength = 00000172
TransferBuffer = 826de3e8
TransferBufferMDL = 8255c128
00000000: 01 01 17 01 00 20 19 03 00 00 16 00 00 00 68 00
00000010: 50 00 00 00 5c 01 f0 ff ff ff ff ff ff ff ff ff
00000020: ff ff ff ff ff ff ff ff ff ff ff ff ff ff ff ff
00000030: ff ff ff ff ff ff ff ff ff ff ff ff ff ff ff ff
00000040: ff ff ff ff ff ff ff ff ff ff ff ff 7d ff 59 2f
00000050: fe 86 ff 79 fe f1 a3 ff 89 fc f3 b1 ff 99 fa f4
00000060: c0 ff 99 fa c5 fe 9f 99 18 41 c7 fe cf 96 77 b8
00000070: fe df 86 96 b7 fe df 86 96 b7 0f ff 6c 77 6a 6b
00000080: 71 ff 6d 77 6a 4b 64 ff 6d 77 89 3a 65 ff 6d 67
00000090: 7a 4f f6 df 76 b6 f6 64 ff 6d 67 6b 4f f6 df 76
000000a0: b6 f6 74 ff 6c 67 6b 4f f6 df 76 a6 f7 74 ff 6c
000000b0: 67 7a 4f f7 cf 76 a6 f7 64 ff 6d 67 7a 4f f6 df
000000c0: 76 b6 f6 64 ff 6d 77 6a 4f f6 df 85 97 f7 64 ff
000000d0: 6c 78 79 4f f6 cf 96 96 f7 64 ff 7b 79 77 5f f7
000000e0: 9f 98 18 21 f9 65 ff 99 f9 f6 65 ff 89 fb f5 65
000000f0: ff 89 fb f4 66 ff 79 fd f2 67 ff 59 1f 0f 8f f6
00000100: 9f f2 a7 ff ff ff ff ff ff ff ff ff ff ff ff ff
00000110: ff ff ff ff ff ff ff ff ff ff ff ff ff ff ff ff
00000120: ff ff ff ff ff ff ff ff ff ff ff ff ff ff ff ff
00000130: ff ff ff ff ff ff ff ff ff ff ff ff ff ff 3f f8
00000140: ff ff ff ff ff ff ff ff ff ff ff ff ff ff ff ff
00000150: ff ff ff ff ff ff ff ff ff ff ff ff ff ff ff 1c
00000160: ff ff ff ff ff ff ff ff ff ff ff ff ff ff 1f 1c
00000170: ff ff
UrbLink = 00000000
[10633 ms] UsbSnoop - DispatchAny(f2340610) : IRP_MJ_INTERNAL_DEVICE_CONTROL
[10633 ms] UsbSnoop - MyDispatchInternalIOCTL(f2341e80) : fdo=825ffaf0, Irp=82701008, IRQL=2
[10633 ms] >>> URB 66 going down >>>
-- URB_FUNCTION_BULK_OR_INTERRUPT_TRANSFER:
PipeHandle = 8256385c [endpoint 0x00000082]
TransferFlags = 00000003 (USBD_TRANSFER_DIRECTION_IN, USBD_SHORT_TRANSFER_OK)
TransferBufferLength = 0000041c
TransferBuffer = 826de3e8
TransferBufferMDL = 00000000
UrbLink = 00000000
[10669 ms] UsbSnoop - MyInternalIOCTLCompletion(f2341db0) : fido=00000000, Irp=82701008, Context=825a32e8, IRQL=2
[10669 ms] <<< URB 66 coming back <<<
-- URB_FUNCTION_BULK_OR_INTERRUPT_TRANSFER:
PipeHandle = 8256385c [endpoint 0x00000082]
TransferFlags = 00000003 (USBD_TRANSFER_DIRECTION_IN, USBD_SHORT_TRANSFER_OK)
TransferBufferLength = 0000016a
TransferBuffer = 826de3e8
TransferBufferMDL = 8255c128
00000000: 01 01 17 01 00 20 28 03 00 00 16 00 00 00 68 00
00000010: 50 00 00 00 54 01 f0 ff ff ff ff ff ff ff ff ff
00000020: ff ff ff ff ff ff ff ff ff ff ff ff ff ff ff ff
00000030: ff ff ff ff ff ff ff ff ff ff ff ff ff ff ff ff
00000040: ff ff ff ff ff ff ff ff ff ff ff df f7 ff 3f fc
00000050: 86 ff ff f1 f0 94 ff 7f 62 2f 1f fb ff 27 f5 e4
00000060: fc ff 45 f5 d4 fd ff 54 95 82 ec ff 4f 45 77 b7
00000070: fe ff 54 64 78 eb ff 4f 45 86 b7 fe ff 54 73 69
00000080: 6b 71 ff 4f 35 97 a7 35 f6 ff 44 64 7a 3a 65 ff
00000090: 4f 62 a6 a7 62 f6 ff 6c 6a 4f f6 ff 6c 7a 3f f6
000000a0: ff 6c 7a 3f f6 ff 6c 7a 3f f6 ff 6c 7a 3f f7 ff
000000b0: 6b 7a 3f f6 ff 6c 7a 3f f7 ff 6b 7a 3f f6 ff 6c
000000c0: 7a 3f f6 ff 6c 6a 4f f6 ff 6c 6a 4f f6 ff 6c 6a
000000d0: 4f f7 ff 6b 79 4f f6 ff 6d 78 4f f6 ff 7d 85 5f
000000e0: f6 ff fd f5 65 ff df 5f 5f f6 ff fe f4 85 ff cf
000000f0: 2f 7f f7 ff 0f 0f 7f f6 ff 3f fa ff ff ff ff ff
00000100: ff ff ff ff ff ff ff ff ff ff ff ff ff ff ff ff
00000110: ff ff ff ff ff ff ff ff ff ff ff ff ff ff ff ff
00000120: ff ff ff ff ff ff ff ff ff ff ff ff ff ff ff ff
00000130: ff ff ff ff ff ff 3f f8 ff ff ff ff ff ff ff ff
00000140: ff ff ff ff ff ff ff 17 ff ff ff ff ff ff ff ff
00000150: ff ff ff ff ff ff ff ff 14 ff ff ff ff ff ff ff
00000160: ff ff ff ff ff ff ff 1f 14 ff
UrbLink = 00000000
[10669 ms] UsbSnoop - DispatchAny(f2340610) : IRP_MJ_INTERNAL_DEVICE_CONTROL
[10669 ms] UsbSnoop - MyDispatchInternalIOCTL(f2341e80) : fdo=825ffaf0, Irp=82701008, IRQL=2
[10669 ms] >>> URB 67 going down >>>
-- URB_FUNCTION_BULK_OR_INTERRUPT_TRANSFER:
PipeHandle = 8256385c [endpoint 0x00000082]
TransferFlags = 00000003 (USBD_TRANSFER_DIRECTION_IN, USBD_SHORT_TRANSFER_OK)
TransferBufferLength = 0000041c
TransferBuffer = 826de3e8
TransferBufferMDL = 00000000
UrbLink = 00000000
[10705 ms] UsbSnoop - MyInternalIOCTLCompletion(f2341db0) : fido=00000000, Irp=82701008, Context=8251b2a8, IRQL=2
[10705 ms] <<< URB 67 coming back <<<
-- URB_FUNCTION_BULK_OR_INTERRUPT_TRANSFER:
PipeHandle = 8256385c [endpoint 0x00000082]
TransferFlags = 00000003 (USBD_TRANSFER_DIRECTION_IN, USBD_SHORT_TRANSFER_OK)
TransferBufferLength = 00000166
TransferBuffer = 826de3e8
TransferBufferMDL = 8255c128
00000000: 01 01 17 01 00 20 36 03 00 00 16 00 00 00 68 00
00000010: 50 00 00 00 50 01 f0 ff ff ff ff ff ff ff ff ff
00000020: ff ff ff ff ff ff ff ff ff ff ff ff ff ff ff ff
00000030: ff ff ff ff ff ff ff ff ff ff ff ff ff ff ff ff
00000040: ff ff ff ff ff ff ff ff ff ff 72 ff 65 ff af 68
00000050: f6 87 ff 8f 69 f8 94 ff 6f 6b f9 b1 ff 5f 6c ea
00000060: fc ff d4 a6 dd ff 3f 6e ca fe ff e3 7a eb ff 3f
00000070: ae b7 fe ff e3 6b eb ff 3f 26 b6 b6 fe ff 63 72
00000080: 7a 5a 72 ff 3f 44 b6 a7 43 f7 ff 24 75 7a 2a 75
00000090: ff bf a7 f6 73 ff bf a7 f6 73 ff bf a7 f7 72 ff
000000a0: bf a7 f7 72 ff bf a7 f6 64 ff bf a7 f7 63 ff bf
000000b0: a7 f6 64 ff bf a7 f7 72 ff bf a7 f6 73 ff bf a7
000000c0: f6 64 ff bf a7 f6 64 ff cf a6 f6 73 ff cf 96 f7
000000d0: 73 ff cf 96 f6 74 ff cf 76 f8 65 ff cf 56 fa 74
000000e0: ff cf 56 fa 74 ff cf 56 f9 66 ff cf 56 f8 67 ff
000000f0: cf 56 f7 58 ff ff 49 ff ff ff ff ff ff ff ff ff
00000100: ff ff ff ff ff ff ff ff ff ff ff ff ff ff ff ff
00000110: ff ff ff ff ff ff ff ff ff ff ff ff ff ff ff ff
00000120: ff ff ff ff ff ff ff ff ff ff ff ff ff ff ff ff
00000130: ff ff ff 3f f8 ff ff ff ff ff ff ff ff ff ff ff
00000140: ff ff ff ff ff ff ff ff ff ff ff ff ff ff ff ff
00000150: df f1 ff ff df f1 ff ff ff ff ff ff ff ff ff ff
00000160: ff ff ff ff 11 f1
UrbLink = 00000000
[10705 ms] UsbSnoop - DispatchAny(f2340610) : IRP_MJ_INTERNAL_DEVICE_CONTROL
[10705 ms] UsbSnoop - MyDispatchInternalIOCTL(f2341e80) : fdo=825ffaf0, Irp=82701008, IRQL=2
[10705 ms] >>> URB 68 going down >>>
-- URB_FUNCTION_BULK_OR_INTERRUPT_TRANSFER:
PipeHandle = 8256385c [endpoint 0x00000082]
TransferFlags = 00000003 (USBD_TRANSFER_DIRECTION_IN, USBD_SHORT_TRANSFER_OK)
TransferBufferLength = 0000041c
TransferBuffer = 826de3e8
TransferBufferMDL = 00000000
UrbLink = 00000000
[10732 ms] UsbSnoop - MyInternalIOCTLCompletion(f2341db0) : fido=00000000, Irp=82701008, Context=82510e68, IRQL=2
[10732 ms] <<< URB 68 coming back <<<
-- URB_FUNCTION_BULK_OR_INTERRUPT_TRANSFER:
PipeHandle = 8256385c [endpoint 0x00000082]
TransferFlags = 00000003 (USBD_TRANSFER_DIRECTION_IN, USBD_SHORT_TRANSFER_OK)
TransferBufferLength = 00000162
TransferBuffer = 826de3e8
TransferBufferMDL = 8255c128
00000000: 01 01 17 01 00 20 44 03 00 00 16 00 00 00 68 00
00000010: 50 00 00 00 4c 01 f0 ff ff ff ff ff ff ff ff ff
00000020: ff ff ff ff ff ff ff ff ff ff ff ff ff ff ff ff
00000030: ff ff ff ff ff ff ff ff ff ff ff ff ff ff ff ff
00000040: ff ff ff ff ff ff ff ff ff 3f f7 6f f6 ff 99 ff
00000050: 74 ff 7f fb 2f f9 ff b6 ff a2 ff 5f fd 0f fb ff
00000060: e4 3f 91 fd ff f3 f0 22 d9 ff 3f 0f 2f 92 fd ff
00000070: f3 f0 22 d9 ff 3f 17 f7 22 f8 f0 ff 62 72 2f 82
00000080: 16 f7 ff 53 73 2f 82 44 f6 ff 43 74 3f 81 53 f6
00000090: ff 7b ff 65 ff bf f7 5f f6 ff 7b ff 65 ff bf f7
000000a0: 5f f6 ff 7b ff 65 ff bf f7 5f f6 ff 7b ff 65 ff
000000b0: cf f6 5f f6 ff 6c ff 65 ff cf f6 5f f6 ff 7b ff
000000c0: 65 ff cf f6 5f f6 ff 13 68 ff 65 ff cf f6 5f f6
000000d0: ff 6c ff 65 ff cf f6 5f f6 ff 6c ff 65 ff cf f6
000000e0: 5f f6 ff 6c ff 65 ff cf f6 5f f6 ff 6c ff 16 ff
000000f0: ff ff ff ff ff ff ff ff ff ff ff ff ff ff ff ff
00000100: ff ff ff ff ff ff ff ff ff ff ff ff ff ff ff ff
00000110: ff ff ff ff ff ff ff ff ff ff ff ff ff ff ff ff
00000120: ff ff ff ff ff ff ff ff ff ff ff ff ff ff 3f f8
00000130: ff ff ff ff ff ff ff ff ff ff ff ff ff ff ff ff
00000140: ff ff ff ff ff ff ff ff ff ff ff ff ff ff ff 1c
00000150: ff ff ff ff ff ff ff ff ff ff ff ff ff ff 1f 1c
00000160: ff ff
UrbLink = 00000000
[10732 ms] UsbSnoop - DispatchAny(f2340610) : IRP_MJ_INTERNAL_DEVICE_CONTROL
[10732 ms] UsbSnoop - MyDispatchInternalIOCTL(f2341e80) : fdo=825ffaf0, Irp=82701008, IRQL=2
[10732 ms] >>> URB 69 going down >>>
-- URB_FUNCTION_BULK_OR_INTERRUPT_TRANSFER:
PipeHandle = 8256385c [endpoint 0x00000082]
TransferFlags = 00000003 (USBD_TRANSFER_DIRECTION_IN, USBD_SHORT_TRANSFER_OK)
TransferBufferLength = 0000041c
TransferBuffer = 826de3e8
TransferBufferMDL = 00000000
UrbLink = 00000000
[10768 ms] UsbSnoop - MyInternalIOCTLCompletion(f2341db0) : fido=00000000, Irp=82701008, Context=82549948, IRQL=2
[10768 ms] <<< URB 69 coming back <<<
-- URB_FUNCTION_BULK_OR_INTERRUPT_TRANSFER:
PipeHandle = 8256385c [endpoint 0x00000082]
TransferFlags = 00000003 (USBD_TRANSFER_DIRECTION_IN, USBD_SHORT_TRANSFER_OK)
TransferBufferLength = 0000016e
TransferBuffer = 826de3e8
TransferBufferMDL = 8255c128
00000000: 01 01 17 01 00 20 55 03 00 00 17 00 00 00 68 00
00000010: 50 00 00 00 58 01 f0 ff ff ff ff ff ff ff ff ff
00000020: ff ff ff ff ff ff ff ff ff ff ff ff ff ff ff ff
00000030: ff ff ff ff ff ff ff ff ff ff ff ff ff ff ff ff
00000040: ff ff ff ff ff 2f f6 7a ff ff 85 8f 68 f5 ff 98
00000050: 7f 69 f6 ff b5 6f 5b f6 ff c4 5f 6b f5 ff d4 3f
00000060: 5e f6 ff e2 2f 0f 55 ff 3f fe f2 50 f5 ff e3 2f
00000070: 0f 55 ff 3f fe e2 66 ff 1f 17 f7 53 62 66 ff 2f
00000080: 25 f7 43 73 65 ff 2f 43 f7 33 74 55 ff 3f 62 f6
00000090: 6b 55 ff bf f6 6b 55 ff bf f6 6b 55 ff bf f6 6b
000000a0: 65 ff af f6 6b 55 ff bf f6 6b 65 ff af f7 6a 55
000000b0: ff bf f6 6b 65 ff af f6 6b 55 ff bf f6 6b 55 ff
000000c0: bf f6 6b 55 ff bf f6 6b 55 ff bf f7 6a 55 ff bf
000000d0: 36 f1 67 55 ff bf f7 6a 55 ff bf f6 6b 55 ff bf
000000e0: f6 6b 55 ff bf f6 6b 55 ff bf f6 6b 55 ff bf f6
000000f0: 6b 55 ff bf f6 6b 45 ff ff ff ff ff ff ff ff ff
00000100: ff ff ff ff ff ff ff ff ff ff ff ff ff ff ff ff
00000110: ff ff ff ff ff ff ff ff ff ff ff ff ff ff ff ff
00000120: ff ff ff ff ff ff ff ff ff ff ff ff ff ff ff ff
00000130: ff ff ff ff ff ff ff ff ff ff 1f f8 ff ff ff ff
00000140: ff ff ff ff ff ff ff ff ff ff ff ff ff ff ff ff
00000150: ff ff ff ff ff ff ff ff ff ff ff 1c ff ff ff ff
00000160: ff ff ff ff ff ff ff ff ff ff 1f 1c ff ff
UrbLink = 00000000
[10768 ms] UsbSnoop - DispatchAny(f2340610) : IRP_MJ_INTERNAL_DEVICE_CONTROL
[10768 ms] UsbSnoop - MyDispatchInternalIOCTL(f2341e80) : fdo=825ffaf0, Irp=82701008, IRQL=2
[10768 ms] >>> URB 70 going down >>>
-- URB_FUNCTION_BULK_OR_INTERRUPT_TRANSFER:
PipeHandle = 8256385c [endpoint 0x00000082]
TransferFlags = 00000003 (USBD_TRANSFER_DIRECTION_IN, USBD_SHORT_TRANSFER_OK)
TransferBufferLength = 0000041c
TransferBuffer = 826de3e8
TransferBufferMDL = 00000000
UrbLink = 00000000
[10795 ms] UsbSnoop - MyInternalIOCTLCompletion(f2341db0) : fido=00000000, Irp=82701008, Context=825114a8, IRQL=2
[10795 ms] <<< URB 70 coming back <<<
-- URB_FUNCTION_BULK_OR_INTERRUPT_TRANSFER:
PipeHandle = 8256385c [endpoint 0x00000082]
TransferFlags = 00000003 (USBD_TRANSFER_DIRECTION_IN, USBD_SHORT_TRANSFER_OK)
TransferBufferLength = 0000015e
TransferBuffer = 826de3e8
TransferBufferMDL = 8255c128
00000000: 01 01 17 01 00 20 66 03 00 00 17 00 00 00 68 00
00000010: 50 00 00 00 48 01 f0 ff ff ff ff ff ff ff ff ff
00000020: ff ff ff ff ff ff ff ff ff ff ff ff ff ff ff ff
00000030: ff ff ff ff ff ff ff ff ff ff ff ff ff ff ff ff
00000040: ff ff ff ff ff 61 9f f8 ff 4f f8 89 ff ff 84 7f
00000050: fa 25 ff aa 6f fb 34 ff b9 5f fc 43 ff c8 3f fe
00000060: 52 ff f6 f0 e2 2f f5 6f fe e3 2f f5 6f fe f2 f0
00000070: 52 ff e6 3f fe 52 ff 66 62 3f 35 f6 42 ff 57 63
00000080: 3f 34 f7 32 ff 48 64 3f 53 f6 ff 3d 75 af f6 ff
00000090: 6f f6 6b ff ff 76 af f6 ff 6f f7 6a ff ff 76 af
000000a0: f6 ff 6f f6 6b ff ff 76 af f6 ff 6f f7 6a ff ff
000000b0: 76 af f6 ff 6f f7 6a ff ff 76 af f6 ff 6f f7 6a
000000c0: ff ff 76 af f6 ff 6f f7 6a ff ff 76 af f6 ff 6f
000000d0: f7 6a ff ff 66 bf f7 ff 5f f7 7a ff ff 75 af f7
000000e0: ff 5f f7 6a ff ff 76 af f6 ff ff ff ff ff ff ff
000000f0: ff ff ff ff ff ff ff ff ff ff ff ff ff ff ff ff
00000100: ff ff ff ff ff ff ff ff ff ff ff ff ff ff ff ff
00000110: ff ff ff ff ff ff ff ff ff ff ff ff ff ff ff ff
00000120: ff ff ff ff ff ff ff ff ff ff ff ff cf f8 ff ff
00000130: ff ff ff ff ff ff ff ff ff ff ff ff ff 17 ff ff
00000140: ff ff ff ff ff ff ff ff ff ff ff ff ff ff 14 ff
00000150: ff ff ff ff ff ff ff ff ff ff ff ff ff 1f
UrbLink = 00000000
[10795 ms] UsbSnoop - DispatchAny(f2340610) : IRP_MJ_INTERNAL_DEVICE_CONTROL
[10795 ms] UsbSnoop - MyDispatchInternalIOCTL(f2341e80) : fdo=825ffaf0, Irp=82701008, IRQL=2
[10795 ms] >>> URB 71 going down >>>
-- URB_FUNCTION_BULK_OR_INTERRUPT_TRANSFER:
PipeHandle = 8256385c [endpoint 0x00000082]
TransferFlags = 00000003 (USBD_TRANSFER_DIRECTION_IN, USBD_SHORT_TRANSFER_OK)
TransferBufferLength = 0000041c
TransferBuffer = 826de3e8
TransferBufferMDL = 00000000
UrbLink = 00000000
[10822 ms] UsbSnoop - MyInternalIOCTLCompletion(f2341db0) : fido=00000000, Irp=82701008, Context=825a32e8, IRQL=2
[10822 ms] <<< URB 71 coming back <<<
-- URB_FUNCTION_BULK_OR_INTERRUPT_TRANSFER:
PipeHandle = 8256385c [endpoint 0x00000082]
TransferFlags = 00000003 (USBD_TRANSFER_DIRECTION_IN, USBD_SHORT_TRANSFER_OK)
TransferBufferLength = 00000172
TransferBuffer = 826de3e8
TransferBufferMDL = 8255c128
00000000: 01 01 17 01 00 20 76 03 00 00 17 00 00 00 68 00
00000010: 50 00 00 00 5c 01 f0 ff ff ff ff ff ff ff ff ff
00000020: ff ff ff ff ff ff ff ff ff ff ff ff ff ff ff ff
00000030: ff ff ff ff ff ff ff ff ff ff ff ff ff ff ff ff
00000040: ff ff 62 9f f7 5f f7 79 8f f8 4f f8 98 6f f9 3f
00000050: f9 b6 4f fb 2f fa c5 3f fc 1f fb d4 2f fe ed 2f
00000060: fe f1 f0 ec 2f 0f 1f fe fd f0 f1 f0 e1 df fe f2
00000070: f0 71 61 df fe 72 61 2f 26 f6 6d 62 3f 34 f6 52
00000080: 63 df 25 f7 42 74 1f 44 f6 4d 64 3f 52 f6 6a ef
00000090: 61 f6 6a af f6 6f f6 7a 9f f6 6f f6 6a bf f5 6f
000000a0: f6 7a 9f f6 6f f6 6b af f5 6f f6 7a af f5 6f f6
000000b0: 5b af f6 6f f6 6b 9f f6 6f f6 6b 9f f6 6f f6 6b
000000c0: af f6 5f f7 79 af f6 5f f6 6b af f6 5f f6 7a af
000000d0: f6 5f f6 6b 14 5f f6 5f f6 7a af f6 5f f6 7a af
000000e0: f6 5f f6 7a af f6 5f f6 6b af f6 5f f6 6b af f6
000000f0: 5f f6 6b af f5 7f f5 1c ff ff ff ff ff ff ff ff
00000100: ff ff ff ff ff ff ff ff ff ff ff ff ff ff ff ff
00000110: ff ff ff ff ff ff ff ff ff ff ff ff ff ff ff ff
00000120: ff ff ff ff ff ff ff ff ff ff ff ff ff ff ff ff
00000130: ff ff ff ff ff ff ff ff ff ff ff ff ff 82 ff ff
00000140: ff ff ff ff ff ff ff ff ff ff ff ff ff 7f f1 ff
00000150: ff ff ff ff ff ff ff ff ff ff ff ff ff ff 4f f1
00000160: ff ff ff ff ff ff ff ff ff ff ff ff ff ff 11 f1
00000170: ff ff
UrbLink = 00000000
[10822 ms] UsbSnoop - DispatchAny(f2340610) : IRP_MJ_INTERNAL_DEVICE_CONTROL
[10822 ms] UsbSnoop - MyDispatchInternalIOCTL(f2341e80) : fdo=825ffaf0, Irp=82701008, IRQL=2
[10822 ms] >>> URB 72 going down >>>
-- URB_FUNCTION_BULK_OR_INTERRUPT_TRANSFER:
PipeHandle = 8256385c [endpoint 0x00000082]
TransferFlags = 00000003 (USBD_TRANSFER_DIRECTION_IN, USBD_SHORT_TRANSFER_OK)
TransferBufferLength = 0000041c
TransferBuffer = 826de3e8
TransferBufferMDL = 00000000
UrbLink = 00000000
[10840 ms] UsbSnoop - MyInternalIOCTLCompletion(f2341db0) : fido=00000000, Irp=82701008, Context=8251b2a8, IRQL=2
[10840 ms] <<< URB 72 coming back <<<
-- URB_FUNCTION_BULK_OR_INTERRUPT_TRANSFER:
PipeHandle = 8256385c [endpoint 0x00000082]
TransferFlags = 00000003 (USBD_TRANSFER_DIRECTION_IN, USBD_SHORT_TRANSFER_OK)
TransferBufferLength = 0000017a
TransferBuffer = 826de3e8
TransferBufferMDL = 8255c128
00000000: 01 01 17 01 00 20 86 03 00 00 17 00 00 00 68 00
00000010: 50 00 00 00 64 01 f0 ff ff ff ff ff ff ff ff ff
00000020: ff ff ff ff ff ff ff ff ff ff ff ff ff ff ff ff
00000030: ff ff ff ff ff ff ff ff ff ff ff ff ff ff ff ff
00000040: ff 1f 11 f1 7c ff 56 af f7 88 7f b2 f7 88 7f f9
00000050: 27 9a 6f fa a5 5f 84 fb b5 3f fc 54 b8 4f fc e2
00000060: 2f 76 fc e2 1f 0f 2f 56 fe f1 f0 e1 3f 56 fe f1
00000070: f0 e1 3f 56 fe f1 f0 71 61 3f 65 16 f7 71 61 2f
00000080: 26 f6 43 57 53 3f 34 f6 52 63 3f 83 35 f5 33 64
00000090: 2f 44 f6 23 39 55 3f 62 f5 6a ff 10 56 af f7 69
000000a0: ff 57 bf f6 69 ff 57 af f7 69 ff 57 af f7 69 ff
000000b0: 57 bf f6 5a ff 57 bf f6 5a ff 76 af f5 6a ff 57
000000c0: bf f6 69 ff 57 bf f6 69 ff 57 bf f6 5a ff 57 bf
000000d0: f6 6a ff 56 bf f6 6a ff 66 af f6 6a ff 56 bf f6
000000e0: 6a ff 65 af f7 6a ff 56 bf f6 6a ff 56 af f7 79
000000f0: ff 56 bf f6 6a ff 56 af f7 79 ff 65 bf f6 5a ff
00000100: 57 ff ff ff ff ff ff ff ff ff ff ff ff ff ff ff
00000110: ff ff ff ff ff ff ff ff ff ff ff ff ff ff ff ff
00000120: ff ff ff ff ff ff ff ff ff ff ff ff ff ff ff ff
00000130: ff ff ff ff ff ff ff ff ff ff ff ff ff ff ff ff
00000140: ff ff ff ff ff ff ff 1f f8 ff ff ff ff ff ff ff
00000150: ff ff ff ff ff ff ff ff ff ff ff ff ff ff ff ff
00000160: ff ff ff ff ff ff ff ff 1c ff ff ff ff ff ff ff
00000170: ff ff ff ff ff ff ff 1f 1c ff
UrbLink = 00000000
[10840 ms] UsbSnoop - DispatchAny(f2340610) : IRP_MJ_INTERNAL_DEVICE_CONTROL
[10840 ms] UsbSnoop - MyDispatchInternalIOCTL(f2341e80) : fdo=825ffaf0, Irp=82701008, IRQL=2
[10840 ms] >>> URB 73 going down >>>
-- URB_FUNCTION_BULK_OR_INTERRUPT_TRANSFER:
PipeHandle = 8256385c [endpoint 0x00000082]
TransferFlags = 00000003 (USBD_TRANSFER_DIRECTION_IN, USBD_SHORT_TRANSFER_OK)
TransferBufferLength = 0000041c
TransferBuffer = 826de3e8
TransferBufferMDL = 00000000
UrbLink = 00000000
[10860 ms] UsbSnoop - MyInternalIOCTLCompletion(f2341db0) : fido=00000000, Irp=82701008, Context=82510e68, IRQL=2
[10860 ms] <<< URB 73 coming back <<<
-- URB_FUNCTION_BULK_OR_INTERRUPT_TRANSFER:
PipeHandle = 8256385c [endpoint 0x00000082]
TransferFlags = 00000003 (USBD_TRANSFER_DIRECTION_IN, USBD_SHORT_TRANSFER_OK)
TransferBufferLength = 00000186
TransferBuffer = 826de3e8
TransferBufferMDL = 8255c128
00000000: 01 01 17 01 00 20 95 03 00 00 17 00 00 00 68 00
00000010: 50 00 00 00 70 01 f0 ff ff ff ff ff ff ff ff ff
00000020: ff ff ff ff ff ff ff ff ff ff ff ff ff ff ff ff
00000030: ff ff ff ff ff ff ff ff ff ff ff ff ff ff ff 4f
00000040: f6 9f f1 7b 8f 98 f1 7a 8f f8 97 48 8f f8 96 6f
00000050: 8a f4 a6 4f fb b5 48 5f fb d3 3f 8c f4 c4 2f fe
00000060: d2 48 2f fe f1 f0 e1 48 2f fe e1 2f 8e f4 e2 1f
00000070: fe 72 61 48 2f fe 71 61 2f 26 86 f4 62 61 2f 26
00000080: f6 52 63 48 2f 25 f6 52 63 3f 43 86 f4 42 73 1f
00000090: 44 f6 23 65 48 2f 43 f6 6a af 86 f4 5a af f6 6b
000000a0: 47 af f6 69 af 77 f4 6a 9f f6 5b 48 af f6 69 bf
000000b0: 76 f4 79 9f f6 5b 48 af f6 69 bf 76 f4 5a af f6
000000c0: 7a 47 af f6 69 bf 85 f4 6a 9f f6 5b 48 af f6 69
000000d0: bf 76 f4 6a af f6 6a 47 af f6 6a af 76 f4 6a af
000000e0: f6 6a 47 af f6 79 14 5f 76 f4 79 9f f7 6a 47 af
000000f0: f6 79 af 76 f4 79 9f f7 6a 47 af f6 79 af 76 f4
00000100: 6a 9f f7 6a 47 af f5 5b ff 1a ff ff ff ff ff ff
00000110: ff ff ff ff ff ff ff ff ff ff ff ff ff ff ff ff
00000120: ff ff ff ff ff ff ff ff ff ff ff ff ff ff ff ff
00000130: ff ff ff ff ff ff ff ff ff ff ff ff ff ff ff ff
00000140: ff ff ff ff ff ff ff ff ff ff ff ff ff ff ff ff
00000150: ff 82 ff ff ff ff ff ff ff ff ff ff ff ff ff ff
00000160: ff 7f f1 ff ff ff ff ff ff ff ff ff ff ff ff 15
00000170: ff ff ff 1d ff ff ff ff ff ff ff ff ff ff ff ff
00000180: ff ff 1f 1d ff ff
UrbLink = 00000000
[10860 ms] UsbSnoop - DispatchAny(f2340610) : IRP_MJ_INTERNAL_DEVICE_CONTROL
[10860 ms] UsbSnoop - MyDispatchInternalIOCTL(f2341e80) : fdo=825ffaf0, Irp=82701008, IRQL=2
[10860 ms] >>> URB 74 going down >>>
-- URB_FUNCTION_BULK_OR_INTERRUPT_TRANSFER:
PipeHandle = 8256385c [endpoint 0x00000082]
TransferFlags = 00000003 (USBD_TRANSFER_DIRECTION_IN, USBD_SHORT_TRANSFER_OK)
TransferBufferLength = 0000041c
TransferBuffer = 826de3e8
TransferBufferMDL = 00000000
UrbLink = 00000000
[10878 ms] UsbSnoop - MyInternalIOCTLCompletion(f2341db0) : fido=00000000, Irp=82701008, Context=82549948, IRQL=2
[10878 ms] <<< URB 74 coming back <<<
-- URB_FUNCTION_BULK_OR_INTERRUPT_TRANSFER:
PipeHandle = 8256385c [endpoint 0x00000082]
TransferFlags = 00000003 (USBD_TRANSFER_DIRECTION_IN, USBD_SHORT_TRANSFER_OK)
TransferBufferLength = 00000182
TransferBuffer = 826de3e8
TransferBufferMDL = 8255c128
00000000: 01 01 17 01 00 20 a3 03 00 00 17 00 00 00 68 00
00000010: 50 00 00 00 6c 01 f0 ff ff ff ff ff ff ff ff ff
00000020: ff ff ff ff ff ff ff ff ff ff ff ff ff ff ff ff
00000030: ff ff ff ff ff ff ff ff ff ff ff 9f f1 36 ff 3f
00000040: f1 6b 3f f5 df f7 89 0f d7 f7 87 7f fa 70 7d 6f
00000050: fa b5 0f b7 fa b4 4f fc 70 ba 3f fc d3 0f a6 fb
00000060: f2 f0 e1 0f b4 fd e1 2f fe 20 ec 1f fe e2 ef fd
00000070: e2 2f fe ee 1f fe 61 72 ef 16 f6 52 72 2f 34 f7
00000080: 4e 63 2f 34 f6 33 74 ef 43 f6 32 74 2f 62 f6 3e
00000090: 64 af f6 6a ff 66 9f f7 6a ff 57 af f6 6a 5f e2
000000a0: f6 6a af f6 34 0f f5 6a af f6 43 0f f5 6a af f6
000000b0: 43 0f f5 6a af f6 52 0f f5 6a af f6 61 0f f5 6a
000000c0: af f6 61 0f f5 6a af f6 61 0f f5 6a af f6 70 6e
000000d0: af f6 6a 0f f7 50 af f6 6a 0f f7 50 af f6 6a 0f
000000e0: f7 50 af f6 14 65 0f e7 f6 6a af f6 70 6e af f6
000000f0: 6a 0f e7 f7 69 af f6 70 6e af f6 6a 0f f7 50 af
00000100: f6 5b 6f f1 50 df f2 ff ff ff ff ff ff ff ff ff
00000110: ff ff ff ff ff ff ff ff ff ff ff ff ff ff ff ff
00000120: ff ff ff ff ff ff ff ff ff ff ff ff ff ff ff ff
00000130: ff ff ff ff ff ff ff ff ff ff ff ff ff ff ff ff
00000140: ff ff ff ff ff ff ff ff ff ff ff ff ff ff ff 8d
00000150: ff ff ff ff ff ff ff ff ff ff ff ff ff ff ff 7f
00000160: f1 ff ff ff ff ff ff ff ff ff ff ff ff 15 ff ff
00000170: ff 1d ff ff ff ff ff ff ff ff ff ff ff ff ff ff
00000180: 1f 1d
UrbLink = 00000000
[10878 ms] UsbSnoop - DispatchAny(f2340610) : IRP_MJ_INTERNAL_DEVICE_CONTROL
[10878 ms] UsbSnoop - MyDispatchInternalIOCTL(f2341e80) : fdo=825ffaf0, Irp=82701008, IRQL=2
[10878 ms] >>> URB 75 going down >>>
-- URB_FUNCTION_BULK_OR_INTERRUPT_TRANSFER:
PipeHandle = 8256385c [endpoint 0x00000082]
TransferFlags = 00000003 (USBD_TRANSFER_DIRECTION_IN, USBD_SHORT_TRANSFER_OK)
TransferBufferLength = 0000041c
TransferBuffer = 826de3e8
TransferBufferMDL = 00000000
UrbLink = 00000000
[10899 ms] UsbSnoop - MyInternalIOCTLCompletion(f2341db0) : fido=00000000, Irp=82701008, Context=825114a8, IRQL=2
[10899 ms] <<< URB 75 coming back <<<
-- URB_FUNCTION_BULK_OR_INTERRUPT_TRANSFER:
PipeHandle = 8256385c [endpoint 0x00000082]
TransferFlags = 00000003 (USBD_TRANSFER_DIRECTION_IN, USBD_SHORT_TRANSFER_OK)
TransferBufferLength = 00000186
TransferBuffer = 826de3e8
TransferBufferMDL = 8255c128
00000000: 01 01 17 01 00 20 b1 03 00 00 17 00 00 00 68 00
00000010: 50 00 00 00 70 01 f0 ff ff ff ff ff ff ff ff ff
00000020: ff ff ff ff ff ff ff ff ff ff ff ff ff ff ff ff
00000030: ff ff ff ff ff ff ff ff 6f f3 ff df f4 e4 ff 46
00000040: af f7 f1 f3 2f f7 98 0f 3f 63 7f f8 97 0f 5f 72
00000050: 5f fa a5 0f 5f 72 4f fb b4 1f 28 1a f7 d2 2f ee
00000060: 76 18 f7 f1 f0 e0 1f a3 17 f7 e1 1f 0f 1f b1 17
00000070: f7 e1 1f fe 7e 71 1f fe 71 61 ef 17 f7 61 61 2f
00000080: 35 f6 7e 52 2f 25 f6 33 64 cf 29 f5 42 63 3f 52
00000090: f6 9b 53 2f 43 f7 69 9f 3b f5 5a af f7 b7 54 af
000000a0: f5 7a 6f 5b f5 6a 9f f6 c5 56 af f5 7a 3f 7c f5
000000b0: 5a af f6 a4 59 af f5 6b 2f aa f5 5a af f7 a1 5b
000000c0: af f6 79 1f c9 f5 6a af f5 91 5d af f6 6a 0f e8
000000d0: f5 6a af f6 70 0f f5 6a af f6 70 0f f5 6a af e6
000000e0: 1f 21 54 af f6 6a fe 26 f5 5a bf 26 c1 5f 52 af
000000f0: f6 6a 0f 5f 62 9f f6 6a fe 26 f5 6a af e6 6f 52
00000100: af f6 6a 0f 5f 52 af f5 1d ff 2b ff ff ff ff ff
00000110: ff ff ff ff ff ff ff ff ff ff ff ff ff ff ff ff
00000120: ff ff ff ff ff ff ff ff ff ff ff ff ff ff ff ff
00000130: ff ff ff ff ff ff ff ff ff ff ff ff ff ff ff ff
00000140: ff ff ff ff ff ff ff ff ff ff ff ff ff ff ff ff
00000150: ff ff ff ff ff 8e ff ff ff ff ff ff ff ff ff ff
00000160: ff ff ff ff ff ff ff ff ff ff ff ff ff ff ff ff
00000170: ff ff ff ff ff cf f1 ff ff ff ff ff ff ff ff ff
00000180: ff ff ff ff ff 11
UrbLink = 00000000
[10899 ms] UsbSnoop - DispatchAny(f2340610) : IRP_MJ_INTERNAL_DEVICE_CONTROL
[10899 ms] UsbSnoop - MyDispatchInternalIOCTL(f2341e80) : fdo=825ffaf0, Irp=82701008, IRQL=2
[10899 ms] >>> URB 76 going down >>>
-- URB_FUNCTION_BULK_OR_INTERRUPT_TRANSFER:
PipeHandle = 8256385c [endpoint 0x00000082]
TransferFlags = 00000003 (USBD_TRANSFER_DIRECTION_IN, USBD_SHORT_TRANSFER_OK)
TransferBufferLength = 0000041c
TransferBuffer = 826de3e8
TransferBufferMDL = 00000000
UrbLink = 00000000
[10922 ms] UsbSnoop - MyInternalIOCTLCompletion(f2341db0) : fido=00000000, Irp=82701008, Context=825a32e8, IRQL=2
[10922 ms] <<< URB 76 coming back <<<
-- URB_FUNCTION_BULK_OR_INTERRUPT_TRANSFER:
PipeHandle = 8256385c [endpoint 0x00000082]
TransferFlags = 00000003 (USBD_TRANSFER_DIRECTION_IN, USBD_SHORT_TRANSFER_OK)
TransferBufferLength = 0000016e
TransferBuffer = 826de3e8
TransferBufferMDL = 8255c128
00000000: 01 01 17 01 00 20 c3 03 00 00 18 00 00 00 68 00
00000010: 50 00 00 00 58 01 f0 ff ff ff ff ff ff ff ff ff
00000020: ff ff ff ff ff ff ff ff ff ff ff ff ff ff ff ff
00000030: ff ff ff ff 4f f2 ff ff 8f fc ff 6f f7 f2 f1 4f
00000040: f6 88 0f 4f ff 72 7f f9 f0 f5 0f f9 a5 0f 5f ef
00000050: fa b4 0f 19 fa bd 2f fd 50 78 cf fd e0 0f a4 f7
00000060: da 1f 0f 0f c1 f7 e9 1f fe 7e 9f fe e1 df f8 e9
00000070: 1f 35 f6 8d 9f 16 f7 41 64 cf f8 4a 54 2f 53 f6
00000080: 9b bf 52 f6 69 9f fa 4f f6 69 8f fb 4f f6 79 5f
00000090: fc 5f f6 69 5f fc 6f f6 69 4f fc 7f f6 69 3f fb
000000a0: 9f f5 7a 1f fa bf f6 69 2f f9 cf f6 69 1f f9 df
000000b0: f6 69 1f f8 ef f6 69 0f f8 ff 60 9f f6 80 ff 0f
000000c0: f6 69 0f f7 ff 61 9f f6 90 82 ff 64 9f f6 f0 f6
000000d0: 2f f6 69 0f 6f ff 71 9f f6 f0 f6 2f f6 89 fd f6
000000e0: 2f f6 69 0f 6f ff 71 9f e7 5f ff 53 df f1 ff ff
000000f0: ff ff ff ff ff ff ff ff ff ff ff ff ff ff ff ff
00000100: ff ff ff ff ff ff ff ff ff ff ff ff ff ff ff ff
00000110: ff ff ff ff ff ff ff ff ff ff ff ff ff ff ff ff
00000120: ff ff ff ff ff ff ff ff ff ff ff ff ff ff ff ff
00000130: ff ff ff ff ff ff ff ff ff ff ff ff ff 8e ff ff
00000140: ff ff ff ff ff ff ff ff ff ff ff ff ff ff ff ff
00000150: ff ff ff ff ff ff ff ff ff ff ff ff ff cf f1 ff
00000160: ff ff ff ff ff ff ff ff ff ff ff ff ff 11
UrbLink = 00000000
[10922 ms] UsbSnoop - DispatchAny(f2340610) : IRP_MJ_INTERNAL_DEVICE_CONTROL
[10922 ms] UsbSnoop - MyDispatchInternalIOCTL(f2341e80) : fdo=825ffaf0, Irp=82701008, IRQL=2
[10922 ms] >>> URB 77 going down >>>
-- URB_FUNCTION_BULK_OR_INTERRUPT_TRANSFER:
PipeHandle = 8256385c [endpoint 0x00000082]
TransferFlags = 00000003 (USBD_TRANSFER_DIRECTION_IN, USBD_SHORT_TRANSFER_OK)
TransferBufferLength = 0000041c
TransferBuffer = 826de3e8
TransferBufferMDL = 00000000
UrbLink = 00000000
[10949 ms] UsbSnoop - MyInternalIOCTLCompletion(f2341db0) : fido=00000000, Irp=82701008, Context=8251b2a8, IRQL=2
[10949 ms] <<< URB 77 coming back <<<
-- URB_FUNCTION_BULK_OR_INTERRUPT_TRANSFER:
PipeHandle = 8256385c [endpoint 0x00000082]
TransferFlags = 00000003 (USBD_TRANSFER_DIRECTION_IN, USBD_SHORT_TRANSFER_OK)
TransferBufferLength = 0000016e
TransferBuffer = 826de3e8
TransferBufferMDL = 8255c128
00000000: 01 01 17 01 00 20 d5 03 00 00 19 00 00 00 68 00
00000010: 50 00 00 00 58 01 f0 ff ff ff ff ff ff ff ff ff
00000020: ff ff ff ff ff ff ff ff ff ff ff ff ff ff ff ff
00000030: ff ff ff bf fc ff 7f f6 f2 f1 ff 4f f8 f0 f3 af
00000040: f1 96 fe f5 9f f1 95 0f 5f ff 19 4f fa f0 f6 8f
00000050: f1 b3 0f 76 f8 8f f1 c2 1f a3 f7 8f f2 e0 0f b2
00000060: f7 8f f1 e1 df f7 8f f1 e1 df f7 8f f1 51 62 df
00000070: f8 8f f1 41 63 df f8 ff 3a 65 af f9 ff 4f f5 b9
00000080: ff 19 9f f5 b8 ff 1a 9f f6 b6 ff 1b 9f f6 c4 ff
00000090: 1c 9f f5 c4 ff 1d 9f f6 b2 ff ff 6a 2f fa ff 11
000000a0: 9f f6 a1 ff 2f f1 69 1f f8 ff 14 9f f5 81 ff 5f
000000b0: f1 69 0f f8 ff 15 9f f6 70 ff 6f f1 69 0f f7 ff
000000c0: 16 9f e6 4f ff 1a 9f e6 6f ff 18 9f e6 6f ff 18
000000d0: 9f e6 6f ff 18 9f e6 6f 14 ff 13 9f e6 6f ff 18
000000e0: 9f e6 5f ff ff 25 ff ff ff ff ff ff ff ff ff ff
000000f0: ff ff ff ff ff ff ff ff ff ff ff ff ff ff ff ff
00000100: ff ff ff ff ff ff ff ff ff ff ff ff ff ff ff ff
00000110: ff ff ff ff ff ff ff ff ff ff ff ff ff ff ff ff
00000120: ff ff ff ff ff ff ff ff ff ff ff ff ff ff ff ff
00000130: ff ff ff ff ff ff ff ff ff ff 82 ff ff ff ff ff
00000140: ff ff ff ff ff ff ff ff ff ff 7f f1 ff ff ff ff
00000150: ff ff ff ff ff ff ff ff 15 ff ff ff 1d ff ff ff
00000160: ff ff ff ff ff ff ff ff ff ff ff 1f 1d ff
UrbLink = 00000000
[10949 ms] UsbSnoop - DispatchAny(f2340610) : IRP_MJ_INTERNAL_DEVICE_CONTROL
[10949 ms] UsbSnoop - MyDispatchInternalIOCTL(f2341e80) : fdo=825ffaf0, Irp=82701008, IRQL=2
[10949 ms] >>> URB 78 going down >>>
-- URB_FUNCTION_BULK_OR_INTERRUPT_TRANSFER:
PipeHandle = 8256385c [endpoint 0x00000082]
TransferFlags = 00000003 (USBD_TRANSFER_DIRECTION_IN, USBD_SHORT_TRANSFER_OK)
TransferBufferLength = 0000041c
TransferBuffer = 826de3e8
TransferBufferMDL = 00000000
UrbLink = 00000000
[10977 ms] UsbSnoop - MyInternalIOCTLCompletion(f2341db0) : fido=00000000, Irp=82701008, Context=82510e68, IRQL=2
[10977 ms] <<< URB 78 coming back <<<
-- URB_FUNCTION_BULK_OR_INTERRUPT_TRANSFER:
PipeHandle = 8256385c [endpoint 0x00000082]
TransferFlags = 00000003 (USBD_TRANSFER_DIRECTION_IN, USBD_SHORT_TRANSFER_OK)
TransferBufferLength = 0000015a
TransferBuffer = 826de3e8
TransferBufferMDL = 8255c128
00000000: 01 01 17 01 00 20 e7 03 00 00 1a 00 00 00 68 00
00000010: 50 00 00 00 44 01 f0 ff ff ff ff ff ff ff ff ff
00000020: ff ff ff ff ff ff ff ff ff ff ff ff ff ff ff df
00000030: f7 ff ff 2f fe ff 7f f6 f0 f3 ff 4f f7 f0 f3 ff
00000040: 2f f9 f0 f4 ff 0f ea 5f ff ef fb 70 94 ff cf fc
00000050: 40 88 ff bf fd 30 7a ff bf fd 7d ff bf fd 7d ff
00000060: bf 16 f6 8c ff bf 34 f6 8c ff bf 43 f6 8b ff cf
00000070: 52 f6 a9 ff ff 64 7f fb ff 6f f5 b6 ff ff 66 5f
00000080: fb ff 7f f6 c3 ff ff 68 3f fb ff 9f f6 a2 ff ff
00000090: 6b 1f fa ff cf f6 91 ff ff 6d 0f f9 ff ff 50 0f
000000a0: f8 ff ff 60 0f f7 ff ff 61 0f f7 ff ff 61 8e ff
000000b0: ff 1f e6 6f ff ff 63 fe f6 ff 3f e6 6f ff ff 63
000000c0: fe f6 ff 3f e6 6f ff ff 63 fe f5 ff 5f f4 16 ff
000000d0: ff ff ff ff ff ff ff ff ff ff ff ff ff ff ff ff
000000e0: ff ff ff ff ff ff ff ff ff ff ff ff ff ff ff ff
000000f0: ff ff ff ff ff ff ff ff ff ff ff ff ff ff ff ff
00000100: ff ff ff ff ff ff ff ff ff ff ff ff ff ff ff ff
00000110: ff ff ff ff ff ff ff ff ff ff ff ff ff ff ff ff
00000120: ff ff ff ff ff ff 8a ff ff ff ff ff ff ff ff ff
00000130: ff ff ff ff ff ff 7f f1 ff ff ff ff ff ff ff ff
00000140: ff ff ff ff ff ff ff 4f f1 ff ff ff ff ff ff ff
00000150: ff ff ff ff ff ff ff 11 f1 ff
UrbLink = 00000000
[10977 ms] UsbSnoop - DispatchAny(f2340610) : IRP_MJ_INTERNAL_DEVICE_CONTROL
[10977 ms] UsbSnoop - MyDispatchInternalIOCTL(f2341e80) : fdo=825ffaf0, Irp=82701008, IRQL=2
[10977 ms] >>> URB 79 going down >>>
-- URB_FUNCTION_BULK_OR_INTERRUPT_TRANSFER:
PipeHandle = 8256385c [endpoint 0x00000082]
TransferFlags = 00000003 (USBD_TRANSFER_DIRECTION_IN, USBD_SHORT_TRANSFER_OK)
TransferBufferLength = 0000041c
TransferBuffer = 826de3e8
TransferBufferMDL = 00000000
UrbLink = 00000000
[11003 ms] UsbSnoop - MyInternalIOCTLCompletion(f2341db0) : fido=00000000, Irp=82701008, Context=82549948, IRQL=2
[11003 ms] <<< URB 79 coming back <<<
-- URB_FUNCTION_BULK_OR_INTERRUPT_TRANSFER:
PipeHandle = 8256385c [endpoint 0x00000082]
TransferFlags = 00000003 (USBD_TRANSFER_DIRECTION_IN, USBD_SHORT_TRANSFER_OK)
TransferBufferLength = 00000146
TransferBuffer = 826de3e8
TransferBufferMDL = 8255c128
00000000: 01 01 17 01 00 20 f7 03 00 00 1a 00 00 00 68 00
00000010: 50 00 00 00 30 01 f0 ff ff ff ff ff ff ff ff ff
00000020: ff ff ff ff ff ff ff ff ff ff ff ff ff ff ff 9b
00000030: ff ff ff f1 f0 ff ff fd f2 ff ff fb f4 ff ff fa
00000040: f4 ff ff fa f5 ff ff 79 85 ff ff 9f 94 f7 ff ff
00000050: 1a 7b ff ff ff 77 ff ff ff 77 ff ff ff 86 ff ff
00000060: ff 86 ff ff ff 85 ff ff ff a4 ff ff ff b2 ff ff
00000070: ff b2 ff ff ff b2 ff ff ff b2 ff ff ff b2 ff ff
00000080: ff a2 ff ff ff 94 ff ff ff 94 ff ff ff 75 ff ff
00000090: ff 86 ff ff ff 76 ff ff ff 77 ff ff ff f7 f4 ff
000000a0: ff fa f5 ff ff f9 f5 ff ff f9 f5 ff ff f9 f5 ff
000000b0: ff f9 f5 8f f1 ff f0 f3 ff ff ff ff ff ff ff ff
000000c0: ff ff ff ff ff ff ff ff ff ff ff ff ff ff ff ff
000000d0: ff ff ff ff ff ff ff ff ff ff ff ff ff ff ff ff
000000e0: ff ff ff ff ff ff ff ff ff ff ff ff ff ff ff ff
000000f0: ff ff ff ff ff ff ff ff ff ff ff ff ff ff ff ff
00000100: ff ff ff ff ff ff ff ff ff ff ff ff ff ff ff ff
00000110: ff ff 8d ff ff ff ff ff ff ff ff ff ff ff ff ff
00000120: ff ff ff ff ff ff ff ff ff ff ff ff ff ff ff 1d
00000130: ff ff ff 1d ff ff ff ff ff ff ff ff ff ff ff ff
00000140: ff ff 1f 1d ff ff
UrbLink = 00000000
[11003 ms] UsbSnoop - DispatchAny(f2340610) : IRP_MJ_INTERNAL_DEVICE_CONTROL
[11003 ms] UsbSnoop - MyDispatchInternalIOCTL(f2341e80) : fdo=825ffaf0, Irp=82701008, IRQL=2
[11003 ms] >>> URB 80 going down >>>
-- URB_FUNCTION_BULK_OR_INTERRUPT_TRANSFER:
PipeHandle = 8256385c [endpoint 0x00000082]
TransferFlags = 00000003 (USBD_TRANSFER_DIRECTION_IN, USBD_SHORT_TRANSFER_OK)
TransferBufferLength = 0000041c
TransferBuffer = 826de3e8
TransferBufferMDL = 00000000
UrbLink = 00000000
[11030 ms] UsbSnoop - MyInternalIOCTLCompletion(f2341db0) : fido=00000000, Irp=82701008, Context=825114a8, IRQL=2
[11030 ms] <<< URB 80 coming back <<<
-- URB_FUNCTION_BULK_OR_INTERRUPT_TRANSFER:
PipeHandle = 8256385c [endpoint 0x00000082]
TransferFlags = 00000003 (USBD_TRANSFER_DIRECTION_IN, USBD_SHORT_TRANSFER_OK)
TransferBufferLength = 00000146
TransferBuffer = 826de3e8
TransferBufferMDL = 8255c128
00000000: 01 01 17 01 00 20 04 04 00 00 1a 00 00 00 68 00
00000010: 50 00 00 00 30 01 f0 ff ff ff ff ff ff ff ff ff
00000020: ff ff ff ff ff ff ff ff ff ff ff ff ff ff ff 70
00000030: ff ff ff e2 ff ff ef 1f ff ff cf 3f ff ff bf 3f
00000040: ff ff bf 4f ff ff af 56 f8 ff ff 4a 78 ff ff af
00000050: b2 f6 ff ff 7f f7 ff ff 7f f7 ff ff 7f f7 ff ff
00000060: 6f f8 ff ff 5f f8 ff ff 4f fa ff ff 3f fa ff ff
00000070: 3f fa ff ff 2f fb ff ff 2f fb ff ff 2f fa ff ff
00000080: 4f f9 ff ff 4f f9 ff ff 5f f8 ff ff 5f f8 ff ff
00000090: 6f f7 ff ff 7f f6 ff ff 8f f6 ff ff 8f 3f ff ff
000000a0: bf 4f ff ff af 4f ff ff af 4f ff ff af 4f ff ff
000000b0: af 3f ff 7f f1 3f 0f ff ff ff ff ff ff ff ff ff
000000c0: ff ff ff ff ff ff ff ff ff ff ff ff ff ff ff ff
000000d0: ff ff ff ff ff ff ff ff ff ff ff ff ff ff ff ff
000000e0: ff ff ff ff ff ff ff ff ff ff ff ff ff ff ff ff
000000f0: ff ff ff ff ff ff ff ff ff ff ff ff ff ff ff ff
00000100: ff ff ff ff ff ff ff ff ff ff ff ff ff ff ff ff
00000110: ff ff 8d ff ff ff ff ff ff ff ff ff ff ff ff ff
00000120: ff ff 7f f1 ff ff ff ff ff ff ff ff ff ff ff ff
00000130: ff ff ff 4f f1 ff ff ff ff ff ff ff ff ff ff ff
00000140: ff ff ff 11 f1 ff
UrbLink = 00000000
[11030 ms] UsbSnoop - DispatchAny(f2340610) : IRP_MJ_INTERNAL_DEVICE_CONTROL
[11030 ms] UsbSnoop - MyDispatchInternalIOCTL(f2341e80) : fdo=825ffaf0, Irp=82701008, IRQL=2
[11030 ms] >>> URB 81 going down >>>
-- URB_FUNCTION_BULK_OR_INTERRUPT_TRANSFER:
PipeHandle = 8256385c [endpoint 0x00000082]
TransferFlags = 00000003 (USBD_TRANSFER_DIRECTION_IN, USBD_SHORT_TRANSFER_OK)
TransferBufferLength = 0000041c
TransferBuffer = 826de3e8
TransferBufferMDL = 00000000
UrbLink = 00000000
[11056 ms] UsbSnoop - MyInternalIOCTLCompletion(f2341db0) : fido=00000000, Irp=82701008, Context=825a32e8, IRQL=2
[11056 ms] <<< URB 81 coming back <<<
-- URB_FUNCTION_BULK_OR_INTERRUPT_TRANSFER:
PipeHandle = 8256385c [endpoint 0x00000082]
TransferFlags = 00000003 (USBD_TRANSFER_DIRECTION_IN, USBD_SHORT_TRANSFER_OK)
TransferBufferLength = 0000013e
TransferBuffer = 826de3e8
TransferBufferMDL = 8255c128
00000000: 01 01 17 01 00 20 12 04 00 00 1a 00 00 00 68 00
00000010: 50 00 00 00 28 01 f0 ff ff ff ff ff ff ff ff ff
00000020: ff ff ff ff ff ff ff ff ff ff ff ff ff ff ff ff
00000030: ff ff 17 ff ff ff 3d ff ff ff 4b ff ff ff 4a ff
00000040: ff ff 5a ff ff ff 59 ff ff ff 59 ff ff ff 59 ff
00000050: ff ff 59 ff ff ff 59 ff ff ff 59 ff ff ff 59 ff
00000060: ff ff 49 ff ff ff 4a ff ff ff 4a ff ff ff 3a ff
00000070: ff ff 2b ff ff ff 1c ff ff ff ff ff ff ff ff ff
00000080: ff ff ff ff ff ff ff ff ff ff ff ff ff ff ff ff
00000090: ff ff ff ff ff ff 45 ff ff ff 5a ff ff ff 59 ff
000000a0: ff ff 59 ff ff ff 59 ff ff ff 59 ff ff 15 ff 33
000000b0: ff ff ff ff ff ff ff ff ff ff ff ff ff ff ff ff
000000c0: ff ff ff ff ff ff 1b ff ff ff ff ff ff ff ff ff
000000d0: ff ff ff ff ff ff ff ff ff ff ff ff ff ff ff ff
000000e0: ff ff ff ff ff ff ff ff ff ff ff ff ff ff ff ff
000000f0: ff ff ff ff ff ff ff ff ff ff ff ff ff ff ff ff
00000100: ff ff ff ff ff ff ff ff ff ff ff ff 8d ff ff ff
00000110: ff ff ff ff ff ff ff ff ff ff ff ff 7f f1 ff ff
00000120: ff ff ff ff ff ff ff ff ff ff 15 ff ff ff 1d ff
00000130: ff ff ff ff ff ff ff ff ff ff ff ff ff 1f
UrbLink = 00000000
[11056 ms] UsbSnoop - DispatchAny(f2340610) : IRP_MJ_INTERNAL_DEVICE_CONTROL
[11056 ms] UsbSnoop - MyDispatchInternalIOCTL(f2341e80) : fdo=825ffaf0, Irp=82701008, IRQL=2
[11056 ms] >>> URB 82 going down >>>
-- URB_FUNCTION_BULK_OR_INTERRUPT_TRANSFER:
PipeHandle = 8256385c [endpoint 0x00000082]
TransferFlags = 00000003 (USBD_TRANSFER_DIRECTION_IN, USBD_SHORT_TRANSFER_OK)
TransferBufferLength = 0000041c
TransferBuffer = 826de3e8
TransferBufferMDL = 00000000
UrbLink = 00000000
[11088 ms] UsbSnoop - MyInternalIOCTLCompletion(f2341db0) : fido=00000000, Irp=82701008, Context=8251b2a8, IRQL=2
[11088 ms] <<< URB 82 coming back <<<
-- URB_FUNCTION_BULK_OR_INTERRUPT_TRANSFER:
PipeHandle = 8256385c [endpoint 0x00000082]
TransferFlags = 00000003 (USBD_TRANSFER_DIRECTION_IN, USBD_SHORT_TRANSFER_OK)
TransferBufferLength = 00000132
TransferBuffer = 826de3e8
TransferBufferMDL = 8255c128
00000000: 01 01 17 01 00 20 22 04 00 00 1a 00 00 00 68 00
00000010: 50 00 00 00 1c 01 f0 ff ff ff ff ff ff ff ff ff
00000020: ff ff ff ff ff ff ff ff ff ff ff ff ff ff ff ff
00000030: ff ff ff ff ff ff ff ff ff ff ff ff ff ff ff ff
00000040: ff ff ff ff ff ff ff ff ff ff ff ff ff ff ff ff
00000050: ff ff ff ff ff ff ff ff ff ff ff ff ff ff ff ff
00000060: ff ff ff ff ff ff ff ff ff ff ff ff ff ff ff ff
00000070: ff ff ff ff ff ff ff ff ff ff ff ff ff ff ff ff
00000080: ff ff ff ff ff ff ff ff ff ff ff ff ff ff ff ff
00000090: ff ff ff ff ff ff ff ff ff ff ff ff ff ff ff ff
000000a0: 11 ff ff ff ff ff ff ff ff ff ff ff ff ff ff ff
000000b0: ff ff ff ff ff ff ff ff 2f f1 ff ff ff ff ff ff
000000c0: ff ff ff ff ff ff ff ff ff ff ff ff ff ff ff ff
000000d0: ff ff ff ff ff ff ff ff ff ff ff ff ff ff ff ff
000000e0: ff ff ff ff ff ff ff ff ff ff ff ff ff ff ff ff
000000f0: ff ff ff ff ff ff ff ff ff ff ff ff ff ff cf f9
00000100: ff ff ff ff ff ff ff ff ff ff ff ff ff ff ff 17
00000110: ff ff ff ff ff ff ff ff ff ff ff ff 5f f1 ff ff
00000120: df f1 ff ff ff ff ff ff ff ff ff ff ff ff ff ff
00000130: 11 f1
UrbLink = 00000000
[11088 ms] UsbSnoop - DispatchAny(f2340610) : IRP_MJ_INTERNAL_DEVICE_CONTROL
[11088 ms] UsbSnoop - MyDispatchInternalIOCTL(f2341e80) : fdo=825ffaf0, Irp=82701008, IRQL=2
[11088 ms] >>> URB 83 going down >>>
-- URB_FUNCTION_BULK_OR_INTERRUPT_TRANSFER:
PipeHandle = 8256385c [endpoint 0x00000082]
TransferFlags = 00000003 (USBD_TRANSFER_DIRECTION_IN, USBD_SHORT_TRANSFER_OK)
TransferBufferLength = 0000041c
TransferBuffer = 826de3e8
TransferBufferMDL = 00000000
UrbLink = 00000000
[11404 ms] UsbSnoop - MyInternalIOCTLCompletion(f2341db0) : fido=00000000, Irp=82521608, Context=825412c8, IRQL=2
[11404 ms] <<< URB 7 coming back <<<
-- URB_FUNCTION_BULK_OR_INTERRUPT_TRANSFER:
PipeHandle = 82563840 [endpoint 0x00000081]
TransferFlags = 00000003 (USBD_TRANSFER_DIRECTION_IN, USBD_SHORT_TRANSFER_OK)
TransferBufferLength = 00000007
TransferBuffer = 82546168
TransferBufferMDL = 82644068
00000000: 01 01 17 01 00 30 04
UrbLink = 00000000
[11404 ms] UsbSnoop - DispatchAny(f2340610) : IRP_MJ_INTERNAL_DEVICE_CONTROL
[11404 ms] UsbSnoop - MyDispatchInternalIOCTL(f2341e80) : fdo=825ffaf0, Irp=82521608, IRQL=2
[11404 ms] >>> URB 84 going down >>>
-- URB_FUNCTION_BULK_OR_INTERRUPT_TRANSFER:
PipeHandle = 82563840 [endpoint 0x00000081]
TransferFlags = 00000003 (USBD_TRANSFER_DIRECTION_IN, USBD_SHORT_TRANSFER_OK)
TransferBufferLength = 00000008
TransferBuffer = 82546168
TransferBufferMDL = 00000000
UrbLink = 00000000
[11455 ms] UsbSnoop - MyInternalIOCTLCompletion(f2341db0) : fido=00000000, Irp=82701008, Context=82510e68, IRQL=2
[11455 ms] <<< URB 83 coming back <<<
-- URB_FUNCTION_BULK_OR_INTERRUPT_TRANSFER:
PipeHandle = 8256385c [endpoint 0x00000082]
TransferFlags = 00000003 (USBD_TRANSFER_DIRECTION_IN, USBD_SHORT_TRANSFER_OK)
TransferBufferLength = 0000013a
TransferBuffer = 826de3e8
TransferBufferMDL = 8255c128
00000000: 01 01 17 01 00 20 22 04 00 00 1a 00 00 00 68 00
00000010: 50 00 00 00 24 01 ff ff ff 86 ff ff ff 86 ff ff
00000020: ff 86 ff ff ff 86 ff ff ff 86 ff ff ff 86 ff ff
00000030: ff 86 ff ff ff 86 ff ff ff ff ff ff 9f f1 ff ff
00000040: cf f1 ff ff df f2 ff ff df 11 f1 ff ff bf f1 ff
00000050: ff 9f 31 f4 ff ff 6f 52 f1 ff ff ff ff ff ff ff
00000060: ff ff ff ff ff ff ff ff ff ff ff ff ff ff ff ff
00000070: ff ff ff ff ff ff ff ff ff ff ff ff ff ff ff ff
00000080: ff ff ff ff ff ff ff ff ff ff ff ff ff ff ff ff
00000090: ff ff ff ff ff ff ff ff ff ff ff ff ff ff ff ff
000000a0: ff ff ff ff ff ff ff ff ff ff ff ff ff ff ff ff
000000b0: ff ff ff ff ff ff ff ff ff ff ff ff ff ff ff ff
000000c0: ff ff ff ff ff ff ff ff ff ff ff ff ff ff ff ff
000000d0: ff ff ff ff ff ff ff ff ff ff ff ff ff ff ff ff
000000e0: ff ff ff ff ff ff ff ff ff ff ff ff ff ff ff ff
000000f0: ff ff ff ff ff ff ff ff ff ff ff ff ff ff ff ff
00000100: ff ff ff ff ff ff ff ff ff ff ff ff ff ff ff ff
00000110: ff ff ff ff ff ff ff ff ff ff ff ff ff ff ff ff
00000120: ff ff ff ff ff ff ff ff ff ff ff ff ff ff ff ff
00000130: ff ff ff ff ff ff bb ff ff ff
UrbLink = 00000000
[11455 ms] UsbSnoop - DispatchAny(f2340610) : IRP_MJ_INTERNAL_DEVICE_CONTROL
[11455 ms] UsbSnoop - MyDispatchInternalIOCTL(f2341e80) : fdo=825ffaf0, Irp=82701008, IRQL=2
[11455 ms] >>> URB 85 going down >>>
-- URB_FUNCTION_BULK_OR_INTERRUPT_TRANSFER:
PipeHandle = 8256385c [endpoint 0x00000082]
TransferFlags = 00000003 (USBD_TRANSFER_DIRECTION_IN, USBD_SHORT_TRANSFER_OK)
TransferBufferLength = 0000041c
TransferBuffer = 826de3e8
TransferBufferMDL = 00000000
UrbLink = 00000000
[11455 ms] UsbSnoop - MyInternalIOCTLCompletion(f2341db0) : fido=00000000, Irp=82521608, Context=82549948, IRQL=2
[11455 ms] <<< URB 84 coming back <<<
-- URB_FUNCTION_BULK_OR_INTERRUPT_TRANSFER:
PipeHandle = 82563840 [endpoint 0x00000081]
TransferFlags = 00000003 (USBD_TRANSFER_DIRECTION_IN, USBD_SHORT_TRANSFER_OK)
TransferBufferLength = 00000007
TransferBuffer = 82546168
TransferBufferMDL = 82644068
00000000: 01 01 17 01 00 30 00
UrbLink = 00000000
[11455 ms] UsbSnoop - DispatchAny(f2340610) : IRP_MJ_INTERNAL_DEVICE_CONTROL
[11455 ms] UsbSnoop - MyDispatchInternalIOCTL(f2341e80) : fdo=825ffaf0, Irp=82521608, IRQL=2
[11455 ms] >>> URB 86 going down >>>
-- URB_FUNCTION_BULK_OR_INTERRUPT_TRANSFER:
PipeHandle = 82563840 [endpoint 0x00000081]
TransferFlags = 00000003 (USBD_TRANSFER_DIRECTION_IN, USBD_SHORT_TRANSFER_OK)
TransferBufferLength = 00000008
TransferBuffer = 82546168
TransferBufferMDL = 00000000
UrbLink = 00000000
[11457 ms] UsbSnoop - MyInternalIOCTLCompletion(f2341db0) : fido=00000000, Irp=82701008, Context=825114a8, IRQL=2
[11457 ms] <<< URB 85 coming back <<<
-- URB_FUNCTION_BULK_OR_INTERRUPT_TRANSFER:
PipeHandle = 8256385c [endpoint 0x00000082]
TransferFlags = 00000003 (USBD_TRANSFER_DIRECTION_IN, USBD_SHORT_TRANSFER_OK)
TransferBufferLength = 00000006
TransferBuffer = 826de3e8
TransferBufferMDL = 8255c128
00000000: 01 01 17 01 02 20
UrbLink = 00000000
[11457 ms] UsbSnoop - DispatchAny(f2340610) : IRP_MJ_INTERNAL_DEVICE_CONTROL
[11457 ms] UsbSnoop - MyDispatchInternalIOCTL(f2341e80) : fdo=825ffaf0, Irp=82701008, IRQL=2
[11457 ms] >>> URB 87 going down >>>
-- URB_FUNCTION_BULK_OR_INTERRUPT_TRANSFER:
PipeHandle = 8256385c [endpoint 0x00000082]
TransferFlags = 00000003 (USBD_TRANSFER_DIRECTION_IN, USBD_SHORT_TRANSFER_OK)
TransferBufferLength = 0000041c
TransferBuffer = 826de3e8
TransferBufferMDL = 00000000
UrbLink = 00000000
[14225 ms] UsbSnoop - MyInternalIOCTLCompletion(f2341db0) : fido=00000000, Irp=82521608, Context=825208c8, IRQL=2
[14225 ms] <<< URB 86 coming back <<<
-- URB_FUNCTION_BULK_OR_INTERRUPT_TRANSFER:
PipeHandle = 82563840 [endpoint 0x00000081]
TransferFlags = 00000003 (USBD_TRANSFER_DIRECTION_IN, USBD_SHORT_TRANSFER_OK)
TransferBufferLength = 00000007
TransferBuffer = 82546168
TransferBufferMDL = 82644068
00000000: 01 01 17 01 00 30 02
UrbLink = 00000000
[14225 ms] UsbSnoop - DispatchAny(f2340610) : IRP_MJ_INTERNAL_DEVICE_CONTROL
[14225 ms] UsbSnoop - MyDispatchInternalIOCTL(f2341e80) : fdo=825ffaf0, Irp=82521608, IRQL=2
[14225 ms] >>> URB 88 going down >>>
-- URB_FUNCTION_BULK_OR_INTERRUPT_TRANSFER:
PipeHandle = 82563840 [endpoint 0x00000081]
TransferFlags = 00000003 (USBD_TRANSFER_DIRECTION_IN, USBD_SHORT_TRANSFER_OK)
TransferBufferLength = 00000008
TransferBuffer = 82546168
TransferBufferMDL = 00000000
UrbLink = 00000000
[14385 ms] UsbSnoop - MyInternalIOCTLCompletion(f2341db0) : fido=00000000, Irp=82521608, Context=8261d4a8, IRQL=2
[14385 ms] <<< URB 88 coming back <<<
-- URB_FUNCTION_BULK_OR_INTERRUPT_TRANSFER:
PipeHandle = 82563840 [endpoint 0x00000081]
TransferFlags = 00000003 (USBD_TRANSFER_DIRECTION_IN, USBD_SHORT_TRANSFER_OK)
TransferBufferLength = 00000007
TransferBuffer = 82546168
TransferBufferMDL = 82644068
00000000: 01 01 17 01 00 30 00
UrbLink = 00000000
[14385 ms] UsbSnoop - DispatchAny(f2340610) : IRP_MJ_INTERNAL_DEVICE_CONTROL
[14385 ms] UsbSnoop - MyDispatchInternalIOCTL(f2341e80) : fdo=825ffaf0, Irp=82521608, IRQL=2
[14385 ms] >>> URB 89 going down >>>
-- URB_FUNCTION_BULK_OR_INTERRUPT_TRANSFER:
PipeHandle = 82563840 [endpoint 0x00000081]
TransferFlags = 00000003 (USBD_TRANSFER_DIRECTION_IN, USBD_SHORT_TRANSFER_OK)
TransferBufferLength = 00000008
TransferBuffer = 82546168
TransferBufferMDL = 00000000
UrbLink = 00000000
[50800 ms] UsbSnoop - DispatchAny(f2340610) : IRP_MJ_PNP (IRP_MN_QUERY_DEVICE_RELATIONS)
[50801 ms] UsbSnoop - MyDispatchPNP(f2342ee0) : IRP_MJ_PNP (IRP_MN_QUERY_DEVICE_RELATIONS)
[50801 ms] UsbSnoop - DispatchAny(f2340610) : IRP_MJ_PNP (IRP_MN_CANCEL_REMOVE_DEVICE)
[50801 ms] UsbSnoop - MyDispatchPNP(f2342ee0) : IRP_MJ_PNP (IRP_MN_CANCEL_REMOVE_DEVICE)
[99455 ms] UsbSnoop - DispatchAny(f2340610) : IRP_MJ_PNP (IRP_MN_QUERY_DEVICE_RELATIONS)
[99455 ms] UsbSnoop - MyDispatchPNP(f2342ee0) : IRP_MJ_PNP (IRP_MN_QUERY_DEVICE_RELATIONS)
[99455 ms] UsbSnoop - DispatchAny(f2340610) : IRP_MJ_PNP (IRP_MN_CANCEL_REMOVE_DEVICE)
[99455 ms] UsbSnoop - MyDispatchPNP(f2342ee0) : IRP_MJ_PNP (IRP_MN_CANCEL_REMOVE_DEVICE)
